collected_at_utc,source_type,company,title,location,team,url,external_id,posted_at,description_snippet
2026-03-31 16:54:24,ddg:apply.workable.com,tetrascience,DevOps Engineer,,,https://apply.workable.com/tetrascience/j/E0F1F3EEF9/,ddg::https://apply.workable.com/tetrascience/j/E0F1F3EEF9/,,"At least 5 years of professional experience as aDevOpsEngineeror in a similar role. Extensive experience with Amazon Web Services (AWS), including AWS certification."
2026-03-31 16:54:24,ddg:apply.workable.com,staffordgray,DevOps Engineer with OpenShift,,,https://apply.workable.com/staffordgray/j/6CC93F64A3/,ddg::https://apply.workable.com/staffordgray/j/6CC93F64A3/,,"We are looking for aDevOpsEngineerwho knows OpenShift inside and out. This role focuses on building, automating, and supporting containerized applications in a fast-paced environment."
2026-03-31 16:54:24,ddg:apply.workable.com,methods,Methods Business and Digital Technology,,,https://apply.workable.com/methods/j/C381B809AC/,ddg::https://apply.workable.com/methods/j/C381B809AC/,,We are looking for aDevOpsEngineerwho focuses on solving problems and designing practical solutions. You will take ownership of delivery platforms and influence technical direction across teams and clients.
2026-03-31 16:54:24,ddg:apply.workable.com,telestream,DevOps Engineer,,,https://apply.workable.com/telestream/j/ED54675F67/,ddg::https://apply.workable.com/telestream/j/ED54675F67/,,"Telestream is a seeking aDevOpsEngineerto ensure seamless collaboration between our Software Development and IT Operations teams. Your extensive experience and technical expertise in CI/CD pipelines, infrastructure automation and cloud platforms, will allow you to excel in this role."
2026-03-31 16:54:24,ddg:apply.workable.com,crewbloom,DevOpsEngineer(Project-Based),,,https://apply.workable.com/crewbloom/j/6E020ED2E0/,ddg::https://apply.workable.com/crewbloom/j/6E020ED2E0/,,"As aDevOpsEngineer, you will be responsible for managing and maintaining our staging, production, and development environments on AWS. This role is essential in ensuring the reliability..."
2026-03-31 16:54:24,ddg:apply.workable.com,accellor,Senior Infrastructure/DevOpsEngineer- Accellor,,,https://apply.workable.com/accellor/j/D7F8AD3D0A,ddg::https://apply.workable.com/accellor/j/D7F8AD3D0A,,You should be a strong InfrastructureDevOpsEngineerwith ability to dig deeper into any part of the stack. In depth understanding of the fundamentals of distributed systems is a must.
2026-03-31 16:54:24,ddg:apply.workable.com,ampcontrol,DevOpsEngineer- Ampcontrol,,,https://apply.workable.com/ampcontrol/j/A664174084/,ddg::https://apply.workable.com/ampcontrol/j/A664174084/,,"DevOpsEngineer. Remote Engineering Full time.Proficiency in core DevOps technologies such as Docker, Kubernetes, SQL database management, CI/CD pipelines, and Terraform."
2026-03-31 16:54:24,ddg:apply.workable.com,dsn,Site Reliability Engineer (SRE),,,https://apply.workable.com/dsn/j/52BC16DC28/,ddg::https://apply.workable.com/dsn/j/52BC16DC28/,,"Diversified Services Network, Inc. (DSN) is seeking a full-time Site Reliability Engineer (SRE) – (AWS / Platform Support) to join our team in Chicago, IL ..."
2026-03-31 16:54:24,ddg:apply.workable.com,critical-manufacturing,Site Reliability Engineer,,,https://apply.workable.com/critical-manufacturing/j/21F13A63DD,ddg::https://apply.workable.com/critical-manufacturing/j/21F13A63DD,,"Site Reliability Engineer. HybridEngineering, Research & DevelopmentFull ... SRE's culture of diversity, intellectual curiosity, problem solving and ..."
2026-03-31 16:54:24,ddg:apply.workable.com,multimediallc,Senior Site Reliability Engineer,,,https://apply.workable.com/multimediallc/j/3A3106ABD5,ddg::https://apply.workable.com/multimediallc/j/3A3106ABD5,,We are seeking a remote Senior Site Reliability Engineer who will elevate our infrastructure resilience and optimize system performance. ... Site Reliability ...
2026-03-31 16:54:24,ddg:apply.workable.com,atec-spine,"Sr. Site Reliability Engineer, DevOps",,,https://apply.workable.com/atec-spine/j/DC632B35D9/,ddg::https://apply.workable.com/atec-spine/j/DC632B35D9/,,"The Senior Site Reliability Engineer (SRE) will be responsible for ensuring the availability, performance, scalability, and operational efficiency of the ..."
2026-03-31 16:54:24,ddg:apply.workable.com,dsn,Site Reliability Engineer (SRE),,,https://apply.workable.com/dsn/j/52BC16DC28/apply/,ddg::https://apply.workable.com/dsn/j/52BC16DC28/apply/,,"Diversified Services Network, Inc. (DSN) is seeking a full-time Site Reliability Engineer (SRE) – (AWS / Platform Support) to join our team in Chicago, IL ..."
2026-03-31 16:54:24,ddg:apply.workable.com,firsthelpfinancial,Senior Site Reliability Engineer,,,https://apply.workable.com/firsthelpfinancial/j/D27F8C1D8A/,ddg::https://apply.workable.com/firsthelpfinancial/j/D27F8C1D8A/,,We're looking for a Senior Site Reliability Engineer (SRE) to join our global engineering team and take ownership of the reliability and operational health ...
2026-03-31 16:54:24,ddg:apply.workable.com,therapynotes,Senior Database Site Reliability Engineer,,,https://apply.workable.com/therapynotes/j/127FE35A05/,ddg::https://apply.workable.com/therapynotes/j/127FE35A05/,,"We are seeking a Database Site Reliability Engineer who demonstrates a strong skill set in managing PostgreSQL. ... SRE; Experience in cloud-based compute, ..."
2026-03-31 16:54:24,ddg:apply.workable.com,salla,Senior Site Reliability Engineer (SRE),,,https://apply.workable.com/salla/j/8BBEC70032,ddg::https://apply.workable.com/salla/j/8BBEC70032,,"As a Senior SRE at Salla, you will lead reliability initiatives, handle ... Senior Site Reliability Engineer (SRE). HybridTechnologyFull time. Makkah ..."
2026-03-31 16:54:24,ddg:apply.workable.com,zipliens,Senior Site Reliability Engineer,,,https://apply.workable.com/zipliens/j/255FB74E7E/apply/,ddg::https://apply.workable.com/zipliens/j/255FB74E7E/apply/,,"Zipliens is looking for a Senior Site Reliability Engineer to join our engineering team and support leading the reliability, scalability, and security of ..."
2026-03-31 16:54:24,ddg:apply.workable.com,mancomm,"Full StackPlatformEngineer- Mancomm, Inc.",,,https://apply.workable.com/mancomm/j/49C9CDFEDF,ddg::https://apply.workable.com/mancomm/j/49C9CDFEDF,,"Overview:At Mancomm, safety is at the core of everything we do. We’re dedicated to making regulations clear, accessible, and actionable, so people can work smarter and safer."
2026-03-31 16:54:24,ddg:apply.workable.com,moneyfarm,JuniorPlatformEngineer- Moneyfarm,,,https://apply.workable.com/moneyfarm/j/0D732B43BF/,ddg::https://apply.workable.com/moneyfarm/j/0D732B43BF/,,"As a SoftwareEngineerI in thePlatformEngineering team, you will contribute to building and maintaining ourplatform, focusing on continuous delivery systems, observability, and..."
2026-03-31 16:54:24,ddg:apply.workable.com,visium,Platform Engineer (Azure/AWS),,,https://apply.workable.com/visium/j/3C217A0234/,ddg::https://apply.workable.com/visium/j/3C217A0234/,,"As a Platform Engineer, you will own the design and evolution of cloud platforms and DevOps practices. You act as a technical reference for reliability, ..."
2026-03-31 16:54:24,ddg:apply.workable.com,starling-bank,Engine by Starling,,,https://apply.workable.com/starling-bank/j/54A230460D,ddg::https://apply.workable.com/starling-bank/j/54A230460D,,"As a Platform Engineer at Engine, you'll be at the forefront of building and scaling our cutting-edge cloud-native banking platform across multiple global ..."
2026-03-31 16:54:24,ddg:apply.workable.com,systems-engineering-solutions-corporation,Google Cloud Platform Engineer,,,https://apply.workable.com/systems-engineering-solutions-corporation/j/ADCD7A216B,ddg::https://apply.workable.com/systems-engineering-solutions-corporation/j/ADCD7A216B,,"Google Cloud Platform Engineer. HybridFull time. Hanscom Air Force Base, Massachusetts, United States."
2026-03-31 16:54:24,ddg:apply.workable.com,netx,Platform Engineer,,,https://apply.workable.com/netx/j/5AC4409BA0,ddg::https://apply.workable.com/netx/j/5AC4409BA0,,"The Platform Engineer is responsible for designing, building, and maintaining the foundational infrastructure that supports software development, deployment, ..."
2026-03-31 16:54:24,ddg:apply.workable.com,portswigger,Platform Engineer,,,https://apply.workable.com/portswigger/j/E23FF66E10,ddg::https://apply.workable.com/portswigger/j/E23FF66E10,,"Platform Engineer. On-siteTechnology Tribe. Knutsford, England, United Kingdom. OverviewApplication. Share this job. SVGs not supported by this browser ..."
2026-03-31 16:54:24,ddg:apply.workable.com,and-digital,CloudEngineer- AND Digital,,,https://apply.workable.com/and-digital/j/B17965E52F/,ddg::https://apply.workable.com/and-digital/j/B17965E52F/,,"As aCloudEngineer, you will be a specialist in your team, building scalable cloud solutions to solve a variety of problems."
2026-03-31 16:54:24,ddg:apply.workable.com,blueflag,SeniorCloudEngineer- BlueFlag LLP,,,https://apply.workable.com/blueflag/j/EF677E0012/,ddg::https://apply.workable.com/blueflag/j/EF677E0012/,,"BlueFlag is seeking an ambitious, senior-levelCloudEngineerto join our dynamic team. This opportunity is remote. As a key player in our cloud infrastructure initiatives, you'll have..."
2026-03-31 16:54:24,ddg:apply.workable.com,pepperstone,SeniorCloudEngineer- Pepperstone,,,https://apply.workable.com/pepperstone/j/7425C0FE4B/,ddg::https://apply.workable.com/pepperstone/j/7425C0FE4B/,,We are seeking an experienced SeniorCloudEngineerto join our IT team and contribute to the creation of efficient and scalable cloud solutions for Pepperstone.
2026-03-31 16:54:24,ddg:apply.workable.com,protera,Cloud Engineer,,,https://apply.workable.com/protera/j/6352CA48B5/,ddg::https://apply.workable.com/protera/j/6352CA48B5/,,"TheCloudEngineeris responsible for Operations (design, installation and maintenance) of our Development, Testing, and Production environments. This individual must have a strong ability to integrate cloud principles with application deployment processes and support procedures."
2026-03-31 16:54:24,ddg:apply.workable.com,protera,CloudOps Engineer,,,https://apply.workable.com/protera/j/2DC580ECB2/,ddg::https://apply.workable.com/protera/j/2DC580ECB2/,,"TheCloudEngineer(AWS & DevOps) is responsible for designing, deploying, and maintaining scalable, secure, and automated cloud infrastructures within Amazon Web Services (AWS) environments."
2026-03-31 16:54:24,ddg:apply.workable.com,protera,Cloud Engineer (L2),,,https://apply.workable.com/protera/j/B31550C684/,ddg::https://apply.workable.com/protera/j/B31550C684/,,"CloudEngineer(AWS & VMware) is responsible for designing, deploying, and maintaining highly available and secure cloud infrastructures in Amazon Web Services (AWS) and VMware environments."
2026-03-31 16:54:24,ddg:apply.workable.com,techflow,apply.workable.com,,,https://apply.workable.com/techflow/j/956780CDFF/,ddg::https://apply.workable.com/techflow/j/956780CDFF/,,"As aCloudEngineer, you will be at the forefront of innovation, managing and optimizing Microsoft, AWS, and Azure servers to ensure the seamless operation of the CPM systems."
2026-03-31 16:54:24,ddg:apply.workable.com,horizontal-digital,InfrastructureEngineer- Horizontal Digital,,,https://apply.workable.com/horizontal-digital/j/3C9075FEB4/,ddg::https://apply.workable.com/horizontal-digital/j/3C9075FEB4/,,"As anInfrastructureEngineer, you will be part of a global team of experienced Application and Infrastructure engineers. You will have a unique opportunity in flexibility to develop your..."
2026-03-31 16:54:24,ddg:apply.workable.com,orion-health,InfrastructureEngineer- Orion Health,,,https://apply.workable.com/orion-health/j/95E0DED099/,ddg::https://apply.workable.com/orion-health/j/95E0DED099/,,"As anInfrastructureEngineer, your role is crucial in ensuring our internal IT systems provide highly available, secure, and efficient services to all internal Orion Health teams."
2026-03-31 16:54:24,ddg:apply.workable.com,rokt,Individual ContributorInfrastructureEngineer- Rokt,,,https://apply.workable.com/rokt/j/934984BE89/,ddg::https://apply.workable.com/rokt/j/934984BE89/,,"As an Individual ContributorInfrastructureEngineer, you’ll design, build, and operate the systems that power Rokt’s global platform."
2026-03-31 16:54:24,ddg:apply.workable.com,tp-link-usa-corp,Senior Infrastructure Engineer,,,https://apply.workable.com/tp-link-usa-corp/j/28EF1A8E61/,ddg::https://apply.workable.com/tp-link-usa-corp/j/28EF1A8E61/,,"TP-Link Systems Inc. is seeking a skilled and proactive SeniorInfrastructureEngineerto design, implement, maintain, and support our growing IT infrastructure."
2026-03-31 16:54:24,ddg:apply.workable.com,infotrack-us,Sr. Infrastructure Engineer,,,https://apply.workable.com/infotrack-us/j/1B8D67B3D7/,ddg::https://apply.workable.com/infotrack-us/j/1B8D67B3D7/,,"As a Senior CloudInfrastructureEngineerat InfoTrack, you’ll play a key role in shaping and executing our cloud strategy. This is a hands-on, high-impact role where you’ll design, build, and optimize secure, scalable infrastructure while partnering with developers, product teams, and global colleague"
2026-03-31 16:54:24,ddg:apply.workable.com,covergo,Senior Cloud Infrastructure Engineer (Working hours aligned ...,,,https://apply.workable.com/covergo/j/735CCC4796/,ddg::https://apply.workable.com/covergo/j/735CCC4796/,,"Top 3 Reasons To Join Us100% RemoteInternational EnvironmentWorking on the latest tech for the Insurtech Market LeaderAbout UsAt CoverGo, our mission is to empower all insurance companies to make insurance 100% digital and accessible to everyone.We are..."
2026-03-31 16:54:24,ddg:apply.workable.com,assurity-trusted-solutions,CloudInfrastructureEngineer (Storage),,,https://apply.workable.com/assurity-trusted-solutions/j/6C32206A34,ddg::https://apply.workable.com/assurity-trusted-solutions/j/6C32206A34,,"As a Trusted Partner over the last decade, ATS offers a comprehensive suite of products and services ranging frominfrastructureand operationa..."
2026-03-31 16:54:24,ddg:apply.workable.com,allwynls,CloudInfrastructureEngineer,,,https://apply.workable.com/allwynls/j/161DC41E22/,ddg::https://apply.workable.com/allwynls/j/161DC41E22/,,Responsible for managing acloudbased network across multiple locations. Consult and implementInfrastructurecomponents of the Security Strategy. Help define risks where appropriate.
2026-03-31 16:54:24,ddg:apply.workable.com,assurity-trusted-solutions,"CloudInfrastructureEngineer (Kubernetes, Redhat OpenShift)...",,,https://apply.workable.com/assurity-trusted-solutions/j/8AFB6895C3/,ddg::https://apply.workable.com/assurity-trusted-solutions/j/8AFB6895C3/,,"We are looking for aCloudInfrastructureEngineer (Large Language Model) to join us! You will be working on: Design, deploy, and optimize Kubernetes clusters using the Nvidia software..."
2026-03-31 16:54:24,ddg:apply.workable.com,advansys-esc-1,CloudInfrastructureEngineer,,,https://apply.workable.com/advansys-esc-1/j/63DB695A7D/apply/,ddg::https://apply.workable.com/advansys-esc-1/j/63DB695A7D/apply/,,"CloudInfrastructureEngineer. HybridADVANSYSFull time. 6th of October City, Giza Governorate, Egypt."
2026-03-31 16:54:24,ddg:apply.workable.com,perlego,Cloud Infrastructure Engineer,,,https://apply.workable.com/perlego/j/707C9F2208/,ddg::https://apply.workable.com/perlego/j/707C9F2208/,,"Cloud Infrastructure Management: Manage and support AWS infrastructure, focusing on scalability, security, and reliability. Handle deployments, managing CI/CD ..."
2026-03-31 16:54:24,ddg:apply.workable.com,multigate,Cloud DevOps Specialist,,,https://apply.workable.com/multigate/j/D9E24058AF/,ddg::https://apply.workable.com/multigate/j/D9E24058AF/,,"The individual will be responsible for designing, implementing, and maintaining scalable and secure cloud infrastructure to ensure optimal system performance."
2026-03-31 16:54:24,ddg:apply.workable.com,assurity-trusted-solutions,Cloud Infrastructure Engineer (Openshift),,,https://apply.workable.com/assurity-trusted-solutions/j/8DEEE36701,ddg::https://apply.workable.com/assurity-trusted-solutions/j/8DEEE36701,,We are seeking a skilled Cloud Infrastructure Engineer with expertise in OpenShift to join our innovative team! ... 6+ years of experience in cloud infrastructure ...
2026-03-31 16:54:24,ddg:apply.workable.com,trinetix,Cloud Infrastructure Engineer,,,https://apply.workable.com/trinetix/j/1A85D70708,ddg::https://apply.workable.com/trinetix/j/1A85D70708,,"We are seeking a Senior Cloud Infrastructure Engineer to own and evolve a predominantly Azure-based infrastructure environment. This is a hands-on, senior ..."
2026-03-31 16:54:24,ddg:apply.workable.com,caddi,Site Reliability Engineer,,,https://apply.workable.com/caddi/j/5B2CC4757A/apply?s=BuiltInNationwide,ddg::https://apply.workable.com/caddi/j/5B2CC4757A/apply?s=BuiltInNationwide,,"For security reasons, the candidate must be a US Citizen, or a Permanent Resident (Green Card)OverviewAs a Site Reliability Engineer at CADDi, ..."
2026-03-31 16:54:24,ddg:apply.workable.com,subscript,Software Quality & Reliability Engineer (Founding Role),,,https://apply.workable.com/subscript/j/86D4C74063,ddg::https://apply.workable.com/subscript/j/86D4C74063,,"The role: We're looking for our first Quality & Reliability Engineer who thinks about quality as a system, not a phase at the end of development."
2026-03-31 16:54:24,ddg:apply.workable.com,mlabs,Senior Site Reliability Engineer (Azure),,,https://apply.workable.com/mlabs/j/488D610475,ddg::https://apply.workable.com/mlabs/j/488D610475,,Our client is seeking a Senior Site Reliability Engineer (Azure) to architect and scale a robust infrastructure foundation for a high-growth distributed systems ...
2026-03-31 16:54:24,ddg:apply.workable.com,twgai,Platform Reliability Engineer,,,https://apply.workable.com/twgai/j/E974265187/,ddg::https://apply.workable.com/twgai/j/E974265187/,,"We are seeking a Platform Reliability Engineer (SRE) to ensure the scalability, stability, and performance of our data platforms and ML infrastructure. You'll ..."
2026-03-31 16:54:24,ddg:apply.workable.com,palona,AI Reliability Engineer,,,https://apply.workable.com/palona/j/94F7EFDBDD/,ddg::https://apply.workable.com/palona/j/94F7EFDBDD/,,"As an AI Reliability Engineer, you will: Design and build observability systems that detect quality degradation, latency issues, and system anomalies in ..."
2026-03-31 16:54:24,ddg:apply.workable.com,deeplight,Platform SRE and Reliability Engineer,,,https://apply.workable.com/deeplight/j/91878792F8/,ddg::https://apply.workable.com/deeplight/j/91878792F8/,,"As the Platform SRE & Reliability Engineer, your responsibilities include: Building reusable automation frameworks to test the accuracy, stability, latency, and ..."
2026-03-31 16:54:24,ddg:apply.workable.com,laborup,Reliability Engineer,,,https://apply.workable.com/laborup/j/641136E1F1/apply/,ddg::https://apply.workable.com/laborup/j/641136E1F1/apply/,,OverviewWe're hiring a Reliability Engineer to lead and mature the reliability strategy at one of East Tennessee's fastest-growing plastics manufacturers.
2026-03-31 16:54:24,ddg:apply.workable.com,tyk-technologies,Site Reliability Engineer,,,https://apply.workable.com/tyk-technologies/j/8B2AC5C97A/,ddg::https://apply.workable.com/tyk-technologies/j/8B2AC5C97A/,,"We're looking for a Site Reliability Engineer to manage, maintain, improve and provide support on our platform. You will be curious by nature, always looking ..."
2026-03-31 16:54:24,ddg:jobs.ashbyhq.com,oxygen,DevOpsEngineer@ Oxygen,,,https://jobs.ashbyhq.com/Oxygen/34ef0584-65de-4000-aa57-96d26812b9ef?departmentId=c28bf3bd-a5bb-40c4-a043-ac6ed053e3fd&amp;locationId=d3e38ccb-b511-4f08-a0f9-602dd46c7b48&amp,ddg::https://jobs.ashbyhq.com/Oxygen/34ef0584-65de-4000-aa57-96d26812b9ef?departmentId=c28bf3bd-a5bb-40c4-a043-ac6ed053e3fd&amp;locationId=d3e38ccb-b511-4f08-a0f9-602dd46c7b48&amp,,Oxygen is seeking an experiencedDevOpsEngineerto play a pivotal role in advancing Oxygen's growth journey.
2026-03-31 16:54:24,ddg:jobs.ashbyhq.com,deel,DevOpsEngineer(Azure) @ Deel,,,https://jobs.ashbyhq.com/Deel/fe280fbf-68f4-4704-998d-8243222fa60f,ddg::https://jobs.ashbyhq.com/Deel/fe280fbf-68f4-4704-998d-8243222fa60f,,"C- Certifications such as AWS CertifiedDevOpsEngineer, Microsoft Certified: AzureDevOpsEngineerExpert, or Certified Kubernetes Administrator (CKA). Bachelor’s degree in..."
2026-03-31 16:54:24,ddg:jobs.ashbyhq.com,https:,Site Reliability Engineer (SRE) Roles and Responsibilities,,,https://www.invensislearning.com/blog/site-reliability-engineer-roles-responsibilities/,ddg::https://www.invensislearning.com/blog/site-reliability-engineer-roles-responsibilities/,,"Jan 5, 2026 ·DiscoverSite Reliability Engineerroles and responsibilities, including SLOs, automation, incident response, skills, tools, andSREcareer paths in 2026."
2026-03-31 16:54:24,ddg:jobs.ashbyhq.com,january,"Senior SRE, Software Engineering @ January",,,https://jobs.ashbyhq.com/january/178014c0-3f9f-43a9-91c9-f6fb995b9983?source=linkedin,ddg::https://jobs.ashbyhq.com/january/178014c0-3f9f-43a9-91c9-f6fb995b9983?source=linkedin,,"ABOUT THE ROLE As a SeniorSREyou will ensure the reliability, scalability, and performance of January's production and internal systems as we scale from thousands to millions of borrowers."
2026-03-31 16:54:24,ddg:jobs.ashbyhq.com,socure,Senior Software Engineer -SRE @ Socure,,,https://jobs.ashbyhq.com/socure/1f06fc88-00a1-493d-8208-1fda58add86c?ashby_jid=a093c129-f736-4c26-8541-d88e890f2b90&source=LinkedIn,ddg::https://jobs.ashbyhq.com/socure/1f06fc88-00a1-493d-8208-1fda58add86c?ashby_jid=a093c129-f736-4c26-8541-d88e890f2b90&source=LinkedIn,,"WHY SOCURE? Socure is building the identity trust infrastructure for the digital economy — verifying 100% of good identities in real time and stopping fraud before it starts. The mission is big, the problems are complex, and the impact is felt by businesses, governments, and millions of people every"
2026-03-31 16:54:24,ddg:jobs.ashbyhq.com,openai,"SiteReliabilityEngineer, Research Platform,SRE@ OpenAI",,,https://jobs.ashbyhq.com/openai/d24f97b8-8861-4d07-9ae3-0116fec8a33b?i12m_id=i12m-2024-4-5UJ,ddg::https://jobs.ashbyhq.com/openai/d24f97b8-8861-4d07-9ae3-0116fec8a33b?i12m_id=i12m-2024-4-5UJ,,"As aReliabilityEngineer, you will be at the forefront of maintaining and enhancing the stability, scalability, and performance of our rapidly evolving infrastructure.TheSREteam in research is responsible for defining, measuring, and improving the reliability of the research platform."
2026-03-31 16:54:24,ddg:jobs.ashbyhq.com,airapps,SiteReliabilityEngineer(SRE) @ Air Apps,,,https://jobs.ashbyhq.com/airapps/3078910f-918e-4aed-a2a8-b0027c94a4f2,ddg::https://jobs.ashbyhq.com/airapps/3078910f-918e-4aed-a2a8-b0027c94a4f2,,"As aSiteReliabilityEngineer(SRE) at Air Apps, you will be responsible for ensuring the reliability, availability, and scalability of our systems. You will work at the intersection of software development and operations, implementing automation, monitoring, and performance optimization..."
2026-03-31 16:54:24,ddg:jobs.ashbyhq.com,comulate,PlatformEngineer@ Comulate,,,https://jobs.ashbyhq.com/comulate/b553bfae-6722-4d3f-8585-372c98708996,ddg::https://jobs.ashbyhq.com/comulate/b553bfae-6722-4d3f-8585-372c98708996,,"As our firstPlatformEngineeryou'll play a critical role in shaping our cloud infrastructure and ensuring our systems are reliable, scalable, and secure."
2026-03-31 16:54:24,ddg:jobs.ashbyhq.com,privy,Senior/StaffPlatformSoftwareEngineer@ Privy,,,https://jobs.ashbyhq.com/privy/4b3161d7-f508-44b3-9a7f-23448ab7664a,ddg::https://jobs.ashbyhq.com/privy/4b3161d7-f508-44b3-9a7f-23448ab7664a,,"As aPlatformEngineerat Privy, you will help define how we build, deploy, and scale services that power tens of millions of users across thousands of customers—all within a rapidly..."
2026-03-31 16:54:24,ddg:jobs.ashbyhq.com,ramp,PlatformEngineer| Ops Engineering @ Ramp,,,https://jobs.ashbyhq.com/ramp/1efa03ca-445d-474f-a3a6-582c59859bce,ddg::https://jobs.ashbyhq.com/ramp/1efa03ca-445d-474f-a3a6-582c59859bce,,"Founded in 2019, Ramp powers the fastest-growing corporate card and bill paymentplatformin America, and enables over $100 billion in purchases each year."
2026-03-31 16:54:24,ddg:jobs.ashbyhq.com,ashby,Site Reliability &CloudEngineer- North America Time Zones @ Ashby,,,https://jobs.ashbyhq.com/Ashby/443ded5b-4baf-4bdc-8081-1666b4cb7ee3/application,ddg::https://jobs.ashbyhq.com/Ashby/443ded5b-4baf-4bdc-8081-1666b4cb7ee3/application,,"We’re looking for a curious, rigorous, problem-hungry site reliabilityengineer(who codes!) to carry the ball as we bring Ashby to the big leagues. Ashby builds software that lets talent teams..."
2026-03-31 16:54:24,ddg:jobs.ashbyhq.com,inngest,InfrastructureEngineer@ Inngest,,,https://jobs.ashbyhq.com/inngest/50439b44-2a91-4136-b054-60e123d6251e,ddg::https://jobs.ashbyhq.com/inngest/50439b44-2a91-4136-b054-60e123d6251e,,"Infrastructureengineering is a critical part of Inngest. It involves everything from K8S, terraform, and ansible playbooks (for bare metal) to developing high-throughput datastores to serve..."
2026-03-31 16:54:24,ddg:jobs.ashbyhq.com,oneapp,InfrastructureEngineer@ One,,,https://jobs.ashbyhq.com/oneapp/2aa17d7a-6755-4af9-9d6a-78e587ce1404?subid1=59b5a9e14e39439692e3d8f0af2fc0ee,ddg::https://jobs.ashbyhq.com/oneapp/2aa17d7a-6755-4af9-9d6a-78e587ce1404?subid1=59b5a9e14e39439692e3d8f0af2fc0ee,,"THE ROLEInfrastructureEngineers at One build the foundational systems that enable engineers to serve our customers. Besides designing, building, and evolving core systems, engineers..."
