collected_at_utc,source_type,company,title,location,team,url,external_id,posted_at,description_snippet
2026-03-31 16:54:24,ddg:job-boards.greenhouse.io,formativgroup,Job Application for DevOps Engineer,,,https://job-boards.greenhouse.io/formativgroup/jobs/4204399009,ddg::https://job-boards.greenhouse.io/formativgroup/jobs/4204399009,,"The role of theDevOps Engineeris to design, implement, and maintain secure, scalable infrastructure and automation systems that enable efficient application deployment and operations, with a strong focus on Kubernetes management and enterprise-grade secrets management solutions like CyberArk Conjur "
2026-03-31 16:54:24,ddg:job-boards.greenhouse.io,anaplan,Job Application for DevOps Engineer at Anaplan,,,https://job-boards.greenhouse.io/anaplan/jobs/8480853002,ddg::https://job-boards.greenhouse.io/anaplan/jobs/8480853002,,"We are seeking a skilled and versatileDevOps Engineerto join our team. This role is central to maintaining, upgrading, and ensuring the high availability of our critical DevOps toolchain. The ideal candidate is a hands-on generalist with experience managing a variety of CI/CD and Infrastructure as C"
2026-03-31 16:54:24,ddg:job-boards.greenhouse.io,caseguard,Job Application for DevOps Engineer at CaseGuard,,,https://job-boards.greenhouse.io/caseguard/jobs/5012792008,ddg::https://job-boards.greenhouse.io/caseguard/jobs/5012792008,,"CaseGuard is seeking a skilledDevOps Engineerwith expertise in AWS cloud infrastructure and GitLab CI/CD. The ideal candidate will have experience automating deployments, optimizing cloud environments, and ensuring high availability of ASP.NET applications running on AWS."
2026-03-31 16:54:24,ddg:job-boards.greenhouse.io,remotepeople,Job Application for DevOps Engineer at Remote People,,,https://job-boards.greenhouse.io/remotepeople/jobs/4824362101,ddg::https://job-boards.greenhouse.io/remotepeople/jobs/4824362101,,"We're seeking a SeniorDevOps Engineerto take a lead role in scaling and hardening the infrastructure that powers our global SaaS platform. You'll work on high-impact initiatives that ensure the performance, reliability, and security of our systems as we rapidly grow."
2026-03-31 16:54:24,ddg:job-boards.greenhouse.io,altium,Job Application for DevOps Engineer at Altium,,,https://job-boards.greenhouse.io/altium/jobs/4659413006,ddg::https://job-boards.greenhouse.io/altium/jobs/4659413006,,"TheDevOps Engineeron the Duro Design team builds and operates the infrastructure platform that enables hardware engineers to ship with confidence every day. You'll own the environments, pipelines, clusters, and databases that power our modern stack—ensuring everything is scalable, secure, and reliab"
2026-03-31 16:54:24,ddg:job-boards.greenhouse.io,gongio,Job Application for Senior DevOps Engineer at Gong.io,,,https://job-boards.greenhouse.io/gongio/jobs/4666266006,ddg::https://job-boards.greenhouse.io/gongio/jobs/4666266006,,"We're looking for a SeniorDevOps Engineerto join and scale our U.S.-based DevOps function. You'll join a small team, focused on DevOps tasks in Security-related areas. You'll be pivotal in designing, implementing and maintaining our cloud infrastructure, especially security-related parts of it. You'"
2026-03-31 16:54:24,ddg:job-boards.greenhouse.io,pathward,"Job Application for DevOps Engineer Sr at Pathward, N.A.",,,https://job-boards.greenhouse.io/pathward/jobs/5800343004?gh_src=f1e69a5c4us,ddg::https://job-boards.greenhouse.io/pathward/jobs/5800343004?gh_src=f1e69a5c4us,,"At Pathward, we take tremendous pride in our purpose to create financial inclusion for all™. We are a financial empowerment company that works with innovators to increase financial availability, choice, and opportunity for all. We strive to remove barriers that traditional institutions put in the wa"
2026-03-31 16:54:24,ddg:job-boards.greenhouse.io,resonate,Job Application for DevOps Engineer at Resonate,,,https://job-boards.greenhouse.io/resonate/jobs/5055887007,ddg::https://job-boards.greenhouse.io/resonate/jobs/5055887007,,"Resonate is a leading provider of high-quality, AI-powered consumer data, intelligence, and technology, empowering marketers to create a more personalized world that increases customer acquisition and lifetime value. Our SaaS platform, Ignite, and our Data-as-a-Service (DaaS) offerings provide unpar"
2026-03-31 16:54:24,ddg:job-boards.greenhouse.io,centralreach,"Job Application for Sr. DevOps Engineer, Cloud Security at CentralReach",,,https://job-boards.greenhouse.io/centralreach/jobs/4181860009,ddg::https://job-boards.greenhouse.io/centralreach/jobs/4181860009,,"CentralReach is a leading provider of autism and IDD care software for Applied Behavior Analysis (ABA), multidisciplinary therapy, and special education. Trusted by more than 200,000 users, we enable therapy providers, educators, and employers to scale the way they deliver ABA and related therapies "
2026-03-31 16:54:24,ddg:job-boards.greenhouse.io,xai,Job Application for Site Reliability Engineer (SRE) at xAI,,,https://job-boards.greenhouse.io/xai/jobs/4681662007,ddg::https://job-boards.greenhouse.io/xai/jobs/4681662007,,"Site Reliability Engineer (SRE). London, UK. Apply. About xAI. xAI's mission is to create AI systems that can accurately understand the universe and aid ..."
2026-03-31 16:54:24,ddg:job-boards.greenhouse.io,andurilindustries,Job Application for Senior Site Reliability Engineer at Anduril ...,,,https://job-boards.greenhouse.io/andurilindustries/jobs/5093600007,ddg::https://job-boards.greenhouse.io/andurilindustries/jobs/5093600007,,"We are looking for a Site Reliability Engineer (SRE) to join AGD, our rapidly growing team in Irvine or Costa Mesa. SREs work with external stakeholders to ..."
2026-03-31 16:54:24,ddg:job-boards.greenhouse.io,peoplefinders,Job Application for Site Reliability Engineer (SRE) at PeopleFinders,,,https://job-boards.greenhouse.io/peoplefinders/jobs/5062627007,ddg::https://job-boards.greenhouse.io/peoplefinders/jobs/5062627007,,"Site Reliability Engineer (SRE) · Architect, maintain, and troubleshoot AWS cloud infrastructure, including VPCs, subnets, routing, security groups, and other ..."
2026-03-31 16:54:24,ddg:job-boards.greenhouse.io,fireblocks,Site Reliability Engineer (SRE) (Pacific time),,,https://job-boards.greenhouse.io/fireblocks/jobs/4619316006,ddg::https://job-boards.greenhouse.io/fireblocks/jobs/4619316006,,"Site Reliability Engineer (SRE) (Pacific time) · Research Fireblocks blockchain workflows, identify optimization opportunities, issues, and improve monitoring."
2026-03-31 16:54:24,ddg:job-boards.greenhouse.io,ensono,Site Reliability Engineer,,,https://job-boards.greenhouse.io/ensono/jobs/4671834005,ddg::https://job-boards.greenhouse.io/ensono/jobs/4671834005,,Site Reliability Engineer. Remote - United Kingdom JR012870. At Ensono ... We're looking for Site Reliability Engineering (SRE) to join our growing team.
2026-03-31 16:54:24,ddg:job-boards.greenhouse.io,florencehealthcare,Site Reliability Engineer (SRE),,,https://job-boards.greenhouse.io/florencehealthcare/jobs/4643514005,ddg::https://job-boards.greenhouse.io/florencehealthcare/jobs/4643514005,,"We are seeking a Site Reliability Engineer (SRE) to join one of our Scrum teams and help ensure the reliability, scalability, and performance of the Florence™ ..."
2026-03-31 16:54:24,ddg:job-boards.greenhouse.io,moonlite,Job Application for Sr. Site Reliability Engineer (SRE) at Moonlite,,,https://job-boards.greenhouse.io/moonlite/jobs/4971694008,ddg::https://job-boards.greenhouse.io/moonlite/jobs/4971694008,,"Site Reliability Engineer (SRE). Chicago, IL or Remote. Apply. Moonlite delivers high-performance AI infrastructure for organizations running intensive ..."
2026-03-31 16:54:24,ddg:job-boards.greenhouse.io,togetherai,Job Application for Site Reliability Engineer at Together AI,,,https://job-boards.greenhouse.io/togetherai/jobs/4753034007,ddg::https://job-boards.greenhouse.io/togetherai/jobs/4753034007,,"About the Role. As a Site Reliability Engineer (SRE) at Together, you are responsible for keeping all user-facing services and production systems running ..."
2026-03-31 16:54:24,ddg:job-boards.greenhouse.io,spacex,"Job Application for Platform Engineer, Flight Software (Starlink) at SpaceX",,,https://job-boards.greenhouse.io/spacex/jobs/8478286002?gh_jid=8478286002,ddg::https://job-boards.greenhouse.io/spacex/jobs/8478286002?gh_jid=8478286002,,"As a platform engineer on the Starlink flight software team, you will be responsible for the software that enables rapid iteration and deployment of both ground ..."
2026-03-31 16:54:24,ddg:job-boards.greenhouse.io,pdtpartners,Job Application for Platform Engineer at PDT Partners,,,https://job-boards.greenhouse.io/pdtpartners/jobs/7116729,ddg::https://job-boards.greenhouse.io/pdtpartners/jobs/7116729,,"Platform Engineer · Experience with systems programming and/or software engineering · Practical experience supporting, debugging, and improving production systems ..."
2026-03-31 16:54:24,ddg:job-boards.greenhouse.io,pinwheelapi,Job Application for Platform Engineer at Pinwheel,,,https://job-boards.greenhouse.io/pinwheelapi/jobs/7671891003,ddg::https://job-boards.greenhouse.io/pinwheelapi/jobs/7671891003,,"Pinwheel is looking for a Platform Engineer who thrives at the intersection of backend engineering, infrastructure, and developer enablement. This role owns the ..."
2026-03-31 16:54:24,ddg:job-boards.greenhouse.io,khanacademy,"Senior Platform Engineer I, AI Evaluation (24 months fixed-term)",,,https://job-boards.greenhouse.io/khanacademy/jobs/7453480,ddg::https://job-boards.greenhouse.io/khanacademy/jobs/7453480,,"As a Platform Engineer focused on evaluation, you'll be expected to: Be fluent in the range of offline and online evaluation strategies, and when to apply the ..."
2026-03-31 16:54:24,ddg:job-boards.greenhouse.io,propel,Job Application for Senior Platform Engineer at Propel,,,https://job-boards.greenhouse.io/propel/jobs/7445950002,ddg::https://job-boards.greenhouse.io/propel/jobs/7445950002,,We're looking for a self-motivated Senior Platform Engineer to join our Developer Enablement Team within the engineering org at Propel. This role empowers other ...
2026-03-31 16:54:24,ddg:job-boards.greenhouse.io,furtherearlycareer,Graduate Leadership Program,,,https://job-boards.greenhouse.io/furtherearlycareer/jobs/8384024002,ddg::https://job-boards.greenhouse.io/furtherearlycareer/jobs/8384024002,,"Entry Level Platform Engineer · Completed a Bachelor's or Master's Degree between Fall 2025 and Spring 2026 in Computer Science, Analytics, Information Systems, ..."
2026-03-31 16:54:24,ddg:job-boards.greenhouse.io,capitaltg,Job Application for Platform Engineer at Capital Technology Group,,,https://job-boards.greenhouse.io/capitaltg/jobs/5011382007,ddg::https://job-boards.greenhouse.io/capitaltg/jobs/5011382007,,"Platform Engineer. Remote (USA). Apply. Capital Technology Group provides expert consulting services software development, digital transformation, human ..."
2026-03-31 16:54:24,ddg:job-boards.greenhouse.io,renewedvision,Job Application for Software Reliability & Platform Engineer at Renewed ...,,,https://job-boards.greenhouse.io/renewedvision/jobs/4965954008,ddg::https://job-boards.greenhouse.io/renewedvision/jobs/4965954008,,"As a Software Reliability & Platform Engineer, you'll bring a developer's mindset to reliability, infrastructure, and deployment."
2026-03-31 16:54:24,ddg:job-boards.greenhouse.io,paypaycard,Job Application for Platform Engineer at PayPay Card,,,https://job-boards.greenhouse.io/paypaycard/jobs/4677658008,ddg::https://job-boards.greenhouse.io/paypaycard/jobs/4677658008,,Job Description. PayPay Card is looking for a Cloud infrastructure and platform engineer for PayPay Card's cloud system.
2026-03-31 16:54:24,ddg:job-boards.greenhouse.io,gleanwork,Job Application for Cloud Infrastructure Engineer at Glean,,,https://job-boards.greenhouse.io/gleanwork/jobs/4547218005,ddg::https://job-boards.greenhouse.io/gleanwork/jobs/4547218005,,"Glean is looking for a talentedCloudInfrastructureEngineerto join our rapidly expanding, venture-backed startup. We are building a modern knowledge assistant personalized to every employee in your organization, making all information within your company accessible, contextual, and fresh. Our team wo"
2026-03-31 16:54:24,ddg:job-boards.greenhouse.io,bamboohr17,Job Application for Cloud Engineer at BambooHR,,,https://job-boards.greenhouse.io/bamboohr17/jobs/5746608004,ddg::https://job-boards.greenhouse.io/bamboohr17/jobs/5746608004,,ACloudEngineeraddresses system incidents and issues using a wide variety of tools and techniques to determine the root cause and make Cloud implementation more resilient and stable.
2026-03-31 16:54:24,ddg:job-boards.greenhouse.io,lightfeatheriollc,Job Application for GCP Cloud Engineer at LIGHTFEATHER IO LLC,,,https://job-boards.greenhouse.io/lightfeatheriollc/jobs/5168950008,ddg::https://job-boards.greenhouse.io/lightfeatheriollc/jobs/5168950008,,"LightFeather is seeking a GCPCloud Engineerwho will play a critical role in designing, implementing, and maintaining cloud infrastructure solutions within Google Cloud Platform (GCP). This role requires expertise in infrastructure automation, cloud security, networking, and CI/CD pipeline developmen"
2026-03-31 16:54:24,ddg:job-boards.greenhouse.io,clickhouse,Job Application for Senior Cloud Engineer at ClickHouse,,,https://job-boards.greenhouse.io/clickhouse/jobs/5733571004,ddg::https://job-boards.greenhouse.io/clickhouse/jobs/5733571004,,"Join a small, specialized team building ClickHouse's next frontier — secure, highly scalable database platforms for government and enterprise clients acrosscloud, hybrid, and on-prem environments. Our team is looking for exceptional engineers to design, develop, deploy, and secure a ClickHouseCloudd"
2026-03-31 16:54:24,ddg:job-boards.greenhouse.io,mill,Job Application for Lead Cloud Engineer at Mill,,,https://job-boards.greenhouse.io/mill/jobs/4645656005,ddg::https://job-boards.greenhouse.io/mill/jobs/4645656005,,"We’re looking for a hands-on SeniorCloudEngineerto lead our Cloud work across our AWS infrastructure. This role is responsible for designing, building, and maintaining our end-to-end applications across web, mobile, cloud, and data that support our customer experiences."
2026-03-31 16:54:24,ddg:job-boards.greenhouse.io,twosixtechnologies?error=true,Jobs at Two Six Technologies,,,https://job-boards.greenhouse.io/twosixtechnologies?error=true,ddg::https://job-boards.greenhouse.io/twosixtechnologies?error=true,,"Cloud/ Data ScienceEngineer. Herndon, Virginia.TCI - O-Cyber. Job. Automated TestEngineer. Chantilly, Virginia.CloudDevOpsEngineer."
2026-03-31 16:54:24,ddg:job-boards.greenhouse.io,kalshi,Job Application for Infrastructure Engineer at Kalshi,,,https://job-boards.greenhouse.io/kalshi/jobs/5194694003,ddg::https://job-boards.greenhouse.io/kalshi/jobs/5194694003,,"Infrastructure Engineer. New York, New York, United States. Apply. Kalshi is defining a new category. Kalshi has defined a new category: prediction markets ..."
2026-03-31 16:54:24,ddg:job-boards.greenhouse.io,defcon,Job Application for Cloud Infrastructure Engineer at DEFCON AI,,,https://job-boards.greenhouse.io/defcon/jobs/5091753007,ddg::https://job-boards.greenhouse.io/defcon/jobs/5091753007,,"13 hours ago·We are seeking an experienced Cloud Infrastructure Engineer to design, deploy, and administer cloud environments with a strong emphasis on ..."
2026-03-31 16:54:24,ddg:job-boards.greenhouse.io,transmarketgroup,Job Application for Infrastructure Engineer at TransMarket Group,,,https://job-boards.greenhouse.io/transmarketgroup/jobs/4749909007?gh_jid=4749909007,ddg::https://job-boards.greenhouse.io/transmarketgroup/jobs/4749909007?gh_jid=4749909007,,"Infrastructure Engineer · Ownership over our data center infrastructure, tasked with all aspects of keeping it up and operating in an optimal and reliable manner ..."
2026-03-31 16:54:24,ddg:job-boards.greenhouse.io,anthropic,"Job Application for Infrastructure Engineer, Sandboxing at Anthropic",,,https://job-boards.greenhouse.io/anthropic/jobs/5030680008,ddg::https://job-boards.greenhouse.io/anthropic/jobs/5030680008,,"Infrastructure Engineer, Sandboxing · Responsibilities. Design, build, and operate distributed backend systems that power secure sandboxed execution environments ..."
2026-03-31 16:54:24,ddg:job-boards.greenhouse.io,spacex,Software Infrastructure Engineer (Starlink),,,https://job-boards.greenhouse.io/spacex/jobs/8391128002?gh_jid=8391128002,ddg::https://job-boards.greenhouse.io/spacex/jobs/8391128002?gh_jid=8391128002,,Software Infrastructure Engineer (Starlink) · Develop automation to deploy and manage on-premise compute resources · Deploy and manage core infrastructure such as ...
2026-03-31 16:54:24,ddg:job-boards.greenhouse.io,anthropic,"Job Application for ML Infrastructure Engineer, Safeguards at Anthropic",,,https://job-boards.greenhouse.io/anthropic/jobs/4778843008,ddg::https://job-boards.greenhouse.io/anthropic/jobs/4778843008,,"We are seeking a Machine Learning Infrastructure Engineer to join our Safeguards organization, where you'll build and scale the critical infrastructure that ..."
2026-03-31 16:54:24,ddg:job-boards.greenhouse.io,arcesiumllc,Lead Infrastructure Engineer,,,https://job-boards.greenhouse.io/arcesiumllc/jobs/4457575007,ddg::https://job-boards.greenhouse.io/arcesiumllc/jobs/4457575007,,"As a Lead Infrastructure Engineer – Distributed Systems, you will be at the forefront of technological evolution within multiple functional areas including ..."
2026-03-31 16:54:24,ddg:job-boards.greenhouse.io,descript,Job Application for Senior Infrastructure Engineer at Descript,,,https://job-boards.greenhouse.io/descript/jobs/7500000003,ddg::https://job-boards.greenhouse.io/descript/jobs/7500000003,,"At Descript, we believe that software engineers should own the reliability and performance of what they ship to production, so as an Infrastructure Engineer, ..."
2026-03-31 16:54:24,ddg:job-boards.greenhouse.io,peregrinetechnologies,Senior Infrastructure Engineer,,,https://job-boards.greenhouse.io/peregrinetechnologies/jobs/4550899005,ddg::https://job-boards.greenhouse.io/peregrinetechnologies/jobs/4550899005,,Role. We are looking for a Senior Infrastructure Engineer to join our growing team where you will design and implement the infrastructure that powers the ...
2026-03-31 16:54:24,ddg:job-boards.greenhouse.io,theweathercompany,DevSecOps Engineer at The Weather Company,,,https://job-boards.greenhouse.io/theweathercompany/jobs/5050445007,ddg::https://job-boards.greenhouse.io/theweathercompany/jobs/5050445007,,"TheDevSecOpsEngineer will play a key role, working with the core application engineering team and the cybersecurity lead to ensure that all DROP Platform offerings meet security and compliance goals. This position is part of the Department of Defense (DoD) SkillBridge Program."
2026-03-31 16:54:24,ddg:job-boards.greenhouse.io,mrbeastyoutube,Job Application for Senior DevSecOps Engineer at MrBeast,,,https://job-boards.greenhouse.io/mrbeastyoutube/jobs/5809670004,ddg::https://job-boards.greenhouse.io/mrbeastyoutube/jobs/5809670004,,"We are looking for a SeniorDevSecOpsEngineer to architect and scale a security-first engineering culture across our cloud infrastructure and CI/CD pipelines. You will embed security directly into development workflows, automate detection and response at scale, and harden our AWS and GCP environments"
2026-03-31 16:54:24,ddg:job-boards.greenhouse.io,openenergytransition,Job Application for DevSecOps Engineer at Open Energy Transition,,,https://job-boards.greenhouse.io/openenergytransition/jobs/4469948101,ddg::https://job-boards.greenhouse.io/openenergytransition/jobs/4469948101,,"About the Organization: Open Energy Transition is a non-profit organization dedicated to accelerating the global energy transition through innovative open-source energy planning solutions. We are a team of passionate individuals committed to creating a sustainable future by enabling accessible, effe"
2026-03-31 16:54:24,ddg:job-boards.greenhouse.io,grvty,Job Application for DevSecOps Engineer at GRVTY,,,https://job-boards.greenhouse.io/grvty/jobs/4091494009,ddg::https://job-boards.greenhouse.io/grvty/jobs/4091494009,,"Position Responsibilities: Join GRVTY's mission-focused team as aDevSecOpsEngineer, where you'll have the opportunity to enable secure, automated, and scalable deployment of advanced data analytics tools."
2026-03-31 16:54:24,ddg:job-boards.greenhouse.io,coast,Job Application for DevSecOps Engineer at Coast,,,https://job-boards.greenhouse.io/coast/jobs/5544756004,ddg::https://job-boards.greenhouse.io/coast/jobs/5544756004,,"TheDevSecOpsEngineer is our first explicitly security-focused hire. In this role you will be an early member of the Platform Engineering organization and help us mature a critical part of Coast. We value speed and flexibility, but accept the need for high standards for compliance and security. Doing"
2026-03-31 16:54:24,ddg:job-boards.greenhouse.io,residenthome,Job Application for DevSecOps Engineer at Resident,,,https://job-boards.greenhouse.io/residenthome/jobs/5802530004,ddg::https://job-boards.greenhouse.io/residenthome/jobs/5802530004,,"What you will be doing: As the soleDevSecOpsowner within the DevOps team, you will take end-to-end responsibility for improving the security of our cloud and production environments. You will design and implement security controls across AWS/GCP- from hardening infrastructure and securing Kubernetes"
2026-03-31 16:54:24,ddg:job-boards.greenhouse.io,rhombuspower,"Job Application for DevSecOps Engineer, Palo Alto at Rhombus Power, Inc.",,,https://job-boards.greenhouse.io/rhombuspower/jobs/7599849003?gh_src=3fd7205e3us,ddg::https://job-boards.greenhouse.io/rhombuspower/jobs/7599849003?gh_src=3fd7205e3us,,"Rhombus Power, Inc. delivers AI-powered predictive intelligence in real time for defense and national security organizations worldwide. Our mission-built products— Ambient AI and Guardian— are transforming strategic, operational, and tactical decision-making. By empowering the shift from reactive an"
2026-03-31 16:54:24,ddg:job-boards.greenhouse.io,figment,Job Application for Senior DevSecOps Engineer at Figment,,,https://job-boards.greenhouse.io/figment/jobs/5661946004,ddg::https://job-boards.greenhouse.io/figment/jobs/5661946004,,"About the opportunity Are you an experienced DevOps engineer with a strong security mindset, eager to work at the intersection of blockchain, infrastructure, and security? At Figment, we're building and running staking infrastructure that powers dozens of the most innovative blockchain networks. We'"
2026-03-31 16:54:24,ddg:job-boards.greenhouse.io,gatherai,Job Application for Cloud Engineer (Platform & Infrastructure) at Gather AI,,,https://job-boards.greenhouse.io/gatherai/jobs/5079136007,ddg::https://job-boards.greenhouse.io/gatherai/jobs/5079136007,,"Bachelor's degree in Computer Science, Engineering, or a related field · 5+ years of experience operating production cloud infrastructure at scale · Deep ..."
2026-03-31 16:54:24,ddg:job-boards.greenhouse.io,fireworksai,"Member of Technical Staff, Cloud Infrastructure",,,https://job-boards.greenhouse.io/fireworksai/jobs/4005894009,ddg::https://job-boards.greenhouse.io/fireworksai/jobs/4005894009,,"As a Software Engineer on our Cloud Infrastructure team, you'll be at the forefront, architecting and building the foundational systems that power Fireworks AI."
2026-03-31 16:54:24,ddg:job-boards.greenhouse.io,qualifiedhealth,Job Application for Cloud / Infrastructure Engineer at Qualified ...,,,https://job-boards.greenhouse.io/qualifiedhealth/jobs/5163860008,ddg::https://job-boards.greenhouse.io/qualifiedhealth/jobs/5163860008,,Job Summary: The Cloud / Infrastructure Engineer is the person who builds the platform that everything else runs on. You'll provision Azure environments from ...
2026-03-31 16:54:24,ddg:job-boards.greenhouse.io,tribalscale,Job Application for Oracle Cloud Infrastructure Engineer at TribalScale,,,https://job-boards.greenhouse.io/tribalscale/jobs/4653626006,ddg::https://job-boards.greenhouse.io/tribalscale/jobs/4653626006,,The Role. We are looking for a Cloud Engineer who specializes in Oracle Cloud Infrastructure (OCI) to serve as a technical anchor for our enterprise cloud ...
2026-03-31 16:54:24,ddg:job-boards.greenhouse.io,zscaler,Jobs at Zscaler,,,https://job-boards.greenhouse.io/zscaler,ddg::https://job-boards.greenhouse.io/zscaler,,Zscaler was founded in 2007 with a mission to make the cloud a safe place to do business and a more enjoyable experience for enterprise users.CloudInfrastructure& Operations.
2026-03-31 16:54:24,ddg:job-boards.greenhouse.io,xai,Job Application for Site Reliability Engineer,,,https://job-boards.greenhouse.io/xai/jobs/4974627007,ddg::https://job-boards.greenhouse.io/xai/jobs/4974627007,,"November 7, 2025 -As a SiteReliability Engineerfocused on Hardware, you will serve as an expert focused on firmware, hardware specifications, vendor relations, and failure analysis. You will proactively identify and resolve hardware issues, manage RMA processes, and stay ahead of emerging hardware t"
2026-03-31 16:54:24,ddg:job-boards.greenhouse.io,sumologic,Job Application for Senior Site Reliability Engineer I at Sumo Logic,,,https://job-boards.greenhouse.io/sumologic/jobs/7580063,ddg::https://job-boards.greenhouse.io/sumologic/jobs/7580063,,"Support the engineering teams within your product area by maintaining and executing a reliability roadmap of opportunities for improvement for reliability, maintainability, security, efficiency, and velocity - and help for realizing those opportunities."
