collected_at_utc,source_type,company,title,location,team,url,external_id,posted_at,description_snippet
2026-04-02 13:11:40,weworkremotely,Coderio,SR Data Engineer/DevOps,Remote,,https://weworkremotely.com/remote-jobs/coderio-sr-data-engineer-devops,wwr::https://weworkremotely.com/remote-jobs/coderio-sr-data-engineer-devops,"Sun, 08 Mar 2026 20:46:00 +0000","Headquarters: Santiago de Chile / Concepción / Talca / Valparaíso / Lima / Arequipa / Bogotá Sobre CoderioCoderio diseña y entrega soluciones digitales escalables para empresas globales. Con una base técnica sólida y una mentalidad orientada al producto, nuestros equipos lideran proyectos de softwar"
2026-04-02 13:11:40,weworkremotely,Cognyte,DevOps Expert,Remote,,https://weworkremotely.com/remote-jobs/cognyte-devops-expert,wwr::https://weworkremotely.com/remote-jobs/cognyte-devops-expert,"Thu, 05 Mar 2026 16:03:09 +0000","Headquarters: Herzliya, Tel Aviv District, IL Description: Today’s world is crime-riddled. Criminals are everywhere, invisible, virtual, and sophisticated. Traditional ways to prevent and investigate crime and terror are no longer enough…&nbsp;Technology is changing incredibly fast. The criminals kn"
2026-04-02 13:11:40,weworkremotely,Companion Group Ltd.,Senior Backend Game Engineer (DevOps),Remote,,https://weworkremotely.com/remote-jobs/companion-group-ltd-senior-backend-game-engineer-devops,wwr::https://weworkremotely.com/remote-jobs/companion-group-ltd-senior-backend-game-engineer-devops,"Thu, 05 Mar 2026 16:05:52 +0000","Headquarters: London GB Companion Group is a AAA co-development gaming studio with a globally distributed and fully remote setup, renowned for its adeptness in overcoming the most intricate challenges in multiplayer game development. Our reputation precedes us as an excellent choice for clients aspi"
2026-04-02 13:11:40,weworkremotely,Confidential,Lead DevOps Engineer - AWS,Remote,,https://weworkremotely.com/remote-jobs/confidential-lead-devops-engineer-aws,wwr::https://weworkremotely.com/remote-jobs/confidential-lead-devops-engineer-aws,"Thu, 05 Mar 2026 16:45:20 +0000","Headquarters: Edinburgh, Midlothian Lead DevOps Engineer - AWS Edinburgh (Remote first) £85,000 - £90,000 My client, a leading software company is looking to hire an experienced Lead DevOps Engineer to support their R&amp;D department as well as the deployment and maintenance of their SaaS product. "
2026-04-03 13:01:38,greenhouse,contentful,Platform Engineer,,,https://job-boards.greenhouse.io/contentful/jobs/7544103,greenhouse::7544103,2026-03-23T13:26:52-04:00,
2026-04-03 13:01:38,greenhouse,contentful,Senior Platform Engineer (f/m/d),,,https://job-boards.greenhouse.io/contentful/jobs/7682062,greenhouse::7682062,2026-03-17T16:08:24-04:00,
2026-04-02 13:11:40,arbeitnow,Convact,AI Automation Engineer (m/w/d) - Vollzeit - (Remote),Remote,"Remote, IT",https://www.arbeitnow.com/jobs/companies/convact/ai-automation-engineer-vollzeit-remote-sinsheim-264847,arbeitnow::ai-automation-engineer-vollzeit-remote-sinsheim-264847,1775118630,"Wir sind eine wachsende Marketingagentur und suchen einen neuen Mitarbeiter, der unsere internen Prozesse mit KI und Automatisierung auf das nächste Level bringt. Dabei geht es nicht um klassische IT Verwaltung, sondern um echte Umsetzung. Wir suchen jemanden, der moderne KI Tools nicht nur spannend"
2026-04-03 13:13:55,ddg:jobs.lever.co,cority,Senior Platform Engineer,,,https://jobs.lever.co/cority/7c8b3595-68ea-47e6-a06e-83b3400bc2fb/apply?lever-origin=applied,ddg::https://jobs.lever.co/cority/7c8b3595-68ea-47e6-a06e-83b3400bc2fb/apply?lever-origin=applied,,3 hours ago·Senior Platform Engineer. United States / Canada / United Kingdom. Technology & Engineering – IT /. Full-Time /. Remote. Submit your application. Which location ...
2026-04-02 13:11:40,weworkremotely,Corva,Senior DevOps Engineer (with Go/Python Development Experience),Remote,,https://weworkremotely.com/remote-jobs/corva-senior-devops-engineer-with-go-python-development-experience,wwr::https://weworkremotely.com/remote-jobs/corva-senior-devops-engineer-with-go-python-development-experience,"Thu, 05 Mar 2026 16:45:18 +0000","Headquarters: Poland About CorvaCorva has built a first-of-its-kind energy app store on a bedrock of best-in-class technologies, data pipelines, and a secure and scalable architecture. &nbsp;Our energy solutions solve today's toughest well delivery challenges, from well design through drillout. &nbs"
2026-04-03 13:13:55,ddg:jobs.lever.co,coupa,Sr. Site Reliability Engineer,,,https://jobs.lever.co/coupa/8fbfb298-9b00-46a1-ac88-152c8d5f2ebc/apply?lever-origin=applied,ddg::https://jobs.lever.co/coupa/8fbfb298-9b00-46a1-ac88-152c8d5f2ebc/apply?lever-origin=applied,,"6 hours ago·Site Reliability Engineer - 11293. Mexico City, Mexico. Development – Cloud Operations /. Mid-Senior Level /. Remote. Submit your application. LinkedIn profile."
2026-04-03 13:13:55,ddg:jobs.lever.co,crosslaketech,"Full Stack Software Engineer (US, Remote)",,,https://jobs.lever.co/crosslaketech/98615f7f-d41a-465d-b373-b32fa9f6304b,ddg::https://jobs.lever.co/crosslaketech/98615f7f-d41a-465d-b373-b32fa9f6304b,,14 hours ago·Required Qualifications · 4+ years of professional software development experience · Undergraduate degree in Engineering (Computer Science preferred) · Balanced ...
2026-04-03 13:13:55,ddg:boards.greenhouse.io,customerio,"Job Application for Senior Software Engineer, Full Stack at Customer.io",,,https://boards.greenhouse.io/customerio/jobs/7776591,ddg::https://boards.greenhouse.io/customerio/jobs/7776591,,"13 hours ago·We're looking for curious, driven Fullstack (Product) Engineers who want to own big things and delight our customers. You'll design, build, and ship the core ..."
2026-04-03 13:13:55,ddg:job-boards.greenhouse.io,datadog,Enterprise Sales Engineer,,,https://job-boards.greenhouse.io/datadog/jobs/7742823,ddg::https://job-boards.greenhouse.io/datadog/jobs/7742823,,4 hours ago·... SRE Bits AI Security Analyst MCP Server Agent Directory Metrics Watchdog LLM Observability AI Integrations Workflow Automation App Builder CoScreen Teams ...
2026-04-03 13:01:38,jobicy,Dayforce,DevOps Engineer,USA,DevOps &amp; Infrastructure,https://jobicy.com/jobs/141321-devops-engineer-2,jobicy::141321,2026-03-27T18:09:49+00:00,"Dayforce is a global human capital management (HCM) company headquartered in Toronto, Ontario, and Minneapolis, Minnesota, with operations across North America, Europe, Middle East, Africa (EMEA), and the Asia Pacific..."
2026-04-02 13:11:40,weworkremotely,Decircle,M0 Labs - DevOps - Engineer,Remote,,https://weworkremotely.com/remote-jobs/decircle-m0-labs-devops-engineer,wwr::https://weworkremotely.com/remote-jobs/decircle-m0-labs-devops-engineer,"Mon, 09 Mar 2026 20:34:46 +0000","Headquarters: New York, New York, United States Job descriptionM0 is a stablecoin platform for builders. With M0, developers can create their stablecoins in minutes by extending $M - M0’s superior digital-dollar building block, and customize attributes such as branding, compliance behaviors, and yie"
2026-04-03 13:13:55,ddg:jobs.ashbyhq.com,deel,DevOpsEngineer@ Deel,,,https://jobs.ashbyhq.com/Deel/bf7d8953-2997-4b79-a472-2eb5f787fd98/application?departmentId=8c27e7fa-f898-4de1-adf6-70c67c1e1c11,ddg::https://jobs.ashbyhq.com/Deel/bf7d8953-2997-4b79-a472-2eb5f787fd98/application?departmentId=8c27e7fa-f898-4de1-adf6-70c67c1e1c11,,We have a position for aDevOpsEngineerwith passion for automation and next-gen infrastructure.
2026-04-03 13:13:55,ddg:jobs.ashbyhq.com,deepgram,InfrastructureEngineer@ Deepgram,,,https://jobs.ashbyhq.com/Deepgram/3e70322f-f37e-448f-99e0-abe3ac07fe37?employmentType=FullTime,ddg::https://jobs.ashbyhq.com/Deepgram/3e70322f-f37e-448f-99e0-abe3ac07fe37?employmentType=FullTime,,"We are seeking an experiencedInfrastructureEngineerto design, implement, and maintain our large-scale distributed systems infrastructure."
2026-04-03 13:13:55,ddg:jobs.lever.co,deepjudge,DeepJudge -DevOpsEngineer,,,https://jobs.lever.co/DeepJudge/7f0a4af1-d02e-4cba-b594-01e73e8327aa,ddg::https://jobs.lever.co/DeepJudge/7f0a4af1-d02e-4cba-b594-01e73e8327aa,,"We're seeking aDevOpsEngineerto join our team who will take ownership from day one and is eager to work alongside smart, dedicated, and fun people passionate about solving the complex..."
2026-04-03 13:13:55,ddg:job-boards.greenhouse.io,defenseunicorns?error=true,Jobs at Defense Unicorns,,,https://job-boards.greenhouse.io/defenseunicorns?error=true,ddg::https://job-boards.greenhouse.io/defenseunicorns?error=true,,PlatformEngineer- Customer Success.Senior Software Engineer - Rust. Remote. SkillBridge Intern - Product Manager.
2026-04-03 13:13:55,ddg:jobs.lever.co,deuna,Site Reliability Engineer,,,https://jobs.lever.co/deuna/51b519e1-ad27-4f4d-831a-2cd0efa5fa46/apply?lever-origin=applied,ddg::https://jobs.lever.co/deuna/51b519e1-ad27-4f4d-831a-2cd0efa5fa46/apply?lever-origin=applied,,"22 hours ago·Site Reliability Engineer. Ciudad de México, Mexico / Bogotá, Colombia. Technology /. Jornada Completa /. Remote. Submit your application. Which location are ..."
2026-04-02 13:11:40,weworkremotely,Digital Forms,Azure DevOps Engineer,Remote,,https://weworkremotely.com/remote-jobs/digital-forms-azure-devops-engineer,wwr::https://weworkremotely.com/remote-jobs/digital-forms-azure-devops-engineer,"Wed, 11 Mar 2026 20:31:53 +0000","Headquarters: Warsaw, 14, Poland Job descriptionAs a DevOps Engineer at Digital Forms, you’ll work at the heart of our digital transformation projects - designing robust infrastructure, shaping CI/CD pipelines, and ensuring smooth delivery of products used by companies around the world.This role ble"
2026-04-03 13:13:55,ddg:job-boards.greenhouse.io,doitintl,Jobs at DoiT,,,https://job-boards.greenhouse.io/doitintl,ddg::https://job-boards.greenhouse.io/doitintl,,Check out our recap video to relive the magic and see how we’re helping organizations streamline and scale theircloudinfrastructure.
2026-04-03 13:01:38,greenhouse,dropbox,Atlassian Cloud Platform Engineer,,,https://jobs.dropbox.com/listing/7525048?gh_jid=7525048,greenhouse::7525048,2026-04-02T13:40:26-04:00,
2026-04-03 13:01:38,greenhouse,dropbox,Atlassian Cloud Platform Engineer,,,https://jobs.dropbox.com/listing/7626205?gh_jid=7626205,greenhouse::7626205,2026-04-02T13:40:26-04:00,
2026-04-03 13:01:38,greenhouse,dropbox,Site Reliability Engineer,,,https://jobs.dropbox.com/listing/7539817?gh_jid=7539817,greenhouse::7539817,2026-04-02T13:40:26-04:00,
2026-04-02 13:11:40,arbeitnow,DUALIS GMBH IT Solution,DevOps Engineer (m/w/d),Dresden,Software Development,https://www.arbeitnow.com/jobs/companies/dualis-gmbh-it-solution/devops-engineer-dresden-474153,arbeitnow::devops-engineer-dresden-474153,1775116824,"DU &#x26; DUALIS – let’s plan your future together! Smarte Prozesse, Industrie 4.0 oder einfach clevere Lösungen, wir helfen Fertigungsunternehmen, den Überblick zu behalten, effizienter zu arbeiten und sich zukunftssicher aufzustellen. Werde Teil unseres Teams und gestalte mit uns die Fabrik von mo"
2026-04-03 13:13:55,ddg:jobs.ashbyhq.com,duck-duck-go,Senior SiteReliabilityEngineer@ DuckDuckGo,,,https://jobs.ashbyhq.com/duck-duck-go/9f845ea5-4bdd-432a-8266-7febe26c7163,ddg::https://jobs.ashbyhq.com/duck-duck-go/9f845ea5-4bdd-432a-8266-7febe26c7163,,"As a SiteReliabilityEngineer, you'll dive deep into complex operational challenges, including software, systems, automation, and process analysis."
2026-04-03 13:13:55,ddg:jobs.lever.co,ebury,Ebury -SiteReliabilityEngineer(SRE),,,https://jobs.lever.co/ebury/c281a1ca-877c-4703-92e1-71f9b7eb036c,ddg::https://jobs.lever.co/ebury/c281a1ca-877c-4703-92e1-71f9b7eb036c,,Ebury is a Global FinTech: we apply new technologies to enhance and automate financial services and processes. This allows small and medium-sized businesses to trade and transact internationally by eliminating boundaries related to more traditional procedures.
2026-04-02 13:11:40,greenhouse,elastic,Senior Site Reliability Engineer (FinOps) - Platform,,,https://jobs.elastic.co/jobs?gh_jid=7565188&gh_jid=7565188,greenhouse::7565188,2026-03-31T10:44:14-04:00,
2026-04-03 13:01:38,greenhouse,elastic,Site Reliability Engineer II - Platform Security,,,https://jobs.elastic.co/jobs?gh_jid=7721766&gh_jid=7721766,greenhouse::7721766,2026-03-26T20:39:29-04:00,
2026-04-03 13:13:55,ddg:job-boards.greenhouse.io,endgamesystemsllc,Federal Public Sector - Greenhouse,,,https://job-boards.greenhouse.io/endgamesystemsllc/jobs/5174923008,ddg::https://job-boards.greenhouse.io/endgamesystemsllc/jobs/5174923008,,"16 hours ago·Minimum of 4 years' experience as a Systems Engineer/Administrator, Network Engineer/Administrator, Cloud Engineer/Administrator, or closely related experience ..."
2026-04-03 13:13:55,ddg:boards.greenhouse.io,ensono,Senior Mainframe Systems Programmer,,,https://boards.greenhouse.io/ensono/jobs/4673014005,ddg::https://boards.greenhouse.io/ensono/jobs/4673014005,,13 hours ago·Senior Mainframe Systems Programmer – Run Automation · Utilize system knowledge and project management skills to design automation for different platforms.Missing:Engineer| Show results with:Engineer
2026-04-02 13:11:40,weworkremotely,Escala 24x7 Careers,Cloud Specialist DevOps,Remote,,https://weworkremotely.com/remote-jobs/escala-24x7-careers-cloud-specialist-devops,wwr::https://weworkremotely.com/remote-jobs/escala-24x7-careers-cloud-specialist-devops,"Thu, 05 Mar 2026 16:04:04 +0000","Headquarters: Guatemala ¡Se parte del principal partner de AWS en Latinoamérica y ayuda a las empresas más grandes e innovadoras a acelerar su viaje a la nube! ️Somos un grupo de profesionales talentosos y apasionados en tecnologías en la nube, enfocados en el cliente y con capacidad de afrontar cua"
2026-04-03 13:13:55,ddg:job-boards.greenhouse.io,esri,Software Development Engineer II - Front End Job,,,https://job-boards.greenhouse.io/esri/jobs/5096395007,ddg::https://job-boards.greenhouse.io/esri/jobs/5096395007,,"23 hours ago·Familiarity with cloud platforms (Azure, AWS, or GCP); Experience with monitoring, logging, and observability tools; Exposure to DevSecOps practices and secure ..."
2026-04-03 13:13:55,ddg:boards.greenhouse.io,esri,Sr. Software Development Engineer in Test (SDET),,,https://boards.greenhouse.io/esri/jobs/5076375007,ddg::https://boards.greenhouse.io/esri/jobs/5076375007,,23 hours ago·Responsibilities · Collaborate with Product Engineers to establish test plans and identify gaps in manual and automated testing · Work closely with Software ...
2026-04-03 13:13:55,ddg:boards.greenhouse.io,ethoslife,Job Application for Senior Software Engineer at Ethos Life,,,https://boards.greenhouse.io/ethoslife/jobs/8488243002,ddg::https://boards.greenhouse.io/ethoslife/jobs/8488243002,,"21 hours ago·As a Senior Software Engineer, you'll work across the stack and be responsible for building scalable platform services and systems. You'll work closely with ..."
2026-04-02 13:11:40,weworkremotely,European Dynamics,DevOps Engineer (Remote/Thessaloniki),Remote,,https://weworkremotely.com/remote-jobs/european-dynamics-devops-engineer-remote-thessaloniki,wwr::https://weworkremotely.com/remote-jobs/european-dynamics-devops-engineer-remote-thessaloniki,"Wed, 11 Mar 2026 20:31:49 +0000","Headquarters: Thessaloniki, Central Macedonia, Greece Are you a skilled DevOps Engineer looking to make an impact? We have an exciting opportunity for you to join our expanding development team in Thessaloniki or work fully remotely. Be part of a dynamic and innovative environment where your experti"
2026-04-02 13:11:40,weworkremotely,European Dynamics,Junior Java Developer / DevOps Engineer (Remote/Thessaloniki),Remote,,https://weworkremotely.com/remote-jobs/european-dynamics-junior-java-developer-devops-engineer-remote-thessaloniki,wwr::https://weworkremotely.com/remote-jobs/european-dynamics-junior-java-developer-devops-engineer-remote-thessaloniki,"Wed, 11 Mar 2026 20:31:43 +0000","Headquarters: Thessaloniki, Central Macedonia, Greece Are you a Junior Java Developer or DevOps Engineer looking for a dynamic role in a growing development team? Join us in Thessaloniki or work fully remotely, and become part of our innovative team implementing cutting-edge IT software projects for"
2026-04-03 13:13:55,ddg:job-boards.greenhouse.io,eve,Job Application for Platform Engineer at Eve,,,https://job-boards.greenhouse.io/eve/jobs/4204176009?gh_src=npcuhp8c9us,ddg::https://job-boards.greenhouse.io/eve/jobs/4204176009?gh_src=npcuhp8c9us,,"18 hours ago·Platform Engineer · Educational Background: Bachelor's or Master's degree in Computer Science, Software Engineering, or a related field. · Experience in Scalable ..."
2026-04-03 13:13:55,ddg:job-boards.greenhouse.io,eve?gh_src=npcuhp8c9us,Jobs at Eve,,,https://job-boards.greenhouse.io/eve?gh_src=npcuhp8c9us,ddg::https://job-boards.greenhouse.io/eve?gh_src=npcuhp8c9us,,"18 hours ago·Engineering. Job. AI Engineer. San Mateo, CA (Hybrid) · Engineering Leader - Product Engineering. San Mateo, CA (Hybrid) · Platform Engineer. San Mateo, CA ( ..."
2026-04-02 13:11:40,weworkremotely,Eviden,Ingénieur DevOps Cloud Confirmé (H/F),Remote,,https://weworkremotely.com/remote-jobs/eviden-ingenieur-devops-cloud-confirme-h-f,wwr::https://weworkremotely.com/remote-jobs/eviden-ingenieur-devops-cloud-confirme-h-f,"Wed, 04 Mar 2026 16:43:52 +0000","Headquarters: Les Clayes-Sous-Bois Descriptif du poste Dans le cadre de son développement Evidian recherche son Développeur DevOps Cloud (H/F) pour participer à la mise en place d'une infrastructure complète pour la solution IDaaS Evidian. L'objectif est de participer à la mise en place, support et "
2026-04-03 13:01:38,weworkremotely,Extreme Digital Solutions,ed3b ANALISTA DEVOPS III,Remote,,https://weworkremotely.com/remote-jobs/extreme-digital-solutions-ed3b-analista-devops-iii,wwr::https://weworkremotely.com/remote-jobs/extreme-digital-solutions-ed3b-analista-devops-iii,"Fri, 03 Apr 2026 00:08:59 +0000","Headquarters: BR URL: http://extremedigital.com.br A Extreme Digital Solutions é uma empresa jovem, fundada em 2014, antenada nas mais modernas tendências e tecnologias.&nbsp; Temos como missão tornar negócios mais simples e eficientes, e, na nossa essência, a busca e integração de soluções para as "
2026-04-03 13:01:38,greenhouse,fastly,Cloud Engineer,,,https://www.fastly.com/about/jobs/apply?gh_jid=7698946,greenhouse::7698946,2026-03-20T18:07:12-04:00,
2026-04-02 13:11:40,weworkremotely,Fetcherr,DevOps Team Leader,Remote,,https://weworkremotely.com/remote-jobs/fetcherr-devops-team-leader,wwr::https://weworkremotely.com/remote-jobs/fetcherr-devops-team-leader,"Fri, 06 Mar 2026 20:43:01 +0000","Headquarters: Netanya, Center District, Israel Fetcherr experts in deep learning, e-commerce, and digitization, Fetcherr disrupts traditional systems with its cutting-edge AI technology. At its core is the Large Market Model (LMM), an adaptable AI engine that forecasts demand and market trends with "
2026-04-03 13:01:38,jobicy,Five9,Senior DevOps Engineer,USA,DevOps &amp; Infrastructure,https://jobicy.com/jobs/140704-senior-devops-engineer-2,jobicy::140704,2026-03-15T18:00:20+00:00,"Join us in bringing joy to customer experience. Five9 is a leading provider of cloud contact center software, bringing the power of cloud innovation to customers worldwide. Living our values..."
2026-04-03 13:01:38,greenhouse,fivetran,Senior Site Reliability Engineer,,,https://www.fivetran.com/careers/job?gh_jid=7581692003,greenhouse::7581692003,2026-03-24T15:41:24-04:00,
2026-04-03 13:01:38,greenhouse,fivetran,Senior Site Reliability Engineer,,,https://www.fivetran.com/careers/job?gh_jid=7581688003,greenhouse::7581688003,2026-03-24T15:40:26-04:00,
2026-04-03 13:01:38,greenhouse,fivetran,Senior Site Reliability Engineer,,,https://www.fivetran.com/careers/job?gh_jid=7581685003,greenhouse::7581685003,2026-03-24T15:38:12-04:00,
2026-04-03 13:01:38,greenhouse,gitlab,"Intermediate Site Reliability Engineer, Environment Automation",,,https://job-boards.greenhouse.io/gitlab/jobs/8464417002,greenhouse::8464417002,2026-03-20T10:26:01-04:00,
2026-04-03 13:13:55,ddg:job-boards.greenhouse.io,gitlab,"Job Application for Product Designer, AI at GitLab",,,https://job-boards.greenhouse.io/gitlab/jobs/7927755002,ddg::https://job-boards.greenhouse.io/gitlab/jobs/7927755002,,You’ll be part of the team supporting research and design efforts for Duo Workflow (AI agents across the SDLC) and Duo Chat (GitLab's AI-poweredDevSecOpsassistant).
2026-04-03 13:13:55,ddg:job-boards.greenhouse.io,gitlab,"Job Application for Senior Product Designer, AI at GitLab",,,https://job-boards.greenhouse.io/gitlab/jobs/7799965002,ddg::https://job-boards.greenhouse.io/gitlab/jobs/7799965002,,You’ll be part of the team supporting research and design efforts for Duo Workflow (AI agents across the SDLC) and Duo Chat (GitLab's AI-poweredDevSecOpsassistant).
2026-04-03 13:13:55,ddg:job-boards.greenhouse.io,gitlab,Jobs at GitLab,,,https://job-boards.greenhouse.io/gitlab,ddg::https://job-boards.greenhouse.io/gitlab,,"Job. Assigned Support Engineer (AMER). Remote, Americas. Engineering.Intermediate SiteReliabilityEngineer, Environment Automation."
2026-04-03 13:13:55,ddg:boards.greenhouse.io,gofasti,1061- AI/RAG Engineer (Remote),,,https://boards.greenhouse.io/gofasti/jobs/5844530004,ddg::https://boards.greenhouse.io/gofasti/jobs/5844530004,,"14 hours ago·Proficiency in Python, Node.js, or similar, with experience building APIs and scalable services; Experience with cloud platforms (AWS, GCP, or Azure) ..."
2026-04-03 13:01:38,weworkremotely,Grupo Taking,Analista de Sustentação N1 - Dados (Azure & DevOps) - Pleno - 26181,Remote,,https://weworkremotely.com/remote-jobs/grupo-taking-analista-de-sustentacao-n1-dados-azure-devops-pleno-26181,wwr::https://weworkremotely.com/remote-jobs/grupo-taking-analista-de-sustentacao-n1-dados-azure-devops-pleno-26181,"Fri, 03 Apr 2026 00:08:59 +0000","Headquarters: BR URL: http://taking.com.br Estamos em busca de um(a) profissional para garantir a sustentação N1 dos ambientes de dados em Azure, assegurando disponibilidade e performance dos pipelines em produção, monitorando e tratando incidentes com precisão técnica, promovendo otimização e autom"
2026-04-02 13:11:40,weworkremotely,H1,Sr. DevOps AWS Cloud Engineer,Remote,,https://weworkremotely.com/remote-jobs/h1-sr-devops-aws-cloud-engineer,wwr::https://weworkremotely.com/remote-jobs/h1-sr-devops-aws-cloud-engineer,"Fri, 20 Mar 2026 20:32:19 +0000","Headquarters: New York At H1, we believe access to the best healthcare information is a basic human right. Our mission is to provide a platform that can optimally inform every doctor interaction globally. This promotes health equity and builds needed trust in healthcare systems. To accomplish this o"
2026-04-03 13:13:55,ddg:job-boards.greenhouse.io,halcyon,Job Application for Senior DevOps Engineer at Halcyon,,,https://job-boards.greenhouse.io/halcyon/jobs/5842441004,ddg::https://job-boards.greenhouse.io/halcyon/jobs/5842441004,,"18 hours ago·As a Senior DevOps Engineer, you'll take technical ownership of our cloud infrastructure and DevOps practices. You'll help us design resilient systems, scale ..."
2026-04-03 13:13:55,ddg:jobs.ashbyhq.com,harvey,"Senior Software Engineer,SiteReliabilityEngineer(SRE) @ Harvey",,,https://jobs.ashbyhq.com/harvey/c9cea360-f0b6-4a93-b7b3-0f0145b02ffe,ddg::https://jobs.ashbyhq.com/harvey/c9cea360-f0b6-4a93-b7b3-0f0145b02ffe,,"At Harvey, the future of professional services is being written today — and we’re just getting started. ROLE OVERVIEW As a SoftwareEngineeron theSiteReliabilityteam at Harvey, you will ensure the reliability, scalability, and performance of our legal AI platform."
2026-04-03 13:13:55,ddg:jobs.ashbyhq.com,hyperexponential,CloudEngineer@ hyperexponential,,,https://jobs.ashbyhq.com/Hyperexponential/01897d66-6a62-43e8-a77e-a13a6126e84c,ddg::https://jobs.ashbyhq.com/Hyperexponential/01897d66-6a62-43e8-a77e-a13a6126e84c,,TheCloudEngineering Team's mission is to build scalable and securecloudsolutions for both enterprise B2B customers and engineers.
2026-04-03 13:13:55,ddg:jobs.lever.co,innovativesol-2,Forward Deploy Engineer,,,https://jobs.lever.co/innovativesol-2/083c1f8c-183f-426c-9f0f-e06341892a64,ddg::https://jobs.lever.co/innovativesol-2/083c1f8c-183f-426c-9f0f-e06341892a64,,"14 hours ago·Act as an organizational consultant to customers, guiding them on how cloud-based data and analytics will transform their business. Provide technical guidance ..."
2026-04-03 13:13:55,ddg:jobs.smartrecruiters.com,inpost,InPostDevOpsEngineer| SmartRecruiters,,,https://jobs.smartrecruiters.com/InPost/744000032607312-devops-engineer,ddg::https://jobs.smartrecruiters.com/InPost/744000032607312-devops-engineer,,"We're seeking an experiencedDevOpsEngineerto join our team. You will automate and optimize deployment processes, manage CI/CD pipelines, and actively participate in cloud..."
2026-04-02 13:11:40,weworkremotely,Intetics,1025 | Senior DevOps Engineer,Remote,,https://weworkremotely.com/remote-jobs/intetics-1025-senior-devops-engineer,wwr::https://weworkremotely.com/remote-jobs/intetics-1025-senior-devops-engineer,"Fri, 20 Mar 2026 20:35:27 +0000","Headquarters: Latvia Intetics Inc., a leading American technology company specializing in custom software application development, distributed professional teams creation, software product quality assessment, and “all-things-digital” solutions, is looking for a&nbsp; Senior DevOps&nbsp; to join its "
