collected_at_utc,source_type,company,title,location,team,url,external_id,posted_at,description_snippet
2026-04-03 13:01:38,lever,plaid,Senior Software Engineer - ML Infrastructure,San Francisco,Engineering,https://jobs.lever.co/plaid/16383203-9942-42be-9698-76207e2a500e,lever::16383203-9942-42be-9698-76207e2a500e,1757953826217,We believe that the way people interact with their finances will drastically improve in the next few years. We’re dedicated to empowering this transformation by building the tools and experiences that thousands of developers use to create their own products. Plaid powers the tools millions of people
2026-04-03 13:01:38,lever,plaid,Software Engineer - Platform,San Francisco,Engineering,https://jobs.lever.co/plaid/2b9a141e-0669-4197-aa52-2b07d9fadc96,lever::2b9a141e-0669-4197-aa52-2b07d9fadc96,1755794364103,We believe that the way people interact with their finances will drastically improve in the next few years. We’re dedicated to empowering this transformation by building the tools and experiences that thousands of developers use to create their own products. Plaid powers the tools millions of people
2026-04-03 13:01:38,jobicy,Planet Labs Inc.,"Senior Software Engineer, DevOps",Slovenia,Software Engineering,https://jobicy.com/jobs/140597-senior-software-engineer-devops,jobicy::140597,2026-03-13T07:21:49+00:00,"Welcome to Planet. We believe in using space to help life on Earth.Planet designs, builds, and operates the largest constellation of imaging satellites in history. This constellation delivers an unprecedented..."
2026-04-03 13:13:55,ddg:job-boards.greenhouse.io,point72,Job Application for Devops Engineer at Point72,,,https://job-boards.greenhouse.io/point72/jobs/8396438002?gh_jid=8396438002,ddg::https://job-boards.greenhouse.io/point72/jobs/8396438002?gh_jid=8396438002,,21 hours ago·Devops Engineer · Work closely with our development team to understand solution architecture and build requirements to properly build CI/CD pipeline templates ...
2026-04-03 13:13:55,ddg:jobs.lever.co,pointclickcare,Intermediate AI-Enabled DevOps Engineer,,,https://jobs.lever.co/pointclickcare/94b85a28-9893-48c5-a2bb-a50175887ef1/apply,ddg::https://jobs.lever.co/pointclickcare/94b85a28-9893-48c5-a2bb-a50175887ef1/apply,,"23 hours ago·Intermediate AI-Enabled DevOps Engineer. Remote, USA. Acute & Payer – Engineering /. Full-Time /. Remote. Submit your application. LinkedIn profile. Loading ..."
2026-04-03 13:01:38,arbeitnow,Polarstern Experts,Cloud & Network Automation Engineer (m/w/d) (inhouse/ 80% remote),Cologne,Software Development,https://www.arbeitnow.com/jobs/companies/polarstern-experts/cloud-network-automation-engineer-inhouse-80-remote-cologne-462874,arbeitnow::cloud-network-automation-engineer-inhouse-80-remote-cologne-462874,1775149224,"Wir bauen moderne, sichere und skalierbare IT‑Infrastrukturen mit Schwerpunkt auf Cloud, Netzwerk und Infrastructure as Code (IaC). Wenn du Lust hast, unsere Netzwerklandschaft aktiv mitzugestalten und Automatisierung liebst, bist du bei uns genau richtig! Aufgaben Design, Aufbau und Betrieb von Clo"
2026-04-03 13:13:55,ddg:boards.greenhouse.io,quiknodeinc,Job Application for Web3InfrastructureEngineerII at QuickNode,,,https://boards.greenhouse.io/quiknodeinc/jobs/4353101006,ddg::https://boards.greenhouse.io/quiknodeinc/jobs/4353101006,,"As a SeniorInfrastructureEngineerspecializing in Web3, you will be responsible for deploying and maintaining core infrastructure components across a variety of private and public clouds..."
2026-04-03 13:13:55,ddg:jobs.lever.co,quizlet-2,"Senior Software Engineer, Community",,,https://jobs.lever.co/quizlet-2/905512fb-8ad6-4588-8a01-dd6f8b883b35?utm_source=EdTechJobs.io,ddg::https://jobs.lever.co/quizlet-2/905512fb-8ad6-4588-8a01-dd6f8b883b35?utm_source=EdTechJobs.io,,"17 hours ago·Experience working with cloud infrastructure, distributed systems, and modern CI/CD practices; Familiarity with services, event-driven systems, and data ..."
2026-04-02 13:11:40,arbeitnow,Rahantech GmbH,Cloud Engineer / DevOps Specialist (m/f/d),Frankfurt am Main,Software Development,https://www.arbeitnow.com/jobs/companies/rahantech-gmbh/cloud-engineer-devops-specialist-frankfurt-am-main-349233,arbeitnow::cloud-engineer-devops-specialist-frankfurt-am-main-349233,1775124025,"Tasks Assist in designing, deploying, and managing cloud solutions on AWS, Azure, and Google Cloud. Learn to build and maintain Continuous Integration/Continuous Deployment pipelines for efficient software releases. Help automate cloud processes using tools like Terraform, Ansible, and Docker. Suppo"
2026-04-03 13:13:55,ddg:job-boards.greenhouse.io,relativity,Job Application for Senior Infrastructure Engineer at Relativity ...,,,https://job-boards.greenhouse.io/relativity/jobs/8487244002?utm_source=General+Catalyst+job+board,ddg::https://job-boards.greenhouse.io/relativity/jobs/8487244002?utm_source=General+Catalyst+job+board,,"23 hours ago·As a Senior Infrastructure Engineer, you connect various internal technical teams to define architectural, structural, heavy civil, electrical, mechanical, ..."
2026-04-03 13:13:55,ddg:boards.greenhouse.io,relativity,Job Application for Senior Infrastructure Engineer at Relativity ...,,,https://boards.greenhouse.io/relativity/jobs/8487244002?utm_source=General+Catalyst+job+board,ddg::https://boards.greenhouse.io/relativity/jobs/8487244002?utm_source=General+Catalyst+job+board,,"23 hours ago·As a Senior Infrastructure Engineer, you connect various internal technical teams to define architectural, structural, heavy civil, electrical, mechanical, ..."
2026-04-02 13:11:40,weworkremotely,Remotestar,DevOps & QA Automation Engineer (Remote),Remote,,https://weworkremotely.com/remote-jobs/remotestar-devops-qa-automation-engineer-remote,wwr::https://weworkremotely.com/remote-jobs/remotestar-devops-qa-automation-engineer-remote,"Thu, 05 Mar 2026 16:45:21 +0000","Headquarters: Cambourne, United Kingdom Of Great Britain And Northern Ireland About the Role:&nbsp;We are looking for a DevOps &amp; QA Automation Engineer to join our team during a pivotal architectural transformation. You will be directly responsible for building and maintaining robust CI/CD pipel"
2026-04-03 13:13:55,ddg:apply.workable.com,resonance,DevOpsEngineer(Mid-to-Senior Level),,,https://apply.workable.com/resonance/j/7938DFC75D,ddg::https://apply.workable.com/resonance/j/7938DFC75D,,"About UsResonance is a technology company building a more sustainable and valuable fashion industry for designers, brands, manufacturers, consumers, and the planet."
2026-04-02 13:11:40,weworkremotely,Rheactive,DevOps Senior - Expertise Cloud et Kubernetes H/F,Remote,,https://weworkremotely.com/remote-jobs/rheactive-devops-senior-expertise-cloud-et-kubernetes-h-f,wwr::https://weworkremotely.com/remote-jobs/rheactive-devops-senior-expertise-cloud-et-kubernetes-h-f,"Wed, 04 Mar 2026 16:43:53 +0000","Headquarters: Toulouse, Occitanie, FR Les missions du posteJe suis consultante en recrutement au sein du cabinet RHéactive. Je vous accompagne dans la concrétisation de vos projets professionnels en vous proposant des opportunités sur mesure, en adéquation avec votre profil et vos attentes.Contexte "
2026-04-03 13:01:38,greenhouse,rubrik,Production Engineer/Site Reliability Engineer (Shift Basis),,,https://www.rubrik.com/company/careers/departments/job.7439521?gh_jid=7439521,greenhouse::7439521,2026-03-04T03:48:56-05:00,
2026-04-03 13:01:38,greenhouse,rubrik,Production Engineer/Site Reliability Engineer (Shift Basis),,,https://www.rubrik.com/company/careers/departments/job.7439514?gh_jid=7439514,greenhouse::7439514,2026-03-04T03:48:04-05:00,
2026-04-03 13:01:38,greenhouse,rubrik,Senior Cloud Platform Engineer - FedRAMP,,,https://www.rubrik.com/company/careers/departments/job.7274046?gh_jid=7274046,greenhouse::7274046,2026-03-26T11:05:37-04:00,
2026-04-03 13:01:38,greenhouse,rubrik,Senior Integration & Automation Engineer,,,https://www.rubrik.com/company/careers/departments/job.7570678?gh_jid=7570678,greenhouse::7570678,2026-02-09T23:22:55-05:00,
2026-04-03 13:13:55,ddg:jobs.lever.co,saviynt,Sr. Solutions Engineer,,,https://jobs.lever.co/saviynt/deeb9f65-a652-4e11-ad48-bea8d2ca9b7c,ddg::https://jobs.lever.co/saviynt/deeb9f65-a652-4e11-ad48-bea8d2ca9b7c,,"2 hours ago·In-depth knowledge of common Cloud Platforms, including AWS, GCP, Azure, OCI, etc. Good knowledge of DevOps processes, configuration management, CI/CD pipelines ..."
2026-04-03 13:13:55,ddg:job-boards.greenhouse.io,sciencelogic?error=true,Jobs at ScienceLogic,,,https://job-boards.greenhouse.io/sciencelogic?error=true,ddg::https://job-boards.greenhouse.io/sciencelogic?error=true,,"Sr. Technical Support Engineer.Senior SiteReliabilityEngineer, Observability. Reston, VA or Remote."
2026-04-02 13:11:40,weworkremotely,Selector Software,DevOps/SRE,Remote,,https://weworkremotely.com/remote-jobs/selector-software-devops-sre,wwr::https://weworkremotely.com/remote-jobs/selector-software-devops-sre,"Fri, 06 Mar 2026 16:01:33 +0000","Headquarters: Selector is building an operational intelligence platform for digital infrastructure. By adopting an AI/ML based analytics approach, the platform provides actionable multi-dimensional insights to network, cloud and application operators. It enables operations teams to meet their KPIs t"
2026-04-03 13:13:55,ddg:jobs.smartrecruiters.com,servicenow,ServiceNow Security Engineer-DevSecOps| SmartRecruiters,,,https://jobs.smartrecruiters.com/ServiceNow/744000074821325-security-engineer-devsecops,ddg::https://jobs.smartrecruiters.com/ServiceNow/744000074821325-security-engineer-devsecops,,"TheDevSecOpsteam builds, integrates, and scales security services and to help ServiceNow simplify security activities for thousands of internal customers."
2026-04-03 13:13:55,ddg:jobs.smartrecruiters.com,servicenow,Site Reliability (SRE) |DevSecOps,,,https://jobs.smartrecruiters.com/ServiceNow/744000071174285-security-manager-site-reliability-sre-devsecops,ddg::https://jobs.smartrecruiters.com/ServiceNow/744000071174285-security-manager-site-reliability-sre-devsecops,,"TheDevSecOpsteam within Product Security is responsible for building, integrating, and operating scalable security services that protect the NOW platform, store applications, mobile..."
2026-04-02 13:11:40,remoteok,SharkNinja,Platform Administrator,Worldwide,,https://remoteOK.com/remote-jobs/remote-platform-administrator-sharkninja-1130943,remoteok::1130943,2026-03-31T16:00:24+00:00,"About Us &nbsp; SharkNinja&nbsp;is a global product design and technology company, with a diversified portfolio of 5-star rated lifestyle solutions that positively&nbsp;impact&nbsp;peopleâs lives in homes around the world. Powered by two trusted, global brands, Shark and Ninja , the company has a "
2026-04-03 13:13:55,ddg:jobs.ashbyhq.com,sosafe,Senior AWSCloudEngineer(m/f/d) @ SoSafe,,,https://jobs.ashbyhq.com/sosafe/f9482e1c-f970-41b9-b3af-7f57ec80becd/application,ddg::https://jobs.ashbyhq.com/sosafe/f9482e1c-f970-41b9-b3af-7f57ec80becd/application,,"Drive the delivery of state-of-the-artcloudservices and solutions, including serverless architectures, containerization, and orchestration technologies. •"
2026-04-03 13:13:55,ddg:jobs.lever.co,sporty,Sporty Group -SiteReliabilityEngineer,,,https://jobs.lever.co/sporty/a2d92980-0741-412a-b467-22aa91326636,ddg::https://jobs.lever.co/sporty/a2d92980-0741-412a-b467-22aa91326636,,"SiteReliabilityEngineer. GLOBAL REMOTE. Sporty – SPORTY Technical /.- 4+ years experience in aSREorDevOps position, or if you're a Software Engineer looking to transition then that's also grear!"
2026-04-03 13:13:55,ddg:boards.greenhouse.io,stackexchange,Forward Deployed Engineer,,,https://boards.greenhouse.io/stackexchange/jobs/7772964,ddg::https://boards.greenhouse.io/stackexchange/jobs/7772964,,"20 hours ago·This is a customer-facing delivery role: you'll lead deployments, integrations, and solution validation while shaping delivery playbooks, mentoring future ...Missing:Platform| Show results with:Platform"
2026-04-02 13:11:40,weworkremotely,Stakefish,(f2pool) DevOps Engineer,Remote,,https://weworkremotely.com/remote-jobs/stakefish-f2pool-devops-engineer,wwr::https://weworkremotely.com/remote-jobs/stakefish-f2pool-devops-engineer,"Thu, 19 Mar 2026 20:31:34 +0000","Headquarters: Singapore As our DevOps Engineer, you will be helping us build and maintain blockchain networks and protocols. You will work on improving our current infrastructure including security, automation, and monitoring among other things. You will also have the chance to dive deep into new bl"
2026-04-03 13:13:55,ddg:boards.greenhouse.io,startale,Job Application for SeniorDevSecOpsEngineer (East Asia Timezone)...,,,https://boards.greenhouse.io/startale/jobs/4016929008,ddg::https://boards.greenhouse.io/startale/jobs/4016929008,,Please provide us with any information that can help supplement your application and highlight why you are the best person for this opportunity. LinkedIn Profile (If you don't have a profile...
2026-04-02 13:11:40,weworkremotely,Stormshield,Ingénieur DevOps - Sre H/F,Remote,,https://weworkremotely.com/remote-jobs/stormshield-ingenieur-devops-sre-h-f,wwr::https://weworkremotely.com/remote-jobs/stormshield-ingenieur-devops-sre-h-f,"Wed, 04 Mar 2026 16:43:52 +0000","Headquarters: Lyon, Auvergne-Rhône-Alpes, FR Les missions du postePourquoi choisir Stormshield ?- Vous voulez exercer un métier au coeur des actualités du moment, dans un marché porteur ;- Vous souhaitez intégrer un acteur européen, aux ambitions internationales ;- Vous êtes désireux d'apporter votr"
2026-04-02 13:11:40,weworkremotely,Syrve,Linux Administrator (DevOps team),Remote,,https://weworkremotely.com/remote-jobs/syrve-linux-administrator-devops-team,wwr::https://weworkremotely.com/remote-jobs/syrve-linux-administrator-devops-team,"Wed, 04 Mar 2026 16:43:54 +0000","Headquarters: Yerevan, ER Welcome to Syrve, a leading provider of comprehensive software solutions for cash registers and restaurant management. With a strong foothold in the international market, we are proud to serve over 9000 customers worldwide and counting.Role DescriptionWe are seeking a skill"
2026-04-02 13:11:40,weworkremotely,Sé Parte De Nuestro Equipo. Sé Vos.,Python Backend & DevOps  (Full-Remoto),Remote,,https://weworkremotely.com/remote-jobs/se-parte-de-nuestro-equipo-se-vos-python-backend-devops-full-remoto,wwr::https://weworkremotely.com/remote-jobs/se-parte-de-nuestro-equipo-se-vos-python-backend-devops-full-remoto,"Thu, 05 Mar 2026 16:04:39 +0000","Headquarters: Remoto Acelera tu carrera en Interinnova. ¡Aplica ahora y te contactaremos!Requisitos- Graduado/a o estudiante avanzado/a de carreras de Sistemas, Ingenierías o afines.- Experiencia mínima de 4 años en roles similares dentro de IT.- Contar&nbsp;con skills DevOps&nbsp;&nbsp;- Residir en"
2026-04-02 13:11:40,weworkremotely,Tasq Staffing Solutions,"Senior Azure DevOps Engineer - Remote, Midshift",Remote,,https://weworkremotely.com/remote-jobs/tasq-staffing-solutions-senior-azure-devops-engineer-remote-midshift,wwr::https://weworkremotely.com/remote-jobs/tasq-staffing-solutions-senior-azure-devops-engineer-remote-midshift,"Sun, 08 Mar 2026 20:45:58 +0000","Headquarters: Makati Metro Manila Philippines Position: Lead Azure DevOps Engineer | RemoteSchedule: Midshift (5 p.m. to 2 a.m.) Job Highlights:Our primary focus is on Azure technology, offering numerous exciting opportunities to develop your skills within the Microsoft and Azure ecosystems. Working"
2026-04-02 13:11:40,weworkremotely,Tether Operations Limited,Lead DevOps Engineer (100% Remote),Remote,,https://weworkremotely.com/remote-jobs/tether-operations-limited-lead-devops-engineer-100-remote-3,wwr::https://weworkremotely.com/remote-jobs/tether-operations-limited-lead-devops-engineer-100-remote-3,"Fri, 06 Mar 2026 16:05:20 +0000","Headquarters: London, ENG, United Kingdom Job descriptionJoin Tether and Shape the Future of Digital FinanceAt Tether, we’re not just building products, we’re pioneering a global financial revolution. Our cutting-edge solutions empower businesses—from exchanges and wallets to payment processors and "
2026-04-02 13:11:40,weworkremotely,Tether Operations Limited,Lead DevOps Engineer (100% Remote),Remote,,https://weworkremotely.com/remote-jobs/tether-operations-limited-lead-devops-engineer-100-remote-2,wwr::https://weworkremotely.com/remote-jobs/tether-operations-limited-lead-devops-engineer-100-remote-2,"Fri, 06 Mar 2026 16:05:12 +0000","Headquarters: Belgrade, 00, Serbia Job descriptionJoin Tether and Shape the Future of Digital FinanceAt Tether, we’re not just building products, we’re pioneering a global financial revolution. Our cutting-edge solutions empower businesses—from exchanges and wallets to payment processors and ATMs—to"
2026-04-02 13:11:40,weworkremotely,Tether Operations Limited,Lead DevOps Engineer (100% Remote),Remote,,https://weworkremotely.com/remote-jobs/tether-operations-limited-lead-devops-engineer-100-remote-1,wwr::https://weworkremotely.com/remote-jobs/tether-operations-limited-lead-devops-engineer-100-remote-1,"Fri, 06 Mar 2026 16:05:08 +0000","Headquarters: Buenos Aires, B, Argentina Job descriptionJoin Tether and Shape the Future of Digital FinanceAt Tether, we’re not just building products, we’re pioneering a global financial revolution. Our cutting-edge solutions empower businesses—from exchanges and wallets to payment processors and A"
2026-04-02 13:11:40,weworkremotely,Tether Operations Limited,Lead DevOps Engineer (100% Remote),Remote,,https://weworkremotely.com/remote-jobs/tether-operations-limited-lead-devops-engineer-100-remote,wwr::https://weworkremotely.com/remote-jobs/tether-operations-limited-lead-devops-engineer-100-remote,"Fri, 06 Mar 2026 16:05:01 +0000","Headquarters: Medellin, ANT, Colombia Job descriptionJoin Tether and Shape the Future of Digital FinanceAt Tether, we’re not just building products, we’re pioneering a global financial revolution. Our cutting-edge solutions empower businesses—from exchanges and wallets to payment processors and ATMs"
2026-04-02 13:11:40,weworkremotely,Thaloz,HE - Sr. DevOps Go Developer - 171,Remote,,https://weworkremotely.com/remote-jobs/thaloz-he-sr-devops-go-developer-171,wwr::https://weworkremotely.com/remote-jobs/thaloz-he-sr-devops-go-developer-171,"Sun, 08 Mar 2026 20:46:01 +0000","Headquarters: Brazil We are seeking a highly skilled and motivated Senior DevOps Go Developer to join our Platform Engineering team. This pivotal role focuses on architecting, developing, and refining Go-based Kubernetes controllers and operators to advance our internal GitOps-driven Kubernetes host"
2026-04-03 13:13:55,ddg:apply.workable.com,the-canadian-press,"CloudInfrastructureEngineer, Full-time, (one-year)",,,https://apply.workable.com/the-canadian-press/j/B791E67001/,ddg::https://apply.workable.com/the-canadian-press/j/B791E67001/,,"We are seeking a highly skilledCloudInfrastructureEngineer for a one-year full-time position to manage and optimize our services across AWS, GCP, and on-site environments."
2026-04-02 13:11:40,weworkremotely,Thoughtworks_new,Consultant Infrastructure Developer (DevOps),Remote,,https://weworkremotely.com/remote-jobs/thoughtworks_new-consultant-infrastructure-developer-devops,wwr::https://weworkremotely.com/remote-jobs/thoughtworks_new-consultant-infrastructure-developer-devops,"Thu, 05 Mar 2026 16:45:21 +0000","Headquarters: Manchester, United Kingdom Infrastructure Developers take a multifaceted approach to helping clients achieve technical excellence by assessing challenges from both a technical and operational perspective. As consummate ‘bringers of knowledge,' they take extra care to ensure their team "
2026-04-03 13:13:55,ddg:job-boards.greenhouse.io,togetherai,Jobs at Together AI,,,https://job-boards.greenhouse.io/togetherai,ddg::https://job-boards.greenhouse.io/togetherai,,"InfrastructureEngineer, Data Platform. San Francisco. Machine Learning Engineer.Lead DX Engineer - Documentation. San Francisco. Lead Product Designertags.new."
2026-04-03 13:13:55,ddg:job-boards.greenhouse.io,topsort,"Job Application for Software Engineer, Infrastructure at Topsort",,,https://job-boards.greenhouse.io/topsort/jobs/5158734008,ddg::https://job-boards.greenhouse.io/topsort/jobs/5158734008,,"2 hours ago·... SRE work; Solid hands-on experience with Kubernetes in production — not a homelab, not a tutorial, but real clusters under real load; Experience with at least ..."
2026-04-03 13:13:55,ddg:job-boards.greenhouse.io,trace3?error=true,page_title,,,https://job-boards.greenhouse.io/trace3?error=true,ddg::https://job-boards.greenhouse.io/trace3?error=true,,"CloudEngineerItags.new. Remote - United States - Colorado.Interface Engineer (26-018). Huntsville, AL. Java, DevSecOps Software Engineer."
2026-04-02 13:11:40,weworkremotely,Trafilea,Cloud Engineer (DevOps),Remote,,https://weworkremotely.com/remote-jobs/trafilea-cloud-engineer-devops,wwr::https://weworkremotely.com/remote-jobs/trafilea-cloud-engineer-devops,"Wed, 04 Mar 2026 16:43:54 +0000","Headquarters: Montevideo, Montevideo, Uruguay About Trafilea Trafilea is a dynamic and innovative Tech E-commerce Group that operates multiple direct-to-consumer brands in the intimate apparel and beauty sectors, with a focus on using data-driven strategies to scale their businesses. In addition to "
2026-04-02 13:11:40,weworkremotely,Truelogic,DevOps Engineer - Open Application,Remote,,https://weworkremotely.com/remote-jobs/truelogic-devops-engineer-open-application,wwr::https://weworkremotely.com/remote-jobs/truelogic-devops-engineer-open-application,"Wed, 04 Mar 2026 16:43:51 +0000","Headquarters: About TruelogicAt Truelogic we are a leading provider of nearshore staff augmentation services headquartered in New York. For over two decades, we’ve been delivering top-tier technology solutions to companies of all sizes, from innovative startups to industry leaders, helping them achi"
2026-04-03 13:13:55,ddg:jobs.smartrecruiters.com,unit44,Unit4InfrastructureEngineer| SmartRecruiters,,,https://jobs.smartrecruiters.com/Unit44/744000025220885-infrastructure-engineer,ddg::https://jobs.smartrecruiters.com/Unit44/744000025220885-infrastructure-engineer,,"The IT function is increasing its capabilities and therefore is looking for anInfrastructureEngineer. As anInfrastructureEngineeryou are responsible for designing, deploying, and managing..."
2026-04-03 13:13:55,ddg:jobs.smartrecruiters.com,unit44,Unit4InfrastructureEngineer| SmartRecruiters,,,https://jobs.smartrecruiters.com/Unit44/744000021958205-infrastructure-engineer,ddg::https://jobs.smartrecruiters.com/Unit44/744000021958205-infrastructure-engineer,,"The IT function is increasing its capabilities and therefore is looking for anInfrastructureEngineer. As anInfrastructureEngineeryou are responsible for designing, deploying, and managing..."
2026-04-03 13:13:55,ddg:jobs.smartrecruiters.com,unit44,Unit4InfrastructureEngineer| SmartRecruiters,,,https://jobs.smartrecruiters.com/Unit44/744000017197656-infrastructure-engineer,ddg::https://jobs.smartrecruiters.com/Unit44/744000017197656-infrastructure-engineer,,"The IT function is increasing its capabilities and therefore is looking for anInfrastructureEngineer. As anInfrastructureEngineeryou are responsible for designing, deploying, and managing..."
2026-04-03 13:13:55,ddg:jobs.smartrecruiters.com,unit44,Unit4InfrastructureEngineer| SmartRecruiters,,,https://jobs.smartrecruiters.com/Unit44/744000030078646-infrastructure-engineer,ddg::https://jobs.smartrecruiters.com/Unit44/744000030078646-infrastructure-engineer,,"The IT function is increasing its capabilities and therefore is looking for anInfrastructureEngineer. As anInfrastructureEngineeryou are responsible for designing, deploying, and managing..."
2026-04-03 13:13:55,ddg:apply.workable.com,unitary,PlatformEngineer- Unitary,,,https://apply.workable.com/unitary/j/41856B59AD/,ddg::https://apply.workable.com/unitary/j/41856B59AD/,,"As aPlatformEngineer, you will help us improve and maintain our highly scalable platform that serves up Unitary’s cutting-edge machine learning technology."
2026-04-03 13:01:38,greenhouse,vercel,Anti-Abuse Automation Engineer,,,https://job-boards.greenhouse.io/vercel/jobs/5843010004,greenhouse::5843010004,2026-04-02T11:32:59-04:00,
2026-04-03 13:13:55,ddg:jobs.ashbyhq.com,verto,DevSecOpsEngineer @ Verto,,,https://jobs.ashbyhq.com/verto/d9a9552a-dbeb-4ca1-96ad-a17eeb80c52c,ddg::https://jobs.ashbyhq.com/verto/d9a9552a-dbeb-4ca1-96ad-a17eeb80c52c,,"Experience with Node.js applications for code reviews and remediation. Relevant certifications (e.g., OSCP, CISSP, CEH, AWS Security Specialty, CertifiedDevSecOpsEngineer)."
2026-04-02 13:11:40,weworkremotely,Vexxhost,Ingénieur(e) de OpenStack Cloud (DevOps),Remote,,https://weworkremotely.com/remote-jobs/vexxhost-ingenieur-e-de-openstack-cloud-devops,wwr::https://weworkremotely.com/remote-jobs/vexxhost-ingenieur-e-de-openstack-cloud-devops,"Thu, 05 Mar 2026 16:45:17 +0000","Headquarters: Version FrançaiseNous recherchons une forte expérience en technologies Linux et cloud. Dans ce rôle, vous soutiendrez non seulement nos clients utilisant Atmosphere, notre produit cloud open-source, mais vous fournirez également un soutien essentiel à notre équipe interne de CloudOps q"
2026-04-03 13:13:55,ddg:boards.greenhouse.io,vonage,Job Application for DevOpsPlatformEngineer(mid/senior) at Vonage,,,https://boards.greenhouse.io/vonage/jobs/7061803002,ddg::https://boards.greenhouse.io/vonage/jobs/7061803002,,"On thePlatformEngineering Tooling Team, you will build internal tool sets which benefit our employees in their daily routines, reducing toil and streamline the process of modernizing..."
