collected_at_utc,source_type,company,title,location,team,url,external_id,posted_at,description_snippet
2026-03-31 16:54:24,ddg:boards.greenhouse.io,spacex,"Electrical Hardware Reliability Engineer, Satellites (Starlink)",,,https://boards.greenhouse.io/spacex/jobs/8436944002?gh_jid=8436944002,ddg::https://boards.greenhouse.io/spacex/jobs/8436944002?gh_jid=8436944002,,"Electrical Hardware Reliability Engineer, Satellites (Starlink) · Bachelor's degree in electrical engineering, computer engineering, physics, or other STEM ..."
2026-03-31 16:54:24,ddg:boards.greenhouse.io,braze,"Senior Site Reliability Engineer, Currents",,,https://boards.greenhouse.io/braze/jobs/7491488?gh_jid=7491488,ddg::https://boards.greenhouse.io/braze/jobs/7491488?gh_jid=7491488,,"As a Senior Site Reliability Engineer, you will specifically focus on the observability, scalability, and reliability strategy aspects of every project."
2026-03-31 16:54:24,ddg:boards.greenhouse.io,relativity,Job Application for Senior Build Reliability Engineer at Relativity ...,,,https://boards.greenhouse.io/relativity/jobs/8393648002,ddg::https://boards.greenhouse.io/relativity/jobs/8393648002,,Senior Build Reliability Engineer · Bachelor of Science degree in Engineering or other STEM field and minimum of 5 years of experience acting as a Quality ...
2026-03-31 16:54:24,ddg:jobs.lever.co,valkyrietrading,Valkyrie Trading,,,https://jobs.lever.co/valkyrietrading/c804d5f6-8a0d-4649-97a0-3c3b1863cb13,ddg::https://jobs.lever.co/valkyrietrading/c804d5f6-8a0d-4649-97a0-3c3b1863cb13,,"As a DevOps Engineer, you will be an integral member of our team, collaborating closely with software developers, traders, and quantitative researchers to ..."
2026-03-31 16:54:24,ddg:jobs.lever.co,panopto,DevOps Engineer,,,https://jobs.lever.co/panopto/4a6efe88-2552-4e99-a5c9-efe9b2517b89,ddg::https://jobs.lever.co/panopto/4a6efe88-2552-4e99-a5c9-efe9b2517b89,,"To enhance our team we are seeking an experienced Mid-Level DevOps Engineer who enjoys transforming complex, outdated build systems into streamlined, automated ..."
2026-03-31 16:54:24,ddg:jobs.lever.co,brightedge,Devops Engineer,,,https://jobs.lever.co/brightedge/f0f18ff1-bf64-4a24-8521-1030cd05adcd,ddg::https://jobs.lever.co/brightedge/f0f18ff1-bf64-4a24-8521-1030cd05adcd,,We're currently seeking a motivated Senior DevOps Engineer to join our growing team. Our goal is to ensure high performance and availability of the BrightEdge ...
2026-03-31 16:54:24,ddg:jobs.lever.co,truv,Senior DevOps Engineer,,,https://jobs.lever.co/truv/4049ad13-7b17-4638-bf5d-2c4079474010,ddg::https://jobs.lever.co/truv/4049ad13-7b17-4638-bf5d-2c4079474010,,"We are looking for a Senior DevOps Engineer to join our Infrastructure team and help build the platform that powers Truv. You'll join a small, senior team ..."
2026-03-31 16:54:24,ddg:jobs.lever.co,chownow,Senior DevOps Engineer,,,https://jobs.lever.co/chownow/8d104eff-da42-4e69-b28f-5e8a3f329cac,ddg::https://jobs.lever.co/chownow/8d104eff-da42-4e69-b28f-5e8a3f329cac,,"As a Senior DevOps Engineer at ChowNow, you will be specifically responsible for building, improving, and growing our technology infrastructure. You will help ..."
2026-03-31 16:54:24,ddg:jobs.lever.co,binance,"SeniorSiteReliabilityEngineer(Node.js & QA), Trading...",,,https://jobs.lever.co/binance/7943cc80-5a16-4aaa-852f-95fc683097ab/apply?ref=web3jobs.io,ddg::https://jobs.lever.co/binance/7943cc80-5a16-4aaa-852f-95fc683097ab/apply?ref=web3jobs.io,,About the Role We are looking for a SeniorSiteReliabilityEngineer(SRE) with solid Node.js experience to help maintain and improve our internal testing and validation systems.Engineering – DevOps/SRE/.
2026-03-31 16:54:24,ddg:jobs.lever.co,qonto,Qonto -SiteReliabilityEngineerStorage,,,https://jobs.lever.co/qonto/9fa01a3c-4087-49f5-963d-4f2356e4abbe,ddg::https://jobs.lever.co/qonto/9fa01a3c-4087-49f5-963d-4f2356e4abbe,,"Mission: AsSiteReliabilityEngineer, you will join the Storage team and be responsible for building and maintaining the underlying data storage systems. The primary mission is to provide efficient storage systems with consistent response time at an..."
2026-03-31 16:54:24,ddg:jobs.lever.co,mistral,Site Reliability Engineer,,,https://jobs.lever.co/mistral/6e16e4fa-a60b-4270-a815-06b0450fb597,ddg::https://jobs.lever.co/mistral/6e16e4fa-a60b-4270-a815-06b0450fb597,,Site Reliability Engineer. Paris / London. Engineering & Infra /. Full ... We are seeking highly experienced Site Reliability Engineers (SRE) to shape ...
2026-03-31 16:54:24,ddg:jobs.lever.co,cority,Site Reliability Engineer II,,,https://jobs.lever.co/cority/891c123b-7ea4-4598-ad16-56c087fe1520,ddg::https://jobs.lever.co/cority/891c123b-7ea4-4598-ad16-56c087fe1520,,Site Reliability Engineer II. United States. Technology & Engineering ... You will work with senior team members to implement SRE best practices ...
2026-03-31 16:54:24,ddg:jobs.lever.co,swissborg,Site Reliability Engineer,,,https://jobs.lever.co/swissborg/065d42ce-52c5-45a0-ac53-ea4851a2f60b,ddg::https://jobs.lever.co/swissborg/065d42ce-52c5-45a0-ac53-ea4851a2f60b,,Site Reliability Engineer. Krakow / Warsaw / Estonia / Brussels / Bucharest ... As part of the SRE team you'll work on both internal and external cloud ...
2026-03-31 16:54:24,ddg:jobs.lever.co,voleon,Site Reliability Engineer,,,https://jobs.lever.co/voleon/acecdcc4-f076-47d5-9ab9-a58a6e1995cc,ddg::https://jobs.lever.co/voleon/acecdcc4-f076-47d5-9ab9-a58a6e1995cc,,"As a Site Reliability Engineer (SRE), you will work at the intersection of production operations and software development as you improve, manage, and ..."
2026-03-31 16:54:24,ddg:jobs.lever.co,spotify,Site Reliability Engineer,,,https://jobs.lever.co/spotify/ad5ef898-b800-4213-a63e-e39a97df9cfb/apply,ddg::https://jobs.lever.co/spotify/ad5ef898-b800-4213-a63e-e39a97df9cfb/apply,,"SRE- Backstage- Teressa ... I have 5+ years of experience as a Site Reliability Engineer. ... I rely on Site Reliability/DevOps teams to handle infrastructure, and ..."
2026-03-31 16:54:24,ddg:jobs.lever.co,cority,Senior Platform Engineer,,,https://jobs.lever.co/cority/7c8b3595-68ea-47e6-a06e-83b3400bc2fb,ddg::https://jobs.lever.co/cority/7c8b3595-68ea-47e6-a06e-83b3400bc2fb,,Senior Platform Engineer. United States / Canada. Technology & Engineering – IT /. Full-Time /. Remote. apply for this job. About Cority. Cority helps customers ...
2026-03-31 16:54:24,ddg:jobs.lever.co,ravl_io,Platform Engineer,,,https://jobs.lever.co/ravl_io/877af61b-2377-4dfb-9dcd-7ac1c003fb60,ddg::https://jobs.lever.co/ravl_io/877af61b-2377-4dfb-9dcd-7ac1c003fb60,,"As a Platform Engineer at RAVL, you'll design and deliver the platforms, infrastructure, and automation that power modern engineering teams. You'll bring deep ..."
2026-03-31 16:54:24,ddg:jobs.lever.co,pacerpro,Platform Engineer – Cloud Infrastructure & Reliability,,,https://jobs.lever.co/PacerPro/f96cb805-25b2-4811-b9d9-43602c8a6d51,ddg::https://jobs.lever.co/PacerPro/f96cb805-25b2-4811-b9d9-43602c8a6d51,,Platform Engineer – Cloud Infrastructure & Reliability ... You'll be joining the Engineering team responsible for delivering PacerPro's SaaS and on-premise ...
2026-03-31 16:54:24,ddg:jobs.lever.co,zopa,Platform Engineer (Developer Experience),,,https://jobs.lever.co/zopa/3f8d501e-e4c8-4897-b295-f64ebd6c4ab3?lever-source[]=jobs.augmentum.vc,ddg::https://jobs.lever.co/zopa/3f8d501e-e4c8-4897-b295-f64ebd6c4ab3?lever-source[]=jobs.augmentum.vc,,Platform Engineer (Developer Experience). London. Engineering – DevX & Platform Engineering /. Employee - Permanent /. Hybrid. apply for this job. Our Story.
2026-03-31 16:54:24,ddg:jobs.lever.co,healx,Platform Engineer,,,https://jobs.lever.co/healx/dc53c5cb-2be5-4702-8e1d-0b1bb4b13de2?lever-source[]=jobs.amadeuscapital.com,ddg::https://jobs.lever.co/healx/dc53c5cb-2be5-4702-8e1d-0b1bb4b13de2?lever-source[]=jobs.amadeuscapital.com,,Healx is hiring a motivated Platform Engineer to build cloud infrastructure and develop production pipelines that enable our AI drug discovery process.
2026-03-31 16:54:24,ddg:jobs.lever.co,kubra,Platform Engineer – Cloud & Security Automation,,,https://jobs.lever.co/kubra/27f1a6c5-a0d8-45d2-9495-7b766e06fd4f,ddg::https://jobs.lever.co/kubra/27f1a6c5-a0d8-45d2-9495-7b766e06fd4f,,"As a Platform Engineer – Cloud & Security Automation, you will help build the infrastructure, guardrails, and automation that make KUBRA's Internal ..."
2026-03-31 16:54:24,ddg:jobs.lever.co,saga-xyz,Senior Platform Engineer,,,https://jobs.lever.co/saga-xyz/012a47ad-c15a-47c3-a459-1f14058939dd,ddg::https://jobs.lever.co/saga-xyz/012a47ad-c15a-47c3-a459-1f14058939dd,,"As a Senior Platform Engineer, you'll own the backend systems and infrastructure that power our products. You'll build the services, APIs, deployment pipelines, ..."
2026-03-31 16:54:24,ddg:jobs.lever.co,bestegg,Data Platform Engineer II,,,https://jobs.lever.co/BestEgg/0569542d-826d-471a-bfb4-44261a0d53ea,ddg::https://jobs.lever.co/BestEgg/0569542d-826d-471a-bfb4-44261a0d53ea,,"We are seeking a highly skilled and experienced Data Platform Engineer II to join our team. The ideal candidate brings deep expertise across data platforms, ..."
2026-03-31 16:54:24,ddg:jobs.lever.co,thinkahead,"Cloud Engineer, AWS",,,https://jobs.lever.co/thinkahead/acbaef6b-526e-4134-bb66-d2ceeb4ff25a,ddg::https://jobs.lever.co/thinkahead/acbaef6b-526e-4134-bb66-d2ceeb4ff25a,,"As an AWS Cloud Engineer – Level 2, you will be responsible for designing, implementing, and managing scalable, secure, and reliable cloud infrastructure ..."
2026-03-31 16:54:24,ddg:jobs.lever.co,blackcloak,Senior Cloud Engineer,,,https://jobs.lever.co/BlackCloak/afab4049-7a6c-4920-85cc-ab4ed46ad454,ddg::https://jobs.lever.co/BlackCloak/afab4049-7a6c-4920-85cc-ab4ed46ad454,,"As a Senior Cloud Engineer, you will be a key member of BlackCloak's internal technology team, responsible for the architecture, reliability, and automation of ..."
2026-03-31 16:54:24,ddg:jobs.lever.co,h1,Sr. DevOps AWS Cloud Engineer,,,https://jobs.lever.co/h1/73868723-fcc6-4338-896c-3a59b53eb934,ddg::https://jobs.lever.co/h1/73868723-fcc6-4338-896c-3a59b53eb934,,"As a Senior DevOps / AWS Cloud Engineer, you will play a critical role in designing, scaling, and operating H1's cloud infrastructure. You will serve as a ..."
2026-03-31 16:54:24,ddg:jobs.lever.co,ryzlabs,Sr. Cloud Engineer,,,https://jobs.lever.co/RyzLabs/e150bfd5-43e5-4254-9648-801d9ff6269f,ddg::https://jobs.lever.co/RyzLabs/e150bfd5-43e5-4254-9648-801d9ff6269f,,"RYZ Labs is looking for a Senior Cloud Engineer to join one of our client's teams, from the sports merchandising industry! This role is ideal for an engineer ..."
2026-03-31 16:54:24,ddg:jobs.lever.co,thinkahead,Associate Cloud Engineer– AWS,,,https://jobs.lever.co/thinkahead/b53edd31-1772-4571-b4e1-1d0a623b652d,ddg::https://jobs.lever.co/thinkahead/b53edd31-1772-4571-b4e1-1d0a623b652d,,"As an Associate Cloud Engineer (AWS), you will support the design, deployment, monitoring, and optimization of cloud infrastructure for our clients. You will ..."
2026-03-31 16:54:24,ddg:jobs.lever.co,shieldai,Senior Cloud Engineer (R4222),,,https://jobs.lever.co/shieldai/702e2609-db48-49ab-8bec-d405c956a6ce,ddg::https://jobs.lever.co/shieldai/702e2609-db48-49ab-8bec-d405c956a6ce,,"Shield AI is looking for a Cloud Engineer to support its leadership in applied artificial intelligence development. In this role, you will be responsible for ..."
2026-03-31 16:54:24,ddg:jobs.lever.co,quantco-,Cloud Engineer,,,https://jobs.lever.co/quantco-/a7c4f142-b1ad-449c-a18e-bdbda41a3f86,ddg::https://jobs.lever.co/quantco-/a7c4f142-b1ad-449c-a18e-bdbda41a3f86,,Cloud Engineer ... QuantCo turns advances in artificial intelligence and statistical learning into real-world impact in leading enterprises and public sector ...
2026-03-31 16:54:24,ddg:jobs.lever.co,innovativesol-2,Innovative Solutions,,,https://jobs.lever.co/innovativesol-2/398b2b92-a60f-43b7-acb4-30717addf359,ddg::https://jobs.lever.co/innovativesol-2/398b2b92-a60f-43b7-acb4-30717addf359,,Cloud Engineer - Full Stack Developer · Assisting in the designing and building modern and highly scalable cloud-based applications for customers · Migrating and ...
2026-03-31 16:54:24,ddg:jobs.lever.co,anavationllc,Cloud Engineer,,,https://jobs.lever.co/anavationllc/9d0fb963-8c70-47d2-a0cf-4584a4e58932,ddg::https://jobs.lever.co/anavationllc/9d0fb963-8c70-47d2-a0cf-4584a4e58932,,We support and enhance a variety of core application and data services leveraged by multiple Government Agencies. The Cloud Engineer will: Design and implement ...
2026-03-31 16:54:24,ddg:jobs.lever.co,aircall,Infrastructure Engineer,,,https://jobs.lever.co/aircall/a0b5380d-de63-440b-bdb8-204315d8b11b,ddg::https://jobs.lever.co/aircall/a0b5380d-de63-440b-bdb8-204315d8b11b,,"As an Infrastructure Engineer, you'll be responsible for managing and operating our AWS Cloud Infrastructure, whilst working in deep collaboration with peers ..."
2026-03-31 16:54:24,ddg:jobs.lever.co,ivo,"Software Engineer, Infrastructure",,,https://jobs.lever.co/ivo/dceaaf87-1cac-45b6-81d6-568b2913acef,ddg::https://jobs.lever.co/ivo/dceaaf87-1cac-45b6-81d6-568b2913acef,,Infrastructure Engineers build the foundation for Ivo's entire platform. We're looking for an Infrastructure Engineer to: • Own and shape the future of our ...
2026-03-31 16:54:24,ddg:jobs.lever.co,iru,Senior Infrastructure Engineer,,,https://jobs.lever.co/iru/4356620c-cab2-4347-a61b-89ab9e28df5e,ddg::https://jobs.lever.co/iru/4356620c-cab2-4347-a61b-89ab9e28df5e,,"As a Staff Infrastructure Engineer at Iru, you will be instrumental in architecting and scaling our AWS-based infrastructure to support our rapid growth. In ..."
2026-03-31 16:54:24,ddg:jobs.lever.co,palantir,Ceph Infrastructure Engineer,,,https://jobs.lever.co/palantir/aadf59e6-80a5-49fd-93d3-58e8de2dc8c9,ddg::https://jobs.lever.co/palantir/aadf59e6-80a5-49fd-93d3-58e8de2dc8c9,,"As a Senior Infrastructure Engineer, you will leverage your expertise in Ceph to manage and optimize storage solutions at scale, ensuring seamless integration ..."
2026-03-31 16:54:24,ddg:jobs.lever.co,sysdig,Senior Infrastructure Engineer,,,https://jobs.lever.co/sysdig/9c63b209-7dfa-489a-b75b-a033fde72850,ddg::https://jobs.lever.co/sysdig/9c63b209-7dfa-489a-b75b-a033fde72850,,Senior Infrastructure Engineer ; What you will do · Compliance and Security: Ensure compliance with industry standards for security and data protection. ; What you ...
2026-03-31 16:54:24,ddg:jobs.lever.co,schmidt-entities,"Compute Infrastructure Engineer, AI and Advanced Computing Institute",,,https://jobs.lever.co/schmidt-entities/6739aba3-6253-4754-a53c-9ae17345d2b4,ddg::https://jobs.lever.co/schmidt-entities/6739aba3-6253-4754-a53c-9ae17345d2b4,,"Reporting to the Compute Program Scientist in the AI Institute, the Infrastructure Engineer will provide technical leadership and apply computational ..."
2026-03-31 16:54:24,ddg:jobs.lever.co,axoni,Site Reliability Engineer,,,https://jobs.lever.co/axoni/9bcb978e-6306-423f-bbf6-e3eb0c6ec468,ddg::https://jobs.lever.co/axoni/9bcb978e-6306-423f-bbf6-e3eb0c6ec468,,"Axoni’sDevSecOpsteam is responsible for managing and maintaining the company’s corporate cloud infrastructure, focused primarily on organizational-level operating standards and..."
2026-03-31 16:54:24,ddg:jobs.lever.co,standtogether,Senior DevSecOps Engineer,,,https://jobs.lever.co/standtogether/2f823c57-af9a-4cb4-999b-c8ca1d99befc,ddg::https://jobs.lever.co/standtogether/2f823c57-af9a-4cb4-999b-c8ca1d99befc,,"Act as a trusted advisor on cloud security strategy, incident response, and disaster recovery. Coach engineers on secure coding, DevSecOps patterns, and ..."
2026-03-31 16:54:24,ddg:jobs.lever.co,vrchat,Lead DevSecOps Engineer,,,https://jobs.lever.co/vrchat/0049381f-cbfa-453a-9d21-ba0324da7b4f,ddg::https://jobs.lever.co/vrchat/0049381f-cbfa-453a-9d21-ba0324da7b4f,,"Lead DevSecOps Engineer. Anywhere. Engineering /. Full-Time /. Remote. apply for this job. Join the VRChat Team! VRChat offers a first-of-its-kind, game- ..."
2026-03-31 16:54:24,ddg:jobs.lever.co,mistral,"CyberSecurity Engineer, DevSecOps",,,https://jobs.lever.co/mistral/94a331c8-0ddf-4e88-a6ad-7a70c212e0fa,ddg::https://jobs.lever.co/mistral/94a331c8-0ddf-4e88-a6ad-7a70c212e0fa,,"5+ years of experience in DevSecOps, Security Engineering, or Cloud Security, ideally acting as an early security hire in a fast-paced or hyper-scale ..."
2026-03-31 16:54:24,ddg:jobs.lever.co,outsight,DevSecOps Engineer,,,https://jobs.lever.co/outsight/b6620e7c-fc8d-492b-994d-8b158482ac49,ddg::https://jobs.lever.co/outsight/b6620e7c-fc8d-492b-994d-8b158482ac49,,Integration: Ensure seamless integration of security tools into the CI/CD pipeline (DevSecOps) to support our engineering teams. Participate to software supply- ...
2026-03-31 16:54:24,ddg:jobs.lever.co,keboola,Senior DevSecOps Engineer,,,https://jobs.lever.co/keboola/bcc4d516-0fde-46d8-953b-169602de85bd,ddg::https://jobs.lever.co/keboola/bcc4d516-0fde-46d8-953b-169602de85bd,,What you'll do. Design and oversee security architecture with a focus on DevSecOps principles (shift-left security). Integrate security controls into CI/ ...
2026-03-31 16:54:24,ddg:jobs.lever.co,yuno,DevSecOps Engineer,,,https://jobs.lever.co/yuno/938d33f5-c4d1-4c13-a337-1bcad72aa4f3,ddg::https://jobs.lever.co/yuno/938d33f5-c4d1-4c13-a337-1bcad72aa4f3,,"As a DevSecOps Engineer at Yuno, you will be responsible for embedding security by default across our development and operations workflows. In this role, you ..."
2026-03-31 16:54:24,ddg:jobs.lever.co,pingwind,DevSecOps Senior Specialist,,,https://jobs.lever.co/pingwind/f457facc-4be7-418e-ab55-e5f01498e506,ddg::https://jobs.lever.co/pingwind/f457facc-4be7-418e-ab55-e5f01498e506,,"The Senior DevSecOps Engineer also provides technical leadership, mentors junior engineers, and partners with development, operations, and cybersecurity teams ..."
2026-03-31 16:54:24,ddg:jobs.lever.co,airalo,Senior DevSecOps Engineer,,,https://jobs.lever.co/airalo/f88c0a7b-c462-41d0-aa7f-b4b0c088b544,ddg::https://jobs.lever.co/airalo/f88c0a7b-c462-41d0-aa7f-b4b0c088b544,,Define and enforce secure coding standards and provide training and mentorship to development teams on DevSecOps principles. ... 5+ years of experience in ...
2026-03-31 16:54:24,ddg:jobs.lever.co,agile-defense,DevSecOps Engineer,,,https://jobs.lever.co/agile-defense/f5348e9b-eaf8-4b03-b59f-e24c9c4cb5bb,ddg::https://jobs.lever.co/agile-defense/f5348e9b-eaf8-4b03-b59f-e24c9c4cb5bb,,"We are seeking a DevSecOps Engineer with 3–5 years of experience to join a specialized Agile Pod dedicated to building and sustaining a secure, automated ..."
2026-03-31 16:54:24,ddg:jobs.lever.co,welocalize,Cloud Infrastructure Engineer,,,https://jobs.lever.co/welocalize/85ff50fe-96ce-47f2-8527-4e3ac233ff5e,ddg::https://jobs.lever.co/welocalize/85ff50fe-96ce-47f2-8527-4e3ac233ff5e,,"TheCloudPlatform Engineer II is responsible for the design, implementation, and optimization of cloud-basedinfrastructure, CI/CD pipelines, integration and delivery of software across development and production environments and ensuring overallcloudinfrastructurereliability."
2026-03-31 16:54:24,ddg:jobs.lever.co,oowlish,Senior Cloud Infrastructure Engineer (AWS),,,https://jobs.lever.co/oowlish/ff00ef9b-a262-4122-9f55-fb46adece15c,ddg::https://jobs.lever.co/oowlish/ff00ef9b-a262-4122-9f55-fb46adece15c,,"We are seeking a SeniorCloudInfrastructureEngineer to lead the design, build, and operation of scalable, secure, and reliablecloudinfrastructure across AWS and Heroku."
2026-03-31 16:54:24,ddg:jobs.lever.co,weride,Senior Software Engineer,,,https://jobs.lever.co/weride/752dee2b-50d8-4276-97cc-ec1e1f0e1fb7,ddg::https://jobs.lever.co/weride/752dee2b-50d8-4276-97cc-ec1e1f0e1fb7,,"Senior Software Engineer - Cloud Infrastructure. San Jose, CA. Software Engineering /. Full-time /. On-site. apply for this job. Established in 2017, WeRide ..."
2026-03-31 16:54:24,ddg:jobs.lever.co,go-cloudforce,Cloud Infrastructure Administrator,,,https://jobs.lever.co/go-cloudforce/65b119a2-6acd-43c6-bd45-5ab5f0b5aec9,ddg::https://jobs.lever.co/go-cloudforce/65b119a2-6acd-43c6-bd45-5ab5f0b5aec9,,"Strong troubleshooting skills across Azure cloud infrastructure - especially those involving roles, resource access, and networking issues. Experience using ..."
2026-03-31 16:54:24,ddg:jobs.lever.co,leverdemo-8,"Software Engineer, Cloud Infrastructure",,,https://jobs.lever.co/leverdemo-8/96a3a8ed-b7c9-4880-a432-72d9dde9d9fc,ddg::https://jobs.lever.co/leverdemo-8/96a3a8ed-b7c9-4880-a432-72d9dde9d9fc,,"Software Engineer, Cloud Infrastructure. San Francisco, California. Engineering – Back End /. apply for this job. ________This is an example!______. PLEASE ..."
2026-03-31 16:54:24,ddg:jobs.lever.co,jiostar,Cloud/Infrastructure Security Engineer – JioStar,,,https://jobs.lever.co/jiostar/77798d18-65eb-4d44-a53c-6b4fd63989e6,ddg::https://jobs.lever.co/jiostar/77798d18-65eb-4d44-a53c-6b4fd63989e6,,"Role Summary: As a Cloud/Infrastructure Security Engineer at JioStar, you will design, implement, and maintain secure cloud and infrastructure solutions to ..."
2026-03-31 16:54:24,ddg:jobs.lever.co,go-cloudforce,Cloudforce jobs,,,https://jobs.lever.co/go-cloudforce,ddg::https://jobs.lever.co/go-cloudforce,,Job openings at Cloudforce
2026-03-31 16:54:24,ddg:jobs.lever.co,zoox,Senior Reliability Engineer,,,https://jobs.lever.co/zoox/bcf1b023-dcb8-43c8-a137-f50747f95f95,ddg::https://jobs.lever.co/zoox/bcf1b023-dcb8-43c8-a137-f50747f95f95,,"Bonus Qualifications: ASQ CertifiedReliabilityEngineer, or similar professional recognition An understanding of ISO 26262 Functional Safety Working knowledge of SQL, Pyspark, and python based packages for fleet wide data analysis Experience applying numerical methods to highly distributed compute wo"
2026-03-31 16:54:24,ddg:jobs.lever.co,cority,Site Reliability Engineer II,,,https://jobs.lever.co/cority/891c123b-7ea4-4598-ad16-56c087fe1520/apply,ddg::https://jobs.lever.co/cority/891c123b-7ea4-4598-ad16-56c087fe1520/apply,,"Role Summary As an IntermediateSiteReliabilityEngineer, you will support the reliability, performance, and scalability of cloud-hosted services and database platforms."
2026-03-31 16:54:24,ddg:jobs.lever.co,airalo,Senior Site Reliability Engineer,,,https://jobs.lever.co/airalo/79d755b4-a0d5-41ac-a162-4dae80939bd5,ddg::https://jobs.lever.co/airalo/79d755b4-a0d5-41ac-a162-4dae80939bd5,,5+ years of experience as aSiteReliabilityEngineeror in a similar role. 3+ years of experience with AWS services including strong knowledge of container orchestration.
2026-03-31 16:54:24,ddg:jobs.lever.co,jobgether,Senior Site Reliability Engineer,,,https://jobs.lever.co/jobgether/e9271ae3-6bdd-462e-9f5a-ed2bed86dff3,ddg::https://jobs.lever.co/jobgether/e9271ae3-6bdd-462e-9f5a-ed2bed86dff3,,"We are currently looking for a Senior SiteReliabilityEngineerin the United States. This role offers a unique opportunity to ensure the reliability, scalability, and performance of critical platform services in a fast-paced, technology-driven environment."
2026-03-31 16:54:24,ddg:jobs.lever.co,lightedge,Site Reliability Engineer,,,https://jobs.lever.co/lightedge/d6f19a02-8d47-4bea-b9ac-afffb921db2a,ddg::https://jobs.lever.co/lightedge/d6f19a02-8d47-4bea-b9ac-afffb921db2a,,"As aSiteReliabilityEngineer(SRE), you will be an integral part of the team at LightEdge Solutions. This position will report to the DevOps Manager, and will be responsible for reliable operation of the organization’s systems and services."
2026-03-31 16:54:24,ddg:jobs.lever.co,palantir,Forward Deployed Reliability Engineer,,,https://jobs.lever.co/palantir/689e6869-01bc-40f1-b580-adb33a020065,ddg::https://jobs.lever.co/palantir/689e6869-01bc-40f1-b580-adb33a020065,,"As a Forward Deployed Reliability Engineer (FDRE), you ensure stability and reliability of mission-critical workflows built on Palantir software. You gather ..."
2026-03-31 16:54:24,ddg:jobs.lever.co,restaurant365,Site Reliability Engineer II,,,https://jobs.lever.co/restaurant365/d2f85f2f-f664-4aa4-a050-78e7cf3ed597,ddg::https://jobs.lever.co/restaurant365/d2f85f2f-f664-4aa4-a050-78e7cf3ed597,,"The Site Reliability Engineer II will be responsible for supporting, enhancing, and maintaining Restaurant365's cloud infrastructure and applications. Qualified ..."
2026-03-31 16:54:24,ddg:apply.workable.com,enfos-inc,Devops System Engineer,,,https://apply.workable.com/enfos-inc/j/6684AA8E92/,ddg::https://apply.workable.com/enfos-inc/j/6684AA8E92/,,"As aDevOpsEngineerat ENFOS, you will report directly to the Head of Engineering and serve as a key contributor to the reliability, security, and performance of our platform."
2026-03-31 16:54:24,ddg:apply.workable.com,creyos,DevOps Engineer,,,https://apply.workable.com/creyos/j/7CD26E82A2/,ddg::https://apply.workable.com/creyos/j/7CD26E82A2/,,"ThisDevOpsEngineerwill focus on enhancing the efficiency and reliability of the software development and deployment processes. You will work on automating configuration management, implementing continuous integration and deployment pipelines, optimizing cloud infrastructure, and monitoring system pe"
2026-03-31 16:54:24,ddg:apply.workable.com,lod-technologies-inc,LOD Technologies Inc.,,,https://apply.workable.com/lod-technologies-inc/j/5C6D384D12/,ddg::https://apply.workable.com/lod-technologies-inc/j/5C6D384D12/,,"We are looking for aDevOpsEngineerto help scale our cloud and on-prem environments, automate deployments, and strengthen our security posture across mission-critical systems."
