collected_at_utc,source_type,company,title,location,team,url,external_id,posted_at,description_snippet
2026-04-03 13:13:55,ddg:jobs.smartrecruiters.com,iomaxisllc,"MAXISIQ, Inc.CloudInfrastructureEngineer",,,https://jobs.smartrecruiters.com/IOMAXISLLC/3743990007276226-cloud-infrastructure-engineer,ddg::https://jobs.smartrecruiters.com/IOMAXISLLC/3743990007276226-cloud-infrastructure-engineer,,"As aCloudInfrastructureEngineer, you will play a pivotal role in designing, deploying, and managing cloud-based systems that support national priorities. This position requires a full scope..."
2026-04-03 13:01:38,remoteok,Ivanti,Senior Software Engineer C++ Windows SDK WIN32 API,Hyderabad,,https://remoteOK.com/remote-jobs/remote-senior-software-engineer-c-windows-sdk-win32-api-ivanti-1130909,remoteok::1130909,2026-03-27T16:00:54+00:00,"Are you an expert in Windows internals with a passion for low-level software engineering? At Ivanti, you'll have the opportunity to develop and maintain critical Windows applications, services, and device drivers used by organizations worldwide to manage and secure their digital environments. As a v"
2026-04-03 13:01:38,greenhouse,jetbrains,Cloud Infrastructure Engineer (Kineto),,,https://job-boards.eu.greenhouse.io/jetbrains/jobs/4777558101,greenhouse::4777558101,2026-04-01T06:11:34-04:00,
2026-04-03 13:01:38,greenhouse,jetbrains,QA Automation Engineer (IJ Platform / Remote Development),,,https://job-boards.eu.greenhouse.io/jetbrains/jobs/4779443101,greenhouse::4779443101,2026-04-02T06:49:37-04:00,
2026-04-03 13:01:38,greenhouse,jetbrains,QA Automation Engineer (IJ Platform/ Dev Environments),,,https://job-boards.eu.greenhouse.io/jetbrains/jobs/4777933101,greenhouse::4777933101,2026-04-02T06:50:58-04:00,
2026-04-03 13:01:38,greenhouse,jetbrains,Technical Writer (JetBrains Cloud Platform),,,https://job-boards.eu.greenhouse.io/jetbrains/jobs/4808543101,greenhouse::4808543101,2026-04-01T09:14:18-04:00,
2026-04-03 13:13:55,ddg:jobs.lever.co,jiostar,Senior Devops Engineer,,,https://jobs.lever.co/jiostar/cea4f185-cd3c-4d5d-9587-31ca5dedc16c,ddg::https://jobs.lever.co/jiostar/cea4f185-cd3c-4d5d-9587-31ca5dedc16c,,"17 hours ago·We are looking for a skilled DevOps Engineer with strong expertise in Kubernetes, CI/CD pipelines, and Jenkins. The ideal candidate should have hands-on ..."
2026-04-03 13:13:55,ddg:jobs.lever.co,jobgether,Data Engineer,,,https://jobs.lever.co/jobgether/f58ca68a-a8f7-456f-ade5-93693b914edf,ddg::https://jobs.lever.co/jobgether/f58ca68a-a8f7-456f-ade5-93693b914edf,,11 hours ago·Hands-on experience with dbt for data transformation and orchestration tools like Airflow. Proficient in Python for programming and AWS as your cloud platform.
2026-04-03 13:13:55,ddg:jobs.lever.co,jobgether,Platform Engineer,,,https://jobs.lever.co/jobgether/f3eeb586-0101-4172-94bd-7d04a7e9a7c0,ddg::https://jobs.lever.co/jobgether/f3eeb586-0101-4172-94bd-7d04a7e9a7c0,,"8 hours ago·As a Senior Associate Platform Engineer, you will play a critical role in shaping the digital landscape of a Fortune 100 leader by overseeing the LeanIX ..."
2026-04-03 13:01:38,jobicy,Libertex Group,Infrastructure Engineer (Remote or Relocation to Montenegro),Serbia,DevOps &amp; Infrastructure,https://jobicy.com/jobs/140100-infrastructure-engineer-remote-or-relocation-to-montenegro,jobicy::140100,2026-03-04T09:53:58+00:00,"Established in 1997, the Libertex Group has helped shape the online trading industry by merging innovative technology, market movements and digital trends. The multi-awarded online trading platform, Libertex, enables traders to..."
2026-04-03 13:13:55,ddg:apply.workable.com,lightmatter,InfrastructureEngineer(Toronto),,,https://apply.workable.com/lightmatter/j/7C83D813BC/,ddg::https://apply.workable.com/lightmatter/j/7C83D813BC/,,InfrastructureEngineer. Lightmatter builds chips that enable extreme-scale artificial intelligence computing clusters.
2026-04-03 13:13:55,ddg:jobs.lever.co,loftorbital,Loft Orbital Solutions,,,https://jobs.lever.co/loftorbital/,ddg::https://jobs.lever.co/loftorbital/,,"TestInfrastructure. Apply. Senior SoftwareEngineer. Hybrid — Full timeGolden, CO.EngineeringInfrastructure. Apply. Electrical SystemsEngineer. On-site — Full timeAbu Dhabi."
2026-04-03 13:01:38,weworkremotely,Luby,Profissional SRE/DevOps (AWS/Terraform) Sênior - Remoto,Remote,,https://weworkremotely.com/remote-jobs/luby-profissional-sre-devops-aws-terraform-senior-remoto,wwr::https://weworkremotely.com/remote-jobs/luby-profissional-sre-devops-aws-terraform-senior-remoto,"Fri, 03 Apr 2026 00:08:59 +0000","Headquarters: BR URL: http://luby.com.br #VemPraLuby💙 Aqui você terá a oportunidade de: Evoluir em um ambiente de alta performance: &nbsp;Uma cultura onde o desenvolvimento é contínuo, com autonomia e envolvimento em projetos nacionais e internacionais que realmente testam suas habilidades e impulsi"
2026-04-03 13:13:55,ddg:jobs.ashbyhq.com,m-kopa,CloudInfrastructureEngineer @ M-KOPA,,,https://jobs.ashbyhq.com/M-KOPA/540fcad1-aeab-44ab-a9d9-79a21cd16f82?embed=js,ddg::https://jobs.ashbyhq.com/M-KOPA/540fcad1-aeab-44ab-a9d9-79a21cd16f82?embed=js,,"We’re looking for aCloudInfrastructureEngineer to join our Technical Department who’s collaborative, communicative, systematic and a fast-learning results-driven person."
2026-04-02 13:11:40,arbeitnow,MAIA,Senior DevOps / Platform Engineer (f/m/x),Remote,"Remote, IT",https://www.arbeitnow.com/jobs/companies/maia/senior-devops-platform-engineer-leipzig-147320,arbeitnow::senior-devops-platform-engineer-leipzig-147320,1775062824,"MAIA is the AI platform built for industrial companies - where generic AI tools break down because the data is complex, the stakes are high, and precision actually matters. We focus on the hard problems: integrating with real engineering workflows, understanding complex technical documents, and turn"
2026-04-03 13:01:38,remotive,Marketerx,Senior DevOps Engineer,USA,DevOps / Sysadmin,https://remotive.com/remote-jobs/devops/senior-devops-engineer-2070150,remotive::2070150,2026-03-18T14:31:25,"The Role: Architect of a Resilient Future We are seeking a highly experienced and motivated Senior DevOps/Security Engineer to join our founding engineering team. This isn't just another DevOps role. You will be the architect of the resilient, scalable, and secure foundation upon which our entire au"
2026-04-03 13:01:38,weworkremotely,Matera,Devops - Pleno e Sênior (Banco de Talentos),Remote,,https://weworkremotely.com/remote-jobs/matera-devops-pleno-e-senior-banco-de-talentos,wwr::https://weworkremotely.com/remote-jobs/matera-devops-pleno-e-senior-banco-de-talentos,"Fri, 03 Apr 2026 00:08:59 +0000","Headquarters: BR URL: http://matera.com.br Aqui na&nbsp; Matera , tecnologia conecta pessoas, transforma negócios e amplia possibilidades. Trabalhamos para tornar o acesso a serviços financeiros mais seguro, eficiente e democrático, desenvolvendo soluções que impactam milhões de pessoas todos os dia"
2026-04-02 13:11:40,weworkremotely,MAX Digital Services,Ingénieur·e DevOps H/F,Remote,,https://weworkremotely.com/remote-jobs/max-digital-services-ingenieur-e-devops-h-f,wwr::https://weworkremotely.com/remote-jobs/max-digital-services-ingenieur-e-devops-h-f,"Wed, 04 Mar 2026 16:43:52 +0000","Headquarters: Rennes, Bretagne, FR Détail du posteConstruire une Infrastructure as Code sous Terraform ou Ansible ? Même pas peur !Y mettre du Kubernetes pour garder des containers up ? Un classique.L'héberger dans le Cloud ? AWS, GCP ou Azure, tu maîtrises.Automatiser le tout sous Gitlab ou Jenkins"
2026-04-03 13:01:38,lever,metabase,Senior SRE/DevOps Engineer,Global Remote,Engineering,https://jobs.lever.co/metabase/1b702919-4d0b-4085-baec-8947f9b7e4ee,lever::1b702919-4d0b-4085-baec-8947f9b7e4ee,1589224005614,"Metabase is the easiest way for people to get insights from their data, from tiny startups who get up and running quickly to major corporations with tens of thousands of users. That's why people love us. We bring data tools with the elegance and simplicity of consumer products to the crufty world of"
2026-04-03 13:13:55,ddg:apply.workable.com,minderacraft,ExperiencedCloudEngineer(Azure),,,https://apply.workable.com/minderacraft/j/792106B3F4/,ddg::https://apply.workable.com/minderacraft/j/792106B3F4/,,AsCloudEng you’ll be part of an agile project team working with all the infrastructure pieces of a system.
2026-04-03 13:01:38,remoteok,MinIO,Site Reliability Engineer US West,Worldwide,,https://remoteOK.com/remote-jobs/remote-site-reliability-engineer-us-west-minio-1130893,remoteok::1130893,2026-03-26T16:01:22+00:00,"MinIO is the industry leader in high-performance object storage and the company behind the worldâs fastest, most widely deployed object store, powering production infrastructure for more than half of the Fortune 500, including 9 of the 10 largest global automakers and all 10 of the largest U.S. ba"
2026-04-03 13:13:55,ddg:jobs.lever.co,mistral,Mistral AI -DevOpsEngineer,,,https://jobs.lever.co/mistral/7ecf3446-2810-47af-a8cb-d248986d649b,ddg::https://jobs.lever.co/mistral/7ecf3446-2810-47af-a8cb-d248986d649b,,We are seeking our firstDevOpsEngineer. Responsibilities. - Collaborate with AI/ML engineers and researchers to develop and implement a CI/CD that enables safe and reproducible...
2026-04-03 13:13:55,ddg:job-boards.greenhouse.io,modulrfinance,Job Application for Senior Information Security Engineer at Modulr,,,https://job-boards.greenhouse.io/modulrfinance/jobs/8456587002?gh_jid=8456587002,ddg::https://job-boards.greenhouse.io/modulrfinance/jobs/8456587002?gh_jid=8456587002,,"1 day ago -The team works across cloud, network and corporate environments to ensure security is embedded into how technology is designed, built and operated. This role reports to the Information Security Director and works closely with Platform Engineering, DevOps, Infrastructure and Product teams."
2026-04-03 13:01:38,greenhouse,mongodb,Cloud Operations Engineer,,,https://www.mongodb.com/careers/job/?gh_jid=7453323,greenhouse::7453323,2026-04-01T10:21:32-04:00,
2026-04-03 13:01:38,greenhouse,mongodb,Cloud Operations Engineer,,,https://www.mongodb.com/careers/job/?gh_jid=7647255,greenhouse::7647255,2026-04-01T10:21:32-04:00,
2026-04-03 13:01:38,greenhouse,mongodb,"Senior Site Reliability Engineer,  Fleet Management",,,https://www.mongodb.com/careers/job/?gh_jid=7727873,greenhouse::7727873,2026-04-01T10:21:32-04:00,
2026-04-03 13:01:38,greenhouse,mongodb,"Site Reliability Engineer (Senior or Staff), Atlas",,,https://www.mongodb.com/careers/job/?gh_jid=6984809,greenhouse::6984809,2026-04-01T10:21:32-04:00,
2026-04-03 13:01:38,greenhouse,mongodb,"Site Reliability Engineer (Senior or Staff), Infrastructure Security",,,https://www.mongodb.com/careers/job/?gh_jid=7758610,greenhouse::7758610,2026-04-01T10:21:32-04:00,
2026-04-03 13:01:38,greenhouse,mongodb,"Site Reliability Engineer (Senior or Staff), Observability",,,https://www.mongodb.com/careers/job/?gh_jid=7192648,greenhouse::7192648,2026-04-01T10:21:32-04:00,
2026-04-03 13:01:38,greenhouse,mongodb,"Site Reliability Engineer (Senior or Staff), Observability",,,https://www.mongodb.com/careers/job/?gh_jid=6711349,greenhouse::6711349,2026-04-01T10:21:32-04:00,
2026-04-03 13:01:38,greenhouse,mongodb,"Team Lead, Site Reliability Engineering - Fleet Management",,,https://www.mongodb.com/careers/job/?gh_jid=7650199,greenhouse::7650199,2026-04-01T10:21:32-04:00,
2026-04-03 13:01:38,greenhouse,mongodb,"Team Lead, Site Reliability Engineering - Storage Layer Service",,,https://www.mongodb.com/careers/job/?gh_jid=7743306,greenhouse::7743306,2026-04-01T10:21:32-04:00,
2026-04-03 13:01:38,greenhouse,mongodb,"Team Lead, Site Reliability Engineering - Storage Layer Service",,,https://www.mongodb.com/careers/job/?gh_jid=7743304,greenhouse::7743304,2026-04-01T10:21:32-04:00,
2026-04-03 13:13:55,ddg:jobs.lever.co,moonpay,Backend Engineer,,,https://jobs.lever.co/moonpay/8d65d39e-64fc-4d12-9c4a-14804129518c,ddg::https://jobs.lever.co/moonpay/8d65d39e-64fc-4d12-9c4a-14804129518c,,"23 hours ago·Understand database structures, theories, principles, and best practices. Experienced with Cloud Native applications such as Google Cloud or similar (e.g. AWS, ..."
2026-04-03 13:01:38,arbeitnow,MY Humancapital GmbH,DevSecOps / IT Security Specialist (m/w/d),Augsburg,System and Network Administration,https://www.arbeitnow.com/jobs/companies/my-humancapital-gmbh/devsecops-it-security-specialist-augsburg-229497,arbeitnow::devsecops-it-security-specialist-augsburg-229497,1775176240,Im Auftrag unseres Kunden suchen wir Sie für den Standort Augsburg zum nächstmöglichen Zeitpunkt als „DevSecOps / IT Security Specialist“ Aufgaben Als DevSecOps / IT Security Specialist (m/w/d) treiben Sie die Weiterentwicklung des DevSecOps-Ansatzes in den Produkt-Teams voran Dabei führen Sie Siche
2026-04-03 13:01:38,lever,neon,Software Engineer - Afirmativa para Pessoas com Deficiência,Remoto,Production Engineering,https://jobs.lever.co/neon/e794724d-ea43-4d52-a975-037b8adb9297,lever::e794724d-ea43-4d52-a975-037b8adb9297,1768857803252,"Sobre a Neon Queremos ser, cada vez mais, um time excepcional - que constrói, apoia e reconhece equipes diversas que sobem a barra lá em cima! Somos uma fintech fundada por um brasileiro que, insatisfeito com os bancos tradicionais, começou a construir um serviço que ajudasse a vida financeira das p"
2026-04-02 13:11:40,weworkremotely,Newsmatics,Cloud Engineer (Ruby/DevOps)  100% remote,Remote,,https://weworkremotely.com/remote-jobs/newsmatics-cloud-engineer-ruby-devops-100-remote,wwr::https://weworkremotely.com/remote-jobs/newsmatics-cloud-engineer-ruby-devops-100-remote,"Sat, 07 Mar 2026 20:44:56 +0000","Headquarters: Czech Republic Who are we looking for?We’re looking for more than just an infrastructure guru. We want a DevOps powerhouse with solid AWS expertise – who also brings something extra to the table. Maybe you’re a part-time data scientist, a seasoned backend coder, or you geek out on dash"
2026-04-03 13:13:55,ddg:jobs.smartrecruiters.com,nexthink,NexthinkPlatformEngineer| SmartRecruiters,,,https://jobs.smartrecruiters.com/Nexthink/743999917221823-platform-engineer,ddg::https://jobs.smartrecruiters.com/Nexthink/743999917221823-platform-engineer,,"Min 3 years of experience as a Software Engineer, DevOps Engineer,PlatformEngineeror Site Reliability Engineer with knowledge of best practices of professional software..."
2026-04-02 13:11:40,weworkremotely,Nick Ai,Backend/DevOps Engineer,Remote,,https://weworkremotely.com/remote-jobs/nick-ai-backend-devops-engineer,wwr::https://weworkremotely.com/remote-jobs/nick-ai-backend-devops-engineer,"Tue, 10 Mar 2026 20:35:50 +0000","Headquarters: United States About NickAINickAI is revolutionizing cryptocurrency investing through AI-powered autonomous trading agents. Our platform enables users to create sophisticated AI agents that manage crypto portfolios 24/7, eliminating emotional trading decisions and maximizing investment "
2026-04-03 13:13:55,ddg:jobs.ashbyhq.com,northflank.com,CloudInfrastructureEngineer @ Northflank,,,https://jobs.ashbyhq.com/northflank.com/25024796-eeea-4b8b-bb49-b939ced37c65,ddg::https://jobs.ashbyhq.com/northflank.com/25024796-eeea-4b8b-bb49-b939ced37c65,,"In this role, you'll be instrumental in architecting and maintaining the robustcloudinfrastructurethat powers our platform. This position is remote. Key Responsibilities"
2026-04-03 13:13:55,ddg:jobs.smartrecruiters.com,now100,Now100SiteReliabilityEngineer-SRE| SmartRecruiters,,,https://jobs.smartrecruiters.com/Now100/743999884115973-site-reliability-engineer-sre,ddg::https://jobs.smartrecruiters.com/Now100/743999884115973-site-reliability-engineer-sre,,"Role:SiteReliabilityEngineer. Location: Atlanta, GA OR Dallas OR Austin, TX. Duration: Long Term or 6+ Months contract to Hire. Note: Remote Possible, however candidates will move to work onsite/Hybrid eventually."
2026-04-02 13:11:40,weworkremotely,Oben Technology,DevOps with French,Remote,,https://weworkremotely.com/remote-jobs/oben-technology-devops-with-french,wwr::https://weworkremotely.com/remote-jobs/oben-technology-devops-with-french,"Tue, 10 Mar 2026 20:33:47 +0000","Headquarters: Bucharest Romania ABOUT COMPANY Oben stands ready to provide the IT Strategy and Consulting support for Global Leaders to help them steer their Organizations through Change. We leverage our functional and technology expertise, insights and industry know-how to help Enterprises reach th"
2026-04-02 13:11:40,weworkremotely,Octo Technology,Stage - DevOps - F/H/N,Remote,,https://weworkremotely.com/remote-jobs/octo-technology-stage-devops-f-h-n,wwr::https://weworkremotely.com/remote-jobs/octo-technology-stage-devops-f-h-n,"Fri, 06 Mar 2026 20:43:02 +0000","Headquarters: 34 Av. de l&#39;Opéra, 75002 Paris, France Description de l'entrepriseOCTOPremier cabinet d’architectes IT fondé en 1998, pionnier du delivery agile et véritable concentrateur de talents. Nous incarnons les nouvelles façons de faire du conseil et du Delivery. Digital Doers &amp; Thinke"
2026-04-02 13:11:40,weworkremotely,Octopus It,DevOps - Réseau Social à Fort Trafic - Full Remote H/F,Remote,,https://weworkremotely.com/remote-jobs/octopus-it-devops-reseau-social-a-fort-trafic-full-remote-h-f,wwr::https://weworkremotely.com/remote-jobs/octopus-it-devops-reseau-social-a-fort-trafic-full-remote-h-f,"Wed, 04 Mar 2026 16:43:53 +0000","Headquarters: Paris, Île-de-France, FR Détail du posteLa sociétéNotre client est une société à taille humaine, qui développe notamment un réseau social (5 millions d'inscrits, 700 000 visites / jour).Leur mission est de proposer des produits qui permettent à nos utilisateurs d'être eux-même.En forte"
2026-04-02 13:11:40,weworkremotely,Octopus It,DevOps - Start Up - Healthtech - Full Remote Possible H/F,Remote,,https://weworkremotely.com/remote-jobs/octopus-it-devops-start-up-healthtech-full-remote-possible-h-f,wwr::https://weworkremotely.com/remote-jobs/octopus-it-devops-start-up-healthtech-full-remote-possible-h-f,"Wed, 04 Mar 2026 16:43:53 +0000","Headquarters: Paris, Île-de-France, FR Détail du posteLa sociétéLeur mission :rendre l'accès aux soins cardiaques de haut niveauaccessible à tous, n'importe où, n'importe quand.Pour concrétiser cette vision, ils tirent parti des technologies d'apprentissage automatique (IA) et de cloud computing. Le"
2026-04-02 13:11:40,weworkremotely,Octopus It,DevOps - Start-Up Spécialisée en Deep Learning - Fullremote H/F,Remote,,https://weworkremotely.com/remote-jobs/octopus-it-devops-start-up-specialisee-en-deep-learning-fullremote-h-f,wwr::https://weworkremotely.com/remote-jobs/octopus-it-devops-start-up-specialisee-en-deep-learning-fullremote-h-f,"Wed, 04 Mar 2026 16:43:53 +0000","Headquarters: Paris, Île-de-France, FR Détail du posteLa sociétéCréée en 2018 cette start-up a construit une plateforme basée sur du deep learningafin defournir des services de prédiction pour l'agriculture à grande échelle.Les clients utilisent leur smartphone pour diagnostiquer leur production en "
2026-04-03 13:01:38,greenhouse,okta,Senior Adobe Experience Cloud Engineer,,,https://www.okta.com/company/careers/opportunity/7629690?gh_jid=7629690,greenhouse::7629690,2026-04-01T10:48:59-04:00,
2026-04-03 13:01:38,greenhouse,okta,Senior AEM DevSecOps Engineer,,,https://www.okta.com/company/careers/opportunity/7688701?gh_jid=7688701,greenhouse::7688701,2026-03-26T03:52:11-04:00,
2026-04-03 13:01:38,greenhouse,okta,Senior Data Platform Engineer (Bengaluru),,,https://www.okta.com/company/careers/opportunity/7648977?gh_jid=7648977,greenhouse::7648977,2026-03-23T15:50:52-04:00,
2026-04-03 13:01:38,greenhouse,okta,Senior Database Reliability Engineer (DBRE),,,https://www.okta.com/company/careers/opportunity/7437987?gh_jid=7437987,greenhouse::7437987,2026-03-23T15:50:52-04:00,
2026-04-02 13:11:40,greenhouse,okta,Senior Database Reliability Engineer (DBRE) ; postgreSQL,,,https://www.okta.com/company/careers/opportunity/7774364?gh_jid=7774364,greenhouse::7774364,2026-04-01T22:35:11-04:00,
2026-04-03 13:01:38,greenhouse,okta,Senior Database Reliability Engineer (DBRE) ; postgreSQL,,,https://www.okta.com/company/careers/opportunity/7437974?gh_jid=7437974,greenhouse::7437974,2026-04-01T22:33:24-04:00,
2026-04-03 13:01:38,greenhouse,okta,Senior Database Reliability Engineer (DBRE) ; postgreSQL,,,https://www.okta.com/company/careers/opportunity/7437947?gh_jid=7437947,greenhouse::7437947,2026-04-01T22:33:52-04:00,
2026-04-03 13:01:38,greenhouse,okta,Senior Database Reliability Engineer (DBRE) ; postgreSQL,,,https://www.okta.com/company/careers/opportunity/7436028?gh_jid=7436028,greenhouse::7436028,2026-04-01T22:33:09-04:00,
2026-04-03 13:01:38,greenhouse,okta,"Senior Platform Engineer, Control Plane (Auth0)",,,https://www.okta.com/company/careers/opportunity/7595065?gh_jid=7595065,greenhouse::7595065,2026-03-23T15:50:52-04:00,
2026-04-03 13:01:38,greenhouse,okta,Senior Site Reliability Engineer (Auth0),,,https://www.okta.com/company/careers/opportunity/7418982?gh_jid=7418982,greenhouse::7418982,2026-03-23T15:50:52-04:00,
2026-04-03 13:01:38,greenhouse,okta,Senior Site Reliability Engineer - Observability,,,https://www.okta.com/company/careers/opportunity/7658254?gh_jid=7658254,greenhouse::7658254,2026-03-23T15:50:52-04:00,
2026-04-03 13:01:38,greenhouse,okta,Senior Site Reliability Engineer - Security and Data Systems (Federal),,,https://www.okta.com/company/careers/opportunity/7591606?gh_jid=7591606,greenhouse::7591606,2026-03-24T16:04:49-04:00,
2026-04-03 13:01:38,greenhouse,okta,"Senior Site Reliability Engineer, Edge - TS/SCI",,,https://www.okta.com/company/careers/opportunity/7562925?gh_jid=7562925,greenhouse::7562925,2026-03-23T15:50:52-04:00,
2026-04-03 13:01:38,greenhouse,okta,"Senior Site Reliability Engineer, TCore (FedRamp)",,,https://www.okta.com/company/careers/opportunity/7674807?gh_jid=7674807,greenhouse::7674807,2026-03-23T15:50:52-04:00,
2026-04-03 13:01:38,greenhouse,okta,Senior Site Reliability Engineer- Observability,,,https://www.okta.com/company/careers/opportunity/7653045?gh_jid=7653045,greenhouse::7653045,2026-03-23T15:50:52-04:00,
2026-04-03 13:01:38,greenhouse,okta,Site Reliability Engineer (Auth0),,,https://www.okta.com/company/careers/opportunity/7325605?gh_jid=7325605,greenhouse::7325605,2026-03-23T15:50:52-04:00,
2026-04-03 13:13:55,ddg:jobs.ashbyhq.com,openai,"InfrastructureEngineer, Public Sector @ OpenAI",,,https://jobs.ashbyhq.com/openai/3de62595-eb62-4272-a611-ae393bb973a6?i12m_id=i12m-2024-4-5UJ,ddg::https://jobs.ashbyhq.com/openai/3de62595-eb62-4272-a611-ae393bb973a6?i12m_id=i12m-2024-4-5UJ,,About the Role. We’re seeking anInfrastructureEngineerwith experience in building and operating infrastructure at scale.
2026-04-03 13:13:55,ddg:jobs.ashbyhq.com,openai,"Software Engineer,CloudInfrastructure@ OpenAI",,,https://jobs.ashbyhq.com/openai/973ef76d-ddb8-41fd-87bb-2f701556749d,ddg::https://jobs.ashbyhq.com/openai/973ef76d-ddb8-41fd-87bb-2f701556749d,,"Thecloudinfrastructureteam builds and maintains infrastructure abstractions allowing OpenAI to ship products quickly and scalably. This role is based in San Francisco, CA."
2026-04-03 13:13:55,ddg:apply.workable.com,orion-health,InfrastructureEngineer- Orion Health,,,https://apply.workable.com/orion-health/j/95E0DED099/,ddg::https://apply.workable.com/orion-health/j/95E0DED099/,,"As anInfrastructureEngineer, your role is crucial in ensuring our internal IT systems provide highly available, secure, and efficient services to all internal Orion Health teams."
2026-04-03 13:13:55,ddg:job-boards.greenhouse.io,oura,"Job Application for Senior Fullstack Engineer, Commerce Mission at Ōura",,,https://job-boards.greenhouse.io/oura/jobs/4205832009,ddg::https://job-boards.greenhouse.io/oura/jobs/4205832009,,"17 hours ago·Collaborate with QA and SRE to ensure readiness for peak events (launches, BFCM, campaigns). Support on-call rotations by helping debug, fix, and prevent ..."
2026-04-03 13:13:55,ddg:jobs.ashbyhq.com,oxygen,DevOpsEngineer@ Oxygen,,,https://jobs.ashbyhq.com/Oxygen/34ef0584-65de-4000-aa57-96d26812b9ef?departmentId=c28bf3bd-a5bb-40c4-a043-ac6ed053e3fd&amp;locationId=d3e38ccb-b511-4f08-a0f9-602dd46c7b48&amp,ddg::https://jobs.ashbyhq.com/Oxygen/34ef0584-65de-4000-aa57-96d26812b9ef?departmentId=c28bf3bd-a5bb-40c4-a043-ac6ed053e3fd&amp;locationId=d3e38ccb-b511-4f08-a0f9-602dd46c7b48&amp,,Oxygen is seeking an experiencedDevOpsEngineerto play a pivotal role in advancing Oxygen's growth journey.
2026-04-03 13:13:55,ddg:jobs.lever.co,palantir,"ProductReliabilityEngineer, New Grad",,,https://jobs.lever.co/palantir/63494bd6-3c41-4449-b01f-0932dc664fc4,ddg::https://jobs.lever.co/palantir/63494bd6-3c41-4449-b01f-0932dc664fc4,,"As a ProductReliabilityEngineer, you’ll need to be resourceful, analytical, and agile. Every day is different as Palantir’s products, and our customer’s problems are constantly evolving."
2026-04-03 13:13:55,ddg:job-boards.greenhouse.io,phonepe?error=true,Jobs at PhonePe,,,https://job-boards.greenhouse.io/phonepe?error=true,ddg::https://job-boards.greenhouse.io/phonepe?error=true,,SiteReliabilityEngineer(8 - 13 yrs).Job. Production Engineer. Bangalore. Engineering / Tech Infra & IT_L1.
2026-04-03 13:01:38,lever,plaid,Senior Software Engineer - Data Infrastructure,San Francisco,Engineering,https://jobs.lever.co/plaid/05b0ae3f-ec60-48d6-ae27-1bd89d928c47,lever::05b0ae3f-ec60-48d6-ae27-1bd89d928c47,1757949773106,We believe that the way people interact with their finances will drastically improve in the next few years. We’re dedicated to empowering this transformation by building the tools and experiences that thousands of developers use to create their own products. Plaid powers the tools millions of people
