collected_at_utc,source_type,company,title,location,team,url,external_id,posted_at,description_snippet
2026-03-31 16:54:24,ddg:job-boards.greenhouse.io,andurilindustries,Job Application for Senior Site Reliability Engineer,,,https://job-boards.greenhouse.io/andurilindustries/jobs/4277287007,ddg::https://job-boards.greenhouse.io/andurilindustries/jobs/4277287007,,"If you are an experienced SRE who ... Engineers (SRE)work with technical leaders and System Deployment Engineers to determine technical direction and deliver with thorough analysis, designs and code...."
2026-03-31 16:54:24,ddg:job-boards.greenhouse.io,braze,Job Application for Senior Site Reliability Engineer at Braze,,,https://job-boards.greenhouse.io/braze/jobs/7602207,ddg::https://job-boards.greenhouse.io/braze/jobs/7602207,,"Site Reliability Engineers (SREs) areresponsible for keeping all internal-facing services and platforms running smoothly. In a nutshell, SREs ensure site uptime."
2026-03-31 16:54:24,ddg:job-boards.greenhouse.io,moniepoint,Job Application for Site Reliability Engineer at Moniepoint,,,https://job-boards.greenhouse.io/moniepoint/jobs/4784643101,ddg::https://job-boards.greenhouse.io/moniepoint/jobs/4784643101,,"Job Summary We are seeking a SiteReliability Engineer(SRE) responsible for ensuring our systems run smoothly and efficiently while engineering solutions to improve visibility, eliminate repetitive tasks, and increase system resilience."
2026-03-31 16:54:24,ddg:job-boards.greenhouse.io,redwoodmaterials,"Job Application for Reliability Engineer, Energy Storage at Redwood Materials",,,https://job-boards.greenhouse.io/redwoodmaterials/jobs/5836554004?gh_jid=5836554004,ddg::https://job-boards.greenhouse.io/redwoodmaterials/jobs/5836554004?gh_jid=5836554004,,"As an early member of a new engineering team, you will be responsible for defining system reliability requirements, generating damage models, and characterizing the reliability of our new product."
2026-03-31 16:54:24,ddg:boards.greenhouse.io,updater,Job Application for Senior DevOps Engineer at Updater,,,https://boards.greenhouse.io/updater/jobs/5912519,ddg::https://boards.greenhouse.io/updater/jobs/5912519,,"As aDevOps Engineer, you will play a crucial role in driving our long-term business outcomes, improving deployment velocity, ensuring system reliability and stability, and implementing cutting-edge system observability practices."
2026-03-31 16:54:24,ddg:boards.greenhouse.io,predictiveindex,Job Application for Salesforce DevOps Engineer at The Predictive Index,,,https://boards.greenhouse.io/predictiveindex/jobs/5438832002,ddg::https://boards.greenhouse.io/predictiveindex/jobs/5438832002,,"The SalesforceDevOps Engineerwill govern and operate PI’s DevOps and source control applications, set a roadmap for continuous improvements to the DevOps process and infrastructure, and work with a team of Salesforce Admins and Developers to improve the speed and quality of features released to prod"
2026-03-31 16:54:24,ddg:boards.greenhouse.io,novo,Job Application for Devops Engineer at Novo,,,https://boards.greenhouse.io/novo/jobs/4325567004,ddg::https://boards.greenhouse.io/novo/jobs/4325567004,,"You will join our DevOps team and work on the integration, delivery, and reliability layers of Novo.DevOps Engineers work closely with our product management, product engineering, and platform teams to continuously improve uptime, cycle time, MTTR, and other vital DORA metrics."
2026-03-31 16:54:24,ddg:boards.greenhouse.io,grover,Job Application for DevOps Engineer (m/w/x) at Grover,,,https://boards.greenhouse.io/grover/jobs/4851691003,ddg::https://boards.greenhouse.io/grover/jobs/4851691003,,We are looking for aDevOps Engineerto join our talented Engineering team.
2026-03-31 16:54:24,ddg:boards.greenhouse.io,blackedgecapital,Job Application for DevOps Engineer at BlackEdge Capital,,,https://boards.greenhouse.io/blackedgecapital/jobs/4032384005,ddg::https://boards.greenhouse.io/blackedgecapital/jobs/4032384005,,"Build a top-tier DevOps infrastructure to scale our system to new exchanges, data centers, and products. Care for mission-critical hardware and software infrastructure. Vet new releases and coordinate roll-out processes. Research and diagnose system issues. Interface with third-party vendors to mana"
2026-03-31 16:54:24,ddg:boards.greenhouse.io,smartbear,Job Application for SwaggerOS,,,https://boards.greenhouse.io/smartbear/jobs/6095173003,ddg::https://boards.greenhouse.io/smartbear/jobs/6095173003,,"As anDevOps Engineer, you will be joining a team comprised of engineers in Poland, Ireland, and the United States. We're a highly collaborative team with engineers at various skill levels to help everyone improve and grow."
2026-03-31 16:54:24,ddg:boards.greenhouse.io,edifylabsinc,Job Application for DevOps Engineer at Edify,,,https://boards.greenhouse.io/edifylabsinc/jobs/4873490003,ddg::https://boards.greenhouse.io/edifylabsinc/jobs/4873490003,,We are looking for aDevOps Engineerto join our quickly growing team at Edify! The purpose of theDevOps Engineeris to ensure our global cloud infrastructure is top-notch and meets our industry-leading 100% SLA.. The right candidate will be confident with executing and automating operational processes
2026-03-31 16:54:24,ddg:boards.greenhouse.io,spaceship,Job Application for DevOps Engineer,,,https://boards.greenhouse.io/spaceship/jobs/3066609,ddg::https://boards.greenhouse.io/spaceship/jobs/3066609,,"The DevOps team transforms and evolves the Spaceship business through the deployment of best-in-class global networks, web-scale data centres and software infrastructure. As aDevOps Engineerin this team, you will guide internal customers on how to configure and deploy their cloud infrastructure cons"
2026-03-31 16:54:24,ddg:boards.greenhouse.io,clicklease,Job Application for Devops Engineer at Clicklease,,,https://boards.greenhouse.io/clicklease/jobs/4740175004,ddg::https://boards.greenhouse.io/clicklease/jobs/4740175004,,"The Devops Engineer will help manage the company’s devops and release processes in Costa Rica, ensuring the devops systems function as needed for stable, functional, and timely releases for the business. This role should have experience with git repositories, devops tools, and have experience with e"
2026-03-31 16:54:24,ddg:boards.greenhouse.io,alphagrepsecurities,Job Application for Devops Engineer at AlphaGrep Securities,,,https://boards.greenhouse.io/alphagrepsecurities/jobs/4656447002,ddg::https://boards.greenhouse.io/alphagrepsecurities/jobs/4656447002,,Have hands-on-experience in providing 1st level monitoring and engineering support.
2026-03-31 16:54:24,ddg:boards.greenhouse.io,andurilindustries,"Senior Site Reliability Engineer, Production Engineering",,,https://boards.greenhouse.io/andurilindustries/jobs/5093563007,ddg::https://boards.greenhouse.io/andurilindustries/jobs/5093563007,,"Senior Site Reliability Engineer, Production Engineering ... 7+ years of engineering experience with at least 3+ years focused on SRE, production operations, or ..."
2026-03-31 16:54:24,ddg:boards.greenhouse.io,andurilindustries,Job Application for Senior Site Reliability Engineer at Anduril ...,,,https://boards.greenhouse.io/andurilindustries/jobs/5093600007,ddg::https://boards.greenhouse.io/andurilindustries/jobs/5093600007,,"We are looking for a Site Reliability Engineer (SRE) to join AGD, our rapidly growing team in Irvine or Costa Mesa. SREs work with external stakeholders to ..."
2026-03-31 16:54:24,ddg:boards.greenhouse.io,andurilindustries,Job Application for Senior Site Reliability Engineer at Anduril ...,,,https://boards.greenhouse.io/andurilindustries/jobs/5055678007?gh_jid=5055678007?ref=employbl,ddg::https://boards.greenhouse.io/andurilindustries/jobs/5055678007?gh_jid=5055678007?ref=employbl,,"Senior Site Reliability Engineer. Seattle, Washington, United States. Apply ... 7+ years of working experience in DevOps or SRE type roles; Strongly ..."
2026-03-31 16:54:24,ddg:boards.greenhouse.io,cookunity,Senior Site Reliability Engineer,,,https://boards.greenhouse.io/cookunity/jobs/7589959003,ddg::https://boards.greenhouse.io/cookunity/jobs/7589959003,,Senior Site Reliability Engineer - B2B. Engineering. Argentina (Remote). About ... Do you count with 5+ years of experience as a SRE? (Optional). Select an ...
2026-03-31 16:54:24,ddg:boards.greenhouse.io,backblaze,Job Application for Sr. Site Reliability Engineer at Backblaze External ...,,,https://boards.greenhouse.io/backblaze/jobs/5155632008,ddg::https://boards.greenhouse.io/backblaze/jobs/5155632008,,"About the Role: We are seeking a Senior Site Reliability Engineer (SRE) to help ensure the stability, scalability, and reliability of our services and ..."
2026-03-31 16:54:24,ddg:boards.greenhouse.io,corelight,Lead Cloud Infrastructure Engineer / Site Reliability Engineer (SRE),,,https://boards.greenhouse.io/corelight/jobs/7504742?gh_jid=7504742?ref=employbl,ddg::https://boards.greenhouse.io/corelight/jobs/7504742?gh_jid=7504742?ref=employbl,,"As a Lead Cloud Infrastructure Engineer / Site Reliability Engineer (SRE), you will ensure the stability, performance, and security of our Federal region's ..."
2026-03-31 16:54:24,ddg:boards.greenhouse.io,andurilindustries,Job Application for Senior Site Reliability Engineer,,,https://boards.greenhouse.io/andurilindustries/jobs/5050318007?gh_jid=5050318007,ddg::https://boards.greenhouse.io/andurilindustries/jobs/5050318007?gh_jid=5050318007,,"Senior Site Reliability Engineer - Deployed, Connected Warfare. Seattle, Washington, United States. Apply ... A Connected Warfare SRE - System Deployment deploys ..."
2026-03-31 16:54:24,ddg:boards.greenhouse.io,medrio,Job Application for Senior Site Reliability Engineer at Medrio,,,https://boards.greenhouse.io/medrio/jobs/8481782002,ddg::https://boards.greenhouse.io/medrio/jobs/8481782002,,"As a Medrio Senior Site Reliability Engineer, you will be a part of the ITOps group responsible for maintaining all environments supporting the SDLC for ..."
2026-03-31 16:54:24,ddg:boards.greenhouse.io,spacex,"Job Application for Platform Engineer, Flight Software (Starlink) at SpaceX",,,https://boards.greenhouse.io/spacex/jobs/8478286002?gh_jid=8478286002,ddg::https://boards.greenhouse.io/spacex/jobs/8478286002?gh_jid=8478286002,,"As a platform engineer on the Starlink flight software team, you will be responsible for the software that enables rapid iteration and deployment of both ground ..."
2026-03-31 16:54:24,ddg:boards.greenhouse.io,applovin,Job Application for Platform Engineer at AppLovin,,,https://boards.greenhouse.io/applovin/jobs/4664949006,ddg::https://boards.greenhouse.io/applovin/jobs/4664949006,,Wurl is seeking a Platform Engineer to help design and operate the systems that power our ad-serving and streaming platforms. You'll build and evolve the ...
2026-03-31 16:54:24,ddg:boards.greenhouse.io,ridgeline,"Senior Platform Engineer, Data Persistence",,,https://boards.greenhouse.io/ridgeline/jobs/7615707003?gh_jid=7615707003?ref=employbl,ddg::https://boards.greenhouse.io/ridgeline/jobs/7615707003?gh_jid=7615707003?ref=employbl,,"As a Senior Platform Engineer on the Data Persistence team, you will play a critical role in designing, building, and optimizing the data systems that power ..."
2026-03-31 16:54:24,ddg:boards.greenhouse.io,faire,Job Application for Senior Growth Platform Engineer at Faire,,,https://boards.greenhouse.io/faire/jobs/8465041002,ddg::https://boards.greenhouse.io/faire/jobs/8465041002,,Senior Growth Platform Engineer · Have 5+ years of backend software engineering experience. · Have strong experience designing and operating distributed systems ...
2026-03-31 16:54:24,ddg:boards.greenhouse.io,andurilindustries,Senior Mission Data Platform Engineer,,,https://boards.greenhouse.io/andurilindustries/jobs/5042299007?gh_jid=5042299007,ddg::https://boards.greenhouse.io/andurilindustries/jobs/5042299007?gh_jid=5042299007,,"We are seeking a Senior Mission Data Platform Engineer to design, build, and operate the foundational data infrastructure that empowers our analytics and ..."
2026-03-31 16:54:24,ddg:boards.greenhouse.io,sonyinteractiveentertainmentglobal,Job Application for Platform Engineer at PlayStation Global,,,https://boards.greenhouse.io/sonyinteractiveentertainmentglobal/jobs/5831487004,ddg::https://boards.greenhouse.io/sonyinteractiveentertainmentglobal/jobs/5831487004,,"We're looking for a strong Platform Engineer with strong hands-on experience in Kubernetes, AWS, and DevOps/GitOps tooling. This role sits within our Data ..."
2026-03-31 16:54:24,ddg:boards.greenhouse.io,emnify,Job application for Senior Platform Engineer,,,https://boards.greenhouse.io/emnify/jobs/4780474101,ddg::https://boards.greenhouse.io/emnify/jobs/4780474101,,"Senior Platform Engineer - Kafka (d/f/m). Apply Now. Infrastructure. Berlin, Germany. Share this Job. Why emnify? With a predicted 25 billion connected IoT ..."
2026-03-31 16:54:24,ddg:boards.greenhouse.io,bluerivertech,Blue River Technology,,,https://boards.greenhouse.io/bluerivertech/jobs/7739711,ddg::https://boards.greenhouse.io/bluerivertech/jobs/7739711,,"We are seeking a Senior CVML Platform Engineer to help design, build, and evolve the platforms that support computer vision and ML workloads at scale. This role ..."
2026-03-31 16:54:24,ddg:boards.greenhouse.io,faire,Careers at Faire,,,https://boards.greenhouse.io/faire/jobs/8426107002?gh_jid=8426107002,ddg::https://boards.greenhouse.io/faire/jobs/8426107002?gh_jid=8426107002,,"Senior Staff Machine Learning Platform Engineer. San Francisco, CA · Staff Machine Learning Platform Engineer. San Francisco, CA · Senior Staff Machine Learning ..."
2026-03-31 16:54:24,ddg:boards.greenhouse.io,ruggable,Job Application for Cloud Engineer at Ruggable,,,https://boards.greenhouse.io/ruggable/jobs/5098726003,ddg::https://boards.greenhouse.io/ruggable/jobs/5098726003,,"This role willsupport and maintain the growing suite of Cloud applications and platforms that drive the growth of the company, and will play an integral part of the IT team, as well as being a major point of contact for the DevOps team."
2026-03-31 16:54:24,ddg:boards.greenhouse.io,wpp,Job Application for Cloud Engineer at WPP,,,https://boards.greenhouse.io/wpp/jobs/6626438002,ddg::https://boards.greenhouse.io/wpp/jobs/6626438002,,"The role is responsible for overseeing operations support for cloud services through monitoring, incident response, and incident resolution for production applications and infrastructure deployed in the cloud environment."
2026-03-31 16:54:24,ddg:boards.greenhouse.io,pdtpartners,Job Application for Cloud Engineer at PDT Partners,,,https://boards.greenhouse.io/pdtpartners/jobs/1825569,ddg::https://boards.greenhouse.io/pdtpartners/jobs/1825569,,"We’re looking for aCloud Engineer, with a passion for public cloud, automation, and configuration management to join our world-class team. PDTers are creative, energetic, friendly, entrepreneurial, and collaborative. If you could walk around our office, you’d see that we’re a focused, ..."
2026-03-31 16:54:24,ddg:boards.greenhouse.io,enmacc,Job Application for Cloud Engineer,,,https://boards.greenhouse.io/enmacc/jobs/4163722101,ddg::https://boards.greenhouse.io/enmacc/jobs/4163722101,,"You will have a real impact in shaping our engineering culture and - of course - our platform, assuming responsibility and growing within our quickly developing start-up. Your main focus will be the design, implementation, and management of cloud-based systems and infrastructure for enmacc."
2026-03-31 16:54:24,ddg:boards.greenhouse.io,embed,"Job Application for Software Engineer, Cloud Engineering at The New York Times",,,https://boards.greenhouse.io/embed/job_app?token=4594826005,ddg::https://boards.greenhouse.io/embed/job_app?token=4594826005,,"August 15, 2025 -Work within the overlap of several areas of focus: observability, security, deployment pipelines, cloud infrastructure and containerization · Promote the use of modern automation around access management and Infrastructure-as-code · Work with product engineering teams, helping them "
2026-03-31 16:54:24,ddg:boards.greenhouse.io,charlesriverassociates,Job Application for Cloud Engineer at Charles River Associates,,,https://boards.greenhouse.io/charlesriverassociates/jobs/5316291,ddg::https://boards.greenhouse.io/charlesriverassociates/jobs/5316291,,"The Cloud Engineer will be responsible for:Installation, configuration, maintenance and support of infrastructure and systems in multiple Datacenters across the globe· Maintaining and supporting cloud-based infrastructure · Maintaining the ..."
2026-03-31 16:54:24,ddg:boards.greenhouse.io,verramobility,Job Application for Cloud Engineer at Verra Mobility,,,https://boards.greenhouse.io/verramobility/jobs/4320022006,ddg::https://boards.greenhouse.io/verramobility/jobs/4320022006,,"Position Overview: We are seeking an experienced and detail-orientedCloud Engineerto join our team. In this role, you will be responsible for creating, maintaining, and securing our cloud infrastructure, using scripts to deploy and release change."
2026-03-31 16:54:24,ddg:boards.greenhouse.io,darkwolfsolutions,Job Application for Cloud Engineer at Dark Wolf Solutions,,,https://boards.greenhouse.io/darkwolfsolutions/jobs/6238099003,ddg::https://boards.greenhouse.io/darkwolfsolutions/jobs/6238099003,,"Dark Wolf Solutions is seeking a Cloud Engineer with Networking and Help Desk experience to support out Operational IT team. Cloud Engineers areresponsible for designing, implementing, and managing cloud solutions for our customers."
2026-03-31 16:54:24,ddg:boards.greenhouse.io,andurilindustries,"Job Application for Cloud Infrastructure Engineer, Security at Anduril ...",,,https://boards.greenhouse.io/andurilindustries/jobs/5040112007,ddg::https://boards.greenhouse.io/andurilindustries/jobs/5040112007,,We are seeking a mission-driven Cloud Infrastructure Engineer to take a leading role in designing and implementing world-class defensive controls. This is a ...
2026-03-31 16:54:24,ddg:boards.greenhouse.io,spacex,"IT Network Infrastructure Engineer, Launch",,,https://boards.greenhouse.io/spacex/jobs/8458745002?gh_jid=8458745002,ddg::https://boards.greenhouse.io/spacex/jobs/8458745002?gh_jid=8458745002,,"As a Network Infrastructure Engineer at SpaceX, you will work in a complex environment designing and supporting a variety of IT systems critical for Starship ..."
2026-03-31 16:54:24,ddg:boards.greenhouse.io,redcellpartners,Job Application for Cloud Infrastructure Engineer at Red Cell ...,,,https://boards.greenhouse.io/redcellpartners/jobs/5091754007,ddg::https://boards.greenhouse.io/redcellpartners/jobs/5091754007,,"4 days ago·We are seeking an experienced Cloud Infrastructure Engineer to design, deploy, and administer cloud environments with a strong emphasis on ..."
2026-03-31 16:54:24,ddg:boards.greenhouse.io,neo4j,Job Application for Sr. IT Infrastructure Engineer at Neo4j,,,https://boards.greenhouse.io/neo4j/jobs/4666598006,ddg::https://boards.greenhouse.io/neo4j/jobs/4666598006,,"Sr. IT Infrastructure Engineer · What you'll do: Scale our tools (endpoint, identity, and infrastructure). · Responsibilities: Extending our use of identity and ..."
2026-03-31 16:54:24,ddg:boards.greenhouse.io,qualifiedhealth,Cloud / Infrastructure Engineer,,,https://boards.greenhouse.io/qualifiedhealth/jobs/5163860008,ddg::https://boards.greenhouse.io/qualifiedhealth/jobs/5163860008,,The Cloud / Infrastructure Engineer is the person who builds the platform that everything else runs on. You'll provision Azure environments from scratch for ...
2026-03-31 16:54:24,ddg:boards.greenhouse.io,spacex,"Job Application for Reliability Engineer, Facilities at SpaceX",,,https://boards.greenhouse.io/spacex/jobs/8474952002,ddg::https://boards.greenhouse.io/spacex/jobs/8474952002,,"Facilities Infrastructure Engineer/Level I: $100,000.00 - $115,000.00/per year. Facilities Infrastructure Engineer/Level II: $110,000.00 - $135,000.00/per year."
2026-03-31 16:54:24,ddg:boards.greenhouse.io,applovin,Grow your career at AppLovin,,,https://boards.greenhouse.io/applovin/jobs/4568195006,ddg::https://boards.greenhouse.io/applovin/jobs/4568195006,,"Foundational Research Scientist. Palo Alto, CA · Machine Learning Engineer – Feed Recommendation. Singapore · ML Infrastructure Engineer. Palo Alto, CA ..."
2026-03-31 16:54:24,ddg:boards.greenhouse.io,esri,DevSecOps Engineer II - SaaS Job,,,https://boards.greenhouse.io/esri/jobs/5072573007,ddg::https://boards.greenhouse.io/esri/jobs/5072573007,,"2 weeks ago -As aDevSecOpsEngineer for the world’s most advanced geospatial information systems company, you will lead the implementation of and support operations for advancing security principles, ensuring continuous compliance, automating risk assessment, d"
2026-03-31 16:54:24,ddg:boards.greenhouse.io,defcon,Job Application for Senior DevSecOps Engineer at DEFCON,,,https://boards.greenhouse.io/defcon/jobs/4508745007,ddg::https://boards.greenhouse.io/defcon/jobs/4508745007,,"As a SeniorDevSecOpsEngineer, you will play a crucial role in maintaining and supporting our mission-critical systems. Your primary responsibilities will include deploying, managing, and troubleshooting applications and infrastructure on AWS, Kubernetes, and Terraform."
2026-03-31 16:54:24,ddg:boards.greenhouse.io,raft,Job Application for DevSecOps Engineer at Raft Company Website,,,https://boards.greenhouse.io/raft/jobs/5318345004,ddg::https://boards.greenhouse.io/raft/jobs/5318345004,,"As a DevSecOps Engineer, you will beresponsible for developing and implementing secure, end-to-end cluster and application lifecycles in cloud environments. You will collaborate with clients and internal teams to design and implement ..."
2026-03-31 16:54:24,ddg:boards.greenhouse.io,behavox,Job Application for DevSecOps Engineer 3 at Behavox,,,https://boards.greenhouse.io/behavox/jobs/6557466,ddg::https://boards.greenhouse.io/behavox/jobs/6557466,,"At Behavox, we are at the forefront of transforming how businesses utilize data. As aDevSecOpsEngineer 3, you will play a critical role in enhancing our security measures ensuring the integrity, availability, and confidentiality of our systems."
2026-03-31 16:54:24,ddg:boards.greenhouse.io,weedmaps77,Job Application for DevSecOps Engineer (Remote) at Weedmaps,,,https://boards.greenhouse.io/weedmaps77/jobs/6719559002,ddg::https://boards.greenhouse.io/weedmaps77/jobs/6719559002,,"The DevSecOps Engineer isa hands-on technical position responsible for designing, building, and operating a diverse set of cloud security controls and process automations. In addition to internal security tasks, this role will work directly ..."
2026-03-31 16:54:24,ddg:boards.greenhouse.io,avalabs,Job Application for DevSecOps Engineer at Ava Labs,,,https://boards.greenhouse.io/avalabs/jobs/4542207004,ddg::https://boards.greenhouse.io/avalabs/jobs/4542207004,,Serve as a subject matterexpert (SME) inDevSecOpsand security for CI/CD best practices
2026-03-31 16:54:24,ddg:boards.greenhouse.io,upgrade,Job Application for Senior DevSecOps Engineer at Upgrade,,,https://boards.greenhouse.io/upgrade/jobs/4257535005,ddg::https://boards.greenhouse.io/upgrade/jobs/4257535005,,Build security utilities and tools for internal use that enable theDevSecOpsteam to operate at high speed and wide scale.
2026-03-31 16:54:24,ddg:boards.greenhouse.io,isomorphiclabs,"Job Application for DevSecOps Engineer, London at Isomorphic Labs",,,https://boards.greenhouse.io/isomorphiclabs/jobs/5074062004,ddg::https://boards.greenhouse.io/isomorphiclabs/jobs/5074062004,,"Setup, maintain and operateDevSecOpstools and monitoring systems"
2026-03-31 16:54:24,ddg:boards.greenhouse.io,pay2dc,Job Application for 05.CloudInfrastructureEngineer at PayPay India,,,https://boards.greenhouse.io/pay2dc/jobs/4286240006,ddg::https://boards.greenhouse.io/pay2dc/jobs/4286240006,,PayPay India is looking for aCloudInfrastructureEngineer to work on our Cloud Based payment system infrastructure to deliver the best payment experience for our growing customers...
2026-03-31 16:54:24,ddg:boards.greenhouse.io,carta,Job Application for Senior Site Reliability Engineer at Carta,,,https://boards.greenhouse.io/carta/jobs/5936341003,ddg::https://boards.greenhouse.io/carta/jobs/5936341003,,"Infrastructure as Code (IaC): Proficient in using tools such as Terraform, Ansible, or CloudFormation for managing and provisioningcloudinfrastructure."
2026-03-31 16:54:24,ddg:boards.greenhouse.io,acquia,Job Application for Associate Cloud Operations Engineer at Acquia,,,https://boards.greenhouse.io/acquia/jobs/7595476,ddg::https://boards.greenhouse.io/acquia/jobs/7595476,,"Cloud Infrastructure Management: Assist in setting up and maintaining AWS services such as EC2, S3, RDS, and VPC. Perform basic monitoring of cloud ..."
2026-03-31 16:54:24,ddg:boards.greenhouse.io,spacex,"Electrical Test and Reliability Engineer, Gateways (Starlink)",,,https://boards.greenhouse.io/spacex/jobs/8445519002?gh_jid=8445519002,ddg::https://boards.greenhouse.io/spacex/jobs/8445519002?gh_jid=8445519002,,"As an Electrical Test and Reliability Engineer on Starlink, you'll contribute to the design, build, and test electronics for the world's largest network of ..."
2026-03-31 16:54:24,ddg:boards.greenhouse.io,spacex,Build Reliability Engineer (Raptor Additive/Foundry),,,https://boards.greenhouse.io/spacex/jobs/8403220002,ddg::https://boards.greenhouse.io/spacex/jobs/8403220002,,Your breadth of exposure and responsibility as a Build Reliability Engineer will be immense as you collaborate with other core groups at SpaceX as the primary ...
