collected_at_utc,source_type,company,title,location,team,url,external_id,posted_at,description_snippet
2026-05-06 14:24:23,adzuna,"Syms Strategic Group, LLC ",Senior Cloud Computing Engineer,"Warner Robins, Houston County",,https://www.adzuna.com/details/5718727105?utm_medium=api&utm_source=632a28fd,adzuna::5718727105,2026-05-04,Syms Strategic Group (SSG) is seeking a talented Senior Cloud Computing Engineer Location: Remote Department: Veterans Affairs (VA) Type: Full Time Min. Experience: Experienced Security Clearance Level: Public Trust (MBI) Military Veterans are highly encouraged to apply! Essential Duties and Respons
2026-05-06 14:24:23,adzuna,"Syms Strategic Group, LLC ",Senior Cloud Computing Engineer,"Clearwater, Pinellas County",,https://www.adzuna.com/details/5718727102?utm_medium=api&utm_source=632a28fd,adzuna::5718727102,2026-05-04,Syms Strategic Group (SSG) is seeking a talented Senior Cloud Computing Engineer Location: Remote Department: Veterans Affairs (VA) Type: Full Time Min. Experience: Experienced Security Clearance Level: Public Trust (MBI) Military Veterans are highly encouraged to apply! Essential Duties and Respons
2026-05-06 14:24:23,adzuna,"Syms Strategic Group, LLC ",Senior Cloud Computing Engineer,"Ann Arbor, Washtenaw County",,https://www.adzuna.com/details/5718727098?utm_medium=api&utm_source=632a28fd,adzuna::5718727098,2026-05-04,Syms Strategic Group (SSG) is seeking a talented Senior Cloud Computing Engineer Location: Remote Department: Veterans Affairs (VA) Type: Full Time Min. Experience: Experienced Security Clearance Level: Public Trust (MBI) Military Veterans are highly encouraged to apply! Essential Duties and Respons
2026-05-06 14:24:23,adzuna,"Syms Strategic Group, LLC ",Senior Cloud Computing Engineer,"Annapolis, Anne Arundel County",,https://www.adzuna.com/details/5718727112?utm_medium=api&utm_source=632a28fd,adzuna::5718727112,2026-05-04,Syms Strategic Group (SSG) is seeking a talented Senior Cloud Computing Engineer Location: Remote Department: Veterans Affairs (VA) Type: Full Time Min. Experience: Experienced Security Clearance Level: Public Trust (MBI) Military Veterans are highly encouraged to apply! Essential Duties and Respons
2026-05-06 14:24:23,adzuna,"Syms Strategic Group, LLC ",Senior Cloud Computing Engineer,"Overland Park, Johnson County",,https://www.adzuna.com/details/5718727092?utm_medium=api&utm_source=632a28fd,adzuna::5718727092,2026-05-04,Syms Strategic Group (SSG) is seeking a talented Senior Cloud Computing Engineer Location: Remote Department: Veterans Affairs (VA) Type: Full Time Min. Experience: Experienced Security Clearance Level: Public Trust (MBI) Military Veterans are highly encouraged to apply! Essential Duties and Respons
2026-05-06 14:24:23,adzuna,Leidos,Hybrid Cloud Engineer (Remote) with Security Clearance,"Herndon, Fairfax County",,https://www.adzuna.com/land/ad/5718701474?se=Ok75TldJ8RGngtw_dMYZiA&utm_medium=api&utm_source=632a28fd&v=AAE2856627E0F5A340B56CACD8459B57E61F6C77,adzuna::5718701474,2026-05-04,"R-00178883 Description The Digital Modernization Sector has an exciting career opportunity for a in El Segundo, CA to support the US Space Force’s Space Systems Command (SSC), Operational Command and Control Acquisition Delta, known as Kobayashi Maru. This role is instrumental in the development and"
2026-05-06 14:24:23,adzuna,ITSYNTAX INC,Cloud Network and Security Engineer,US,,https://www.adzuna.com/land/ad/5718644401?se=Ok75TldJ8RGngtw_dMYZiA&utm_medium=api&utm_source=632a28fd&v=B96164CD8ED2FA950970750BE68DC49C1F531064,adzuna::5718644401,2026-05-04,Job Title: Cloud Network Security Engineer (Public Cloud & NGFW) Location: Remote Job Summary We are seeking a skilled Cloud Network Security Engineer with strong expertise in public cloud networking and next-generation firewall technologies. The ideal candidate will have hands-on experience in desi
2026-05-06 14:24:23,adzuna,Talent Portus,Oracle Cloud Engineer,US,,https://www.adzuna.com/land/ad/5718613308?se=Ok75TldJ8RGngtw_dMYZiA&utm_medium=api&utm_source=632a28fd&v=336721C43148F93E10702BA62C4626E1BE4FE26E,adzuna::5718613308,2026-05-04,Job Title: Oracle Cloud Engineer (OCI Migration & Modernization) Location: Mostly Remote (Light Travel Required) Employment Type: Contract / Full-Time (Based on requirement) Visa Requirement: U.S. Citizen (USC) Clearance: Active DoD Secret Clearance (Mandatory for DoD-related engagements) Internal O
2026-05-06 14:24:23,adzuna,CACI,Cloud Software Engineer,"Hanover, Anne Arundel County",,https://www.adzuna.com/land/ad/5718421983?se=Ok75TldJ8RGngtw_dMYZiA&utm_medium=api&utm_source=632a28fd&v=ED63AECE58AC10891826C628C9E60D41D86B5820,adzuna::5718421983,2026-05-04,"Job Title: Cloud Software Engineer Job Category: Engineering Time Type: Full time Minimum Clearance Required to Start: None Employee Type: Regular Percentage of Travel Required: None Type of Travel: None * * * The Opportunity: CACI is seeking a Cloud Software Engineer for either our Hanover, MD loca"
2026-05-06 14:24:23,adzuna,Openkyber,Associate ML Infrastructure Engineer,"Alaska, US",,https://www.adzuna.com/details/5718274388?utm_medium=api&utm_source=632a28fd,adzuna::5718274388,2026-05-03,"Assistant Director (Senior Cloud & Automation Engineer) Location : 100% Remote Must Description : Healthcare Client is seeking a Assistant Director (Senior Cloud & Automation Engineer) to lead the design, implementation, and automation of enterprise multi-cloud infrastructure across AWS and Oracle C"
2026-05-06 14:24:23,adzuna,Openkyber,Junior Cloud Automation Engineer,"Alaska, US",,https://www.adzuna.com/details/5718274324?utm_medium=api&utm_source=632a28fd,adzuna::5718274324,2026-05-03,"DevSecOps Engineer (AWS Cloud) Hybrid - Remote Gaithersburg, MD Contract-to-Hire Compensation : $97/hour Security Clearance : Public trust required to start Overview We're hiring a Mid-Level DevSecOps Engineer to help build and scale a Common Automation Platform supporting secure, enterprise-wide De"
2026-05-06 14:24:23,adzuna,Openkyber,Junior GCP Cloud Engineer,"Alaska, US",,https://www.adzuna.com/details/5718274263?utm_medium=api&utm_source=632a28fd,adzuna::5718274263,2026-05-03,Cloud Engineer (Managed Services) DETAILS Location : Remote Position Type : 6M C2H Hourly / Salary : BOE! JOB SUMMARY OpenKyber is currently seeking a Cloud Engineer (Managed Services) for a 6M C2H opportunity that is remote. The Cloud Engineer (Managed Services) will be accountable for the ongoing 
2026-05-06 14:24:23,adzuna,Openkyber,Infrastructure Engineer (Cloud Focus),"Alaska, US",,https://www.adzuna.com/details/5718274229?utm_medium=api&utm_source=632a28fd,adzuna::5718274229,2026-05-03,"IT Cloud Architect Lead II Job at a Glance Title: Infrastructure Engineer (Cloud Focus) Location: Remote, but must reside witin RI, PA or KY Contract: W2 only Overview Join our Cybersecurity organization as a Cloud Security Architect or Cloud Platform Developer with a hands-on coding focus. You will"
2026-05-06 14:24:23,adzuna,Openkyber,Cloud Infrastructure Engineer,"Alaska, US",,https://www.adzuna.com/details/5718274197?utm_medium=api&utm_source=632a28fd,adzuna::5718274197,2026-05-03,"Position Title: Azure Cloud Infrastructure Engineer Location: Remote, USA Let's create our future together at OpenKyber! About OpenKyber: OpenKyber is a premier technology consulting company that has been bringing businesses and talent together for over 20 years to deliver the most innovative techno"
2026-05-06 14:24:23,adzuna,Openkyber,Junior Cloud Engineer,"Alaska, US",,https://www.adzuna.com/details/5718274188?utm_medium=api&utm_source=632a28fd,adzuna::5718274188,2026-05-03,"Senior Hybrid AWS Cloud Engineer (IAM, Kubernetes, Automation) Remote Contract to Hire (OpenKyber W2 Contract Coworker) OpenKyber is hiring a hands-on, code-first AWS Cloud Engineer with deep expertise in IAM, Kubernetes, and infrastructure as code . This is a true engineering role-focused on buildi"
2026-05-06 14:24:23,adzuna,Openkyber,Cloud Support Associate,"Alaska, US",,https://www.adzuna.com/details/5718274174?utm_medium=api&utm_source=632a28fd,adzuna::5718274174,2026-05-03,Role: Cloud Network Security Engineer (Public Cloud & NGFW) Location: Remote Experience: 10  years Job Summary: We are seeking a skilled Cloud Network Security Engineer with strong expertise in public cloud networking and next-generation firewall technologies. The ideal candidate will have hands-on 
2026-05-06 14:24:23,adzuna,Openkyber,Cloud Support Associate,"Alaska, US",,https://www.adzuna.com/details/5718274151?utm_medium=api&utm_source=632a28fd,adzuna::5718274151,2026-05-03,"Role: Azure Cloud Engineer Location: Remote Duration: 12 months Role Description: The Mid Cloud Engineer role requires strong knowledge and experience leveraging Microsoft Azure Cloud platforms and technologies. The Mid Cloud Engineer will also possess experience designing, developing, and implement"
2026-05-06 14:24:23,adzuna,Match Point Solutions,Multi-Cloud Security Engineer,US,,https://www.adzuna.com/details/5718272614?utm_medium=api&utm_source=632a28fd,adzuna::5718272614,2026-05-03,"MatchPoint Solutions is a fast-growing, young, energetic global IT-Engineering services company with clients across the US . We provide technology solutions to various clients like Uber, Robinhood, Netflix, Airbnb, Google, Sephora, and more! More recently, we have expanded to working internationally"
2026-05-06 14:24:23,adzuna,General Dynamics Information Technology,Senior Cloud Engineer - NAVSUP OIS - Remote,"Fairfax, Fairfax County",,https://www.adzuna.com/details/5718271821?utm_medium=api&utm_source=632a28fd,adzuna::5718271821,2026-05-03,"Req ID: RQ219225 Type of Requisition: Regular Clearance Level Must Be Able to Obtain: Secret Public Trust/Other Required: None Job Family: Software Engineering Skills: Cloud Automation,Cloud Software,DevSecOps,Requirements Analysis,Systems Engineering Certifications: CompTIA Security CE | CompTIA - "
2026-05-06 14:24:23,adzuna,KIK Consumer Products,Infrastructure Engineer (Cloud & On-prem),"Grayson, Gwinnett County",,https://www.adzuna.com/land/ad/5717511920?se=Ok75TldJ8RGngtw_dMYZiA&utm_medium=api&utm_source=632a28fd&v=3BA2DD6421216298141FBC4FC2940F8D5E20ED42,adzuna::5717511920,2026-05-02,"Azure Cloud Engineer and Office 365 admin - REMOTE We Create Products and Brands That People Trust to Clean, Sanitize, and Protect Their Homes and Pools When you join KIK Consumer Products, you're joining a team that cares about the work we do and also about each other. We bring exceptional brands a"
2026-05-06 14:24:23,adzuna,Openkyber,Cloud-Native MLOps Engineer,"Georgia, US",,https://www.adzuna.com/details/5717402727?utm_medium=api&utm_source=632a28fd,adzuna::5717402727,2026-05-02,"Senior Hybrid AWS Cloud Engineer (IAM, Kubernetes, Automation) Remote Contract to Hire (OpenKyber W2 Contract Coworker) OpenKyber is hiring a hands-on, code-first AWS Cloud Engineer with deep expertise in IAM, Kubernetes, and infrastructure as code . This is a true engineering role-focused on buildi"
2026-05-06 14:24:23,adzuna,Healthmark Group,Security Engineer,US,,https://www.adzuna.com/details/5716641446?utm_medium=api&utm_source=632a28fd,adzuna::5716641446,2026-05-02,"COMPANY OVERVIEW: HealthMark Group is a leading provider of health IT solutions for healthcare providers across the country. By leveraging technology to reimagine the business of healthcare, HealthMark transforms administrative processes into seamless digital solutions. From HealthMark’ s proprietar"
2026-05-06 14:24:23,adzuna,Insight Global,Remote Cloud Engineer II,"Glendale, Denver",,https://www.adzuna.com/land/ad/5716447194?se=Ok75TldJ8RGngtw_dMYZiA&utm_medium=api&utm_source=632a28fd&v=B932BA09FF3F2691A61CE5B8B72F6B656DEA8C0B,adzuna::5716447194,2026-05-01,"Job Description One of Insight Global's clients is seeking a Cloud Engineer II (CEII) to support the modernization and transformation of government-based environments through secure, scalable, and resilient cloud engineering. This role is responsible for designing, deploying, optimizing AWS infrastr"
2026-05-06 14:24:23,adzuna,Openkyber,Junior GCP Cloud Engineer,"Alaska, US",,https://www.adzuna.com/details/5716336649?utm_medium=api&utm_source=632a28fd,adzuna::5716336649,2026-05-01,Role: Cloud Network Security Engineer (Public Cloud & NGFW) Location: Remote Experience: 10  years We are seeking a skilled Cloud Network Security Engineer with strong expertise in public cloud networking and next-generation firewall technologies. The ideal candidate will have hands-on experience in
2026-05-06 14:24:23,adzuna,Openkyber,Junior Cloud Engineer,"Alaska, US",,https://www.adzuna.com/details/5716336527?utm_medium=api&utm_source=632a28fd,adzuna::5716336527,2026-05-01,"Position Title: AWS Cloud Engineer Mid-level Location: Remote, USA Let's create our future together at OpenKyber! About OpenKyber OpenKyber is a premier technology staffing and services company that has been bringing businesses and talent together for over 20 years to deliver innovative technology s"
2026-05-06 14:24:23,adzuna,Openkyber,Cloud Support Associate,"Alaska, US",,https://www.adzuna.com/details/5716336502?utm_medium=api&utm_source=632a28fd,adzuna::5716336502,2026-05-01,"Role: Network Cloud( Azure) Engineer Location: Dallas TX || Remote Job Description: Must Have Technical/Functional Skills VNets/VPCs Create VNets/VPCs Modify VNet/VPC settings Create VNet Peering Configure peering settings UDRs Configure route tables (e.g., UDR) DDI DNS services (DNS anycast) DHCP s"
2026-05-06 14:24:23,adzuna,Openkyber,Cloud Support Associate,"Alaska, US",,https://www.adzuna.com/details/5716336442?utm_medium=api&utm_source=632a28fd,adzuna::5716336442,2026-05-01,Cloud Engineer (Managed Services) DETAILS: Location : Remote Position Type : 6M C2H Hourly / Salary : BOE! JOB SUMMARY OpenKyber is currently seeking a Cloud Engineer (Managed Services) for a 6M C2H opportunity that is remote. The Cloud Engineer (Managed Services) will be accountable for the ongoing
2026-05-06 14:24:23,adzuna,Openkyber,Network Engineer,"Alaska, US",,https://www.adzuna.com/details/5716336219?utm_medium=api&utm_source=632a28fd,adzuna::5716336219,2026-05-01,Position: Cloud Network Engineer Location: Remote Hiring Mode: 12 M onths C ontract Job Description: We are seeking a highly skilled Cloud Network Engineer with a strong foundation in traditional networking and hands-on experience in Microsoft Azure. This role is ideal for a network-first profession
2026-05-06 14:24:23,adzuna,"Nasscomm, Inc.",Lead Network Engineer (AWS Transit Gateway),US,,https://www.adzuna.com/land/ad/5716243114?se=Ok75TldJ8RGngtw_dMYZiA&utm_medium=api&utm_source=632a28fd&v=3919414F271B7D93F4EC05FD839EBA3CCD04A649,adzuna::5716243114,2026-05-01,"Position: Senior AWS Network Engineer (Cloud WAN / Enterprise Connectivity) Location: Remote Duration: 3 months Contract Scope: A network engineer to support the Connected Enterprise workstream within the Enterprise Acceleration Program. This role will focus on designing, implementing, and optimizin"
2026-05-06 14:24:23,adzuna,AbbVie,Cloud Security Engineer (Remote),"North Chicago, Lake County",,https://www.adzuna.com/details/5715464916?utm_medium=api&utm_source=632a28fd,adzuna::5715464916,2026-05-01,"Job Description As a member of the Information Security Risk Management architecture team, the Cloud Security Engineer plays a crucial role in shaping and guiding the organization's security strategy, architecture, and practices, with a focus on cloud computing technology. The Cloud Security Enginee"
2026-05-06 14:24:23,adzuna,Abbott,"Software Engineer, Cloud",US,,https://www.adzuna.com/details/5715284056?utm_medium=api&utm_source=632a28fd,adzuna::5715284056,2026-04-30,"Abbott is a global healthcare leader that helps people live more fully at all stages of life. Our portfolio of life-changing technologies spans the spectrum of healthcare, with leading businesses and products in diagnostics, medical devices, nutritionals and branded generic medicines. Our 115,000 co"
2026-05-06 14:24:23,adzuna,Pegasystems,"Senior Cloud Operations Engineer, Deployments",US,,https://www.adzuna.com/land/ad/5715204434?se=Ok75TldJ8RGngtw_dMYZiA&utm_medium=api&utm_source=632a28fd&v=51094A7949974429B93EBA3BFF989B4F6DBFE129,adzuna::5715204434,2026-04-30,"Senior Cloud Operations Engineer, Deployments Job Category: Engineering & Cloud Location: US - DC - Remote | US - Massachusetts - Remote | US - Vermont - Remote | US - Virginia - Dulles Meet Our Team: _Due to occasional work with FedRamp_ _US Citizenship_ _is required._ _Shift Description:_ _The sta"
2026-05-06 14:24:23,adzuna,Pegasystems,"Senior Cloud Operations Engineer, Infrastructure","Washington, D.C., US",,https://www.adzuna.com/land/ad/5715113047?se=Ok75TldJ8RGngtw_dMYZiA&utm_medium=api&utm_source=632a28fd&v=A2611FB061D986960DE1B6761B344283E9F456B1,adzuna::5715113047,2026-04-30,"Senior Cloud Operations Engineer, Infrastructure Job Category: Engineering & Cloud Location: US - DC - Remote | US - Massachusetts - Remote | US - Virginia - Dulles | US - Virginia - Remote Meet Our Team: _>> This role will work 2nd shift hours <<_ As a member of the Service Reliability Team (SRT), "
2026-05-06 14:24:23,adzuna,Pegasystems,"Senior Cloud Operations Engineer, Deployments","Washington, D.C., US",,https://www.adzuna.com/land/ad/5715113045?se=Ok75TldJ8RGngtw_dMYZiA&utm_medium=api&utm_source=632a28fd&v=417A1F2686475BEE68083D518B4441E14E04A395,adzuna::5715113045,2026-04-30,"Senior Cloud Operations Engineer, Deployments Job Category: Engineering & Cloud Location: US - DC - Remote | US - Massachusetts - Remote | US - Vermont - Remote | US - Virginia - Dulles Meet Our Team: _>> This role will work 2nd shift hours <<_ As a member of Cloud Operations team, you will be a key"
2026-05-06 14:24:23,adzuna,Pegasystems,"Senior Cloud Operations Engineer, Infrastructure","Boston, Suffolk County",,https://www.adzuna.com/land/ad/5715082992?se=Ok75TldJ8RGngtw_dMYZiA&utm_medium=api&utm_source=632a28fd&v=FD9F0839C593D665E751DB20AB1655C909D17A28,adzuna::5715082992,2026-04-30,"Senior Cloud Operations Engineer, Infrastructure Job Category: Engineering & Cloud Location: US - DC - Remote | US - Massachusetts - Remote | US - Virginia - Dulles | US - Virginia - Remote Meet Our Team: _Due to the nature of work with FedRamp, US Citizenship is required._ _This is a 2nd shift oppo"
2026-05-06 14:24:23,adzuna,Pegasystems,"Senior Cloud Operations Engineer, Deployments","Boston, Suffolk County",,https://www.adzuna.com/land/ad/5715082947?se=Ok75TldJ8RGngtw_dMYZiA&utm_medium=api&utm_source=632a28fd&v=A023527422DEE2D8CEB0A47C216980D1F6F7C251,adzuna::5715082947,2026-04-30,"Senior Cloud Operations Engineer, Deployments Job Category: Engineering & Cloud Location: US - DC - Remote | US - Massachusetts - Remote | US - Vermont - Remote | US - Virginia - Dulles Meet Our Team: _Due to occasional work with FedRamp_ _US Citizenship_ _is required._ _Shift Description:_ _The sta"
2026-05-06 14:24:23,adzuna,"Zachary Piper Solutions, LLC",SME Cloud Engineer (Hybrid Remote) with Security Clearance,"Reston, Fairfax County",,https://www.adzuna.com/land/ad/5715051390?se=Ok75TldJ8RGngtw_dMYZiA&utm_medium=api&utm_source=632a28fd&v=49185950C5EBEE3761CC0504204962756DFFC160,adzuna::5715051390,2026-04-30,"Zachary Piper Solutions is seeking a skilled Cloud Engineer SME to join our team in Reston, VA. As a Cloud Engineer SME, you will collaborate with government and industry customers to develop a multi-cloud solution. You will provide technical leadership on an agile development team, working alongsid"
2026-05-06 14:24:23,adzuna,"Advantech GS Enterprises, Inc.",Remote Cloud Data Engineer (AZURE) with Security Clearance,"Fort George G Meade, Anne Arundel County",,https://www.adzuna.com/land/ad/5715013203?se=Ok75TldJ8RGngtw_dMYZiA&utm_medium=api&utm_source=632a28fd&v=93FD6790B897F0E82D10019E605714077D3FBACD,adzuna::5715013203,2026-04-30,"Advantech GS Enterprises is seeking a Data Cloud Engineer with expertise in cloud-based data architecture, security compliance, and analytics to support the DISA NEXUS program at Fort Meade. The ideal candidate will design, develop, and secure cloud-enabled data solutions within Azure and AWS, lever"
2026-05-06 14:24:23,adzuna,"Unknown, GA",Senior Cloud Security Engineer,"Georgia, US",,https://www.adzuna.com/details/5714961398?utm_medium=api&utm_source=632a28fd,adzuna::5714961398,2026-04-30,"Senior Cloud Security Engineer Perm Role Remote Role Client is seeking a Senior Cloud Security Engineer who is a builder at heart with deep expertise in at least one cloud provider (Azure strongly preferred), and working knowledge of others. In this role, you wont just ""assess"" or ""advise, you will "
2026-05-06 14:24:23,adzuna,"Yoh, A Day & Zimmermann Company",Infrastructure Engineer= REMOTE,"Fort Collins, Larimer County",,https://www.adzuna.com/land/ad/5720411327?se=hucIUFdJ8RGrCbrQ468g0g&utm_medium=api&utm_source=632a28fd&v=6872A7084174FDB50ECF259EC4CB201EBC4F660C,adzuna::5720411327,2026-05-06,"Job Description Job Title: Enterprise Infrastructure Engineer Location: REMOTE Type- Full Time Salary: $100000- $125000/ Yr Official Job Description Our client is seeking an Enterprise Infrastructure Engineer , managing a 95% Windows environment— Windows 11 and Server 2022/2025— driving repeatable, "
2026-05-06 14:24:23,adzuna,Infotech Sourcing,Web Developer III,"Chelsea and Clinton, Manhattan",,https://www.adzuna.com/details/5720281092?utm_medium=api&utm_source=632a28fd,adzuna::5720281092,2026-05-06,Request ID: 70052-1 Location: US - NY - Remote Job Title: Infrastructure Engineering - Web Developer III Summary We're seeking experience a software engineering with a background in building web apps with 3 years of experience in Python to help us build the next generation of computer-use agents. Yo
2026-05-06 14:24:23,adzuna,Dexter Technologies,IT Infrastructure Engineer - Short Term (Remote),"Aldine, Houston",,https://www.adzuna.com/land/ad/5720208084?se=hucIUFdJ8RGrCbrQ468g0g&utm_medium=api&utm_source=632a28fd&v=92C9599380147858ECA65E98312D26154555F9C1,adzuna::5720208084,2026-05-06,"Dexter Technologies Inc., is a leading provider of Staffing and Recruiting Services. For over two decades, we have put countless professionals to work at exciting opportunities. We are proud of the fact that many of them have been promoted to more senior roles: management, senior management, and sen"
2026-05-06 14:24:23,adzuna,Hilton,Lead DevOps Engineer,"Madison, Dane County",,https://www.adzuna.com/land/ad/5720133192?se=hucIUFdJ8RGrCbrQ468g0g&utm_medium=api&utm_source=632a28fd&v=E5C83BCC41C206A50EE90028B6662C9C85A813D2,adzuna::5720133192,2026-05-06,"_\*\*\*The location for this position is virtual/remote\*\*\*_  Exceptional Hospitality Starts with You This is your chance to be a part of an in\-house Technology team that's creating consumer\-facing, modern technologies revolutionizing the hospitality industry around the world\! As a Lead DevOps "
2026-05-06 14:24:23,adzuna,GovCIO,Systems Administrator - Access Services,"Tumwater, Thurston County",,https://www.adzuna.com/land/ad/5720124971?se=hucIUFdJ8RGrCbrQ468g0g&utm_medium=api&utm_source=632a28fd&v=7706A9614F2B1DF80CE18EBAB999FB86394CAFA5,adzuna::5720124971,2026-05-06,"United States Suitability/Public Trust Fully remote IT Infrastructure & Network Engineering & Operations Overview GovCIO is currently hiring for System Administrator - Access Services to support access services including national active directory, multi-factor authentication, and remote access. The "
2026-05-06 14:24:23,adzuna,Hilton,Lead DevOps Engineer,"Bonnie, Utah County",,https://www.adzuna.com/land/ad/5720123409?se=hucIUFdJ8RGrCbrQ468g0g&utm_medium=api&utm_source=632a28fd&v=B46EAA3CFE56CC66EA51A58DA2965487F822AEA5,adzuna::5720123409,2026-05-06,"_\*\*\*The location for this position is virtual/remote\*\*\*_  Exceptional Hospitality Starts with You This is your chance to be a part of an in\-house Technology team that's creating consumer\-facing, modern technologies revolutionizing the hospitality industry around the world\! As a Lead DevOps "
2026-05-06 14:24:23,adzuna,GovCIO,Systems Administrator - Access Services,"Bonnie, Utah County",,https://www.adzuna.com/land/ad/5720123319?se=hucIUFdJ8RGrCbrQ468g0g&utm_medium=api&utm_source=632a28fd&v=A8E9940CA15800EF4F4E189DA8EA83F2E4F1B9F3,adzuna::5720123319,2026-05-06,"United States Suitability/Public Trust Fully remote IT Infrastructure & Network Engineering & Operations Overview GovCIO is currently hiring for System Administrator - Access Services to support access services including national active directory, multi-factor authentication, and remote access. The "
2026-05-06 14:24:23,adzuna,Hilton,Lead DevOps Engineer,"Charleston, Kanawha County",,https://www.adzuna.com/land/ad/5720058851?se=hucIUFdJ8RGrCbrQ468g0g&utm_medium=api&utm_source=632a28fd&v=C3E0E5601A2A59D36AFC8295F2F844365E623BA0,adzuna::5720058851,2026-05-05,"_\*\*\*The location for this position is virtual/remote\*\*\*_  Exceptional Hospitality Starts with You This is your chance to be a part of an in\-house Technology team that's creating consumer\-facing, modern technologies revolutionizing the hospitality industry around the world\! As a Lead DevOps "
2026-05-06 14:24:23,adzuna,GovCIO,Systems Administrator - Access Services,"Charleston, Kanawha County",,https://www.adzuna.com/land/ad/5720058830?se=hucIUFdJ8RGrCbrQ468g0g&utm_medium=api&utm_source=632a28fd&v=BBE85642A7179A4BA212B89392BBA67B2850E55A,adzuna::5720058830,2026-05-05,"United States Suitability/Public Trust Fully remote IT Infrastructure & Network Engineering & Operations Overview GovCIO is currently hiring for System Administrator - Access Services to support access services including national active directory, multi-factor authentication, and remote access. The "
