collected_at_utc,source_type,company,title,location,team,url,external_id,posted_at,description_snippet
2026-05-06 14:24:23,adzuna,IronArch Technology,Systems Engineer,US,,https://www.adzuna.com/land/ad/5716804549?se=0t7_UVdJ8RGngtw_dMYZiA&utm_medium=api&utm_source=632a28fd&v=59C181B6D4FA6A7356AE7A98B24BF6461D76458C,adzuna::5716804549,2026-05-02,"Who We Are Known for being a Best Place to Work and a People First company, IronArch Technology is an award-winning Service-Disabled Veteran-Owned Small Business (SDVOSB) specializing in providing innovative solutions and world class services to Federal Government clients. Our employees have voted u"
2026-05-06 14:24:23,adzuna,Leidos,Mid-Level DevSecOps Engineer with Security Clearance,"Madison, Madison County",,https://www.adzuna.com/land/ad/5715017128?se=0t7_UVdJ8RGngtw_dMYZiA&utm_medium=api&utm_source=632a28fd&v=985B43DBD1B6CB76090BF15153196B5F01554EA3,adzuna::5715017128,2026-04-30,"R-00180577 Description Looking for an opportunity to make an impact? At Leidos, we deliver innovative solutions through the efforts of our diverse and talented people who are dedicated to our customers’ success. We empower our teams, contribute to our communities, and operate sustainably. Everything"
2026-05-06 14:24:23,adzuna,TEKsystems c/o Allegis Group,DevSecOps Engineer with Security Clearance,"Redstone Arsenal, Madison County",,https://www.adzuna.com/land/ad/5715010067?se=0t7_UVdJ8RGngtw_dMYZiA&utm_medium=api&utm_source=632a28fd&v=907FF5605AF4DB22E3E0A9111C41FFE2633404A0,adzuna::5715010067,2026-04-30,"NOT A REMOTE POSITION  Expertise in DevSecOps, CI/CD, secure pipelines, and automation. Experience migrating DevSecOps pipelines from IL‑5 → IL‑6. GitLab, Jenkins, SonarQube, Hadolint, TruffleHog, Twistlock Terraform, Kustomize, Podman, Prometheus/Grafana, Keycloak AWS GovCloud, Cloud One services C"
2026-05-06 14:24:23,adzuna,Openkyber,DevOps Engineer,"Alaska, US",,https://www.adzuna.com/details/5714946788?utm_medium=api&utm_source=632a28fd,adzuna::5714946788,2026-04-30,"Job Title: Senior DevSecOps Systems Administrator Location-Remote Role Overview We are seeking a Senior DevSecOps Systems Administrator to manage, secure, and automate infrastructure and application delivery pipelines. This role blends system administration, DevOps practices, and security (DevSecOps"
2026-05-06 14:24:23,adzuna,Openkyber,SOC Administrator,"Alaska, US",,https://www.adzuna.com/details/5713091967?utm_medium=api&utm_source=632a28fd,adzuna::5713091967,2026-04-28,"Job Title: Senior DevSecOps Systems Administrator Location-Remote Role Overview We are seeking a Senior DevSecOps Systems Administrator to manage, secure, and automate infrastructure and application delivery pipelines. This role blends system administration, DevOps practices, and security (DevSecOps"
2026-05-06 14:24:23,adzuna,Openkyber,Senior Cloud IAM Engineer,"Alaska, US",,https://www.adzuna.com/details/5713091840?utm_medium=api&utm_source=632a28fd,adzuna::5713091840,2026-04-28,"Job Title: Senior DevSecOps Systems Administrator Location-Remote Role Overview We are seeking a Senior DevSecOps Systems Administrator to manage, secure, and automate infrastructure and application delivery pipelines. This role blends system administration, DevOps practices, and security (DevSecOps"
2026-05-06 14:24:23,adzuna,System One,DevSecOps Engineer (AWS Cloud),"Montgomery Village, Montgomery County",,https://www.adzuna.com/land/ad/5712834390?se=0t7_UVdJ8RGngtw_dMYZiA&utm_medium=api&utm_source=632a28fd&v=4AD5AFA1D69251D38F40199D8BA2BDBD0F6DE6DF,adzuna::5712834390,2026-04-28,"DevSecOps Engineer (AWS Cloud) Hybrid - Remote Gaithersburg, MD Contract-to-Hire Compensation : $97/hour Security Clearance : Public trust required to start Overview We’re hiring a Mid-Level DevSecOps Engineer to help build and scale a Common Automation Platform supporting secure, enterprise-wide De"
2026-05-06 14:24:23,adzuna,Take2 Consulting,DevSecOps Engineer - 100% Remote,US,,https://www.adzuna.com/land/ad/5712796860?se=0t7_UVdJ8RGngtw_dMYZiA&utm_medium=api&utm_source=632a28fd&v=822A5F927E33BBB56624927AFA1A800D068F025A,adzuna::5712796860,2026-04-28,"DevSecOps Engineer - 100% Remote What You'll Do Build and secure cloud-native solutions for government systems using AWS, Kubernetes, and Docker. Automate DevSecOps pipelines, implement Infrastructure-as-Code (Terraform, CloudFormation, AWS CDK), and ensure compliance with federal security standards"
2026-05-06 14:24:23,adzuna,Apex Systems,Software Engineer / Application Packager,"South Norfolk, Chesapeake City",,https://www.adzuna.com/land/ad/5709765289?se=0t7_UVdJ8RGngtw_dMYZiA&utm_medium=api&utm_source=632a28fd&v=AB9387D4209ECE82942C360D9886B469EBD9BE61,adzuna::5709765289,2026-04-24,"Job: 3030796 Job Description: (100% Remote) - Software / DevSecOps Engineer -  $145,000 - $160,000  Apex Systems has an Immediate Need for a (100% Remote) Software / DevSecOps Engineer  This will be an Est. ""6 Month Contract to Permanent Hire"" opportunity, supporting one of our Largest DoD / Governm"
2026-05-06 14:24:23,adzuna,Recruiting From Scratch,Senior Software Engineer - DevSecOps,"Nob Hill, San Francisco",,https://www.adzuna.com/details/5709167219?utm_medium=api&utm_source=632a28fd,adzuna::5709167219,2026-04-24,"Who is Recruiting from Scratch: Recruiting from Scratch is a specialized talent firm dedicated to helping companies build exceptional teams. We partner closely with our clients to deeply understand their needs, then connect them with top-tier candidates who are not only highly skilled but also the r"
2026-05-06 14:24:23,adzuna,DecisionPoint,DevSecOps Engineer (Data & Integration),US,,https://www.adzuna.com/details/5701444636?utm_medium=api&utm_source=632a28fd,adzuna::5701444636,2026-04-16,"DecisionPoint seeks a DevSecOps Engineer (Data & Integration) to support automation, security, and monitoring of data integration and analytics platforms within a secure, cloud-hosted Department of Defense (DoD) enterprise environment. The engineer will design, implement, and maintain CI/CD pipeline"
2026-05-06 14:24:23,adzuna,DecisionPoint,Data Engineer,US,,https://www.adzuna.com/details/5701444610?utm_medium=api&utm_source=632a28fd,adzuna::5701444610,2026-04-16,"DecisionPoint seeks a Data Engineer to design, develop, and maintain secure data pipelines, transformations, and analytics infrastructure supporting enterprise systems within a Department of Defense (DoD) modernization initiative. The Data Engineer will ensure accurate , reliable, and performant dat"
2026-05-06 14:24:23,adzuna,Decisionpoint Corporation,DevSecOps Engineer (Data & Integration),US,,https://www.adzuna.com/land/ad/5701275093?se=0t7_UVdJ8RGngtw_dMYZiA&utm_medium=api&utm_source=632a28fd&v=1ED79E378403B98311001881C954380FFD5E7C3E,adzuna::5701275093,2026-04-16,"Overview DecisionPoint seeks a DevSecOps Engineer (Data & Integration) to support automation, security, and monitoring of data integration and analytics platforms within a secure, cloud-hosted Department of Defense (DoD) enterprise environment. The engineer will design, implement, and maintain CI/CD"
2026-05-06 14:24:23,adzuna,Decisionpoint Corporation,Data Engineer,US,,https://www.adzuna.com/land/ad/5701275083?se=0t7_UVdJ8RGngtw_dMYZiA&utm_medium=api&utm_source=632a28fd&v=A35DD9D41513AEB1C4F4BA863D886235F38E9428,adzuna::5701275083,2026-04-16,"Overview DecisionPoint seeks a Data Engineer to design, develop, and maintain secure data pipelines, transformations, and analytics infrastructure supporting enterprise systems within a Department of Defense (DoD) modernization initiative. The Data Engineer will ensure accurate, reliable, and perfor"
2026-05-06 14:24:23,adzuna,Leidos,Mid-Level DevSecOps Engineer,"Huntsville, Madison County",,https://www.adzuna.com/land/ad/5697269151?se=0t7_UVdJ8RGngtw_dMYZiA&utm_medium=api&utm_source=632a28fd&v=52C8C07AEC7CE1126ECA4B352B3CED499150F871,adzuna::5697269151,2026-04-12,"Looking for an opportunity to make an impact? At Leidos, we deliver innovative solutions through the efforts of our diverse and talented people who are dedicated to our customers’ success. We empower our teams, contribute to our communities, and operate sustainably. Everything we do is built on a co"
2026-05-06 14:24:23,adzuna,Leidos,Mid-Level DevSecOps Engineer,"Redstone Arsenal, Madison County",,https://www.adzuna.com/land/ad/5697133281?se=0t7_UVdJ8RGngtw_dMYZiA&utm_medium=api&utm_source=632a28fd&v=3DC404CCAC17F82804579A7F2459F9AE410755A5,adzuna::5697133281,2026-04-11,"Description Looking for an opportunity to make an impact? At Leidos, we deliver innovative solutions through the efforts of our diverse and talented people who are dedicated to our customers' success. We empower our teams, contribute to our communities, and operate sustainably. Everything we do is b"
2026-05-06 14:24:23,adzuna,Serco,Experienced DevSecOps Engineer - (100% Remote),"Sacramento, Sacramento County",,https://www.adzuna.com/land/ad/5697041264?se=0t7_UVdJ8RGngtw_dMYZiA&utm_medium=api&utm_source=632a28fd&v=27643C32DABEBF66B434C70EC7AA41630E3BCE6F,adzuna::5697041264,2026-04-11,"Position Description & Qualifications Position Description & Qualifications Serco is seeking a highly skilled and motivated Experienced DevSecOps Engineer to join our team - (100% Remote) . This role is critical in integrating security practices within the DevOps process, ensuring that security is e"
2026-05-06 14:24:23,adzuna,Shyft6,Jr DevSecOps Engineer,"Grand Central, Manhattan",,https://www.adzuna.com/details/5695353068?utm_medium=api&utm_source=632a28fd,adzuna::5695353068,2026-04-10,"This is a remote position. Junior DevSecOps Engineer Overview We are seeking a Junior DevSecOps Engineer to support the development, security, and deployment of AI-driven applications and data platforms. This role will help integrate security best practices into DevOps processes , ensuring safe, rel"
2026-05-06 14:24:23,adzuna,Serco,Experienced DevSecOps Engineer - (100% Remote),"Driftwood, Pierce County",,https://www.adzuna.com/land/ad/5681953150?se=0t7_UVdJ8RGngtw_dMYZiA&utm_medium=api&utm_source=632a28fd&v=1DA3A026BD971465B8B9FC5E45A3ED049978F94C,adzuna::5681953150,2026-03-29,"Position Description & Qualifications Position Description & Qualifications Serco is seeking a highly skilled and motivated Experienced DevSecOps Engineer to join our team - (100% Remote) . This role is critical in integrating security practices within the DevOps process, ensuring that security is e"
2026-05-06 14:24:23,adzuna,Serco,Experienced DevSecOps Engineer - (100% Remote),"Grandview Heights, Franklin County",,https://www.adzuna.com/land/ad/5681833489?se=0t7_UVdJ8RGngtw_dMYZiA&utm_medium=api&utm_source=632a28fd&v=85C495175A8EB90066ADA497AFDECC8639559751,adzuna::5681833489,2026-03-28,"Position Description & Qualifications Position Description & Qualifications Serco is seeking a highly skilled and motivated Experienced DevSecOps Engineer to join our team - (100% Remote) . This role is critical in integrating security practices within the DevOps process, ensuring that security is e"
2026-05-06 14:24:23,adzuna,Serco,Experienced DevSecOps Engineer - (100% Remote),"Berthoud, Larimer County",,https://www.adzuna.com/land/ad/5681819408?se=0t7_UVdJ8RGngtw_dMYZiA&utm_medium=api&utm_source=632a28fd&v=04AE041B0E4F63A18CCD827601E3DAECAFE43D53,adzuna::5681819408,2026-03-28,"Position Description & Qualifications Position Description & Qualifications Serco is seeking a highly skilled and motivated Experienced DevSecOps Engineer to join our team - (100% Remote) . This role is critical in integrating security practices within the DevOps process, ensuring that security is e"
2026-05-06 14:24:23,adzuna,Serco,Experienced DevSecOps Engineer - (100% Remote),"Tarrytown, Travis County",,https://www.adzuna.com/details/5681749502?utm_medium=api&utm_source=632a28fd,adzuna::5681749502,2026-03-28,"Position Description & Qualifications Position Description & Qualifications Serco is seeking a highly skilled and motivated Experienced DevSecOps Engineer to join our team - (100% Remote) . This role is critical in integrating security practices within the DevOps process, ensuring that security is e"
2026-05-06 14:24:23,adzuna,Serco,Experienced DevSecOps Engineer - (100% Remote),"Herndon, Fairfax County",,https://www.adzuna.com/details/5681748014?utm_medium=api&utm_source=632a28fd,adzuna::5681748014,2026-03-28,"Position Description & Qualifications Position Description & Qualifications Serco is seeking a highly skilled and motivated Experienced DevSecOps Engineer to join our team - (100% Remote) . This role is critical in integrating security practices within the DevOps process, ensuring that security is e"
2026-05-06 14:24:23,adzuna,G2i,DevOps Engineer,US,,https://www.adzuna.com/details/5608908286?utm_medium=api&utm_source=632a28fd,adzuna::5608908286,2026-02-01,"Job Title: DevOps / DevSecOps Engineer Location: Remote (US based, US citizens only) Type: Full-Time What You’ll Do: Infrastructure: Own and evolve our AWS infra (ECS/Fargate, RDS/Postgres, S3, IAM, VPC) CI/CD & IaC: Maintain and improve CI/CD pipelines (GitHub Actions) and Infra-as-Code (Terraform)"
2026-05-06 14:24:23,adzuna,GeoDelphi,DevSecOps Engineer,"Alexandria, Alexandria City",,https://www.adzuna.com/details/5602507112?utm_medium=api&utm_source=632a28fd,adzuna::5602507112,2026-01-27,"Position: DevSecOps Engineer Location: Remote / Alexandria, VA Clearance: Preferred US Gov Secret or above clearance (not a hard requirement) Whitespace is dedicated to delivering innovative technological solutions that meet the highest standards of security and compliance. We are seeking a highly e"
2026-05-06 14:24:23,adzuna,GeoDelphi,DevSecOps Engineer,US,,https://www.adzuna.com/details/5602507150?utm_medium=api&utm_source=632a28fd,adzuna::5602507150,2026-01-27,"Position: DevSecOps Engineer Location: Remote / Alexandria, VA Clearance: Preferred US Gov Secret or above clearance (not a hard requirement) Whitespace is dedicated to delivering innovative technological solutions that meet the highest standards of security and compliance. We are seeking a highly e"
2026-05-06 14:24:23,adzuna,AbbVie,Senior DevSecOps Engineer - Platform and Tooling (Remote),"Atlanta, Fulton County",,https://www.adzuna.com/land/ad/5544976744?se=0t7_UVdJ8RGngtw_dMYZiA&utm_medium=api&utm_source=632a28fd&v=BA1046D711288729E854075D8BB68C3F27B18349,adzuna::5544976744,2025-12-16,"Company Description AbbVie's mission is to discover and deliver innovative medicines and solutions that solve serious health issues today and address the medical challenges of tomorrow. We strive to have a remarkable impact on people's lives across several key therapeutic areas - immunology, oncolog"
2026-05-06 14:24:23,adzuna,Cyrten,AWS DevSecOps Engineer (Sr)- 100% Remote - 1935,"Princeton, Mercer County",,https://www.adzuna.com/details/5330061057?utm_medium=api&utm_source=632a28fd,adzuna::5330061057,2025-07-31,AWS DevSecOps Engineer - 100% Remote Experience: 7 years Work Authorization: US Citizenship – Required (Federal client) Location: Remote Length: 12 – 36 Months Rate: D.O.E. Qualifications: We are seeking a skilled Security Assessment Engineer to join our team. The ideal candidate will be instrumenta
2026-05-06 14:24:23,adzuna,PTR Global,DevOps Engineer III,"Times Square, King County",,https://www.adzuna.com/land/ad/5720013579?se=sH02U1dJ8RGngtw_dMYZiA&utm_medium=api&utm_source=632a28fd&v=7B0F44B0B740AD1CF17A13CE880891116A516A41,adzuna::5720013579,2026-05-05,"Job Title: Devops/ SRE Engineer (AI/ML) Location: Seattle, WA (Remote) Duration: 12 months Job Id: 171076 Job Description: The MLPT Polymer group supports a range of Machine Learning platform products including: Bolt, Hub, Lightning and many Data Platform systems. These are all internal production t"
2026-05-06 14:24:23,adzuna,Golden Resources. Inc.,Sr. Software Engineer - SRE,"Alaska, US",,https://www.adzuna.com/land/ad/5718551006?se=sH02U1dJ8RGngtw_dMYZiA&utm_medium=api&utm_source=632a28fd&v=3271C8A6E8DD6482AC0CCC5F9B2DBAABD03DC4F1,adzuna::5718551006,2026-05-04,"Your Next Career Move Starts Here The Role : Senior Software Engineer - SRE Location: Remote Type: Full time What You ll Do: We are looking for a driven Senior Software Engineer with experience in Node.js, React.js, and Site Reliability Engineering (SRE) principles. You will play a key role in accel"
2026-05-06 14:24:23,adzuna,Openkyber,Junior Cloud Engineer,"Alaska, US",,https://www.adzuna.com/details/5714946591?utm_medium=api&utm_source=632a28fd,adzuna::5714946591,2026-04-30,"Position : Lead TechOps & SRE Engineer (AWS Cloud) Location : 100% REMOTE Employment mode : Contract to hire Department : Technology / Engineering Role Overview: We are seeking a highly experienced Lead TechOps & SRE Engineer with deep expertise in Cloud to lead our cloud infrastructure, DevOps prac"
2026-05-06 14:24:23,adzuna,Openkyber,AWS Network Engineer,"Georgia, US",,https://www.adzuna.com/details/5714012338?utm_medium=api&utm_source=632a28fd,adzuna::5714012338,2026-04-29,"Position : Lead TechOps & SRE Engineer (AWS Cloud) Location : 100% REMOTE Employment mode : Contract to hire Department : Technology / Engineering Role Overview: We are seeking a highly experienced Lead TechOps & SRE Engineer with deep expertise in Cloud to lead our cloud infrastructure, DevOps prac"
2026-05-06 14:24:23,adzuna,Openkyber,AWS Network Engineer,"Alaska, US",,https://www.adzuna.com/details/5713092094?utm_medium=api&utm_source=632a28fd,adzuna::5713092094,2026-04-28,"Position : Lead TechOps & SRE Engineer (AWS Cloud) Location : 100% REMOTE Employment mode : Contract to hire Department : Technology / Engineering Role Overview: We are seeking a highly experienced Lead TechOps & SRE Engineer with deep expertise in Cloud to lead our cloud infrastructure, DevOps prac"
2026-05-06 14:24:23,adzuna,Simple Solutions,Sr TechOps & SRE Lead Engineer (AWS Cloud) - Remote EST,"Villano Beach, St. Johns County",,https://www.adzuna.com/details/5709153148?utm_medium=api&utm_source=632a28fd,adzuna::5709153148,2026-04-24,"Sr TechOps & SRE Lead Engineer (AWS Cloud) Department: Technology / Engineering Role Overview We are seeking a highly experienced TechOps & SRE Lead Engineer with deep expertise in Cloud to lead our cloud infrastructure, DevOps practices, reliability engineering, and operational excellence initiativ"
2026-05-06 14:24:23,adzuna,"Pleasanton, CA",Site Reliability Engineer- Senior Dev Operations Engineer - SRE,"Pleasanton, Alameda County",,https://www.adzuna.com/details/5706589445?utm_medium=api&utm_source=632a28fd,adzuna::5706589445,2026-04-21,"Site Reliability Engineer- Senior Dev Operations Engineer – SRE Pleasanton, CA (100% remote) 12 Months Web Cam Interview $60-$70/Hr on w2 LinkedIn with recommendation is mandatory. They need very strong AWS, CI/CD pipeline, IAC candidates . Feedback from the manager: Wanted to see more on the AWS ba"
2026-05-06 14:24:23,adzuna,Cognizant,Multi-Cloud Site Reliability Engineer (SRE),"Talcott Village, Hartford County",,https://www.adzuna.com/land/ad/5693973271?se=sH02U1dJ8RGngtw_dMYZiA&utm_medium=api&utm_source=632a28fd&v=E145E497D71B13BFF178D0B91C96A7815FC65647,adzuna::5693973271,2026-04-08,"Job Title: Multi  Cloud Site Reliability Engineer (SRE) Job Location- Remote, USA  _Please note, this role is not able to offer visa transfer or sponsorship now or in the future_ We are seeking a highly skilled Multi  Cloud Site Reliability Engineer (SRE) to design, build, and operate secure, resili"
2026-05-06 14:24:23,adzuna,Cognizant,Multi-Cloud Site Reliability Engineer (SRE),"Uptown, Marion County",,https://www.adzuna.com/land/ad/5693972579?se=sH02U1dJ8RGngtw_dMYZiA&utm_medium=api&utm_source=632a28fd&v=766CE4F99A3CD76104E489D5AC8F5C19EFAA6DD5,adzuna::5693972579,2026-04-08,"Job Title: Multi  Cloud Site Reliability Engineer (SRE) Job Location- Remote, USA  _Please note, this role is not able to offer visa transfer or sponsorship now or in the future_ We are seeking a highly skilled Multi  Cloud Site Reliability Engineer (SRE) to design, build, and operate secure, resili"
2026-05-06 14:24:23,adzuna,Cognizant,Multi-Cloud Site Reliability Engineer (SRE),"Salem, Marion County",,https://www.adzuna.com/land/ad/5693972586?se=sH02U1dJ8RGngtw_dMYZiA&utm_medium=api&utm_source=632a28fd&v=769E2D4FDECF3262C147BEEE9CEB47345267D7E3,adzuna::5693972586,2026-04-08,"Job Title: Multi  Cloud Site Reliability Engineer (SRE) Job Location- Remote, USA  _Please note, this role is not able to offer visa transfer or sponsorship now or in the future_ We are seeking a highly skilled Multi  Cloud Site Reliability Engineer (SRE) to design, build, and operate secure, resili"
2026-05-06 14:24:23,adzuna,Cognizant,Multi-Cloud Site Reliability Engineer (SRE),"Oklahoma City, Oklahoma County",,https://www.adzuna.com/land/ad/5693972377?se=sH02U1dJ8RGngtw_dMYZiA&utm_medium=api&utm_source=632a28fd&v=F3E0C00762242280A2130338A9548C3FAFCF07A6,adzuna::5693972377,2026-04-08,"Job Title: Multi  Cloud Site Reliability Engineer (SRE) Job Location- Remote, USA  _Please note, this role is not able to offer visa transfer or sponsorship now or in the future_ We are seeking a highly skilled Multi  Cloud Site Reliability Engineer (SRE) to design, build, and operate secure, resili"
2026-05-06 14:24:23,adzuna,Cognizant,Multi-Cloud Site Reliability Engineer (SRE),"Chisolm, Montgomery County",,https://www.adzuna.com/land/ad/5693971833?se=sH02U1dJ8RGngtw_dMYZiA&utm_medium=api&utm_source=632a28fd&v=AC8831FD213E622AA946A75E5662B26DF6DFB365,adzuna::5693971833,2026-04-08,"Job Title: Multi  Cloud Site Reliability Engineer (SRE) Job Location- Remote, USA  _Please note, this role is not able to offer visa transfer or sponsorship now or in the future_ We are seeking a highly skilled Multi  Cloud Site Reliability Engineer (SRE) to design, build, and operate secure, resili"
2026-05-06 14:24:23,adzuna,Cognizant,Multi-Cloud Site Reliability Engineer (SRE),"Cammack Village, Pulaski County",,https://www.adzuna.com/land/ad/5693971480?se=ZOgHVFdJ8RG0ypNj_0xhbg&utm_medium=api&utm_source=632a28fd&v=60018A7581FC2D238D162A7D2920C033157A1437,adzuna::5693971480,2026-04-08,"Job Title: Multi  Cloud Site Reliability Engineer (SRE) Job Location- Remote, USA  _Please note, this role is not able to offer visa transfer or sponsorship now or in the future_ We are seeking a highly skilled Multi  Cloud Site Reliability Engineer (SRE) to design, build, and operate secure, resili"
2026-05-06 14:24:23,adzuna,Cognizant,Multi-Cloud Site Reliability Engineer (SRE),"Edgewood, Richland County",,https://www.adzuna.com/land/ad/5693965202?se=ZOgHVFdJ8RG0ypNj_0xhbg&utm_medium=api&utm_source=632a28fd&v=961126FC6BBCE94A87ED5D04BCFD7EED5EFC7D70,adzuna::5693965202,2026-04-08,"Job Title: Multi  Cloud Site Reliability Engineer (SRE) Job Location- Remote, USA  _Please note, this role is not able to offer visa transfer or sponsorship now or in the future_ We are seeking a highly skilled Multi  Cloud Site Reliability Engineer (SRE) to design, build, and operate secure, resili"
2026-05-06 14:24:23,adzuna,Cognizant,Multi-Cloud Site Reliability Engineer (SRE),"Des Moines, Polk County",,https://www.adzuna.com/land/ad/5693964987?se=ZOgHVFdJ8RG0ypNj_0xhbg&utm_medium=api&utm_source=632a28fd&v=A898FDEC3B15E375847C03D84F43537D3F985D91,adzuna::5693964987,2026-04-08,"Job Title: Multi  Cloud Site Reliability Engineer (SRE) Job Location- Remote, USA  _Please note, this role is not able to offer visa transfer or sponsorship now or in the future_ We are seeking a highly skilled Multi  Cloud Site Reliability Engineer (SRE) to design, build, and operate secure, resili"
2026-05-06 14:24:23,adzuna,Cognizant,Multi-Cloud Site Reliability Engineer (SRE),"Wake Island, Honolulu",,https://www.adzuna.com/land/ad/5693962452?se=ZOgHVFdJ8RG0ypNj_0xhbg&utm_medium=api&utm_source=632a28fd&v=FA191E92901E07E25104D96A1953B4FCD7C0AFF1,adzuna::5693962452,2026-04-08,"Job Title: Multi  Cloud Site Reliability Engineer (SRE) Job Location- Remote, USA  _Please note, this role is not able to offer visa transfer or sponsorship now or in the future_ We are seeking a highly skilled Multi  Cloud Site Reliability Engineer (SRE) to design, build, and operate secure, resili"
2026-05-06 14:24:23,adzuna,Cognizant,Multi-Cloud Site Reliability Engineer (SRE),"Augusta, Kennebec County",,https://www.adzuna.com/land/ad/5693962230?se=ZOgHVFdJ8RG0ypNj_0xhbg&utm_medium=api&utm_source=632a28fd&v=811A604A6731D6CFEC0F2A13BC5E431C8B1BF8DA,adzuna::5693962230,2026-04-08,"Job Title: Multi  Cloud Site Reliability Engineer (SRE) Job Location- Remote, USA  _Please note, this role is not able to offer visa transfer or sponsorship now or in the future_ We are seeking a highly skilled Multi  Cloud Site Reliability Engineer (SRE) to design, build, and operate secure, resili"
2026-05-06 14:24:23,adzuna,Cognizant,Multi-Cloud Site Reliability Engineer (SRE),"Helena, Lewis and Clark County",,https://www.adzuna.com/land/ad/5693961750?se=ZOgHVFdJ8RG0ypNj_0xhbg&utm_medium=api&utm_source=632a28fd&v=9BD8851E15B370192762C6BC5F2B57CB09946D56,adzuna::5693961750,2026-04-08,"Job Title: Multi  Cloud Site Reliability Engineer (SRE) Job Location- Remote, USA  _Please note, this role is not able to offer visa transfer or sponsorship now or in the future_ We are seeking a highly skilled Multi  Cloud Site Reliability Engineer (SRE) to design, build, and operate secure, resili"
2026-05-06 14:24:23,adzuna,Cognizant,Multi-Cloud Site Reliability Engineer (SRE),"Penbrook, Dauphin County",,https://www.adzuna.com/details/5693925790?utm_medium=api&utm_source=632a28fd,adzuna::5693925790,2026-04-08,"Job Title: Multi  Cloud Site Reliability Engineer (SRE) Job Location- Remote, USA  _Please note, this role is not able to offer visa transfer or sponsorship now or in the future_ We are seeking a highly skilled Multi  Cloud Site Reliability Engineer (SRE) to design, build, and operate secure, resili"
