collected_at_utc,source_type,company,title,location,team,url,external_id,posted_at,description_snippet
2026-04-18 12:36:45,serp:boards.greenhouse.io,sezzle,Job Application for Senior Security Infrastructure Engineer at Sezzle,,,https://boards.greenhouse.io/sezzle/jobs/7694889003,serp::https://boards.greenhouse.io/sezzle/jobs/7694889003,,"Senior Security Infrastructure Engineer. Türkiye, Remote. Apply. The salary range for this role is $5,000 - $9,500 per month (Gross in USD). About Sezzle: With ..."
2026-04-18 12:36:45,serp:boards.greenhouse.io,kerv,Job Application for Cloud Infrastructure Engineer at Kerv,,,https://boards.greenhouse.io/kerv/jobs/4841099101,serp::https://boards.greenhouse.io/kerv/jobs/4841099101,,"Cloud Infrastructure Engineer ... Please note: this role is Remote UK, no overseas candidates or work from overseas will be acceptable due to nature of our ..."
2026-04-18 12:36:45,serp:boards.greenhouse.io,gitlab,Job Application for Customer Success Engineer at GitLab,,,https://boards.greenhouse.io/gitlab/jobs/8498481002,serp::https://boards.greenhouse.io/gitlab/jobs/8498481002,,Customer Success Engineer. Remote. Apply. GitLab is the intelligent orchestration platform for DevSecOps. GitLab enables organizations ...
2026-04-18 12:36:45,serp:boards.greenhouse.io,defcon,Job Application for Senior DevSecOps / Platform Security Engineer ...,,,https://boards.greenhouse.io/defcon/jobs/5049058007,serp::https://boards.greenhouse.io/defcon/jobs/5049058007,,"Senior DevSecOps / Platform Security Engineer (AWS + Kubernetes) ... A fully remote, results-based environment ... United States military operation for which an ..."
2026-04-18 12:36:45,serp:boards.greenhouse.io,gitlab,"Job Application for Field CTO, Public Sector at GitLab",,,https://boards.greenhouse.io/gitlab/jobs/8493679002,serp::https://boards.greenhouse.io/gitlab/jobs/8493679002,,"Field CTO, Public Sector. Remote, US. Apply. GitLab is the intelligent orchestration platform for DevSecOps. GitLab ..."
2026-04-18 12:36:45,serp:boards.greenhouse.io,guidepointsecurity,AWS Cloud Security Consultant- Remote (Anywhere in the U.S.),,,https://boards.greenhouse.io/guidepointsecurity/jobs/5891994004,serp::https://boards.greenhouse.io/guidepointsecurity/jobs/5891994004,,... DevSecOps and CNAPP practices. This position also involves mentoring junior ... United States military operation for which an Armed Forces service ...
2026-04-18 12:36:45,serp:boards.greenhouse.io,corelight,Lead Cloud Infrastructure Engineer / Site Reliability Engineer (SRE),,,https://boards.greenhouse.io/corelight/jobs/7785288?gh_jid=7785288,serp::https://boards.greenhouse.io/corelight/jobs/7785288?gh_jid=7785288,,Lead Cloud Infrastructure Engineer / Site Reliability Engineer (SRE). North ... Residence within the contiguous United States. Willingness to undergo a ...
2026-04-18 12:36:45,serp:boards.greenhouse.io,specterops,Job Application for Senior IT Systems Administrator at SpecterOps,,,https://boards.greenhouse.io/specterops/jobs/8507537002,serp::https://boards.greenhouse.io/specterops/jobs/8507537002,,"Senior IT Systems Administrator. Remote, United States. Apply. SpecterOps is ... Design and operate multi-cloud infrastructure environments, including identity ..."
2026-04-18 12:36:45,serp:boards.greenhouse.io,andurilindustries,"Job Application for Cloud Infrastructure Engineer, Security at Anduril ...",,,https://boards.greenhouse.io/andurilindustries/jobs/5040112007,serp::https://boards.greenhouse.io/andurilindustries/jobs/5040112007,,"Cloud Infrastructure Engineer, Security. Costa Mesa, California, United States. Apply. Anduril Industries is a defense technology company with a mission to ..."
2026-04-18 12:36:45,serp:boards.greenhouse.io,andurilindustries,Job Application for Senior Site Reliability Engineer at Anduril ...,,,https://boards.greenhouse.io/andurilindustries/jobs/5055678007?gh_jid=5055678007,serp::https://boards.greenhouse.io/andurilindustries/jobs/5055678007?gh_jid=5055678007,,"Senior Site Reliability Engineer. Seattle, Washington, United States ... United States military operation for which an Armed Forces service medal was ..."
2026-04-18 12:36:45,serp:job-boards.greenhouse.io,trellahealth,Job Application for DevOps Engineer at Trella Health,,,http://job-boards.greenhouse.io/trellahealth/jobs/5969817004,serp::http://job-boards.greenhouse.io/trellahealth/jobs/5969817004,,"DevOps Engineer. Remote - Atlanta. Apply. At Trella Health, we are passionate and committed to ..."
2026-04-18 12:36:45,serp:job-boards.greenhouse.io,vannevarlabs,Job Application for DevOps Engineer at Vannevar,,,http://job-boards.greenhouse.io/vannevarlabs/jobs/5106734007,serp::http://job-boards.greenhouse.io/vannevarlabs/jobs/5106734007,,100% remote first culture. You can work from anywhere in the US and ... United States military operation for which an Armed Forces service medal was ...
2026-04-18 12:36:45,serp:job-boards.greenhouse.io,oddball,Job Application for DevOps Engineer at Oddball,,,http://job-boards.greenhouse.io/oddball/jobs/7686827003,serp::http://job-boards.greenhouse.io/oddball/jobs/7686827003,,Fully remote; Annual stipend; Comprehensive Benefits Package; Company Match 401 ... United States military operation for which an Armed Forces service ...
2026-04-18 12:36:45,serp:job-boards.greenhouse.io,centralreach,"Sr. DevOps Engineer, Cloud Security",,,http://job-boards.greenhouse.io/centralreach/jobs/4181860009,serp::http://job-boards.greenhouse.io/centralreach/jobs/4181860009,,"DevOps Engineer, Cloud Security. Remote - US. Apply. CentralReach is a leading provider of autism and IDD care ..."
2026-04-18 12:36:45,serp:job-boards.greenhouse.io,rivaltechnologies,Job Application for Senior DevOps Engineer at Rival Technologies,,,http://job-boards.greenhouse.io/rivaltechnologies/jobs/5132992008,serp::http://job-boards.greenhouse.io/rivaltechnologies/jobs/5132992008,,"This is a remote opportunity to experience working in a growing technology ... Please note, we are open to both Senior DevOps Engineer or Lead DevOps Engineer's."
2026-04-18 12:36:45,serp:job-boards.greenhouse.io,55564patriot334567software868575745,Job Application for Senior DevOps Engineer at Patriot Software,,,http://job-boards.greenhouse.io/55564patriot334567software868575745/jobs/4091852009,serp::http://job-boards.greenhouse.io/55564patriot334567software868575745/jobs/4091852009,,"Full-time, direct-hire, 100% remote role · Open to candidates residing in and legally eligible to work in the United States · Not open to applicants residing in: ..."
2026-04-18 12:36:45,serp:job-boards.greenhouse.io,juvare,Job Application for Senior DevOps Engineer at Juvare,,,https://job-boards.greenhouse.io/juvare/jobs/4685034005,serp::https://job-boards.greenhouse.io/juvare/jobs/4685034005,,Senior DevOps Engineer. Atlanta or Remote. Apply. Juvare is a SaaS software company focused on developing ...
2026-04-18 12:36:45,serp:job-boards.greenhouse.io,technologyadvice,DevOps Engineer II,,,https://job-boards.greenhouse.io/technologyadvice/jobs/5843319004,serp::https://job-boards.greenhouse.io/technologyadvice/jobs/5843319004,,"DevOps Engineer II. DevOps. Hi, we're TechnologyAdvice. At TechnologyAdvice ... Remote-First Culture: Work from the comfort of your home. Paid Time Off ..."
2026-04-18 12:36:45,serp:job-boards.greenhouse.io,clickhouse,Senior Site Reliability Engineer- Remote,,,http://job-boards.greenhouse.io/clickhouse/jobs/5819755004,serp::http://job-boards.greenhouse.io/clickhouse/jobs/5819755004,,"Senior Site Reliability Engineer- Remote · For roles based in the United States, · If you have any questions or comments about compensation as a candidate, please ..."
2026-04-18 12:36:45,serp:job-boards.greenhouse.io,weedmaps77,Job Application for Site Reliability Engineer (Remote) at Weedmaps,,,http://job-boards.greenhouse.io/weedmaps77/jobs/8488088002,serp::http://job-boards.greenhouse.io/weedmaps77/jobs/8488088002,,"Site Reliability Engineer (Remote). Austin, TX. Apply Here. Site Reliability ... United States military operation for which an Armed Forces service medal ..."
2026-04-18 12:36:45,serp:job-boards.greenhouse.io,peoplefinders,Job Application for Site Reliability Engineer (SRE) at PeopleFinders,,,http://job-boards.greenhouse.io/peoplefinders/jobs/5062627007,serp::http://job-boards.greenhouse.io/peoplefinders/jobs/5062627007,,"Site Reliability Engineer (SRE). California. Apply. PeopleFinders.com, the ... Demonstrated success working in a fully remote or distributed engineering team."
2026-04-18 12:36:45,serp:job-boards.greenhouse.io,zora,Job Application for Sr. Site Reliability Engineer (SRE) at Zora,,,http://job-boards.greenhouse.io/zora/jobs/5811801004,serp::http://job-boards.greenhouse.io/zora/jobs/5811801004,,Site Reliability Engineer (SRE). Remote. Apply. About Us: Zora is a new kind of ... Remote-First Culture: Work from anywhere in the world! Competitive ...
2026-04-18 12:36:45,serp:job-boards.greenhouse.io,centralreach,"Sr. Site Reliability Engineer, Security",,,http://job-boards.greenhouse.io/centralreach/jobs/4181882009,serp::http://job-boards.greenhouse.io/centralreach/jobs/4181882009,,"SRE, you will work closely with the key stakeholders in Software Engineering ... However, we will consider remote candidates located in other U.S. states for the ..."
2026-04-18 12:36:45,serp:job-boards.greenhouse.io,calendly,Job Application for Senior Site Reliability Engineer at Calendly,,,http://job-boards.greenhouse.io/calendly/jobs/8504765002,serp::http://job-boards.greenhouse.io/calendly/jobs/8504765002,,Senior Site Reliability Engineer. Remote - US. Apply. What's in it for you? Ready to ...
2026-04-18 12:36:45,serp:job-boards.greenhouse.io,censys,Job Application for Senior Site Reliability Engineer at Censys,,,http://job-boards.greenhouse.io/censys/jobs/8492894002,serp::http://job-boards.greenhouse.io/censys/jobs/8492894002,,This is a fully remote position within the United States. Role Summary. As a Senior Site Reliability Engineer (SRE) on the Infrastructure and Ops platform ...
2026-04-18 12:36:45,serp:job-boards.greenhouse.io,beaconbiosignals,Job Application for Site Reliability Engineer at Beacon Biosignals,,,https://job-boards.greenhouse.io/beaconbiosignals/jobs/4105184009,serp::https://job-boards.greenhouse.io/beaconbiosignals/jobs/4105184009,,"Site Reliability Engineer. Boston, MA - Remote. Apply. Beacon Biosignals is on a mission to ..."
2026-04-18 12:36:45,serp:job-boards.greenhouse.io,perfectserve,Senior Platform Engineer,,,http://job-boards.greenhouse.io/perfectserve/jobs/5868778004,serp::http://job-boards.greenhouse.io/perfectserve/jobs/5868778004,,Senior Platform Engineer - US Remote. Remote. Apply. What is PerfectServe ... United States military operation for which an Armed Forces service medal was ...
2026-04-18 12:36:45,serp:job-boards.greenhouse.io,204951305985924,Job Application for Platform Engineer at Stitch Fix Annex,,,http://job-boards.greenhouse.io/204951305985924/jobs/7808248,serp::http://job-boards.greenhouse.io/204951305985924/jobs/7808248,,"Platform Engineer. Remote, USA. Apply. About Stitch Fix, Inc. Stitch Fix ... As a Platform Engineer, you will contribute to building and improving Stitch ..."
2026-04-18 12:36:45,serp:job-boards.greenhouse.io,defenseunicorns,Job Application for Platform Engineer at Defense Unicorns,,,http://job-boards.greenhouse.io/defenseunicorns/jobs/5107193007,serp::http://job-boards.greenhouse.io/defenseunicorns/jobs/5107193007,,"Platform Engineer. Remote, United States. Apply. EMPLOYER IS A CONTRACTOR FOR THE U.S. GOVERNMENT. THIS POSITION REQUIRES AN ACTIVE SECRET CLEARANCE. Role ..."
2026-04-18 12:36:45,serp:job-boards.greenhouse.io,clara,Job Application for Senior Platform Engineer,,,http://job-boards.greenhouse.io/clara/jobs/5082649007,serp::http://job-boards.greenhouse.io/clara/jobs/5082649007,,"Senior Platform Engineer - Remote · Design and maintain a developer portal (Backstage.io or similar) as the central hub for resource management · Design, ..."
2026-04-18 12:36:45,serp:job-boards.greenhouse.io,jungroup,Job Application for Platform Engineer (Remote / Contract) at Verve ...,,,http://job-boards.greenhouse.io/jungroup/jobs/8455454002,serp::http://job-boards.greenhouse.io/jungroup/jobs/8455454002,,"Platform Engineer (Remote / Contract). New York, NY. Apply. Verve For ... United States military operation for which an Armed Forces service medal was ..."
2026-04-18 12:36:45,serp:job-boards.greenhouse.io,perfectserve,Job Application for Platform Engineer,,,https://job-boards.greenhouse.io/perfectserve/jobs/5735142004,serp::https://job-boards.greenhouse.io/perfectserve/jobs/5735142004,,Platform Engineer - US Remote. Remote. Apply. What is PerfectServe ... Do you reside within the United States?*. Select... Do you now or at a future date ...
2026-04-18 12:36:45,serp:job-boards.greenhouse.io,figma,Job Application for Data Platform Engineer at Figma,,,http://job-boards.greenhouse.io/figma/jobs/5840332004?gh_jid=5840332004,serp::http://job-boards.greenhouse.io/figma/jobs/5840332004?gh_jid=5840332004,,"Data Platform Engineer. San Francisco, CA • New York, NY • United ... United States military operation for which an Armed Forces service medal was ..."
2026-04-18 12:36:45,serp:job-boards.greenhouse.io,gatherai,Job Application for Platform Engineer at Gather AI,,,http://job-boards.greenhouse.io/gatherai/jobs/5066436007,serp::http://job-boards.greenhouse.io/gatherai/jobs/5066436007,,"Platform Engineer. Open to Remote (USA); Pittsburgh, PA. Apply. About Us ... United States military operation for which an Armed Forces service medal was ..."
2026-04-18 12:36:45,serp:job-boards.greenhouse.io,leaflink,Job Application for Senior Cloud Engineer at LeafLink,,,http://job-boards.greenhouse.io/leaflink/jobs/8478947002,serp::http://job-boards.greenhouse.io/leaflink/jobs/8478947002,,"Senior Cloud Engineer. New York, New York, United States. Apply. About LeafLink ... LeafLink is seeking a Staff Cloud Engineer to lead the evolution of our cloud ..."
2026-04-18 12:36:45,serp:job-boards.greenhouse.io,americaninstitutesforresearch,Job Application for Senior Cloud Engineer I at ...,,,http://job-boards.greenhouse.io/americaninstitutesforresearch/jobs/5147920008,serp::http://job-boards.greenhouse.io/americaninstitutesforresearch/jobs/5147920008,,Senior Cloud Engineer I. US-Remote | US-VA-Arlington | US-NC-Chapel Hill | US ... United States and globally. We generate evidence and apply data-driven ...
2026-04-18 12:36:45,serp:job-boards.greenhouse.io,bamboohr17,Job Application for Cloud Engineer at BambooHR,,,http://job-boards.greenhouse.io/bamboohr17/jobs/5746608004,serp::http://job-boards.greenhouse.io/bamboohr17/jobs/5746608004,,"Cloud Engineer. Utah | Remote. Apply. Please Note: This is a remote position available in the state listed on this job. Additionally, employment with BambooHR ..."
2026-04-18 12:36:45,serp:job-boards.greenhouse.io,clickhouse,Job Application for Senior Cloud Engineer at ClickHouse,,,http://job-boards.greenhouse.io/clickhouse/jobs/5733571004,serp::http://job-boards.greenhouse.io/clickhouse/jobs/5733571004,,"Senior Cloud Engineer. United States (remote). Apply. About ClickHouse. Recognized on the 2025 Forbes Cloud 100 list, ClickHouse is one of the most innovative ..."
2026-04-18 12:36:45,serp:job-boards.greenhouse.io,seisandbox,Job Application for IT Cloud Engineer at SEI,,,https://job-boards.greenhouse.io/seisandbox/jobs/4680883005,serp::https://job-boards.greenhouse.io/seisandbox/jobs/4680883005,,"IT Cloud Engineer. Cincinnati, Ohio, United States. Apply. WHO WE LOOK FOR. An SEI-er is a master communicator and active listener who understands how to ..."
2026-04-18 12:36:45,serp:job-boards.greenhouse.io,hiddenlayer,Full Stack Cloud Engineer (AI Security Platform),,,http://job-boards.greenhouse.io/hiddenlayer/jobs/5100067007,serp::http://job-boards.greenhouse.io/hiddenlayer/jobs/5100067007,,Full Stack Cloud Engineer (AI Security Platform). Remote [within the US]- strong preference for Eastern Time Zone hours. ABOUT THE ROLE:.
2026-04-18 12:36:45,serp:job-boards.greenhouse.io,faradayfuture,Job Application for Senior Cloud Engineer,,,https://job-boards.greenhouse.io/faradayfuture/jobs/7504774003,serp::https://job-boards.greenhouse.io/faradayfuture/jobs/7504774003,,"Senior Cloud Engineer - FOTA. Gardena, California, United States. Apply. The Company: Faraday Future (FF) is a California-based mobility company, leveraging ..."
2026-04-18 12:36:45,serp:job-boards.greenhouse.io,lightspeeddms,Platform Engineering,,,http://job-boards.greenhouse.io/lightspeeddms/jobs/5108573008,serp::http://job-boards.greenhouse.io/lightspeeddms/jobs/5108573008,,"Cloud Engineer - Platform Engineering. South Jordan, UT. Apply. Company Overview ... Hybrid or Remote (Utah preferred, open to other locations); Occasional ..."
2026-04-18 12:36:45,serp:job-boards.greenhouse.io,defcon,Job Application for Cloud Infrastructure Engineer at DEFCON AI,,,http://job-boards.greenhouse.io/defcon/jobs/5091753007,serp::http://job-boards.greenhouse.io/defcon/jobs/5091753007,,"Cloud Infrastructure Engineer · A fully remote, results-based environment · Competitive salary, bonus, and equity package · 100% employer paid, ..."
2026-04-18 12:36:45,serp:job-boards.greenhouse.io,cresta,Job Application for Infrastructure Engineer/SRE at Cresta,,,http://job-boards.greenhouse.io/cresta/jobs/5113850008,serp::http://job-boards.greenhouse.io/cresta/jobs/5113850008,,Infrastructure Engineer/SRE. Taiwan (Remote). Apply. Cresta is on a mission to ... Work from home office stipend to help you succeed in a remote environment.
2026-04-18 12:36:45,serp:job-boards.greenhouse.io,manifest,Job Application for Senior Infrastructure Engineer at Manifest Cyber ...,,,http://job-boards.greenhouse.io/manifest/jobs/4180759009,serp::http://job-boards.greenhouse.io/manifest/jobs/4180759009,,Senior Infrastructure Engineer · Help organizations gain visibility into their software supply chain and improve security · Fully remote (with potential for ...
2026-04-18 12:36:45,serp:job-boards.greenhouse.io,filescom,Job Application for Infrastructure Engineer (Remote) at Files.com,,,https://job-boards.greenhouse.io/filescom/jobs/4415773005,serp::https://job-boards.greenhouse.io/filescom/jobs/4415773005,,Infrastructure Engineer (Remote). Remote. Apply. Location: Remote (USA Only) ... United States military operation for which an Armed Forces service ...
2026-04-18 12:36:45,serp:job-boards.greenhouse.io,flex,Job Application for Senior Infrastructure Engineer at Flex,,,http://job-boards.greenhouse.io/flex/jobs/4666310005,serp::http://job-boards.greenhouse.io/flex/jobs/4666310005,,This remote role requires a minimum of 5 years of cloud infrastructure experience. ... Are you authorized to work in the United States?*. Select... Will you ...
2026-04-18 12:36:45,serp:job-boards.greenhouse.io,cloverhealth,Job Application for Cloud Infrastructure Engineer at Clover Health,,,http://job-boards.greenhouse.io/cloverhealth/jobs/7401436?gh_jid=7401436,serp::http://job-boards.greenhouse.io/cloverhealth/jobs/7401436?gh_jid=7401436,,Cloud Infrastructure Engineer. Remote - USA. Apply. We value diversity — in backgrounds and in experiences.
2026-04-18 12:36:45,serp:job-boards.greenhouse.io,qualifiedhealth,Job Application for Cloud / Infrastructure Engineer at Qualified Health,,,http://job-boards.greenhouse.io/qualifiedhealth/jobs/5163860008,serp::http://job-boards.greenhouse.io/qualifiedhealth/jobs/5163860008,,Cloud / Infrastructure Engineer. Remote - US. Apply. Transform healthcare ... United States military operation for which an Armed Forces service medal was ...
2026-04-18 12:36:45,serp:job-boards.greenhouse.io,twilio,Job Application for Senior Infrastructure Engineer at Twilio,,,http://job-boards.greenhouse.io/twilio/jobs/7474040,serp::http://job-boards.greenhouse.io/twilio/jobs/7474040,,"Senior Infrastructure Engineer. Remote - US. Apply. Who we are. At Twilio, we're ..."
2026-04-18 12:36:45,serp:job-boards.greenhouse.io,oddball,Job Application for DevSecOps Engineer at Oddball,,,http://job-boards.greenhouse.io/oddball/jobs/7694308003,serp::http://job-boards.greenhouse.io/oddball/jobs/7694308003,,"DevSecOps Engineer · Fully remote · Annual stipend · Comprehensive Benefits Package · Company Match 401(k) plan · Flexible PTO, Paid Holidays."
2026-04-18 12:36:45,serp:job-boards.greenhouse.io,mrbeastyoutube,Job Application for Senior DevSecOps Engineer at MrBeast,,,http://job-boards.greenhouse.io/mrbeastyoutube/jobs/5809670004,serp::http://job-boards.greenhouse.io/mrbeastyoutube/jobs/5809670004,,"Location: (On-site / Hybrid / Remote – NY, Bay Area, Chicago, Greenville) ... Are you legally authorized to work in the United States?*. Select... Will you ..."
2026-04-18 12:36:45,serp:job-boards.greenhouse.io,echodynecorp,Sr. DevSecOps Software Engineer,,,https://job-boards.greenhouse.io/echodynecorp/jobs/4671900006,serp::https://job-boards.greenhouse.io/echodynecorp/jobs/4671900006,,"DevSecOps Software Engineer. Kirkland, WA. Apply. Radar Reinvented ... United States military operation for which an Armed Forces service medal was ..."
2026-04-18 12:36:45,serp:job-boards.greenhouse.io,rackner,Job Application for DevSecOps (Kubernetes) SME at Rackner,,,http://job-boards.greenhouse.io/rackner/jobs/4340012005,serp::http://job-boards.greenhouse.io/rackner/jobs/4340012005,,DevSecOps (Kubernetes) SME. Remote (United States). Apply. Title: DevSecOps (Kubernetes) Engineer SME Clearance: US Citizen (Secret Eligible) Location: Remote.
2026-04-18 12:36:45,serp:job-boards.greenhouse.io,c5miinsightllc,Job Application for DevSecOps Engineer at C5MI Insight,,,http://job-boards.greenhouse.io/c5miinsightllc/jobs/4214561009,serp::http://job-boards.greenhouse.io/c5miinsightllc/jobs/4214561009,,DevSecOps Engineer. United States - Remote. Apply Now. C5MI is not your typical consulting firm. We are a high-performance team of SAP and supply chain experts ...
2026-04-18 12:36:45,serp:job-boards.greenhouse.io,alpaca,Job Application for DevSecOps Engineer at Alpaca,,,http://job-boards.greenhouse.io/alpaca/jobs/5840799004,serp::http://job-boards.greenhouse.io/alpaca/jobs/5840799004,,The Security Team is 100% distributed and remote. Things You Get To Do: The core responsibilities of the DevSecOps Engineer role are focused on embedding ...
2026-04-18 12:36:45,serp:job-boards.greenhouse.io,theweathercompany,Job Application for SkillBridge,,,http://job-boards.greenhouse.io/theweathercompany/jobs/5050445007,serp::http://job-boards.greenhouse.io/theweathercompany/jobs/5050445007,,"SkillBridge - DevSecOps Engineer. USA Remote. Apply. About The Weather Company ... The DevSecOps Engineer will play a key role, working with the core ..."
2026-04-18 12:36:45,serp:job-boards.greenhouse.io,alchemy,Job Application for Cloud Infrastructure Engineer at Alchemy,,,http://job-boards.greenhouse.io/alchemy/jobs/4684687005,serp::http://job-boards.greenhouse.io/alchemy/jobs/4684687005,,"Cloud Infrastructure Engineer. New York, New York, United States, San Francisco, California, United States ... Deep experience with cloud infrastructure (AWS ..."
2026-04-18 12:36:45,serp:job-boards.greenhouse.io,dbtlabsinc,"Senior Financial Analyst, Cloud Infrastructure",,,http://job-boards.greenhouse.io/dbtlabsinc/jobs/4667712005,serp::http://job-boards.greenhouse.io/dbtlabsinc/jobs/4667712005,,"Worked asynchronously as part of a fully-remote, distributed team ... For employees outside the United States, dbt Labs offers a competitive benefits package."
2026-04-18 12:36:45,serp:job-boards.greenhouse.io,tribalscale,Job Application for Oracle Cloud Infrastructure Engineer at TribalScale,,,http://job-boards.greenhouse.io/tribalscale/jobs/4653626006,serp::http://job-boards.greenhouse.io/tribalscale/jobs/4653626006,,"Oracle Cloud Infrastructure Engineer. Remote Office. Apply. Shape the Future with TribalScale. At TribalScale, we're not just participating in digital ..."
2026-04-18 12:36:45,serp:job-boards.greenhouse.io,weedmaps77,Job Application for Site Reliability Engineer (Remote) at Weedmaps,,,http://job-boards.greenhouse.io/weedmaps77/jobs/8488081002,serp::http://job-boards.greenhouse.io/weedmaps77/jobs/8488081002,,"Site Reliability Engineer (Remote). New York City, NY. Apply Here. Site ... United States military operation for which an Armed Forces service medal was ..."
2026-04-18 12:36:45,serp:job-boards.greenhouse.io,clickhouse,Senior Site Reliability Engineer,,,http://job-boards.greenhouse.io/clickhouse/jobs/5819754004,serp::http://job-boards.greenhouse.io/clickhouse/jobs/5819754004,,"Senior Site Reliability Engineer- Remote. United States(remote). Apply. About ClickHouse. Recognized on the 2025 Forbes Cloud 100 list, ClickHouse is one of the ..."
2026-04-18 12:36:45,serp:job-boards.greenhouse.io,engine,Job Application for Senior Supply Reliability Engineer at Engine,,,http://job-boards.greenhouse.io/engine/jobs/7690579003,serp::http://job-boards.greenhouse.io/engine/jobs/7690579003,,"Senior Supply Reliability Engineer ... Whether you are in one of our amazing offices or fully remote, we'll make sure you have what you need to succeed."
2026-04-18 12:36:45,serp:job-boards.greenhouse.io,customerio,Job Application for Senior Site Reliability Engineer at Customer.io,,,http://job-boards.greenhouse.io/customerio/jobs/7689438,serp::http://job-boards.greenhouse.io/customerio/jobs/7689438,,"Senior Site Reliability Engineer. EMEA Remote. Apply. About Customer.io. Over 8,000 companies - from ..."
2026-04-18 12:36:45,serp:job-boards.greenhouse.io,akuity,Job Application for Senior Site Reliability Engineer at Akuity,,,http://job-boards.greenhouse.io/akuity/jobs/4186344009,serp::http://job-boards.greenhouse.io/akuity/jobs/4186344009,,Senior Site Reliability Engineer. Remote - US Timezones. Apply. About ... Fully remote: work from anywhere within US time zones (Pacific ...
