collected_at_utc,source_type,company,title,location,team,url,external_id,posted_at,description_snippet
2026-04-18 12:36:45,serp:apply.workable.com,beamng,Senior Full-Stack Platform Engineer (onsite/remote),,,https://apply.workable.com/beamng/j/D030F08D8E/,serp::https://apply.workable.com/beamng/j/D030F08D8E/,,"Senior Full-Stack Platform Engineer (onsite/remote). RemoteEngineering ... As a Senior Full-Stack Platform Engineer at BeamNG, you will build and scale ..."
2026-04-18 12:36:45,serp:apply.workable.com,tetrascience,Lead Platform Engineer,,,https://apply.workable.com/tetrascience/j/00D96E7292/,serp::https://apply.workable.com/tetrascience/j/00D96E7292/,,Lead Platform Engineer - Search Platform. Remote. United States. Overview ... We're looking for a Lead/Principal Platform Engineer to lead that effort.
2026-04-18 12:36:45,serp:apply.workable.com,mindex,Senior AWS Cloud Engineer,,,https://apply.workable.com/mindex/j/5F72EE9A18/,serp::https://apply.workable.com/mindex/j/5F72EE9A18/,,"Senior AWS Cloud Engineer - Remote (Req. #757). RemoteCloudFull time. Rochester, New York, United States. OverviewApplication. Share this job. SVGs not ..."
2026-04-18 12:36:45,serp:apply.workable.com,protera,Jobs By Workable,,,https://apply.workable.com/protera/j/6352CA48B5/,serp::https://apply.workable.com/protera/j/6352CA48B5/,,"Cloud Engineer. RemoteCloudOpsFull time. United States. OverviewApplication ... The Cloud Engineer is responsible for Operations (design, installation and ..."
2026-04-18 12:36:45,serp:apply.workable.com,mindex,Senior AWS Cloud Engineer,,,https://apply.workable.com/mindex/j/5F72EE9A18/apply/,serp::https://apply.workable.com/mindex/j/5F72EE9A18/apply/,,"Senior AWS Cloud Engineer - Remote (Req #757). RemoteCloudFull time. Rochester, New York, United States. OverviewApplication. Autofill application. Save time by ..."
2026-04-18 12:36:45,serp:apply.workable.com,credence,Jobs By Workable,,,https://apply.workable.com/credence/j/C3DDC161D9/apply/,serp::https://apply.workable.com/credence/j/C3DDC161D9/apply/,,"Cloud Engineer. On-siteAgency, DLAFull time20269708. McLean, Virginia, United ... United States and/or other countries for storage, processing and use by ..."
2026-04-18 12:36:45,serp:apply.workable.com,j,Senior AWS Cloud Engineer,,,https://apply.workable.com/j/B7DABF5C45,serp::https://apply.workable.com/j/B7DABF5C45,,"With more than 30 years in business, Mindex is a product and services company with a proven track record of delivering successful software and product ..."
2026-04-18 12:36:45,serp:apply.workable.com,esgusa,Senior DevOps Cloud Engineer,,,https://apply.workable.com/esgusa/j/11108D53FF,serp::https://apply.workable.com/esgusa/j/11108D53FF,,"Senior DevOps Cloud Engineer. HybridSoftware Engineering & DevelopmentFull time. Norwell, Massachusetts, United States. OverviewApplication. Share this job."
2026-04-18 12:36:45,serp:apply.workable.com,dsn,"Diversified Services Network, Inc.",,,https://apply.workable.com/dsn/j/3DF7FDF797/apply/,serp::https://apply.workable.com/dsn/j/3DF7FDF797/apply/,,"AWS Cloud Engineer. On-siteFull time194257. Chicago, Illinois, United States. Dallas, Texas, United States. OverviewApplication. Autofill application. Save time ..."
2026-04-18 12:36:45,serp:apply.workable.com,maxana,Infrastructure Engineer,,,https://apply.workable.com/maxana/j/8FC5EEF581/,serp::https://apply.workable.com/maxana/j/8FC5EEF581/,,"Infrastructure Engineer. HybridFull time. New York, New York, United States. San Francisco, California, United States. Seattle, Washington, United States."
2026-04-18 12:36:45,serp:apply.workable.com,systems-engineering-solutions-corporation,Cloud Infrastructure Engineer,,,https://apply.workable.com/systems-engineering-solutions-corporation/j/25C6B3C979,serp::https://apply.workable.com/systems-engineering-solutions-corporation/j/25C6B3C979,,"Cloud Infrastructure Engineer. HybridFull time. Boston, Massachusetts, United States. Huntsville, Alabama, United States. OverviewApplication. Share this job."
2026-04-18 12:36:45,serp:apply.workable.com,mlabs,Senior Infrastructure Engineer,,,https://apply.workable.com/mlabs/j/94F4F1BD49/,serp::https://apply.workable.com/mlabs/j/94F4F1BD49/,,"Location: Remote - Remote - Based In ET+2 / -3, NY PreferredRemote | Full ... Senior Infrastructure Engineer. RemoteAGF262519. New York, New York, United States."
2026-04-18 12:36:45,serp:apply.workable.com,eqltech,Infrastructure Engineer,,,https://apply.workable.com/eqltech/j/A7180F0623/,serp::https://apply.workable.com/eqltech/j/A7180F0623/,,"Infrastructure Engineer. On-siteEngineering, Product & TechFull time. San Francisco, California, United States. Phoenix, Arizona, United States. Overview ..."
2026-04-18 12:36:45,serp:apply.workable.com,surglobal,Windows Infrastructure Engineer,,,https://apply.workable.com/surglobal/j/E3CBBEABF3,serp::https://apply.workable.com/surglobal/j/E3CBBEABF3,,"Windows Infrastructure Engineer ... Understanding of application publishing, user access management, and optimizing performance for remote app users."
2026-04-18 12:36:45,serp:apply.workable.com,mlabs,Senior Infrastructure Engineer,,,https://apply.workable.com/mlabs/j/918C17F086/,serp::https://apply.workable.com/mlabs/j/918C17F086/,,Senior Infrastructure Engineer - Blockchain Wallet Backbone. Location: Remote - United States. Compensation: $180K - $300K.
2026-04-18 12:36:45,serp:apply.workable.com,kraftkennedy,Microsoft Cloud Support Infrastructure Engineer,,,https://apply.workable.com/kraftkennedy/j/B0530C6B82/apply/,serp::https://apply.workable.com/kraftkennedy/j/B0530C6B82/apply/,,Microsoft Cloud Support Infrastructure Engineer. RemoteInfrastructure and Enterprise Systems (IES)Full time. United States. OverviewApplication. Autofill ...
2026-04-18 12:36:45,serp:apply.workable.com,mlabs,Senior Infrastructure Engineer,,,https://apply.workable.com/mlabs/j/94F4F1BD49/apply/,serp::https://apply.workable.com/mlabs/j/94F4F1BD49/apply/,,"Senior Infrastructure Engineer. RemoteAGF262519. New York, New York, United States. Washington, District of Columbia, United States. Boston, Massachusetts, ..."
2026-04-18 12:36:45,serp:apply.workable.com,boundless-networks-inc-1,Senior Software Engineer,,,https://apply.workable.com/boundless-networks-inc-1/j/CE8155D309,serp::https://apply.workable.com/boundless-networks-inc-1/j/CE8155D309,,"As an Infrastructure Engineer, you'll build and deploy the computational ... Remote-first with regular off-sites and a high-trust, high-velocity team ..."
2026-04-18 12:36:45,serp:apply.workable.com,platzi,Infrastructure Engineer,,,https://apply.workable.com/platzi/j/40D4568480,serp::https://apply.workable.com/platzi/j/40D4568480,,"We operate mostly remote, with key offices in Bogotá, Medellín and Mexico City. Summary. We are looking for an Infrastructure Engineer eager to grow ..."
2026-04-18 12:36:45,serp:apply.workable.com,opendatajobs,"Software Developer (Remote, Secret Clearance Preferred)",,,https://apply.workable.com/opendatajobs/j/57ADC6CFA9/,serp::https://apply.workable.com/opendatajobs/j/57ADC6CFA9/,,"Potomac, Maryland, United States ... You are comfortable working across SharePoint, Power Platform, and modern development frameworks, and you see DevSecOps ..."
2026-04-18 12:36:45,serp:apply.workable.com,geodelphi,DevSecOps Engineer,,,https://apply.workable.com/geodelphi/j/25B453E437/,serp::https://apply.workable.com/geodelphi/j/25B453E437/,,"DevSecOps Engineer. RemoteEngineeringFull time. United States. Alexandria, Virginia ..."
2026-04-18 12:36:45,serp:apply.workable.com,thaloz,Jobs By Workable,,,https://apply.workable.com/thaloz/j/1F1F00AF5A/,serp::https://apply.workable.com/thaloz/j/1F1F00AF5A/,,"Clearco is hiring a Senior DevSecOps ... Define and maintain end-user device security standards, including requirements for EDR and remote access tooling, and ..."
2026-04-18 12:36:45,serp:apply.workable.com,imetalx,DevSecOps Engineer (cleared),,,https://apply.workable.com/imetalx/j/1A17AFDD1A/,serp::https://apply.workable.com/imetalx/j/1A17AFDD1A/,,"DevSecOps Engineer (cleared). On-siteEngineeringFull time. Sausalito, California, United States ... 4+ years of experience in a DevOps/DevSecOps/Platform ..."
2026-04-18 12:36:45,serp:apply.workable.com,futurae,Security Engineer (DevSecOps),,,https://apply.workable.com/futurae/j/33039DCD9F/,serp::https://apply.workable.com/futurae/j/33039DCD9F/,,"Several years of experience with security engineering, DevSecOps, computer and network security, PKI and security protocols. ... Joint co-working days for remote ..."
2026-04-18 12:36:45,serp:apply.workable.com,imetalx,CyberSecurity & DevSecOps Engineer,,,https://apply.workable.com/imetalx/j/620D0C0ED9/,serp::https://apply.workable.com/imetalx/j/620D0C0ED9/,,"CyberSecurity & DevSecOps Engineer - Summer Internship 2026. On-siteEngineeringTemporary. Sausalito, California, United States ... DevSecOps Engineer - Summer ..."
2026-04-18 12:36:45,serp:apply.workable.com,credence,DevSecOps Engineer,,,https://apply.workable.com/credence/j/F6198B5821/apply/,serp::https://apply.workable.com/credence/j/F6198B5821/apply/,,"DevSecOps Engineer. HybridAgency, DLAFull time. McLean, Virginia, United ... United States. If employed, I understand that as a condition of employment ..."
2026-04-18 12:36:45,serp:apply.workable.com,remote-raven,AI & Cloud Engineering,,,https://apply.workable.com/remote-raven/j/B327D744A2,serp::https://apply.workable.com/remote-raven/j/B327D744A2,,Build and maintain AI systems and cloud infrastructure in accordance with ... Requirements. This is a 100% Remote Job. Full time. Rate is $10/hr. Apply for ...
2026-04-18 12:36:45,serp:apply.workable.com,trinetix,Cloud Infrastructure Engineer,,,https://apply.workable.com/trinetix/j/DCC7B860B6/apply/,serp::https://apply.workable.com/trinetix/j/DCC7B860B6/apply/,,"Cloud Infrastructure Engineer. HybridSTA0022. Nashville, Tennessee, United States. Brentwood ..."
2026-04-18 12:36:45,serp:apply.workable.com,huzzle,"Full-Stack Developer (Python, React, AI)",,,https://apply.workable.com/huzzle/j/E950529CC8/,serp::https://apply.workable.com/huzzle/j/E950529CC8/,,We are seeking a Remote AI Backend / Full-Stack Engineer with strong Python ... Understanding of cloud infrastructure (AWS or similar platforms) ...
2026-04-18 12:36:45,serp:apply.workable.com,mullers-solutions-1,Systems and Cloud Administrator(Remote),,,https://apply.workable.com/mullers-solutions-1/j/2578F3CDB5/,serp::https://apply.workable.com/mullers-solutions-1/j/2578F3CDB5/,,"Müller's Solutions is seeking a Systems and Cloud Administrator to join our remote team. In this role, you will be the backbone of our cloud infrastructure ..."
2026-04-18 12:36:45,serp:apply.workable.com,routesmart-technologies-inc,RouteSmart Technologies Inc,,,https://apply.workable.com/routesmart-technologies-inc/j/9DC9221B1F,serp::https://apply.workable.com/routesmart-technologies-inc/j/9DC9221B1F,,"However, we will consider the right candidate for remote work if domiciled in ... 5+ years of experience with cloud infrastructure, systems, and security."
2026-04-18 12:36:45,serp:apply.workable.com,systems-engineering-solutions-corporation,Systems Engineering Solutions Corporation,,,https://apply.workable.com/systems-engineering-solutions-corporation/j/3A513722EC/,serp::https://apply.workable.com/systems-engineering-solutions-corporation/j/3A513722EC/,,"Reliability Engineer. HybridFull time. Hanscom Air Force Base, Massachusetts, United States. Boston, Massachusetts, United States. OverviewApplication. Share ..."
2026-04-18 12:36:45,serp:apply.workable.com,twgai,Platform Reliability Engineer,,,https://apply.workable.com/twgai/j/E974265187/,serp::https://apply.workable.com/twgai/j/E974265187/,,"Platform Reliability Engineer. On-siteAI Product EngineeringFull time. Jacksonville, Florida, United States ... We are seeking a Platform Reliability Engineer ..."
2026-04-18 12:36:45,serp:apply.workable.com,salla,Database Reliability Engineer,,,https://apply.workable.com/salla/j/A69E03E08B/,serp::https://apply.workable.com/salla/j/A69E03E08B/,,"Database Reliability Engineer. HybridTechnologyFull time. Madinah, Al Madinah ... Hybrid/remote environment. Comfortable working in a hybrid model and ..."
2026-04-18 12:36:45,serp:jobs.smartrecruiters.com,mirantis,Mirantis Senior DevOps Engineer,,,https://jobs.smartrecruiters.com/Mirantis/744000109788455-senior-devops-engineer,serp::https://jobs.smartrecruiters.com/Mirantis/744000109788455-senior-devops-engineer,,"Senior DevOps Engineer. Riga, Latvia Employees can work ... Work in a global, collaborative, remote-first culture that rewards initiative and execution."
2026-04-18 12:36:45,serp:jobs.smartrecruiters.com,endava,Endava DevOps Engineer,,,https://jobs.smartrecruiters.com/Endava/744000117901952-devops-engineer-,serp::https://jobs.smartrecruiters.com/Endava/744000117901952-devops-engineer-,,"DevOps Engineer. Remote, United States Employees can work remotely; Full-time ... Certifications in cloud platforms (AWS Certified Solutions Architect, Azure ..."
2026-04-18 12:36:45,serp:jobs.smartrecruiters.com,experian,Experian DevOps engineer,,,https://jobs.smartrecruiters.com/Experian/744000118887539-devops-engineer,serp::https://jobs.smartrecruiters.com/Experian/744000118887539-devops-engineer,,"Certification in cloud platforms such as AWS Certified DevOps Engineer, Azure DevOps Engineer etc. ... Flexible work environment, ability to work remote, hybrid ..."
2026-04-18 12:36:45,serp:jobs.smartrecruiters.com,sparrowconnected,Sparrow Connected Azure DevOps Specialist (Remote),,,https://jobs.smartrecruiters.com/SparrowConnected/743999737789029-azure-devops-specialist-remote-,serp::https://jobs.smartrecruiters.com/SparrowConnected/743999737789029-azure-devops-specialist-remote-,,"Azure DevOps Specialist (Remote). 150 9 Ave SW, Calgary, AB T2P 3H9 ... Azure DevOps Engineer or Azure Developer Associate certification; 3+ years of ..."
2026-04-18 12:36:45,serp:jobs.smartrecruiters.com,abbvie,AbbVie Senior Site Reliability Engineer (Remote),,,https://jobs.smartrecruiters.com/AbbVie/3743990012089126-senior-site-reliability-engineer-remote-,serp::https://jobs.smartrecruiters.com/AbbVie/3743990012089126-senior-site-reliability-engineer-remote-,,"Senior Site Reliability Engineer (Remote). Mettawa, IL, USA Employees work in ... The SRE, coordinating with developers, will monitor the pulse of ..."
2026-04-18 12:36:45,serp:jobs.smartrecruiters.com,now100,Now100 Site Reliability Engineer - SRE,,,https://jobs.smartrecruiters.com/Now100/743999884115973-site-reliability-engineer-sre,serp::https://jobs.smartrecruiters.com/Now100/743999884115973-site-reliability-engineer-sre,,"Site Reliability Engineer - SRE. Paces Ferry Rd, Atlanta, GA, United States Employees can work remotely; Contract. Company Description. Now100 is committed to ..."
2026-04-18 12:36:45,serp:jobs.smartrecruiters.com,devexperts,Devexperts Site Reliability Engineer (SRE),,,https://jobs.smartrecruiters.com/Devexperts/744000113145398-site-reliability-engineer-sre-,serp::https://jobs.smartrecruiters.com/Devexperts/744000113145398-site-reliability-engineer-sre-,,"We are looking for a Site Reliability Engineer (SRE) to fill the open ... Possibility of hybrid/remote work mode in Georgia,; Flexible working hours ..."
2026-04-18 12:36:45,serp:jobs.smartrecruiters.com,bet3651,bet365 Site Reliability Engineer,,,https://jobs.smartrecruiters.com/Bet3651/744000116627647-site-reliability-engineer,serp::https://jobs.smartrecruiters.com/Bet3651/744000116627647-site-reliability-engineer,,"Regulatory Data Developer (Remote) ... Similar jobs. Senior Site Reliability Engineer FedRAMP. CyberArk; Boston, Massachusetts. Senior Site Reliability Engineer ( ..."
2026-04-18 12:36:45,serp:jobs.smartrecruiters.com,ifs1,IFS Senior Site Reliability Engineer,,,https://jobs.smartrecruiters.com/IFS1/744000120859977-senior-site-reliability-engineer,serp::https://jobs.smartrecruiters.com/IFS1/744000120859977-senior-site-reliability-engineer,,"As a Senior Site Reliability Engineer (SRE) within the Web Center of Excellence (Web COE), you will be responsible for ensuring the reliability, security ..."
2026-04-18 12:36:45,serp:jobs.smartrecruiters.com,blueally,BlueAlly Platform Engineer,,,https://jobs.smartrecruiters.com/BlueAlly/744000114703579-platform-engineer,serp::https://jobs.smartrecruiters.com/BlueAlly/744000114703579-platform-engineer,,"Platform Engineer. Manila, Metro Manila, Philippines Employees can work ... ***This role is 100% remote. I'm interested · I'm interested. Cookies Settings."
2026-04-18 12:36:45,serp:jobs.smartrecruiters.com,dev2,Dev Lead Platform Engineer (Cloud FinOps),,,https://jobs.smartrecruiters.com/Dev2/743999950671236-lead-platform-engineer-cloud-finops-,serp::https://jobs.smartrecruiters.com/Dev2/743999950671236-lead-platform-engineer-cloud-finops-,,"Job Description. NYC 299 Park Avenue (22957), United States of America, New York, New York. Lead Platform Engineer (Cloud FinOps). Do you love building and ..."
2026-04-18 12:36:45,serp:jobs.smartrecruiters.com,goldstonepartners,DevOps Platform Engineer – US Remote,,,https://jobs.smartrecruiters.com/goldstonepartners/744000115491827-devops-platform-engineer-us-remote?oga=true,serp::https://jobs.smartrecruiters.com/goldstonepartners/744000115491827-devops-platform-engineer-us-remote?oga=true,,"DevOps Platform Engineer – US Remote. Golden, CO, USA. DevOps Platform ... United States +1. Uruguay +598. US ..."
2026-04-18 12:36:45,serp:jobs.smartrecruiters.com,harvarduniversity,Harvard University Scientific Platform Engineer,,,https://jobs.smartrecruiters.com/HarvardUniversity/3743990012305746-scientific-platform-engineer,serp::https://jobs.smartrecruiters.com/HarvardUniversity/3743990012305746-scientific-platform-engineer,,"Scientific Platform Engineer. Boston, Massachusetts, United States Employees can work remotely; Full-time. Work Format: Fully Remote; Harvard Job Function ..."
2026-04-18 12:36:45,serp:jobs.smartrecruiters.com,cyberark1,Back End Platform Engineer (Machine Identity Security) hybrid,,,https://jobs.smartrecruiters.com/Cyberark1/744000119519107-senior-software-engineer-back-end-platform-engineer-machine-identity-security-hybrid,serp::https://jobs.smartrecruiters.com/Cyberark1/744000119519107-senior-software-engineer-back-end-platform-engineer-machine-identity-security-hybrid,,"Senior Software Engineer - Back End Platform Engineer (Machine Identity Security) hybrid. Santa Clara, California, United States Employees work in a hybrid ..."
2026-04-18 12:36:45,serp:jobs.smartrecruiters.com,goldstonepartners,Senior Azure Cloud Engineer,,,https://jobs.smartrecruiters.com/goldstonepartners/744000117931877-senior-azure-cloud-engineer-us-remote?oga=true,serp::https://jobs.smartrecruiters.com/goldstonepartners/744000117931877-senior-azure-cloud-engineer-us-remote?oga=true,,"Senior Azure Cloud Engineer - US Remote. Oak Brook, IL, USA. Senior Azure ... United States +1. Uruguay +598. US ..."
2026-04-18 12:36:45,serp:jobs.smartrecruiters.com,ignatiuzcom,Google Cloud Engineer,,,https://jobs.smartrecruiters.com/Ignatiuzcom/87284586-google-cloud-engineer?oga=true&trid=8dc3fc18-7d27-474f-af15-47b783076ace,serp::https://jobs.smartrecruiters.com/Ignatiuzcom/87284586-google-cloud-engineer?oga=true&trid=8dc3fc18-7d27-474f-af15-47b783076ace,,"Google Cloud Engineer. Atlanta, GA. Google Cloud Engineer. Easy Apply. Choose ... United States +1. Uruguay +598. US ..."
2026-04-18 12:36:45,serp:jobs.smartrecruiters.com,westerndigital,Western Digital AWS Cloud Engineer / Administrator,,,https://jobs.smartrecruiters.com/WesternDigital/744000117053907-aws-cloud-engineer-administrator,serp::https://jobs.smartrecruiters.com/WesternDigital/744000117053907-aws-cloud-engineer-administrator,,"AWS Cloud Engineer / Administrator. 5601 Great Oaks Parkway, San Jose ... remote jobs that can be performed in California, Colorado and New York. This ..."
2026-04-18 12:36:45,serp:jobs.smartrecruiters.com,experian,Experian Cloud Engineer,,,https://jobs.smartrecruiters.com/Experian/744000119568451-cloud-engineer,serp::https://jobs.smartrecruiters.com/Experian/744000119568451-cloud-engineer,,"Cloud Engineer. 4th Floor, Tower -1, Phoenix Equinox, Telangana ... Senior Product Manager - Healthcare Technology (Remote). United States, UNITED STATES."
2026-04-18 12:36:45,serp:jobs.smartrecruiters.com,devoteam,Devoteam AWS Cloud Engineer,,,https://jobs.smartrecruiters.com/Devoteam/744000103010744-aws-cloud-engineer,serp::https://jobs.smartrecruiters.com/Devoteam/744000103010744-aws-cloud-engineer,,"AWS Cloud Engineer. Kiš Ernea, Novi Sad, Serbia Employees work in a ... Flexible options for remote work; Work one month per year from anywhere; Free ..."
2026-04-18 12:36:45,serp:jobs.smartrecruiters.com,experian,Experian Cloud Infrastructure Engineer (AWS),,,https://jobs.smartrecruiters.com/Experian/744000118940980-cloud-infrastructure-engineer-aws-,serp::https://jobs.smartrecruiters.com/Experian/744000118940980-cloud-infrastructure-engineer-aws-,,Cloud Infrastructure Engineer (AWS). Centro Corporativo el Cafetal ... #LI-Remote. Our uniqueness is that we celebrate yours. Experian's culture and ...
2026-04-18 12:36:45,serp:jobs.smartrecruiters.com,versant3,Versant Sr. Infrastructure Engineer,,,https://jobs.smartrecruiters.com/Versant3/744000120551517-sr-infrastructure-engineer,serp::https://jobs.smartrecruiters.com/Versant3/744000120551517-sr-infrastructure-engineer,,"Infrastructure Engineer. 7580 Golf Channel Drive, Orlando, FL Employees can ... Fully Remote: This position has been designated as fully remote, meaning ..."
2026-04-18 12:36:45,serp:jobs.smartrecruiters.com,aerovect,AeroVect Infrastructure Engineer,,,https://jobs.smartrecruiters.com/AeroVect/743999798723067-infrastructure-engineer,serp::https://jobs.smartrecruiters.com/AeroVect/743999798723067-infrastructure-engineer,,"Infrastructure Engineer. HQ, San Francisco, CA, United States Employees can work remotely; Full-time. Company Description. At AeroVect, we provide autonomous ..."
2026-04-18 12:36:45,serp:jobs.smartrecruiters.com,paconsulting,Azure DevOps/Infrastructure Engineer,,,https://jobs.smartrecruiters.com/PAConsulting/744000119487537-azure-devops-infrastructure-engineer,serp::https://jobs.smartrecruiters.com/PAConsulting/744000119487537-azure-devops-infrastructure-engineer,,"Azure DevOps/Infrastructure Engineer · Tower Point, 6th Floor, 27-43 Wormwood Street, Boston, MA 02210, United States of America, Boston Employees work in a ..."
2026-04-18 12:36:45,serp:jobs.smartrecruiters.com,unit44,Unit4 Senior Cloud Infrastructure Engineer,,,https://jobs.smartrecruiters.com/Unit44/744000119536008-senior-cloud-infrastructure-engineer,serp::https://jobs.smartrecruiters.com/Unit44/744000119536008-senior-cloud-infrastructure-engineer,,"The Global Cloud Infrastructure Team is seeking a skilled a Senior Cloud Infrastructure Engineer to join our international team. ... remote working opportunities, ..."
2026-04-18 12:36:45,serp:jobs.smartrecruiters.com,artechinformationsystemllc,Artech Information System LLC Infrastructure Engineer,,,https://jobs.smartrecruiters.com/ArtechInformationSystemLLC/743999659207404-infrastructure-engineer,serp::https://jobs.smartrecruiters.com/ArtechInformationSystemLLC/743999659207404-infrastructure-engineer,,"Infrastructure Engineer. Ashburn, VA; Contract. Company ... • Ability to provide remote leadership and direction within conference bridge environments."
2026-04-18 12:36:45,serp:jobs.smartrecruiters.com,abbvie,AbbVie Senior DevSecOps Engineer,,,https://jobs.smartrecruiters.com/AbbVie/3743990012271341-senior-devsecops-engineer-platform-and-tooling-remote-,serp::https://jobs.smartrecruiters.com/AbbVie/3743990012271341-senior-devsecops-engineer-platform-and-tooling-remote-,,"Senior DevSecOps Engineer - Platform and Tooling (Remote). Atlanta, GA, USA Employees can work remotely; Full-time. Salary Min: 109500; Salary Max: 208500 ..."
2026-04-18 12:36:45,serp:jobs.smartrecruiters.com,oteemoinc,DevSecOps Engineer,,,https://jobs.smartrecruiters.com/OteemoInc/744000114740117-devsecops-engineer?oga=true,serp::https://jobs.smartrecruiters.com/OteemoInc/744000114740117-devsecops-engineer?oga=true,,"DevSecOps Engineer. College Park, MD, College Park, MD, United States ... United States +1. Uruguay +598. US ..."
2026-04-18 12:36:45,serp:jobs.smartrecruiters.com,oteemoinc,"Oteemo, Inc Senior DevSecOps Engineer",,,https://jobs.smartrecruiters.com/OteemoInc/744000111137612-senior-devsecops-engineer,serp::https://jobs.smartrecruiters.com/OteemoInc/744000111137612-senior-devsecops-engineer,,"Senior DevSecOps Engineer. Manassas, VA, Manassas, VA, United States; Full-time. Company Description. Join Oteemo and become part of a transformation powerhouse ..."
2026-04-18 12:36:45,serp:jobs.smartrecruiters.com,cyberark1,CyberArk Senior Security Consultant (DevSecOps),,,https://jobs.smartrecruiters.com/Cyberark1/744000117855657-senior-security-consultant-devsecops-,serp::https://jobs.smartrecruiters.com/Cyberark1/744000117855657-senior-security-consultant-devsecops-,,"DevSecOps will report to Manager, Security Services - DevSecOps. Responsibilities: • Lead on-site and remote implementations and onboarding engagements with ..."
2026-04-18 12:36:45,serp:jobs.smartrecruiters.com,dev2,"Dev Regular/Senior Security Engineer, SecOps",,,https://jobs.smartrecruiters.com/Dev2/743999785102409-regular-senior-security-engineer-secops,serp::https://jobs.smartrecruiters.com/Dev2/743999785102409-regular-senior-security-engineer-secops,,"We are proud to offer a collaborative, diverse, and remote-friendly work environment, as well as competitive salaries and generous equity. ... Senior DevSecOps ..."
