collected_at_utc,source_type,company,title,location,team,url,external_id,posted_at,description_snippet
2026-04-18 12:36:45,serp:jobs.lever.co,espresso,DevOps Engineer,,,https://jobs.lever.co/Espresso/928cd4da-e76d-4d6a-ba58-fba57e6ae81a,serp::https://jobs.lever.co/Espresso/928cd4da-e76d-4d6a-ba58-fba57e6ae81a,,DevOps Engineer. Remote. Engineering – Infrastructure /. Full-time /. Remote. apply for this job. Espresso Systems builds foundational infrastructure to power ...
2026-04-18 12:36:45,serp:jobs.lever.co,panopto,DevOps Engineer,,,https://jobs.lever.co/panopto/4a6efe88-2552-4e99-a5c9-efe9b2517b89,serp::https://jobs.lever.co/panopto/4a6efe88-2552-4e99-a5c9-efe9b2517b89,,"DevOps Engineer. Remote - US. Research & Development – Engineering ... Remote, US: Candidates looking for flexible or remote-friendly positions are ..."
2026-04-18 12:36:45,serp:jobs.lever.co,pointclickcare,Senior AI-Enabled DevOps Engineer,,,https://jobs.lever.co/pointclickcare/53e0c620-e7e9-4e54-90f5-3ff2bff10a35,serp::https://jobs.lever.co/pointclickcare/53e0c620-e7e9-4e54-90f5-3ff2bff10a35,,"For Remote Roles: If this role is remote, there will be in-office events ... As a Senior DevOps Engineer, you will design, build, and operate scalable ..."
2026-04-18 12:36:45,serp:jobs.lever.co,biointellisense,Biointellisense,,,https://jobs.lever.co/biointellisense/0bbdecb1-4bb6-40bb-85e1-7683fb698753,serp::https://jobs.lever.co/biointellisense/0bbdecb1-4bb6-40bb-85e1-7683fb698753,,"DevOps Engineer. United States. Research & Development – Cloud /. Full Time ... We're a remote-first, lean start-up environment and our global BioTeam ..."
2026-04-18 12:36:45,serp:jobs.lever.co,quokka,DevOps Engineer,,,https://jobs.lever.co/quokka/f9ec8f4e-e18f-436a-9da2-875739db2c3e,serp::https://jobs.lever.co/quokka/f9ec8f4e-e18f-436a-9da2-875739db2c3e,,DevOps Engineer. Remote. Research & Development – Engineering /. Full-time /. Remote. apply for this job. Quokka is an enterprise mobile security company ...
2026-04-18 12:36:45,serp:jobs.lever.co,olo,DevOps Engineer,,,https://jobs.lever.co/olo/a6638069-48c8-4db7-9a6a-b5cf2fc49629,serp::https://jobs.lever.co/olo/a6638069-48c8-4db7-9a6a-b5cf2fc49629,,"DevOps Engineer. Belfast, Northern Ireland, Remote. Platform Engineering – Developer Productivity /. Full-Time /. Remote. apply for this job. Olo is a leading ..."
2026-04-18 12:36:45,serp:jobs.lever.co,truv,Senior DevOps Engineer,,,https://jobs.lever.co/truv/4049ad13-7b17-4638-bf5d-2c4079474010,serp::https://jobs.lever.co/truv/4049ad13-7b17-4638-bf5d-2c4079474010,,Senior DevOps Engineer. Miami / New York / San Francisco. Engineering /. Remote /. Remote. apply for this job. About Truv. Truv is transforming the financial ...
2026-04-18 12:36:45,serp:jobs.lever.co,ro,Senior Site Reliability Engineer,,,https://jobs.lever.co/ro/fc823e16-7424-4920-8aef-88fa79ef8223,serp::https://jobs.lever.co/ro/fc823e16-7424-4920-8aef-88fa79ef8223,,"Since 2017, Ro has helped millions of patients in nearly every single county in the United States, including 99% of primary care deserts. ... As a Senior SRE ..."
2026-04-18 12:36:45,serp:jobs.lever.co,cority,Site Reliability Engineer II,,,https://jobs.lever.co/cority/891c123b-7ea4-4598-ad16-56c087fe1520,serp::https://jobs.lever.co/cority/891c123b-7ea4-4598-ad16-56c087fe1520,,Site Reliability Engineer II. United States. Technology & Engineering – Engineering /. Remote. apply for this job.
2026-04-18 12:36:45,serp:jobs.lever.co,spotify,Senior Site Reliability Engineer,,,https://jobs.lever.co/spotify/fdfe281d-889c-478a-8f27-c9bc36b2b0cf,serp::https://jobs.lever.co/spotify/fdfe281d-889c-478a-8f27-c9bc36b2b0cf,,"Senior Site Reliability Engineer. New York, NY. Data and Analytics – Platform /. Permanent /. Remote. apply for this job."
2026-04-18 12:36:45,serp:jobs.lever.co,regrello,Senior Site Reliability Engineer,,,https://jobs.lever.co/regrello/e4222908-c38b-4c4c-9067-9f66d94c0be2,serp::https://jobs.lever.co/regrello/e4222908-c38b-4c4c-9067-9f66d94c0be2,,Senior Site Reliability Engineer. United States (Remote). Engineering /. Full ... SRE@Regrello's customers aren't just internal teams: operating and ...
2026-04-18 12:36:45,serp:jobs.lever.co,certifid,Senior Site Reliability Engineer,,,https://jobs.lever.co/certifid/ea61bb47-69b8-4777-ab3f-65057fe6c5a6,serp::https://jobs.lever.co/certifid/ea61bb47-69b8-4777-ab3f-65057fe6c5a6,,"SRE who enjoys solving complex operational problems, building automation, and mentoring others. ... Remote worker reimbursement of $300/year; Professional ..."
2026-04-18 12:36:45,serp:jobs.lever.co,elementsolutions,Sr. Site Reliability Engineer,,,https://jobs.lever.co/elementsolutions/c0466d39-13f7-440d-bdf1-74afb627c112,serp::https://jobs.lever.co/elementsolutions/c0466d39-13f7-440d-bdf1-74afb627c112,,"The Senior Site Reliability Engineer (SRE) serves as the Technical ... We are a remote-first company based in Washington, DC. Element is an equal ..."
2026-04-18 12:36:45,serp:jobs.lever.co,voleon,Site Reliability Engineer,,,https://jobs.lever.co/voleon/acecdcc4-f076-47d5-9ab9-a58a6e1995cc,serp::https://jobs.lever.co/voleon/acecdcc4-f076-47d5-9ab9-a58a6e1995cc,,"Site Reliability Engineer. Remote, United States / New York City, New York ... As a Site Reliability Engineer (SRE), you will work at the intersection of ..."
2026-04-18 12:36:45,serp:jobs.lever.co,jobgether,Site Reliability Engineer,,,https://jobs.lever.co/jobgether/d62d40f7-1928-4f0c-be68-d7dfaee4e263,serp::https://jobs.lever.co/jobgether/d62d40f7-1928-4f0c-be68-d7dfaee4e263,,We are currently looking for a Site Reliability Engineer in United States. This role sits at the heart of a global cloud enablement and platform engineering ...
2026-04-18 12:36:45,serp:jobs.lever.co,hatchit,Site Reliability Engineer (SRE),,,https://jobs.lever.co/hatchit/38f8edb7-45b1-44a0-9e50-b4c65dd9b944,serp::https://jobs.lever.co/hatchit/38f8edb7-45b1-44a0-9e50-b4c65dd9b944,,Site Reliability Engineer (SRE). Remote. Featured Hatch Accounts – CardioOne /. Full Time /. Remote. apply for this job. hatch I.T. is partnering with CardioOne ...
2026-04-18 12:36:45,serp:jobs.lever.co,ethree,Energy and Environmental Economics,,,https://jobs.lever.co/ethree/2dbdb46d-5009-4749-91c9-59470beb2d4a,serp::https://jobs.lever.co/ethree/2dbdb46d-5009-4749-91c9-59470beb2d4a,,"Cloud Platform Engineer. All E3 Office Locations / Remote / Boston, MA ... United States and/or Canada. Office Location: E3 Office (Boston, Chicago ..."
2026-04-18 12:36:45,serp:jobs.lever.co,pacerpro,Platform Engineer – Cloud Infrastructure & Reliability,,,https://jobs.lever.co/PacerPro/f96cb805-25b2-4811-b9d9-43602c8a6d51/apply,serp::https://jobs.lever.co/PacerPro/f96cb805-25b2-4811-b9d9-43602c8a6d51/apply,,Remote work setting. Are you comfortable working in a remote setting?✱. Yes ... Work authorization. Are you legally authorized to work in the United States?
2026-04-18 12:36:45,serp:jobs.lever.co,pacerpro,Platform Engineer – Cloud Infrastructure & Reliability,,,https://jobs.lever.co/PacerPro/f96cb805-25b2-4811-b9d9-43602c8a6d51,serp::https://jobs.lever.co/PacerPro/f96cb805-25b2-4811-b9d9-43602c8a6d51,,Platform Engineer – Cloud Infrastructure & Reliability. Remote. Engineering /. Full Time /. Remote. apply for this job. About this Job. You'll be joining the ...
2026-04-18 12:36:45,serp:jobs.lever.co,moo,Platform Engineer II,,,https://jobs.lever.co/moo/b53e27bc-5c63-44ee-aa5a-d452973b8a13,serp::https://jobs.lever.co/moo/b53e27bc-5c63-44ee-aa5a-d452973b8a13,,"Platform Engineer II. Cape Town, South Africa. Product ... We also offer flexible work schedules with hybrid and remote working for certain roles."
2026-04-18 12:36:45,serp:jobs.lever.co,blackcloak,Senior Cloud Engineer,,,https://jobs.lever.co/BlackCloak/afab4049-7a6c-4920-85cc-ab4ed46ad454,serp::https://jobs.lever.co/BlackCloak/afab4049-7a6c-4920-85cc-ab4ed46ad454,,Senior Cloud Engineer. United States. Engineering /. Full Time /. Remote. apply for this job. BlackCloak's mission is to protect corporate executives and high ...
2026-04-18 12:36:45,serp:jobs.lever.co,oci,"Object Computing, Inc.",,,https://jobs.lever.co/oci/c69b5353-d759-4209-941b-63c59c99e9a7/apply,serp::https://jobs.lever.co/oci/c69b5353-d759-4209-941b-63c59c99e9a7/apply,,Cloud Engineer. Remote. Cloud Services – Cloud Engineering /. Full ... Do you now or will you in the future require sponsorship to work in the United States?
2026-04-18 12:36:45,serp:jobs.lever.co,innovativesol-2,Innovative Solutions,,,https://jobs.lever.co/innovativesol-2/398b2b92-a60f-43b7-acb4-30717addf359/apply,serp::https://jobs.lever.co/innovativesol-2/398b2b92-a60f-43b7-acb4-30717addf359/apply,,"Cloud Engineer - Full Stack Developer. Reports into Rochester, NY ... Are you legally authorized to work in the United States?✱. Yes; No. Will you ..."
2026-04-18 12:36:45,serp:jobs.lever.co,zencore,Senior Cloud Engineer (Short Term Contract),,,https://jobs.lever.co/zencore/f15d7703-cffa-43a8-94f4-d1fb3f291900,serp::https://jobs.lever.co/zencore/f15d7703-cffa-43a8-94f4-d1fb3f291900,,Senior Cloud Engineer (Short Term Contract). Remote. Engineering – Infrastructure /. Full-Time /. Remote. apply for this job. Zencore is a fast-growing company ...
2026-04-18 12:36:45,serp:jobs.lever.co,h1,Sr. DevOps AWS Cloud Engineer,,,https://jobs.lever.co/h1/73868723-fcc6-4338-896c-3a59b53eb934,serp::https://jobs.lever.co/h1/73868723-fcc6-4338-896c-3a59b53eb934,,"DevOps AWS Cloud Engineer. New York. Technical Excellence – Technical Excellence /. Full time /. Remote. apply for this job. At H1, we believe access to the ..."
2026-04-18 12:36:45,serp:jobs.lever.co,palantir,Forward Deployed Infrastructure Engineer,,,https://jobs.lever.co/palantir/b57f08e9-546c-4b9b-8d21-db0ebbc11363,serp::https://jobs.lever.co/palantir/b57f08e9-546c-4b9b-8d21-db0ebbc11363,,"Forward Deployed Infrastructure Engineer - US Government ... Based on business need, there are a few roles that allow for “Remote” work on an exceptional basis."
2026-04-18 12:36:45,serp:jobs.lever.co,sysdig,Senior Infrastructure Engineer,,,https://jobs.lever.co/sysdig/9c63b209-7dfa-489a-b75b-a033fde72850,serp::https://jobs.lever.co/sysdig/9c63b209-7dfa-489a-b75b-a033fde72850,,"Senior Infrastructure Engineer. Flexible - USA. Engineering – INFRASTRUCTURE /. Regular - Full Time /. Remote. apply for this job. At Sysdig, we believe cloud ..."
2026-04-18 12:36:45,serp:jobs.lever.co,earthspecies,Senior Infrastructure Engineer (Backend/Data Performance),,,https://jobs.lever.co/earthspecies/b40800f0-1765-496f-b477-0cf8fe33e089,serp::https://jobs.lever.co/earthspecies/b40800f0-1765-496f-b477-0cf8fe33e089,,Senior Infrastructure Engineer (Backend/Data Performance). Remote. AI /. Full-time /. Remote. apply for this job. About Earth Species Project. Earth Species ...
2026-04-18 12:36:45,serp:jobs.lever.co,businesswire,Senior Infrastructure Engineer,,,https://jobs.lever.co/businesswire/93ddd3e1-0a1c-4aba-aed2-d5d6ecd579bb,serp::https://jobs.lever.co/businesswire/93ddd3e1-0a1c-4aba-aed2-d5d6ecd579bb,,"Senior Infrastructure Engineer. United States. Information Technology /. Full Time /. Remote. apply for this job. Business Wire, a Berkshire Hathaway company, ..."
2026-04-18 12:36:45,serp:jobs.lever.co,voleon,Senior Linux Infrastructure Engineer,,,https://jobs.lever.co/voleon/73e3e6d4-a2c7-4232-ac17-6ccedd23805d,serp::https://jobs.lever.co/voleon/73e3e6d4-a2c7-4232-ac17-6ccedd23805d,,"Senior Linux Infrastructure Engineer. Remote, United States. IT /. Full-time /. Remote. apply for this job. Voleon is a technology company that applies state-of ..."
2026-04-18 12:36:45,serp:jobs.lever.co,ciandt,"Senior/Lead AWS Cloud Infrastructure Engineer (Remote), México",,,https://jobs.lever.co/ciandt/89d88760-ffba-4e23-b966-42f522204d2b,serp::https://jobs.lever.co/ciandt/89d88760-ffba-4e23-b966-42f522204d2b,,"Senior/Lead AWS Cloud Infrastructure Engineer (Remote), México · Experience in application or infrastructure design, implementation, or consulting. · Experience ..."
2026-04-18 12:36:45,serp:jobs.lever.co,serverfarm,Senior Critical Infrastructure Engineer,,,https://jobs.lever.co/serverfarm/20759625-ff1f-4037-9f61-eefeb0415dbd,serp::https://jobs.lever.co/serverfarm/20759625-ff1f-4037-9f61-eefeb0415dbd,,Senior Critical Infrastructure Engineer. United States. Operations Engineering – Operations Engineering /. Remote. apply for this job. Serverfarm is a leading ...
2026-04-18 12:36:45,serp:jobs.lever.co,jobgether,Infrastructure Engineer,,,https://jobs.lever.co/jobgether/bef8af6a-9b85-4940-841e-8f10d926c799/apply,serp::https://jobs.lever.co/jobgether/bef8af6a-9b85-4940-841e-8f10d926c799/apply,,Infrastructure Engineer - REMOTE. Washington. General – General /. Full-time /. Remote. Submit your application. LinkedIn profile. Loading... Apply with ...
2026-04-18 12:36:45,serp:jobs.lever.co,toptal,Senior Infrastructure Engineer,,,https://jobs.lever.co/toptal/455f29f5-6349-4f4a-8da2-537d8ad9fd1a,serp::https://jobs.lever.co/toptal/455f29f5-6349-4f4a-8da2-537d8ad9fd1a,,"Senior Infrastructure Engineer ... With $200+ million in annual revenue and team members based around the globe, Toptal is the world's largest fully remote ..."
2026-04-18 12:36:45,serp:jobs.lever.co,standtogether,Senior DevSecOps Engineer,,,https://jobs.lever.co/standtogether/2f823c57-af9a-4cb4-999b-c8ca1d99befc,serp::https://jobs.lever.co/standtogether/2f823c57-af9a-4cb4-999b-c8ca1d99befc,,"Senior DevSecOps Engineer. Arlington, VA. Knowledge Systems – Enterprise IT /. Full-time /. Remote. apply for this job. Stand Together is a philanthropic ..."
2026-04-18 12:36:45,serp:jobs.lever.co,vrchat,Lead DevSecOps Engineer,,,https://jobs.lever.co/vrchat/0049381f-cbfa-453a-9d21-ba0324da7b4f,serp::https://jobs.lever.co/vrchat/0049381f-cbfa-453a-9d21-ba0324da7b4f,,"Lead DevSecOps Engineer. Anywhere. Engineering /. Full-Time /. Remote. apply for this job. Join the VRChat Team! VRChat offers a first-of-its-kind, game- ..."
2026-04-18 12:36:45,serp:jobs.lever.co,agile-defense,DevSecOps Engineer,,,https://jobs.lever.co/agile-defense/f5348e9b-eaf8-4b03-b59f-e24c9c4cb5bb,serp::https://jobs.lever.co/agile-defense/f5348e9b-eaf8-4b03-b59f-e24c9c4cb5bb,,Job Title: DevSecOps Engineer. Location: Remote. Clearance Level: Secret Eligible. Reports To: VP of Platform Engineering. Position Summary. We are seeking a ...
2026-04-18 12:36:45,serp:jobs.lever.co,pingwind,DevSecOps Senior Specialist,,,https://jobs.lever.co/pingwind/f457facc-4be7-418e-ab55-e5f01498e506,serp::https://jobs.lever.co/pingwind/f457facc-4be7-418e-ab55-e5f01498e506,,DevSecOps Senior Specialist. Multiple Locations. Upcoming Work – FT. Meade /. Remote. apply for this job. Location: Multiples Locations. Required Clearance: Top ...
2026-04-18 12:36:45,serp:jobs.lever.co,vrchat,Lead DevSecOps Engineer,,,https://jobs.lever.co/vrchat/0049381f-cbfa-453a-9d21-ba0324da7b4f/apply,serp::https://jobs.lever.co/vrchat/0049381f-cbfa-453a-9d21-ba0324da7b4f/apply,,Lead DevSecOps Engineer. Anywhere. Engineering /. Full-Time /. Remote. Submit your application.
2026-04-18 12:36:45,serp:jobs.lever.co,3eco,DevSecOps Engineering Team Lead,,,https://jobs.lever.co/3eco/82cc218d-1c23-4f46-b361-3abc4e561294,serp::https://jobs.lever.co/3eco/82cc218d-1c23-4f46-b361-3abc4e561294,,"DevSecOps Engineering Team Lead. Carlsbad, California. Technology & Engineering /. Full-time /. Remote. apply for this job. About 3E: We are a mission-driven ..."
2026-04-18 12:36:45,serp:jobs.lever.co,highstreetit,Cloud Infrastructure (OCI),,,https://jobs.lever.co/highstreetit/bd02427b-ef7f-4643-93b5-ffe145277849,serp::https://jobs.lever.co/highstreetit/bd02427b-ef7f-4643-93b5-ffe145277849,,Remote. apply for this job. The Senior Consultant – Cloud Infrastructure is responsible for delivering high quality cloud solutions with a primary focus on ...
2026-04-18 12:36:45,serp:jobs.lever.co,fieldnation,Senior Engineer,,,https://jobs.lever.co/fieldnation/4448ecf9-e166-49bc-84d0-ef48fb3baabc,serp::https://jobs.lever.co/fieldnation/4448ecf9-e166-49bc-84d0-ef48fb3baabc,,"The Cloud Platforms team works across Field Nation to build and maintain the cloud infrastructure that engineers rely on to develop, ship, and scale software."
2026-04-18 12:36:45,serp:jobs.lever.co,zencore,"Senior Cloud Engineer, Infrastructure",,,https://jobs.lever.co/zencore/2f59f6de-ac72-46aa-81e4-9c4d2fceded9,serp::https://jobs.lever.co/zencore/2f59f6de-ac72-46aa-81e4-9c4d2fceded9,,"Design, implement, and manage cloud infrastructure in Google Cloud; Migrate ... We are a fully remote company and offer competitive compensation and benefits."
2026-04-18 12:36:45,serp:jobs.lever.co,smart-working-solutions,"Senior DevOps Engineer (Cloud & MongoDB & Terraform), (Remote ...",,,https://jobs.lever.co/smart-working-solutions/dbb27f38-7024-4674-950a-3b99fa93e630,serp::https://jobs.lever.co/smart-working-solutions/dbb27f38-7024-4674-950a-3b99fa93e630,,"Senior DevOps Engineer (Cloud & MongoDB & Terraform), (Remote, Full-Time) [HR154] ... Proven experience designing and operating scalable cloud infrastructure."
2026-04-18 12:36:45,serp:jobs.lever.co,jobgether,Software Engineer,,,https://jobs.lever.co/jobgether/c3d7c7a1-a74b-4c40-844e-fa1aea4f5881,serp::https://jobs.lever.co/jobgether/c3d7c7a1-a74b-4c40-844e-fa1aea4f5881,,"We are currently looking for a Software Engineer - Cloud in the United States ... Design, build, and maintain scalable cloud infrastructure and data systems that ..."
2026-04-18 12:36:45,serp:jobs.lever.co,pointclickcare,Senior Database Reliability Engineer (SQL),,,https://jobs.lever.co/pointclickcare/1a88bdc7-ef46-4c3a-a7c2-db9541a8ed4e,serp::https://jobs.lever.co/pointclickcare/1a88bdc7-ef46-4c3a-a7c2-db9541a8ed4e,,Senior Database Reliability Engineer (SQL). Remote. PointClickCare – SaaS Ops /. Full-Time /. Hybrid. apply for this job. At PointClickCare our mission is ...
2026-04-18 12:36:45,serp:jobs.lever.co,filevine,Senior Database Reliability Engineer,,,https://jobs.lever.co/filevine/6c5e505e-8190-4813-8bf2-d08db49a4c74,serp::https://jobs.lever.co/filevine/6c5e505e-8190-4813-8bf2-d08db49a4c74,,Senior Database Reliability Engineer. United States. Engineering – Reliability /. Full-time /. Remote. apply for this job. Filevine is a Legal AI company ...
2026-04-18 12:36:45,serp:jobs.lever.co,palantir,Site Reliability Engineer,,,https://jobs.lever.co/palantir/211f99dc-269e-4f25-84d3-d73dea782080,serp::https://jobs.lever.co/palantir/211f99dc-269e-4f25-84d3-d73dea782080,,"Site Reliability Engineer - US Government ... Based on business need, there are a few roles that allow for “Remote” work on an exceptional basis."
2026-04-18 12:36:45,serp:boards.greenhouse.io,vannevarlabs,Job Application for DevOps Engineer at Vannevar,,,https://boards.greenhouse.io/vannevarlabs/jobs/5106734007,serp::https://boards.greenhouse.io/vannevarlabs/jobs/5106734007,,100% remote first culture. You can work from anywhere in the US and ... United States military operation for which an Armed Forces service medal was ...
2026-04-18 12:36:45,serp:boards.greenhouse.io,robotsandpencils,Job Application for DevOps Engineer,,,https://boards.greenhouse.io/robotsandpencils/jobs/5188773008,serp::https://boards.greenhouse.io/robotsandpencils/jobs/5188773008,,"DevOps Engineer - L4. Canada - Remote. Apply. At Robots & Pencils, we build meaningful, scalable digital products that solve real business problems. We're ..."
2026-04-18 12:36:45,serp:boards.greenhouse.io,accenturefederalservices,Job Application for DevOps Engineer at Accenture Federal Services,,,https://boards.greenhouse.io/accenturefederalservices/jobs/4672558006?gh_jid=4672558006,serp::https://boards.greenhouse.io/accenturefederalservices/jobs/4672558006?gh_jid=4672558006,,"DevOps Engineer. Arlington, VA. Apply. At Accenture Federal Services ... United States Postal Service, and USAID (see list of exceptions below). NOTE ..."
2026-04-18 12:36:45,serp:boards.greenhouse.io,andurilindustries,Job Application for Senior Site Reliability Engineer at Anduril ...,,,https://boards.greenhouse.io/andurilindustries/jobs/5055674007?gh_jid=5055674007,serp::https://boards.greenhouse.io/andurilindustries/jobs/5055674007?gh_jid=5055674007,,"Senior Site Reliability Engineer. Costa Mesa, California, United States. Apply. Anduril Industries is a defense technology ..."
2026-04-18 12:36:45,serp:boards.greenhouse.io,spacex,Site Reliability Engineer (Application Software),,,https://boards.greenhouse.io/spacex/jobs/8505386002?utm_source=Thrive+Capital+job+board&utm_medium=getro.com&gh_src=Thrive+Capital+job+board,serp::https://boards.greenhouse.io/spacex/jobs/8505386002?utm_source=Thrive+Capital+job+board&utm_medium=getro.com&gh_src=Thrive+Capital+job+board,,We are looking for a Site Reliability Engineer who brings a strong SRE ... United States military operation for which an Armed Forces service medal was ...
2026-04-18 12:36:45,serp:boards.greenhouse.io,cookunity,Senior Site Reliability Engineer,,,https://boards.greenhouse.io/cookunity/jobs/7589959003,serp::https://boards.greenhouse.io/cookunity/jobs/7589959003,,"Senior Site Reliability Engineer - B2B. Engineering. Argentina (Remote). About CookUnity: Food has lost its soul to modern convenience. And with it, it has ..."
2026-04-18 12:36:45,serp:boards.greenhouse.io,andurilindustries,"Job Application for Site Reliability Engineer, Discovery at Anduril ...",,,https://boards.greenhouse.io/andurilindustries/jobs/5102673007,serp::https://boards.greenhouse.io/andurilindustries/jobs/5102673007,,"Site Reliability Engineer, Discovery. Washington, District of Columbia ... United States military operation for which an Armed Forces service medal was ..."
2026-04-18 12:36:45,serp:boards.greenhouse.io,cloudbedsthirdpartyboard,Senior Site Reliability Engineer,,,https://boards.greenhouse.io/cloudbedsthirdpartyboard/jobs/4684413005,serp::https://boards.greenhouse.io/cloudbedsthirdpartyboard/jobs/4684413005,,Senior Site Reliability Engineer · 5+ years of experience as a DevOps or SRE working within the AWS ecosystem. · 5+ years of experience with Kubernetes (EKS) and ...
2026-04-18 12:36:45,serp:boards.greenhouse.io,andurilindustries,Tactical Reconnaissance & Strike,,,https://boards.greenhouse.io/andurilindustries/jobs/5104871007?gh_jid=5104871007,serp::https://boards.greenhouse.io/andurilindustries/jobs/5104871007?gh_jid=5104871007,,Site Reliability Engineer - Tactical Reconnaissance & Strike. Atlanta ... United States military operation for which an Armed Forces service medal was ...
2026-04-18 12:36:45,serp:boards.greenhouse.io,sezzle,Job Application for Site Reliability Engineer II at Sezzle,,,https://boards.greenhouse.io/sezzle/jobs/7692842003,serp::https://boards.greenhouse.io/sezzle/jobs/7692842003,,"Site Reliability Engineer II. Türkiye, Remote. Apply. The salary range for this role is $3,000 - $6,000 ..."
2026-04-18 12:36:45,serp:boards.greenhouse.io,spacex,"Member of Technical Staff, Platform Engineer (Starshied)",,,https://boards.greenhouse.io/spacex/jobs/8501505002,serp::https://boards.greenhouse.io/spacex/jobs/8501505002,,"Member of Technical Staff, Platform Engineer (Starshied). Palo Alto, CA ... United States military operation for which an Armed Forces service medal was ..."
2026-04-18 12:36:45,serp:boards.greenhouse.io,defenseunicorns,Job Application for Platform Engineer,,,https://boards.greenhouse.io/defenseunicorns/jobs/5049314007,serp::https://boards.greenhouse.io/defenseunicorns/jobs/5049314007,,"Platform Engineer - IaC. Remote, United States. Apply. EMPLOYER IS A CONTRACTOR FOR THE U.S. GOVERNMENT. THIS POSITION WILL REQUIRE U.S. CITIZENSHIP. Role ..."
2026-04-18 12:36:45,serp:boards.greenhouse.io,bluerivertech,Blue River Technology,,,https://boards.greenhouse.io/bluerivertech/jobs/7739711,serp::https://boards.greenhouse.io/bluerivertech/jobs/7739711,,"Sr Platform Engineer, CVML. Department: PlatformLocation: Remote-US. Apply Now ... Work Location: Remote in the United States; Visa sponsorship will be ..."
2026-04-18 12:36:45,serp:boards.greenhouse.io,kivaorg,Job Application for Fullstack Platform Engineer at Kiva.org,,,https://boards.greenhouse.io/kivaorg/jobs/7782356?gh_jid=7782356,serp::https://boards.greenhouse.io/kivaorg/jobs/7782356?gh_jid=7782356,,"Fullstack Platform Engineer. Bogota, Colombia. Apply. About ... At this time, we can only consider applicants with authorization to work in the United States ..."
2026-04-18 12:36:45,serp:boards.greenhouse.io,andurilindustries,Factory Systems and Operational Technology,,,https://boards.greenhouse.io/andurilindustries/jobs/5087348007?gh_jid=5087348007,serp::https://boards.greenhouse.io/andurilindustries/jobs/5087348007?gh_jid=5087348007,,"Cloud Engineer – Factory Systems and Operational Technology. Costa Mesa ... If you are a United States citizen or national, please answer with ""N/A"". It ..."
2026-04-18 12:36:45,serp:boards.greenhouse.io,accenturefederalservices,Job Application for Cloud Engineer at Accenture Federal Services,,,https://boards.greenhouse.io/accenturefederalservices/jobs/4673971006?gh_jid=4673971006,serp::https://boards.greenhouse.io/accenturefederalservices/jobs/4673971006?gh_jid=4673971006,,"Cloud Engineer. Arlington, VA. Apply. At Accenture Federal Services ... United States Postal Service, and USAID (see list of exceptions below). NOTE ..."
2026-04-18 12:36:45,serp:boards.greenhouse.io,smxtech,Careers,,,https://boards.greenhouse.io/smxtech/jobs/7575839003,serp::https://boards.greenhouse.io/smxtech/jobs/7575839003,,"... United States Air Force. Responsible for cloud design, development ... This role is remote supporting a Quantico, VA customer. Local candidates ..."
