collected_at_utc,source_type,company,title,location,team,url,external_id,posted_at,description_snippet
2026-04-24 12:56:53,serp:boards.greenhouse.io,gameplantech,Job Application for Cloud Infrastructure Engineer at Game Plan Tech,,,https://boards.greenhouse.io/gameplantech/jobs/4056534009,serp::https://boards.greenhouse.io/gameplantech/jobs/4056534009,,Cloud Infrastructure Engineer. United States Remote. Apply. Cloud Infrastructure Engineer. Role Overview. We're seeking an experienced Cloud Infrastructure ...
2026-04-24 12:56:53,serp:boards.greenhouse.io,nexgencloud,Job Application for Lead Infrastructure Engineer at NexGen Cloud,,,https://boards.greenhouse.io/nexgencloud/jobs/4839505101,serp::https://boards.greenhouse.io/nexgencloud/jobs/4839505101,,Lead Infrastructure Engineer (OpenStack). Location: UK (Remote). Department: Infrastructure. Reporting to: Head of Infrastructure ...
2026-04-24 12:56:53,serp:boards.greenhouse.io,nexgencloud,Job Application for Senior Infrastructure Engineer at NexGen Cloud,,,https://boards.greenhouse.io/nexgencloud/jobs/4837797101,serp::https://boards.greenhouse.io/nexgencloud/jobs/4837797101,,Senior Infrastructure Engineer (OpenStack). Location: UK (Remote). Department: Infrastructure. Reporting to: Head of Infrastructure ...
2026-04-24 12:56:53,serp:boards.greenhouse.io,point72,"Machine Learning Infrastructure Engineer, GenAI Technology",,,https://boards.greenhouse.io/point72/jobs/8472280002?gh_jid=8472280002,serp::https://boards.greenhouse.io/point72/jobs/8472280002?gh_jid=8472280002,,"Machine Learning Infrastructure Engineer, GenAI Technology. United States. Apply. A Career with Point72's Technology Team. As Point72 reimagines the future of ..."
2026-04-24 12:56:53,serp:boards.greenhouse.io,iterable,Job Application for Senior Infrastructure Engineer at Iterable,,,https://boards.greenhouse.io/iterable/jobs/7829203,serp::https://boards.greenhouse.io/iterable/jobs/7829203,,Senior Infrastructure Engineer. REMOTE - US. Apply. Iterable is the leading AI-powered customer engagement platform ...
2026-04-24 12:56:53,serp:boards.greenhouse.io,gitlab,Job Application for Customer Success Engineer at GitLab,,,https://boards.greenhouse.io/gitlab/jobs/8498481002,serp::https://boards.greenhouse.io/gitlab/jobs/8498481002,,Customer Success Engineer. Remote. Apply. GitLab is the intelligent orchestration platform for DevSecOps. GitLab enables organizations ...
2026-04-24 12:56:53,serp:boards.greenhouse.io,defcon,Senior DevSecOps / Platform Security Engineer (AWS ...,,,https://boards.greenhouse.io/defcon/jobs/5049058007,serp::https://boards.greenhouse.io/defcon/jobs/5049058007,,"Senior DevSecOps / Platform Security Engineer (AWS + Kubernetes) ... A fully remote, results-based environment ... United States military operation for which an ..."
2026-04-24 12:56:53,serp:boards.greenhouse.io,mks2technologies,Software Engineer,,,https://boards.greenhouse.io/mks2technologies/jobs/5678405004,serp::https://boards.greenhouse.io/mks2technologies/jobs/5678405004,,"Aurora, Colorado, United States. MKS2 Technologies, LLC, an award-winning high ... Modern DevSecOps and CI/CD methodologies for secure software deployment."
2026-04-24 12:56:53,serp:boards.greenhouse.io,cobaltio,Field Chief Information Security Officer,,,https://boards.greenhouse.io/cobaltio/jobs/8516941002,serp::https://boards.greenhouse.io/cobaltio/jobs/8516941002,,Advise enterprise customers on integrating Cobalt's findings into their security program and DevSecOps workflows. Partner with Sales Enablement to train our go ...
2026-04-24 12:56:53,serp:boards.greenhouse.io,andurilindustries,"Job Application for Cloud Infrastructure Engineer, Security at Anduril ...",,,https://boards.greenhouse.io/andurilindustries/jobs/5040112007,serp::https://boards.greenhouse.io/andurilindustries/jobs/5040112007,,"Cloud Infrastructure Engineer, Security. Costa Mesa, California, United States. Apply. Anduril Industries is a defense technology company with a mission to ..."
2026-04-24 12:56:53,serp:boards.greenhouse.io,remotewoman,Job Application for Cloud Support Engineer at Remote Woman,,,https://boards.greenhouse.io/remotewoman/jobs/8520511002,serp::https://boards.greenhouse.io/remotewoman/jobs/8520511002,,"Upsunners are a remote, global workforce, and we thrive in a multicultural team. ... Cloud infrastructure familiarity: You've worked in or supported distributed ..."
2026-04-24 12:56:53,serp:boards.greenhouse.io,aerospike,Job Application for Support Engineer at Aerospike,,,https://boards.greenhouse.io/aerospike/jobs/8515879002,serp::https://boards.greenhouse.io/aerospike/jobs/8515879002,,"\Support Engineer. Location: Remote, USA. We are seeking an experienced ... Familiarity with hybrid and cloud infrastructure (AWS preferred). Excellent ..."
2026-04-24 12:56:53,serp:boards.greenhouse.io,andurilindustries,Job Application for Senior Site Reliability Engineer at Anduril ...,,,https://boards.greenhouse.io/andurilindustries/jobs/5055678007?gh_jid=5055678007,serp::https://boards.greenhouse.io/andurilindustries/jobs/5055678007?gh_jid=5055678007,,"Senior Site Reliability Engineer. Seattle, Washington, United States ... United States military operation for which an Armed Forces service medal was ..."
2026-04-24 12:56:53,serp:boards.greenhouse.io,corelight,Lead Cloud Infrastructure Engineer / Site Reliability Engineer (SRE),,,https://boards.greenhouse.io/corelight/jobs/7843517?gh_jid=7843517,serp::https://boards.greenhouse.io/corelight/jobs/7843517?gh_jid=7843517,,Lead Cloud Infrastructure Engineer / Site Reliability Engineer (SRE)** ... Residence within the contiguous United States. Willingness to undergo a ...
2026-04-24 12:56:53,serp:boards.greenhouse.io,waymo,"Software Reliability Engineer, Simulation",,,https://boards.greenhouse.io/waymo/jobs/7430578,serp::https://boards.greenhouse.io/waymo/jobs/7430578,,"png. Software Reliability Engineer, Simulation. Mountain View, California, United States Full-Time Software Engineering 4122. Apply now ... remote, the specific ..."
2026-04-24 12:56:53,serp:boards.greenhouse.io,sezzle,Job Application for Site Reliability Engineer II at Sezzle,,,https://boards.greenhouse.io/sezzle/jobs/7692842003,serp::https://boards.greenhouse.io/sezzle/jobs/7692842003,,"Site Reliability Engineer II. Türkiye, Remote. Apply. The salary range for this role is $3,000 - $6,000 ..."
2026-04-24 12:56:53,serp:boards.greenhouse.io,andurilindustries,"Senior Reliability Engineer, Missiles",,,https://boards.greenhouse.io/andurilindustries/jobs/5022515007?gh_jid=5022515007&gh_src=d29cd2417us,serp::https://boards.greenhouse.io/andurilindustries/jobs/5022515007?gh_jid=5022515007&gh_src=d29cd2417us,,"Senior Reliability Engineer, Missiles. Costa Mesa, California, United ... United States military operation for which an Armed Forces service medal was ..."
2026-04-24 12:56:53,serp:job-boards.greenhouse.io,formativgroup,Job Application for DevOps Engineer,,,https://job-boards.greenhouse.io/formativgroup/jobs/4204399009,serp::https://job-boards.greenhouse.io/formativgroup/jobs/4204399009,,"DevOps Engineer - Remote. Remote/ United States - Full-Time. Apply. Summary. The role of the DevOps Engineer is to design, implement, and maintain secure ..."
2026-04-24 12:56:53,serp:job-boards.greenhouse.io,vannevarlabs,Job Application for DevOps Engineer at Vannevar,,,http://job-boards.greenhouse.io/vannevarlabs/jobs/5106734007,serp::http://job-boards.greenhouse.io/vannevarlabs/jobs/5106734007,,100% remote first culture. You can work from anywhere in the US and ... United States military operation for which an Armed Forces service medal was ...
2026-04-24 12:56:53,serp:job-boards.greenhouse.io,postscript,Job Application for Senior DevOps Engineer at Postscript,,,http://job-boards.greenhouse.io/postscript/jobs/8502683002,serp::http://job-boards.greenhouse.io/postscript/jobs/8502683002,,This is a fully remote position that can be based in the US or Canada. ... United States military operation for which an Armed Forces service medal was ...
2026-04-24 12:56:53,serp:job-boards.greenhouse.io,gongio,Job Application for DevOps Engineer at Gong.io,,,http://job-boards.greenhouse.io/gongio/jobs/4668017006,serp::http://job-boards.greenhouse.io/gongio/jobs/4668017006,,DevOps Engineer. New York City. Apply. Gong harnesses the power of AI to ... Work from home stipend to help you succeed in a remote environment. The ...
2026-04-24 12:56:53,serp:job-boards.greenhouse.io,oddball,Job Application for DevOps Engineer at Oddball,,,http://job-boards.greenhouse.io/oddball/jobs/7686827003,serp::http://job-boards.greenhouse.io/oddball/jobs/7686827003,,Fully remote; Annual stipend; Comprehensive Benefits Package; Company Match 401 ... United States military operation for which an Armed Forces service ...
2026-04-24 12:56:53,serp:job-boards.greenhouse.io,duettoresearch,Job Application for Senior DevOps Engineer at Duetto Research,,,http://job-boards.greenhouse.io/duettoresearch/jobs/7811208,serp::http://job-boards.greenhouse.io/duettoresearch/jobs/7811208,,Senior DevOps Engineer. United States. Apply. Thousands of hotels ... Location: United States. Work model: Remote. Reports to: Senior DevOps Manager.
2026-04-24 12:56:53,serp:job-boards.greenhouse.io,trellahealth,Job Application for DevOps Engineer at Trella Health,,,http://job-boards.greenhouse.io/trellahealth/jobs/5969817004,serp::http://job-boards.greenhouse.io/trellahealth/jobs/5969817004,,"DevOps Engineer. Remote - Atlanta. Apply. At Trella Health, we are passionate and committed to ..."
2026-04-24 12:56:53,serp:job-boards.greenhouse.io,mithril,Job Application for Site Reliability Engineer (SRE) at Mithril,,,http://job-boards.greenhouse.io/mithril/jobs/5117694007,serp::http://job-boards.greenhouse.io/mithril/jobs/5117694007,,Site Reliability Engineer (SRE). Palo Alto / San Francisco Bay Area. Apply ... United States military operation for which an Armed Forces service medal ...
2026-04-24 12:56:53,serp:job-boards.greenhouse.io,weedmaps77,Job Application for Site Reliability Engineer (Remote) at Weedmaps,,,http://job-boards.greenhouse.io/weedmaps77/jobs/8488088002,serp::http://job-boards.greenhouse.io/weedmaps77/jobs/8488088002,,"Site Reliability Engineer (Remote). Austin, TX. Apply Here. Site Reliability ... United States military operation for which an Armed Forces service medal ..."
2026-04-24 12:56:53,serp:job-boards.greenhouse.io,clickhouse,Senior Site Reliability Engineer- Remote,,,http://job-boards.greenhouse.io/clickhouse/jobs/5819755004,serp::http://job-boards.greenhouse.io/clickhouse/jobs/5819755004,,"Senior Site Reliability Engineer- Remote · For roles based in the United States, · If you have any questions or comments about compensation as a candidate, please ..."
2026-04-24 12:56:53,serp:job-boards.greenhouse.io,centralreach,"Sr. Site Reliability Engineer, Security",,,http://job-boards.greenhouse.io/centralreach/jobs/4181882009,serp::http://job-boards.greenhouse.io/centralreach/jobs/4181882009,,"SRE, you will work closely with the key stakeholders in Software Engineering ... However, we will consider remote candidates located in other U.S. states for the ..."
2026-04-24 12:56:53,serp:job-boards.greenhouse.io,ujet,Job Application for Senior Site Reliability Engineer at UJET,,,http://job-boards.greenhouse.io/ujet/jobs/4683653005,serp::http://job-boards.greenhouse.io/ujet/jobs/4683653005,,We're looking for a Senior Site Reliability Engineer to help build and scale a high-impact SRE function. ... UJET is a remote-first company. What would be ...
2026-04-24 12:56:53,serp:job-boards.greenhouse.io,zora,Job Application for Sr. Site Reliability Engineer (SRE) at Zora,,,http://job-boards.greenhouse.io/zora/jobs/5811801004,serp::http://job-boards.greenhouse.io/zora/jobs/5811801004,,Site Reliability Engineer (SRE). Remote. Apply. About Us: Zora is a new kind of ... Remote-First Culture: Work from anywhere in the world! Competitive ...
2026-04-24 12:56:53,serp:job-boards.greenhouse.io,appomni,Job Application for Senior Site Reliability Engineer at AppOmni,,,https://job-boards.greenhouse.io/appomni/jobs/5804376004,serp::https://job-boards.greenhouse.io/appomni/jobs/5804376004,,"Senior Site Reliability Engineer. Remote - USA. Apply. About AppOmni ... As the Senior Site Reliability Engineer (SRE), you will ensure our systems ..."
2026-04-24 12:56:53,serp:job-boards.greenhouse.io,perfectserve,Senior Platform Engineer,,,http://job-boards.greenhouse.io/perfectserve/jobs/5868778004,serp::http://job-boards.greenhouse.io/perfectserve/jobs/5868778004,,Senior Platform Engineer - US Remote. Remote. Apply. What is PerfectServe ... United States military operation for which an Armed Forces service medal was ...
2026-04-24 12:56:53,serp:job-boards.greenhouse.io,jungroup,Job Application for Platform Engineer (Remote / Contract) at Verve ...,,,http://job-boards.greenhouse.io/jungroup/jobs/8455454002,serp::http://job-boards.greenhouse.io/jungroup/jobs/8455454002,,"Platform Engineer (Remote / Contract). New York, NY. Apply. Verve For ... United States military operation for which an Armed Forces service medal was ..."
2026-04-24 12:56:53,serp:job-boards.greenhouse.io,204951305985924,Job Application for Platform Engineer at Stitch Fix Annex,,,http://job-boards.greenhouse.io/204951305985924/jobs/7808248,serp::http://job-boards.greenhouse.io/204951305985924/jobs/7808248,,"Platform Engineer. Remote, USA. Apply. About Stitch Fix, Inc. Stitch Fix ... As a Platform Engineer, you will contribute to building and improving Stitch ..."
2026-04-24 12:56:53,serp:job-boards.greenhouse.io,gatherai,Job Application for Platform Engineer at Gather AI,,,http://job-boards.greenhouse.io/gatherai/jobs/5066436007,serp::http://job-boards.greenhouse.io/gatherai/jobs/5066436007,,"Platform Engineer. Open to Remote (USA); Pittsburgh, PA. Apply. About Us ... United States military operation for which an Armed Forces service medal was ..."
2026-04-24 12:56:53,serp:job-boards.greenhouse.io,clara,Job Application for Senior Platform Engineer,,,http://job-boards.greenhouse.io/clara/jobs/5082649007,serp::http://job-boards.greenhouse.io/clara/jobs/5082649007,,"Senior Platform Engineer - Remote · Design and maintain a developer portal (Backstage.io or similar) as the central hub for resource management · Design, ..."
2026-04-24 12:56:53,serp:job-boards.greenhouse.io,figma,Job Application for Data Platform Engineer at Figma,,,http://job-boards.greenhouse.io/figma/jobs/5840332004?gh_jid=5840332004,serp::http://job-boards.greenhouse.io/figma/jobs/5840332004?gh_jid=5840332004,,"Data Platform Engineer. San Francisco, CA • New York, NY • United ... United States military operation for which an Armed Forces service medal was ..."
2026-04-24 12:56:53,serp:job-boards.greenhouse.io,dvtrading,Job Application for Senior Cloud Engineer (Remote) at DV Trading,,,http://job-boards.greenhouse.io/dvtrading/jobs/4687488005,serp::http://job-boards.greenhouse.io/dvtrading/jobs/4687488005,,Senior Cloud Engineer (Remote). Remote. Apply Now. About Us: Founded 20 years ... United States military operation for which an Armed Forces service medal ...
2026-04-24 12:56:53,serp:job-boards.greenhouse.io,americaninstitutesforresearch,Job Application for Senior Cloud Engineer I at ...,,,http://job-boards.greenhouse.io/americaninstitutesforresearch/jobs/5147920008,serp::http://job-boards.greenhouse.io/americaninstitutesforresearch/jobs/5147920008,,Senior Cloud Engineer I. US-Remote | US-VA-Arlington | US-NC-Chapel Hill | US ... United States and globally. We generate evidence and apply data-driven ...
2026-04-24 12:56:53,serp:job-boards.greenhouse.io,bamboohr17,Job Application for Cloud Engineer at BambooHR,,,http://job-boards.greenhouse.io/bamboohr17/jobs/5746608004,serp::http://job-boards.greenhouse.io/bamboohr17/jobs/5746608004,,"Cloud Engineer. Utah | Remote. Apply. Please Note: This is a remote position available in the state listed on this job. Additionally, employment with BambooHR ..."
2026-04-24 12:56:53,serp:job-boards.greenhouse.io,clickhouse,Job Application for Senior Cloud Engineer at ClickHouse,,,http://job-boards.greenhouse.io/clickhouse/jobs/5733571004,serp::http://job-boards.greenhouse.io/clickhouse/jobs/5733571004,,"Senior Cloud Engineer. United States (remote). Apply. About ClickHouse. Recognized on the 2025 Forbes Cloud 100 list, ClickHouse is one of the most innovative ..."
2026-04-24 12:56:53,serp:job-boards.greenhouse.io,hiddenlayer,Full Stack Cloud Engineer (AI Security Platform),,,http://job-boards.greenhouse.io/hiddenlayer/jobs/5100067007,serp::http://job-boards.greenhouse.io/hiddenlayer/jobs/5100067007,,Full Stack Cloud Engineer (AI Security Platform). Remote [within the US]- strong preference for Eastern Time Zone hours. ABOUT THE ROLE:.
2026-04-24 12:56:53,serp:job-boards.greenhouse.io,filescom,Job Application for Infrastructure Engineer (Remote) at Files.com,,,https://job-boards.greenhouse.io/filescom/jobs/4415773005,serp::https://job-boards.greenhouse.io/filescom/jobs/4415773005,,Infrastructure Engineer (Remote). Remote. Apply. Location: Remote (USA Only) ... United States military operation for which an Armed Forces service ...
2026-04-24 12:56:53,serp:job-boards.greenhouse.io,cresta,Job Application for Infrastructure Engineer/SRE at Cresta,,,http://job-boards.greenhouse.io/cresta/jobs/5113850008,serp::http://job-boards.greenhouse.io/cresta/jobs/5113850008,,Infrastructure Engineer/SRE. Taiwan (Remote). Apply. Cresta is on a mission to ... Work from home office stipend to help you succeed in a remote environment.
2026-04-24 12:56:53,serp:job-boards.greenhouse.io,defcon,Job Application for Cloud Infrastructure Engineer at DEFCON AI,,,http://job-boards.greenhouse.io/defcon/jobs/5091753007,serp::http://job-boards.greenhouse.io/defcon/jobs/5091753007,,"Cloud Infrastructure Engineer · A fully remote, results-based environment · Competitive salary, bonus, and equity package · 100% employer paid, ..."
2026-04-24 12:56:53,serp:job-boards.greenhouse.io,manifest,Job Application for Senior Infrastructure Engineer at Manifest Cyber ...,,,http://job-boards.greenhouse.io/manifest/jobs/4180759009,serp::http://job-boards.greenhouse.io/manifest/jobs/4180759009,,Senior Infrastructure Engineer · Help organizations gain visibility into their software supply chain and improve security · Fully remote (with potential for ...
2026-04-24 12:56:53,serp:job-boards.greenhouse.io,nexgencloud,Job Application for Lead Infrastructure Engineer at NexGen Cloud,,,https://job-boards.greenhouse.io/nexgencloud/jobs/4839505101,serp::https://job-boards.greenhouse.io/nexgencloud/jobs/4839505101,,Lead Infrastructure Engineer (OpenStack). Location: UK (Remote). Department: Infrastructure. Reporting to: Head of Infrastructure ...
2026-04-24 12:56:53,serp:job-boards.greenhouse.io,flex,Job Application for Senior Infrastructure Engineer at Flex,,,http://job-boards.greenhouse.io/flex/jobs/4666310005,serp::http://job-boards.greenhouse.io/flex/jobs/4666310005,,This remote role requires a minimum of 5 years of cloud infrastructure experience. ... Are you authorized to work in the United States?*. Select... Will you ...
2026-04-24 12:56:53,serp:job-boards.greenhouse.io,cloverhealth,Job Application for Cloud Infrastructure Engineer at Clover Health,,,http://job-boards.greenhouse.io/cloverhealth/jobs/7401436?gh_jid=7401436,serp::http://job-boards.greenhouse.io/cloverhealth/jobs/7401436?gh_jid=7401436,,Cloud Infrastructure Engineer. Remote - USA. Apply. We value diversity — in backgrounds and in experiences.
2026-04-24 12:56:53,serp:job-boards.greenhouse.io,raft,Job Application for Infrastructure Engineer,,,https://job-boards.greenhouse.io/raft/jobs/5978149004,serp::https://job-boards.greenhouse.io/raft/jobs/5978149004,,As a Infrastructure Engineer - Systems you will provide the United States Space Force (USSF) Systems Engineering and Technical Assistance (SETA) for the ...
2026-04-24 12:56:53,serp:job-boards.greenhouse.io,roadie,Job Application for DevSecOps Engineer at Roadie,,,http://job-boards.greenhouse.io/roadie/jobs/8518953002,serp::http://job-boards.greenhouse.io/roadie/jobs/8518953002,,"DevSecOps Engineer. REMOTE. Apply. Roadie, a UPS company, is a leading ... Are you a veteran or active member of the United States Armed Forces? Select ..."
2026-04-24 12:56:53,serp:job-boards.greenhouse.io,rackner,Kubernetes / DevSecOps (Federal Platform) at Rackner,,,https://job-boards.greenhouse.io/rackner/jobs/4687536005,serp::https://job-boards.greenhouse.io/rackner/jobs/4687536005,,"Senior Technical Account Manager — Kubernetes / DevSecOps (Federal Platform). Location: Remote (U.S.) | Washington, DC Metro Area preferred"
2026-04-24 12:56:53,serp:job-boards.greenhouse.io,c5miinsightllc,Job Application for DevSecOps Engineer at C5MI Insight,,,http://job-boards.greenhouse.io/c5miinsightllc/jobs/4214561009,serp::http://job-boards.greenhouse.io/c5miinsightllc/jobs/4214561009,,DevSecOps Engineer. United States - Remote. Apply Now. C5MI is not your typical consulting firm. We are a high-performance team of SAP and supply chain experts ...
2026-04-24 12:56:53,serp:job-boards.greenhouse.io,mrbeastyoutube,Job Application for Senior DevSecOps Engineer at MrBeast,,,http://job-boards.greenhouse.io/mrbeastyoutube/jobs/5809670004,serp::http://job-boards.greenhouse.io/mrbeastyoutube/jobs/5809670004,,"Location: (On-site / Hybrid / Remote – NY, Bay Area, Chicago, Greenville) ... Are you legally authorized to work in the United States?*. Select... Will you ..."
2026-04-24 12:56:53,serp:job-boards.greenhouse.io,oddball,Job Application for DevSecOps Engineer at Oddball,,,http://job-boards.greenhouse.io/oddball/jobs/7694308003,serp::http://job-boards.greenhouse.io/oddball/jobs/7694308003,,DevSecOps Engineer. Remote. Apply. Oddball believes that the best products are built when companies understand and ...
2026-04-24 12:56:53,serp:job-boards.greenhouse.io,alpaca,Job Application for DevSecOps Engineer at Alpaca,,,http://job-boards.greenhouse.io/alpaca/jobs/5840799004,serp::http://job-boards.greenhouse.io/alpaca/jobs/5840799004,,The Security Team is 100% distributed and remote. Things You Get To Do: The core responsibilities of the DevSecOps Engineer role are focused on embedding ...
2026-04-24 12:56:53,serp:job-boards.greenhouse.io,rackner,Job Application for DevSecOps (Kubernetes) SME at Rackner,,,http://job-boards.greenhouse.io/rackner/jobs/4340012005,serp::http://job-boards.greenhouse.io/rackner/jobs/4340012005,,DevSecOps (Kubernetes) SME. Remote (United States). Apply. Title: DevSecOps (Kubernetes) Engineer SME Clearance: US Citizen (Secret Eligible) Location: Remote.
2026-04-24 12:56:53,serp:job-boards.greenhouse.io,echodynecorp,Sr. DevSecOps Software Engineer,,,http://job-boards.greenhouse.io/echodynecorp/jobs/4671900006,serp::http://job-boards.greenhouse.io/echodynecorp/jobs/4671900006,,"DevSecOps Software Engineer. Kirkland, WA. Apply. Radar Reinvented ... United States military operation for which an Armed Forces service medal was ..."
2026-04-24 12:56:53,serp:job-boards.greenhouse.io,theweathercompany,Job Application for SkillBridge,,,http://job-boards.greenhouse.io/theweathercompany/jobs/5050445007,serp::http://job-boards.greenhouse.io/theweathercompany/jobs/5050445007,,"SkillBridge - DevSecOps Engineer. USA Remote. Apply. About The Weather Company ... The DevSecOps Engineer will play a key role, working with the core ..."
2026-04-24 12:56:53,serp:job-boards.greenhouse.io,dbtlabsinc,"Senior Financial Analyst, Cloud Infrastructure",,,http://job-boards.greenhouse.io/dbtlabsinc/jobs/4667712005,serp::http://job-boards.greenhouse.io/dbtlabsinc/jobs/4667712005,,"Worked asynchronously as part of a fully-remote, distributed team ... For employees outside the United States, dbt Labs offers a competitive benefits package."
2026-04-24 12:56:53,serp:job-boards.greenhouse.io,qualifiedhealth,Job Application for Cloud / Infrastructure Engineer at Qualified Health,,,http://job-boards.greenhouse.io/qualifiedhealth/jobs/5163860008,serp::http://job-boards.greenhouse.io/qualifiedhealth/jobs/5163860008,,Cloud / Infrastructure Engineer. Remote - US. Apply. Transform healthcare ... United States military operation for which an Armed Forces service medal was ...
2026-04-24 12:56:53,serp:job-boards.greenhouse.io,gameplantech,Job Application for Cloud Infrastructure Engineer at Game Plan Tech,,,http://job-boards.greenhouse.io/gameplantech/jobs/4056534009,serp::http://job-boards.greenhouse.io/gameplantech/jobs/4056534009,,Cloud Infrastructure Engineer. United States Remote. Apply. Cloud Infrastructure Engineer. Role Overview. We're seeking an experienced Cloud Infrastructure ...
2026-04-24 12:56:53,serp:job-boards.greenhouse.io,nexgencloud,Job Application for Senior Infrastructure Engineer at NexGen Cloud,,,http://job-boards.greenhouse.io/nexgencloud/jobs/4837797101,serp::http://job-boards.greenhouse.io/nexgencloud/jobs/4837797101,,"We're a tight-knit, fast-moving team working at the cutting edge of AI cloud infrastructure. ... Flexible working arrangements (remote or hybrid, depending on ..."
2026-04-24 12:56:53,serp:job-boards.greenhouse.io,clickhouse,Senior Site Reliability Engineer,,,http://job-boards.greenhouse.io/clickhouse/jobs/5819754004,serp::http://job-boards.greenhouse.io/clickhouse/jobs/5819754004,,"Senior Site Reliability Engineer- Remote. United States(remote). Apply. About ClickHouse. Recognized on the 2025 Forbes Cloud 100 list, ClickHouse is one of the ..."
2026-04-24 12:56:53,serp:job-boards.greenhouse.io,engine,Job Application for Senior Supply Reliability Engineer at Engine,,,http://job-boards.greenhouse.io/engine/jobs/7690579003,serp::http://job-boards.greenhouse.io/engine/jobs/7690579003,,"Senior Supply Reliability Engineer ... Whether you are in one of our amazing offices or fully remote, we'll make sure you have what you need to succeed."
