collected_at_utc,source_type,company,title,location,team,url,external_id,posted_at,description_snippet
2026-04-18 12:36:45,serp:jobs.ashbyhq.com,bespokelabs,DevOps Engineer (Contract) — US @ Bespoke Labs,,,https://jobs.ashbyhq.com/bespokelabs/04583868-1035-4fca-a0d2-72266f59c49b,serp::https://jobs.ashbyhq.com/bespokelabs/04583868-1035-4fca-a0d2-72266f59c49b,,Bespoke Labs is hiring contract DevOps Engineers for project-based work. This role is open to candidates based in the United States ... Remote. Employment ...
2026-04-18 12:36:45,serp:jobs.ashbyhq.com,havocai,DevOps Engineer @ HavocAI,,,https://jobs.ashbyhq.com/havocai/0ec8458c-bd5b-480e-9028-d7a2243df0cc,serp::https://jobs.ashbyhq.com/havocai/0ec8458c-bd5b-480e-9028-d7a2243df0cc,,DevOps Engineer. Location. Remote. Employment Type. Full time. Location Type. Remote. Department. Cloud. Compensation. $150K – $175K • Offers Equity • Offers ...
2026-04-18 12:36:45,serp:jobs.ashbyhq.com,everops,Senior DevOps Engineer @ EverOps,,,https://jobs.ashbyhq.com/everops/5b8b9de2-9371-4777-a88a-63d6d035f3f3,serp::https://jobs.ashbyhq.com/everops/5b8b9de2-9371-4777-a88a-63d6d035f3f3,,"Senior DevOps Engineer. Location. Remote. Employment Type. Full time. Location ... As a Senior DevOps Engineer, you will join our U.S.-Based Virtual ..."
2026-04-18 12:36:45,serp:jobs.ashbyhq.com,risklabs,Senior DevOps Engineer @ Risk Labs,,,https://jobs.ashbyhq.com/risklabs/1e85d1db-d48a-4f05-ba5b-32c5eeae12f4,serp::https://jobs.ashbyhq.com/risklabs/1e85d1db-d48a-4f05-ba5b-32c5eeae12f4,,Senior DevOps Engineer. Location. Remote. Employment Type. Full time. Department. Risk Labs.
2026-04-18 12:36:45,serp:jobs.ashbyhq.com,dualentry,Senior DevOps Engineer @ DualEntry,,,https://jobs.ashbyhq.com/dualentry/48e74b80-5a0f-42f1-a6c5-c38cab30f526,serp::https://jobs.ashbyhq.com/dualentry/48e74b80-5a0f-42f1-a6c5-c38cab30f526,,DevOps Engineer (Senior/Staff) ... Remote-first team - the fastest team you will have ever worked with. Time Off ...
2026-04-18 12:36:45,serp:jobs.ashbyhq.com,highlightta,DevOps Engineer @ HighlightTA,,,https://jobs.ashbyhq.com/highlightta/03ec9df0-ef3e-4121-a6a7-960d531c6be1,serp::https://jobs.ashbyhq.com/highlightta/03ec9df0-ef3e-4121-a6a7-960d531c6be1,,"DevOps Engineer ... If you're passionate about using your skills to drive real impact and want to thrive in a collaborative, fully remote environment, Neon One is ..."
2026-04-18 12:36:45,serp:jobs.ashbyhq.com,pursuit,DevOps Engineer @ Pursuit,,,https://jobs.ashbyhq.com/pursuit/b9f478e3-a09f-4ff6-8d07-07199665e4d6,serp::https://jobs.ashbyhq.com/pursuit/b9f478e3-a09f-4ff6-8d07-07199665e4d6,,DevOps Engineer. Location. United States. Employment Type. Full time. Location Type. Remote. Department. Engineering. OverviewApplication. Company Mission: Our ...
2026-04-18 12:36:45,serp:jobs.ashbyhq.com,homevision,Site Reliability Engineer,,,https://jobs.ashbyhq.com/homevision/2d45f031-69d9-4999-8e36-70a51365603f,serp::https://jobs.ashbyhq.com/homevision/2d45f031-69d9-4999-8e36-70a51365603f,,"Site Reliability Engineer - US - Remote. Location. United States; Puerto Rico ... We're backed by Initialized Capital, growing fast, and looking for an SRE to ..."
2026-04-18 12:36:45,serp:jobs.ashbyhq.com,perchwell,Senior Site Reliability Engineer (Remote or NYC,,,https://jobs.ashbyhq.com/Perchwell/f1f6fa02-f905-4f43-b7c6-71a8e01cdc93,serp::https://jobs.ashbyhq.com/Perchwell/f1f6fa02-f905-4f43-b7c6-71a8e01cdc93,,"... SRE, you will help own and improve the ... Senior Site Reliability Engineer (Remote or NYC - Hybrid). Location. New York Office; United States - Remote ..."
2026-04-18 12:36:45,serp:jobs.ashbyhq.com,andromeda,Senior Site Reliability Engineer,,,https://jobs.ashbyhq.com/andromeda/c0129afa-ddfb-47e1-9968-b3dbf27b5d55,serp::https://jobs.ashbyhq.com/andromeda/c0129afa-ddfb-47e1-9968-b3dbf27b5d55,,"Senior Site Reliability Engineer - AI Infrastructure Location: Global Remote / ... SRE role. You will design, operate, and debug large ..."
2026-04-18 12:36:45,serp:jobs.ashbyhq.com,hopper,"Senior Site Reliability Engineer, Platform & Cloud FinOps ...",,,https://jobs.ashbyhq.com/hopper/a9cb4379-e2a6-4064-b4db-884921a03c44,serp::https://jobs.ashbyhq.com/hopper/a9cb4379-e2a6-4064-b4db-884921a03c44,,"Senior Site Reliability Engineer, Platform & Cloud FinOps (100% Remote - USA Central & EST). Location. Boston - Remote; Austin - Remote ... Strong background in ..."
2026-04-18 12:36:45,serp:jobs.ashbyhq.com,close,Site Reliability Engineer (USA Only,,,https://jobs.ashbyhq.com/close/6610824b-2d94-4071-90e0-bafc3b078870,serp::https://jobs.ashbyhq.com/close/6610824b-2d94-4071-90e0-bafc3b078870,,Site Reliability Engineer (USA Only - 100% Remote). Location. USA - Remote. Employment Type. Full time. Location Type. Remote. Department. Engineering ...
2026-04-18 12:36:45,serp:jobs.ashbyhq.com,chainlink-labs,"Senior Site Reliability Engineer, Node Platform @ Chainlink Labs",,,https://jobs.ashbyhq.com/chainlink-labs/04bd77b4-93ce-4729-a989-57bfa3b29598,serp::https://jobs.ashbyhq.com/chainlink-labs/04bd77b4-93ce-4729-a989-57bfa3b29598,,"Senior Site Reliability Engineer, Node Platform. Location. United States / Remote; Argentina / Remote; Bogota / Remote; Ciudad de México / Remote; São Paulo ..."
2026-04-18 12:36:45,serp:jobs.ashbyhq.com,close,Site Reliability Engineer (USA Only,,,https://jobs.ashbyhq.com/close/6610824b-2d94-4071-90e0-bafc3b078870/application,serp::https://jobs.ashbyhq.com/close/6610824b-2d94-4071-90e0-bafc3b078870/application,,Site Reliability Engineer (USA Only - 100% Remote) · Location · Employment Type · Location Type · Department · Compensation · General Application Questions · SRE.
2026-04-18 12:36:45,serp:jobs.ashbyhq.com,flock%20safety,"Site Reliability Engineer III, Aviation @ Flock",,,https://jobs.ashbyhq.com/Flock%20Safety/8f4dd66b-9051-44c0-b192-54041d715e7c?utm_campaign=41212022-MQL%20Newsletter&utm_source=hs_email&utm_medium=email&_hsenc=p2ANqtz-8J3TukEbdq6k7yP5IThOzzyAooyyJaqTmZnPKy2bw_HFIqp09sIUPRWx7kRAIOkeEx72yC,serp::https://jobs.ashbyhq.com/Flock%20Safety/8f4dd66b-9051-44c0-b192-54041d715e7c?utm_campaign=41212022-MQL%20Newsletter&utm_source=hs_email&utm_medium=email&_hsenc=p2ANqtz-8J3TukEbdq6k7yP5IThOzzyAooyyJaqTmZnPKy2bw_HFIqp09sIUPRWx7kRAIOkeEx72yC,,"... SRE who will be responsible for designing and building systems, tooling, and ... Site Reliability Engineer III, Aviation. Location. Remote - USA ..."
2026-04-18 12:36:45,serp:jobs.ashbyhq.com,freeplay,Site Reliability Engineer (SRE) @ Freeplay,,,https://jobs.ashbyhq.com/Freeplay/e8b1745e-1ef8-45e7-9fd2-bfe183852296,serp::https://jobs.ashbyhq.com/Freeplay/e8b1745e-1ef8-45e7-9fd2-bfe183852296,,"Site Reliability Engineer (SRE). Location. Boulder, CO. Employment Type. Full time. Department. Engineering. Compensation. $135K – $180K • Offers Equity ..."
2026-04-18 12:36:45,serp:jobs.ashbyhq.com,vantageanalytics,Senior Site Reliability Engineer @ Vantage,,,https://jobs.ashbyhq.com/vantageanalytics/74cb0070-b786-4fd9-908c-45a019267afb,serp::https://jobs.ashbyhq.com/vantageanalytics/74cb0070-b786-4fd9-908c-45a019267afb,,"As a Senior Site Reliability Engineer (SRE) / DevOps Engineer at Vantage ... Vantage is proudly headquartered in Toronto, but we're a remote-first team spread ..."
2026-04-18 12:36:45,serp:jobs.ashbyhq.com,wundergraph,"Remote (EMEA) @ WunderGraph, Inc.",,,https://jobs.ashbyhq.com/wundergraph/05bf1896-580e-4376-b8f8-a13d4897ca5c,serp::https://jobs.ashbyhq.com/wundergraph/05bf1896-580e-4376-b8f8-a13d4897ca5c,,Staff Platform Engineer - Remote (EMEA). Location. EMEA. Employment Type. Full time. Location Type. Remote. Department. Engineering. Compensation. €100K – €130K.
2026-04-18 12:36:45,serp:jobs.ashbyhq.com,loancrate,Senior Platform Engineer @ Loancrate,,,https://jobs.ashbyhq.com/loancrate/efe03f3a-2c3d-4bd7-b237-978deed13cbd,serp::https://jobs.ashbyhq.com/loancrate/efe03f3a-2c3d-4bd7-b237-978deed13cbd,,Senior Platform Engineer. Location. United States. Employment Type. Full time. Location Type. Remote ...
2026-04-18 12:36:45,serp:jobs.ashbyhq.com,comulate,Platform Engineer @ Comulate,,,https://jobs.ashbyhq.com/comulate/b553bfae-6722-4d3f-8585-372c98708996,serp::https://jobs.ashbyhq.com/comulate/b553bfae-6722-4d3f-8585-372c98708996,,Platform Engineer. Location. San Francisco / Remote. Employment Type. Full time. Location Type. Remote. Department. Engineering. Compensation. $160K – $240K • ...
2026-04-18 12:36:45,serp:jobs.ashbyhq.com,whatnot,Feature Platform Engineer @ Whatnot,,,https://jobs.ashbyhq.com/whatnot/cb4e987c-b3ea-4117-b91c-75c61b83a7dc,serp::https://jobs.ashbyhq.com/whatnot/cb4e987c-b3ea-4117-b91c-75c61b83a7dc,,"... remote co-located team, we're inspired by our values https ... Feature Platform Engineer. Location. San Francisco, CA. Employment Type."
2026-04-18 12:36:45,serp:jobs.ashbyhq.com,kraken.com,Senior Database Platform Engineer @ Kraken,,,https://jobs.ashbyhq.com/kraken.com/17c989db-9d15-4df4-95ee-827c4781b5bc,serp::https://jobs.ashbyhq.com/kraken.com/17c989db-9d15-4df4-95ee-827c4781b5bc,,Senior Database Platform Engineer ; Location. United States ; Employment Type. Full time ; Location Type. Remote ; Department. EngineeringSRE / Devops ; Compensation.
2026-04-18 12:36:45,serp:jobs.ashbyhq.com,trust-wallet,Senior Platform Engineer @ Trust Wallet,,,https://jobs.ashbyhq.com/trust-wallet/56363170-01d5-4838-9854-3e77c56a6ccc,serp::https://jobs.ashbyhq.com/trust-wallet/56363170-01d5-4838-9854-3e77c56a6ccc,,Senior Platform Engineer. Location. Remote - Global. Employment Type. Full time. Location Type. Remote. Department. Engineering. OverviewApplication. About the ...
2026-04-18 12:36:45,serp:jobs.ashbyhq.com,pragmatike,Senior Cloud Engineer @ Pragmatike,,,https://jobs.ashbyhq.com/pragmatike/28e6df59-0f6d-4e0a-b7cd-6155cb41bdbe,serp::https://jobs.ashbyhq.com/pragmatike/28e6df59-0f6d-4e0a-b7cd-6155cb41bdbe,,Senior Cloud Engineer. Location. Cambridge ; Boston ; California; New Jersey ... Remote option for Out-Of-State applicants. Start date: ASAP Languages ...
2026-04-18 12:36:45,serp:jobs.ashbyhq.com,handshake,Senior Cloud Engineer @ Handshake,,,https://jobs.ashbyhq.com/handshake/117385d2-2578-45ba-a7b6-417ec7b48166,serp::https://jobs.ashbyhq.com/handshake/117385d2-2578-45ba-a7b6-417ec7b48166,,"... Cloud Engineer, you'll be at the center of how we design, deploy, and ... Remote & Office: Internet, commuting, and free lunch/gym in our SF office ..."
2026-04-18 12:36:45,serp:jobs.ashbyhq.com,fundingcircle,Senior Cloud Engineer (Cloud Platform) @ Funding Circle,,,https://jobs.ashbyhq.com/fundingcircle/479409be-a061-4cf8-9d62-928e1d1c70e2,serp::https://jobs.ashbyhq.com/fundingcircle/479409be-a061-4cf8-9d62-928e1d1c70e2,,"Senior Cloud Engineer (Cloud Platform) ... Experience working with AI infrastructure concepts such as MCP, remote agents, as well as tooling like AWS Bedrock."
2026-04-18 12:36:45,serp:jobs.ashbyhq.com,hireveterans,AWS Cloud Engineer @ Hire Veterans,,,https://jobs.ashbyhq.com/hireveterans/50f0112c-b56f-4ac5-a7c2-217c5e9f5b4c,serp::https://jobs.ashbyhq.com/hireveterans/50f0112c-b56f-4ac5-a7c2-217c5e9f5b4c,,AWS Cloud Engineer ... Department. Technology. OverviewApplication. AWS Cloud Systems Engineer (Mid-Level). Location: Remote (U.S.-based – Boston preferred).
2026-04-18 12:36:45,serp:jobs.ashbyhq.com,megazone,Megazone Cloud US,,,https://jobs.ashbyhq.com/megazone,serp::https://jobs.ashbyhq.com/megazone,,"Cloud Engineer Co-op. Tech • Rochester, NY • Full time • On-site. $20 – $30 ... Tech • United States- Remote • Full time • Remote. $110K – $140K • Offers ..."
2026-04-18 12:36:45,serp:jobs.ashbyhq.com,grindr%20llc,Senior Cloud Engineer @ Grindr,,,https://jobs.ashbyhq.com/Grindr%20LLC/30116d94-38bf-4f90-9065-24f2b66e82bb/application,serp::https://jobs.ashbyhq.com/Grindr%20LLC/30116d94-38bf-4f90-9065-24f2b66e82bb/application,,... Cloud Engineer who is passionate about development operations and ... Are you authorized to work in the United States for any employer? Yes No.
2026-04-18 12:36:45,serp:jobs.ashbyhq.com,megazone,Cloud Engineer- Infrastructure @ Megazone Cloud US,,,https://jobs.ashbyhq.com/megazone/3831ae33-179f-4603-a7d3-1a3d2bfa3d8d/application?utm_source=bandana,serp::https://jobs.ashbyhq.com/megazone/3831ae33-179f-4603-a7d3-1a3d2bfa3d8d/application?utm_source=bandana,,"Cloud Engineer- Infrastructure. Location. Frisco, TX; Irvine, CA; Rochester ... Open to remote work. Will you now or in the future require sponsorship for ..."
2026-04-18 12:36:45,serp:jobs.ashbyhq.com,tempo-xyz,"Infrastructure Engineer, Blockchain (Remote",,,https://jobs.ashbyhq.com/tempo-xyz/2572ff39-1777-4d0a-a2e1-c03ad4317bf2,serp::https://jobs.ashbyhq.com/tempo-xyz/2572ff39-1777-4d0a-a2e1-c03ad4317bf2,,"Infrastructure Engineer, Blockchain (Remote - USA). Location. USA (Remote). Employment Type. Full time. Location Type. Remote. Department. Engineering. Overview ..."
2026-04-18 12:36:45,serp:jobs.ashbyhq.com,fieldguide,Infrastructure Engineer @ Fieldguide,,,https://jobs.ashbyhq.com/fieldguide/92cef08a-e3a4-4542-9973-e9005d70577d,serp::https://jobs.ashbyhq.com/fieldguide/92cef08a-e3a4-4542-9973-e9005d70577d,,"Infrastructure Engineer. Location. San Francisco, CA or Remote (USA). Employment Type. Full time. Location Type. Remote. Department. Engineering, Product, and ..."
2026-04-18 12:36:45,serp:jobs.ashbyhq.com,valon,Senior Cloud Infrastructure Engineer @ Valon Tech,,,https://jobs.ashbyhq.com/valon/71dcb68c-302d-4f8c-80cf-c1bd5ac106d5,serp::https://jobs.ashbyhq.com/valon/71dcb68c-302d-4f8c-80cf-c1bd5ac106d5,,Senior Cloud Infrastructure Engineer. Location. Remote. Employment Type. Full time. Location Type. Remote ...
2026-04-18 12:36:45,serp:jobs.ashbyhq.com,scrunch,Senior Infrastructure Engineer @ Scrunch,,,https://jobs.ashbyhq.com/scrunch/8182e8cf-12fe-4d3a-a143-ace3c8f7eddd,serp::https://jobs.ashbyhq.com/scrunch/8182e8cf-12fe-4d3a-a143-ace3c8f7eddd,,Senior Infrastructure Engineer. Location. Remote USA. Employment Type. Full ... 🖥️ Remote support: Phone and internet reimbursement Growth: L&D budget ...
2026-04-18 12:36:45,serp:jobs.ashbyhq.com,vcluster,AI Infrastructure Engineer @ vCluster Labs,,,https://jobs.ashbyhq.com/vCluster/19a7f22e-ee7d-419b-bc9e-e2fa61dff2d1,serp::https://jobs.ashbyhq.com/vCluster/19a7f22e-ee7d-419b-bc9e-e2fa61dff2d1,,"AI Infrastructure Engineer. Location. Remote- US; USA - Boston; USA - New York ... As an AI Infrastructure Engineer, your role will include: Lead ..."
2026-04-18 12:36:45,serp:jobs.ashbyhq.com,railway,Infrastructure Engineer @ Railway,,,https://jobs.ashbyhq.com/railway/b8072f95-043f-404d-a313-f0bdf8dd3c81,serp::https://jobs.ashbyhq.com/railway/b8072f95-043f-404d-a313-f0bdf8dd3c81,,Infrastructure Engineer. Location. Remote (United States). Employment Type. Full time. Location Type. Remote. Department. Platform. OverviewApplication. This is ...
2026-04-18 12:36:45,serp:jobs.ashbyhq.com,togal-ai,Infrastructure Engineer @ Togal AI,,,https://jobs.ashbyhq.com/togal-ai/b46513d8-5b9a-415d-947c-94d3c3663eca,serp::https://jobs.ashbyhq.com/togal-ai/b46513d8-5b9a-415d-947c-94d3c3663eca,,Infrastructure Engineer. Location. Remote; EMEA; United States. Employment Type. Full time. Location Type. Remote. Department. Technology. Compensation. €85K – ...
2026-04-18 12:36:45,serp:jobs.ashbyhq.com,knox-systems,Devops Security Engineer @ Knox Systems,,,https://jobs.ashbyhq.com/knox-systems/747e6c89-9492-491a-8ccb-adbc148857e4,serp::https://jobs.ashbyhq.com/knox-systems/747e6c89-9492-491a-8ccb-adbc148857e4,,"Department: Operations Location: Remote (U.S.), West Coast hours preferred ... DevSecOps role responsible for securing cloud-native, multi-tenant ..."
2026-04-18 12:36:45,serp:jobs.ashbyhq.com,trm-labs,Senior Cloud Security Engineer (DevSecOps) @ TRM Labs,,,https://jobs.ashbyhq.com/trm-labs/d7ca4439-43ab-42aa-a907-ef1a288c5759?utm_source=KaWmZ89zGg,serp::https://jobs.ashbyhq.com/trm-labs/d7ca4439-43ab-42aa-a907-ef1a288c5759?utm_source=KaWmZ89zGg,,Senior Cloud Security Engineer (DevSecOps). Location. North America. Employment Type. Full time. Location Type. Remote. Department. R&DEngineering. Overview ...
2026-04-18 12:36:45,serp:jobs.ashbyhq.com,clearco,Senior DevSecOps Engineer @ Clearco,,,https://jobs.ashbyhq.com/clearco/2daf0010-f167-4bf2-80b5-f38c61fa311f,serp::https://jobs.ashbyhq.com/clearco/2daf0010-f167-4bf2-80b5-f38c61fa311f,,"... DevSecOps Engineer to operate at the intersection of Infrastructure, Security ... remote access tooling, and partner with stakeholders for operational ..."
2026-04-18 12:36:45,serp:jobs.ashbyhq.com,breaker,DevSecOps @ Breaker,,,https://jobs.ashbyhq.com/breaker/70f60bc5-929e-46d1-901a-ac1dc7b9247f,serp::https://jobs.ashbyhq.com/breaker/70f60bc5-929e-46d1-901a-ac1dc7b9247f,,"Platform Engineer (DevSecOps). TL;DR. Own and build Breaker's CI/CD platform from the ground up. GitLab, AWS, Docker, Infrastructure as Code."
2026-04-18 12:36:45,serp:jobs.ashbyhq.com,farsight,Cloud Infrastructure Engineer @ Farsight AI,,,https://jobs.ashbyhq.com/farsight/b4eca1e7-2c95-4c79-af7e-8b6bd0b0d431,serp::https://jobs.ashbyhq.com/farsight/b4eca1e7-2c95-4c79-af7e-8b6bd0b0d431,,"... remote). Job Description As a Cloud Infrastructure Engineer at Farsight AI, you'll lead the design, implementation, and management of infrastructure ..."
2026-04-18 12:36:45,serp:jobs.ashbyhq.com,rula,Sr. Infrastructure Security Engineer (Remote) @ Rula,,,https://jobs.ashbyhq.com/rula/88508717-63a0-4c94-acda-ca54fc266ab2,serp::https://jobs.ashbyhq.com/rula/88508717-63a0-4c94-acda-ca54fc266ab2,,"... cloud infrastructure. Overall, you'll encounter endless learning ... Infrastructure Security Engineer (Remote). Location. Remote - United States ..."
2026-04-18 12:36:45,serp:jobs.ashbyhq.com,onebrief,"Cloud Infrastructure Engineer, Battle Road @ Onebrief",,,https://jobs.ashbyhq.com/onebrief/e2584bd8-7d9a-40fc-ba88-048af7c96aa0,serp::https://jobs.ashbyhq.com/onebrief/e2584bd8-7d9a-40fc-ba88-048af7c96aa0,,"Cloud Infrastructure Engineer, Battle Road. Location. United States | Remote. Employment Type. Full time. Location Type. Remote. Department. Battle Road Digital ..."
2026-04-18 12:36:45,serp:jobs.ashbyhq.com,valon,Cloud Infrastructure @ Valon Tech,,,https://jobs.ashbyhq.com/valon/32fc3fab-87e3-4fed-9b92-db050da6fa40,serp::https://jobs.ashbyhq.com/valon/32fc3fab-87e3-4fed-9b92-db050da6fa40,,We also fully support remote work. About the Role. We're looking for an Engineering Manager to lead our Cloud Infrastructure efforts on the Platform team. In ...
2026-04-18 12:36:45,serp:jobs.ashbyhq.com,homevision,Associate Site Reliability Engineer,,,https://jobs.ashbyhq.com/homevision/fb31c9cd-89c8-4001-8f51-303e504123e3,serp::https://jobs.ashbyhq.com/homevision/fb31c9cd-89c8-4001-8f51-303e504123e3,,Associate Site Reliability Engineer - US - Remote. Location. United States; Puerto Rico. Employment Type. Full time. Location Type. Remote. Department.
2026-04-18 12:36:45,serp:jobs.ashbyhq.com,arkenstonedefense,Systems Reliability Engineer @ Arkenstone Defense,,,https://jobs.ashbyhq.com/ArkenstoneDefense/6b71f94b-7461-4910-8e3f-b0a00d499d12,serp::https://jobs.ashbyhq.com/ArkenstoneDefense/6b71f94b-7461-4910-8e3f-b0a00d499d12,,Systems Reliability Engineer. Location. United States; Menlo Park or D.C.. Employment Type. Full time. Location Type. Remote. Department. MAC. Compensation.
2026-04-18 12:36:45,serp:jobs.ashbyhq.com,supabase,Customer Reliability Engineer @ Supabase,,,https://jobs.ashbyhq.com/supabase/26ad8432-a03e-40f9-a4cc-05344ceedfa3,serp::https://jobs.ashbyhq.com/supabase/26ad8432-a03e-40f9-a4cc-05344ceedfa3,,Customer Reliability Engineer. Location. AMER. Employment Type. Full time. Location Type. Remote ...
2026-04-18 12:36:45,serp:apply.workable.com,telestream,Jobs By Workable,,,https://apply.workable.com/telestream/j/ED54675F67/,serp::https://apply.workable.com/telestream/j/ED54675F67/,,"DevOps Engineer. RemoteDevOpsFull timeDevOps - 6. United States. Overview ... Position Summary: Telestream is seeking a DevOps Engineer with proven, hands ..."
2026-04-18 12:36:45,serp:apply.workable.com,pavago,Jobs By Workable,,,https://apply.workable.com/pavago/j/87F956BA52/,serp::https://apply.workable.com/pavago/j/87F956BA52/,,We are seeking a DevOps Engineer to design and maintain cloud infrastructure and deployment pipelines for our client's technology operations. This remote ...
2026-04-18 12:36:45,serp:apply.workable.com,resonance,DevOps Engineer (Mid-to-Senior Level),,,https://apply.workable.com/resonance/j/7938DFC75D/,serp::https://apply.workable.com/resonance/j/7938DFC75D/,,"DevOps Engineer (Mid-to-Senior Level). RemoteAI System DevelopmentFull time. New York, New York, United States ... Remote Work: This is a fully remote position."
2026-04-18 12:36:45,serp:apply.workable.com,systems-engineering-solutions-corporation,Systems Engineering Solutions Corporation,,,https://apply.workable.com/systems-engineering-solutions-corporation/j/5E8674A381/,serp::https://apply.workable.com/systems-engineering-solutions-corporation/j/5E8674A381/,,... DevOps Engineer. SES is seeking a DevOps Engineer supporting AWS ... DevOps Engineer. RemoteFull time. United States. OverviewApplication. Share this ...
2026-04-18 12:36:45,serp:apply.workable.com,tetrascience,Jobs By Workable,,,https://apply.workable.com/tetrascience/j/E0F1F3EEF9/,serp::https://apply.workable.com/tetrascience/j/E0F1F3EEF9/,,DevOps Engineer. RemoteEngineeringFull time. United States. OverviewApplication ... At least 5 years of professional experience as a DevOps Engineer or in a ...
2026-04-18 12:36:45,serp:apply.workable.com,fable-1,Senior Site Reliability Engineer (SRE),,,https://apply.workable.com/fable-1/j/C49AEB4FED,serp::https://apply.workable.com/fable-1/j/C49AEB4FED,,"Senior Site Reliability Engineer (SRE). RemoteEngineeringFull time. Ontario ... As a Senior Site Reliability Engineer at Fable, you will play a critical ..."
2026-04-18 12:36:45,serp:apply.workable.com,mlabs,Senior Site Reliability Engineer (Azure),,,https://apply.workable.com/mlabs/j/488D610475/,serp::https://apply.workable.com/mlabs/j/488D610475/,,Senior Site Reliability Engineer (Enterprise Platform)Location: US - Open to ... Senior Site Reliability Engineer (Azure). RemoteHGH226464. United States.
2026-04-18 12:36:45,serp:apply.workable.com,cathexis,Site Reliability Engineer,,,https://apply.workable.com/cathexis/j/6E199E9BAD,serp::https://apply.workable.com/cathexis/j/6E199E9BAD,,"Site Reliability Engineer - Top Secret. On-siteInformation TechnologyFull time. Tysons, Virginia, United States ... The Site Reliability Engineer (SRE) will ..."
2026-04-18 12:36:45,serp:apply.workable.com,tp-link-usa-corp,Site Reliability Engineer,,,https://apply.workable.com/tp-link-usa-corp/j/3CFA7549D6/,serp::https://apply.workable.com/tp-link-usa-corp/j/3CFA7549D6/,,"Headquartered in the United States, TP-Link Systems Inc. is a ... Hands-on experience in SRE, DevOps, cloud operations, and cloud security best practices."
2026-04-18 12:36:45,serp:apply.workable.com,satsuma,Senior Site Reliability Engineer,,,https://apply.workable.com/satsuma/j/FFE6AEF596/apply/,serp::https://apply.workable.com/satsuma/j/FFE6AEF596/apply/,,"Senior Site Reliability Engineer. RemoteFull time. Austin, Texas, United States. OverviewApplication. Autofill application. Save time by importing your resume ..."
2026-04-18 12:36:45,serp:apply.workable.com,therapynotes,Senior Database Site Reliability Engineer,,,https://apply.workable.com/therapynotes/j/127FE35A05/,serp::https://apply.workable.com/therapynotes/j/127FE35A05/,,Senior Database Site Reliability Engineer. RemoteITFull time. United States.
2026-04-18 12:36:45,serp:apply.workable.com,alex-staff-agency-careers,Cloud / Platform Engineer (Remote),,,https://apply.workable.com/alex-staff-agency-careers/j/24F8E2E263/,serp::https://apply.workable.com/alex-staff-agency-careers/j/24F8E2E263/,,Cloud / Platform Engineer (Remote) ; Description · Support and develop AWS or GCP infrastructure (multi-region). Operate and troubleshoot Kubernetes platforms.
2026-04-18 12:36:45,serp:apply.workable.com,commercial-lending,"World Business Lenders, LLC",,,https://apply.workable.com/commercial-lending/j/900864697A/apply/,serp::https://apply.workable.com/commercial-lending/j/900864697A/apply/,,... United States that do not have access to traditional financing. The . ... Remote - Azure Platform Engineer. Remote. OverviewApplication. Autofill ...
2026-04-18 12:36:45,serp:apply.workable.com,netx,Platform Engineer,,,https://apply.workable.com/netx/j/5AC4409BA0,serp::https://apply.workable.com/netx/j/5AC4409BA0,,"Platform Engineer. RemoteFull time. United States. OverviewApplication. Share ... The Platform Engineer is responsible for designing, building, and ..."
2026-04-18 12:36:45,serp:apply.workable.com,constructor-1,Platform Engineer: Platform Solutions (Remote),,,https://apply.workable.com/constructor-1/j/16EC82BD53,serp::https://apply.workable.com/constructor-1/j/16EC82BD53,,"Platform Engineer: Platform Solutions (Remote). RemoteEngineering. Overview ... As a Platform Engineer in the Platform Solutions team, you will design ..."
2026-04-18 12:36:45,serp:apply.workable.com,visium,Platform Engineer (Azure/AWS),,,https://apply.workable.com/visium/j/3C217A0234/,serp::https://apply.workable.com/visium/j/3C217A0234/,,"Platform Engineer (Azure/AWS). RemoteEngineeringFull time. Barcelona ... As a Platform Engineer, you will own the design and evolution of cloud platforms ..."
2026-04-18 12:36:45,serp:apply.workable.com,constructor-1,Platform Engineer: Platform Solutions (Remote),,,https://apply.workable.com/constructor-1/j/16EC82BD53/apply/,serp::https://apply.workable.com/constructor-1/j/16EC82BD53/apply/,,Platform Engineer: Platform Solutions (Remote). RemoteEngineering. OverviewApplication. Autofill application. Save time by importing your resume in one of the ...
