collected_at_utc,source_type,company,title,location,team,url,external_id,posted_at,description_snippet
2026-04-24 12:56:53,serp:jobs.lever.co,espresso,DevOps Engineer,,,https://jobs.lever.co/Espresso/928cd4da-e76d-4d6a-ba58-fba57e6ae81a,serp::https://jobs.lever.co/Espresso/928cd4da-e76d-4d6a-ba58-fba57e6ae81a,,DevOps Engineer. Remote. Engineering – Infrastructure /. Full-time /. Remote. apply for this job. Espresso Systems builds foundational infrastructure to power ...
2026-04-24 12:56:53,serp:jobs.lever.co,pointclickcare,Intermediate AI-Enabled DevOps Engineer,,,https://jobs.lever.co/pointclickcare/94b85a28-9893-48c5-a2bb-a50175887ef1,serp::https://jobs.lever.co/pointclickcare/94b85a28-9893-48c5-a2bb-a50175887ef1,,"For Remote Roles: If this role is remote, there will be in-office events ... As an Intermediate DevOps Engineer, you will build, operate, support cloud ..."
2026-04-24 12:56:53,serp:jobs.lever.co,panopto,DevOps Engineer (USA or Canada),,,https://jobs.lever.co/panopto/4a6efe88-2552-4e99-a5c9-efe9b2517b89,serp::https://jobs.lever.co/panopto/4a6efe88-2552-4e99-a5c9-efe9b2517b89,,"DevOps Engineer (USA or Canada). Remote - US. Research & Development ... Remote, US: Candidates looking for flexible or remote-friendly positions are ..."
2026-04-24 12:56:53,serp:jobs.lever.co,pointclickcare,Senior AI-Enabled DevOps Engineer,,,https://jobs.lever.co/pointclickcare/53e0c620-e7e9-4e54-90f5-3ff2bff10a35,serp::https://jobs.lever.co/pointclickcare/53e0c620-e7e9-4e54-90f5-3ff2bff10a35,,"For Remote Roles: If this role is remote, there will be in-office events ... As a Senior DevOps Engineer, you will design, build, and operate scalable ..."
2026-04-24 12:56:53,serp:jobs.lever.co,quokka,DevOps Engineer,,,https://jobs.lever.co/quokka/f9ec8f4e-e18f-436a-9da2-875739db2c3e,serp::https://jobs.lever.co/quokka/f9ec8f4e-e18f-436a-9da2-875739db2c3e,,DevOps Engineer. Remote. Research & Development – Engineering /. Full-time /. Remote. apply for this job. Quokka is an enterprise mobile security company ...
2026-04-24 12:56:53,serp:jobs.lever.co,biointellisense,DevOps Engineer,,,https://jobs.lever.co/biointellisense/0bbdecb1-4bb6-40bb-85e1-7683fb698753,serp::https://jobs.lever.co/biointellisense/0bbdecb1-4bb6-40bb-85e1-7683fb698753,,DevOps Engineer. United States. Research & Development – Cloud /. Full Time /. Remote. apply for this job.
2026-04-24 12:56:53,serp:jobs.lever.co,smart-working-solutions,"Senior AWS DevOps Engineer (Remote, Full-Time) [AS232]",,,https://jobs.lever.co/smart-working-solutions/0c3d8ad8-dc9e-48c1-a96f-9a8f4b8005ef,serp::https://jobs.lever.co/smart-working-solutions/0c3d8ad8-dc9e-48c1-a96f-9a8f4b8005ef,,"Senior AWS DevOps Engineer (Remote, Full-Time) [AS232] ... At Smart Working, we believe your job should not only look right on paper but also feel right every day ..."
2026-04-24 12:56:53,serp:jobs.lever.co,olo,DevOps Engineer,,,https://jobs.lever.co/olo/a6638069-48c8-4db7-9a6a-b5cf2fc49629,serp::https://jobs.lever.co/olo/a6638069-48c8-4db7-9a6a-b5cf2fc49629,,"DevOps Engineer. Belfast, Northern Ireland, Remote. Platform Engineering – Developer Productivity /. Full-Time /. Remote. apply for this job. Olo is a leading ..."
2026-04-24 12:56:53,serp:jobs.lever.co,lyrebirdhealth,Senior Site Reliability Engineer,,,https://jobs.lever.co/lyrebirdhealth/850ccb52-a77e-4919-be9c-7cdc1f8c8b24,serp::https://jobs.lever.co/lyrebirdhealth/850ccb52-a77e-4919-be9c-7cdc1f8c8b24,,"Senior Site Reliability Engineer. The Role. We're hiring a Senior SRE to own the reliability, scalability, and performance of our production systems as we ..."
2026-04-24 12:56:53,serp:jobs.lever.co,ro,Senior Site Reliability Engineer,,,https://jobs.lever.co/ro/fc823e16-7424-4920-8aef-88fa79ef8223,serp::https://jobs.lever.co/ro/fc823e16-7424-4920-8aef-88fa79ef8223,,"Since 2017, Ro has helped millions of patients in nearly every single county in the United States, including 99% of primary care deserts. ... As a Senior SRE ..."
2026-04-24 12:56:53,serp:jobs.lever.co,regrello,Senior Site Reliability Engineer,,,https://jobs.lever.co/regrello/e4222908-c38b-4c4c-9067-9f66d94c0be2,serp::https://jobs.lever.co/regrello/e4222908-c38b-4c4c-9067-9f66d94c0be2,,Senior Site Reliability Engineer. United States (Remote). Engineering /. Full ... SRE@Regrello's customers aren't just internal teams: operating and ...
2026-04-24 12:56:53,serp:jobs.lever.co,cority,Site Reliability Engineer II,,,https://jobs.lever.co/cority/891c123b-7ea4-4598-ad16-56c087fe1520,serp::https://jobs.lever.co/cority/891c123b-7ea4-4598-ad16-56c087fe1520,,Site Reliability Engineer II. United States. Technology & Engineering – Engineering /. Remote. apply for this job.
2026-04-24 12:56:53,serp:jobs.lever.co,elementsolutions,Sr. Site Reliability Engineer,,,https://jobs.lever.co/elementsolutions/c0466d39-13f7-440d-bdf1-74afb627c112,serp::https://jobs.lever.co/elementsolutions/c0466d39-13f7-440d-bdf1-74afb627c112,,"The Senior Site Reliability Engineer (SRE) serves as the Technical ... We are a remote-first company based in Washington, DC. Element is an equal ..."
2026-04-24 12:56:53,serp:jobs.lever.co,spotify,Senior Site Reliability Engineer,,,https://jobs.lever.co/spotify/fdfe281d-889c-478a-8f27-c9bc36b2b0cf,serp::https://jobs.lever.co/spotify/fdfe281d-889c-478a-8f27-c9bc36b2b0cf,,"Senior Site Reliability Engineer. New York, NY. Data and Analytics – Platform /. Permanent /. Remote. apply for this job."
2026-04-24 12:56:53,serp:jobs.lever.co,mistral,Site Reliability Engineer,,,https://jobs.lever.co/mistral/b320e972-3ed8-4d02-acb1-37950812cdbc,serp::https://jobs.lever.co/mistral/b320e972-3ed8-4d02-acb1-37950812cdbc,,"Site Reliability Engineer - NYC. New York, NY. Engineering & Infra /. Full-time /. Remote. apply for this job."
2026-04-24 12:56:53,serp:jobs.lever.co,certifid,Senior Site Reliability Engineer,,,https://jobs.lever.co/certifid/ea61bb47-69b8-4777-ab3f-65057fe6c5a6,serp::https://jobs.lever.co/certifid/ea61bb47-69b8-4777-ab3f-65057fe6c5a6,,"SRE who enjoys solving complex operational problems, building automation, and mentoring others. ... Remote worker reimbursement of $300/year; Professional ..."
2026-04-24 12:56:53,serp:jobs.lever.co,moonpay,Senior Platform Engineer,,,https://jobs.lever.co/moonpay/0d93730a-fe32-474b-80eb-c7952486b514,serp::https://jobs.lever.co/moonpay/0d93730a-fe32-474b-80eb-c7952486b514,,Senior Platform Engineer. New York - Hybrid / United States (East Coast Time Zone) - Remote. Engineering – Product Security /. Full-time /. Hybrid. apply for ...
2026-04-24 12:56:53,serp:jobs.lever.co,lillio,Lillio (formerly HiMama),,,https://jobs.lever.co/Lillio/ba31d7df-c7a1-44cb-a71e-abb3524ecb3f,serp::https://jobs.lever.co/Lillio/ba31d7df-c7a1-44cb-a71e-abb3524ecb3f,,"Senior Platform Engineer. Canada, Remote. Product, Design & Engineering /. Full Time /. Remote. apply for this job. About Lillio (formerly HiMama) and Our ..."
2026-04-24 12:56:53,serp:jobs.lever.co,pacerpro,Platform Engineer – Cloud Infrastructure & Reliability,,,https://jobs.lever.co/PacerPro/f96cb805-25b2-4811-b9d9-43602c8a6d51,serp::https://jobs.lever.co/PacerPro/f96cb805-25b2-4811-b9d9-43602c8a6d51,,Platform Engineer – Cloud Infrastructure & Reliability. Remote. Engineering /. Full Time /. Remote. apply for this job. About this Job. You'll be joining the ...
2026-04-24 12:56:53,serp:jobs.lever.co,h1,Sr. DevOps AWS Cloud Engineer,,,https://jobs.lever.co/h1/73868723-fcc6-4338-896c-3a59b53eb934,serp::https://jobs.lever.co/h1/73868723-fcc6-4338-896c-3a59b53eb934,,"DevOps AWS Cloud Engineer. New York. Technical Excellence – Technical Excellence /. Full time /. Remote. apply for this job. At H1, we believe access to the ..."
2026-04-24 12:56:53,serp:jobs.lever.co,cgsfederal,"Contact Government Services, LLC",,,https://jobs.lever.co/cgsfederal/8b42f617-0ad1-4a30-95e7-f6c6c01cf2a5,serp::https://jobs.lever.co/cgsfederal/8b42f617-0ad1-4a30-95e7-f6c6c01cf2a5,,"Cloud Engineer (AWS). Washington, DC / Remote / Hybrid / Arlington, VA. Information Technology /. Full Time Hybrid /. Hybrid. apply for this job. Cloud Engineer ..."
2026-04-24 12:56:53,serp:jobs.lever.co,oci,"Object Computing, Inc.",,,https://jobs.lever.co/oci/c69b5353-d759-4209-941b-63c59c99e9a7/apply,serp::https://jobs.lever.co/oci/c69b5353-d759-4209-941b-63c59c99e9a7/apply,,Cloud Engineer. Remote. Cloud Services – Cloud Engineering /. Full ... Do you now or will you in the future require sponsorship to work in the United States?
2026-04-24 12:56:53,serp:jobs.lever.co,thinkahead,Associate Cloud Engineer,,,https://jobs.lever.co/thinkahead/44708939-4a32-4566-a142-db51a477c148,serp::https://jobs.lever.co/thinkahead/44708939-4a32-4566-a142-db51a477c148,,"Associate Cloud Engineer - GCP. Gurugram, Haryana. ( Managed Services ) – MS Cloud /. Full Time /. Remote. apply for this job. As Associate Cloud Services ..."
2026-04-24 12:56:53,serp:jobs.lever.co,palantir,Forward Deployed Infrastructure Engineer,,,https://jobs.lever.co/palantir/b57f08e9-546c-4b9b-8d21-db0ebbc11363,serp::https://jobs.lever.co/palantir/b57f08e9-546c-4b9b-8d21-db0ebbc11363,,"Forward Deployed Infrastructure Engineer - US Government ... Based on business need, there are a few roles that allow for “Remote” work on an exceptional basis."
2026-04-24 12:56:53,serp:jobs.lever.co,businesswire,Senior Infrastructure Engineer,,,https://jobs.lever.co/businesswire/93ddd3e1-0a1c-4aba-aed2-d5d6ecd579bb,serp::https://jobs.lever.co/businesswire/93ddd3e1-0a1c-4aba-aed2-d5d6ecd579bb,,"Senior Infrastructure Engineer. United States. Information Technology /. Full Time /. Remote. apply for this job. Business Wire, a Berkshire Hathaway company, ..."
2026-04-24 12:56:53,serp:jobs.lever.co,earthspecies,Senior Infrastructure Engineer (Backend/Data Performance),,,https://jobs.lever.co/earthspecies/b40800f0-1765-496f-b477-0cf8fe33e089,serp::https://jobs.lever.co/earthspecies/b40800f0-1765-496f-b477-0cf8fe33e089,,Senior Infrastructure Engineer (Backend/Data Performance). Remote. AI /. Full-time /. Remote. apply for this job. About Earth Species Project. Earth Species ...
2026-04-24 12:56:53,serp:jobs.lever.co,jobgether,Infrastructure Engineer,,,https://jobs.lever.co/jobgether/bef8af6a-9b85-4940-841e-8f10d926c799/apply,serp::https://jobs.lever.co/jobgether/bef8af6a-9b85-4940-841e-8f10d926c799/apply,,Infrastructure Engineer - REMOTE. Washington. General – General /. Full-time /. Remote. Submit your application. LinkedIn profile. Loading... Apply with ...
2026-04-24 12:56:53,serp:jobs.lever.co,serverfarm,Senior Critical Infrastructure Engineer,,,https://jobs.lever.co/serverfarm/20759625-ff1f-4037-9f61-eefeb0415dbd,serp::https://jobs.lever.co/serverfarm/20759625-ff1f-4037-9f61-eefeb0415dbd,,Senior Critical Infrastructure Engineer. United States. Operations Engineering – Operations Engineering /. Remote. apply for this job. Serverfarm is a leading ...
2026-04-24 12:56:53,serp:jobs.lever.co,voleon,Senior Linux Infrastructure Engineer,,,https://jobs.lever.co/voleon/73e3e6d4-a2c7-4232-ac17-6ccedd23805d,serp::https://jobs.lever.co/voleon/73e3e6d4-a2c7-4232-ac17-6ccedd23805d,,"Senior Linux Infrastructure Engineer. Remote, United States. IT /. Full-time /. Remote. apply for this job. Voleon is a technology company that applies state-of ..."
2026-04-24 12:56:53,serp:jobs.lever.co,ciandt,"Senior/Lead AWS Cloud Infrastructure Engineer (Remote), México",,,https://jobs.lever.co/ciandt/89d88760-ffba-4e23-b966-42f522204d2b,serp::https://jobs.lever.co/ciandt/89d88760-ffba-4e23-b966-42f522204d2b,,"Senior/Lead AWS Cloud Infrastructure Engineer (Remote), México · Experience in application or infrastructure design, implementation, or consulting. · Experience ..."
2026-04-24 12:56:53,serp:jobs.lever.co,toptal,Senior Infrastructure Engineer,,,https://jobs.lever.co/toptal/455f29f5-6349-4f4a-8da2-537d8ad9fd1a,serp::https://jobs.lever.co/toptal/455f29f5-6349-4f4a-8da2-537d8ad9fd1a,,"Senior Infrastructure Engineer ... With $200+ million in annual revenue and team members based around the globe, Toptal is the world's largest fully remote ..."
2026-04-24 12:56:53,serp:jobs.lever.co,trility,Senior AWS DevSecOps Consultant,,,https://jobs.lever.co/trility/620a1fea-f360-4ab1-b5c1-a77fdb231493,serp::https://jobs.lever.co/trility/620a1fea-f360-4ab1-b5c1-a77fdb231493,,Senior AWS DevSecOps Consultant. United States. Technology /. FTE or 1099 /. Remote. apply for this job.
2026-04-24 12:56:53,serp:jobs.lever.co,standtogether,Senior DevSecOps Engineer,,,https://jobs.lever.co/standtogether/2f823c57-af9a-4cb4-999b-c8ca1d99befc,serp::https://jobs.lever.co/standtogether/2f823c57-af9a-4cb4-999b-c8ca1d99befc,,"Senior DevSecOps Engineer. Arlington, VA. Knowledge Systems – Enterprise IT /. Full-time /. Remote. apply for this job. Stand Together is a philanthropic ..."
2026-04-24 12:56:53,serp:jobs.lever.co,jam-loop,IT Admin & DevSecOps Lead,,,https://jobs.lever.co/jam-loop/aedb3b6a-62db-43de-a453-fa131d4ff5ce,serp::https://jobs.lever.co/jam-loop/aedb3b6a-62db-43de-a453-fa131d4ff5ce,,IT Admin & DevSecOps Lead. California. Engineering /. Full-time /. Remote. apply for this job. About Us. JamLoop is a buying platform for OTT & CTV advertising ...
2026-04-24 12:56:53,serp:jobs.lever.co,agile-defense,DevSecOps Engineer,,,https://jobs.lever.co/agile-defense/f5348e9b-eaf8-4b03-b59f-e24c9c4cb5bb,serp::https://jobs.lever.co/agile-defense/f5348e9b-eaf8-4b03-b59f-e24c9c4cb5bb,,Job Title: DevSecOps Engineer. Location: Remote. Clearance Level: Secret Eligible. Reports To: VP of Platform Engineering. Position Summary. We are seeking a ...
2026-04-24 12:56:53,serp:jobs.lever.co,3eco,DevSecOps Engineering Team Lead,,,https://jobs.lever.co/3eco/82cc218d-1c23-4f46-b361-3abc4e561294,serp::https://jobs.lever.co/3eco/82cc218d-1c23-4f46-b361-3abc4e561294,,"DevSecOps Engineering Team Lead. Carlsbad, California. Technology & Engineering /. Full-time /. Remote. apply for this job. About 3E: We are a mission-driven ..."
2026-04-24 12:56:53,serp:jobs.lever.co,vrchat,Lead DevSecOps Engineer,,,https://jobs.lever.co/vrchat/0049381f-cbfa-453a-9d21-ba0324da7b4f/apply,serp::https://jobs.lever.co/vrchat/0049381f-cbfa-453a-9d21-ba0324da7b4f/apply,,Lead DevSecOps Engineer. Anywhere. Engineering /. Full-Time /. Remote. Submit your application.
2026-04-24 12:56:53,serp:jobs.lever.co,moonpay,Cloud Security Engineer,,,https://jobs.lever.co/moonpay/bc09255a-8975-492e-93e4-ecf2f16e8e45,serp::https://jobs.lever.co/moonpay/bc09255a-8975-492e-93e4-ecf2f16e8e45,,Cloud Security Engineer. United States - Hybrid / United States (East Coast Time Zone) - Remote ... cloud infrastructure and Kubernetes deployments in GCP and AWS ...
2026-04-24 12:56:53,serp:jobs.lever.co,pacerpro,Platform Engineer – Cloud Infrastructure & Reliability,,,https://jobs.lever.co/PacerPro/f96cb805-25b2-4811-b9d9-43602c8a6d51/apply,serp::https://jobs.lever.co/PacerPro/f96cb805-25b2-4811-b9d9-43602c8a6d51/apply,,Remote work setting. Are you comfortable working in a remote setting?✱. Yes ... Work authorization. Are you legally authorized to work in the United States?
2026-04-24 12:56:53,serp:jobs.lever.co,fieldnation,Senior Engineer,,,https://jobs.lever.co/fieldnation/4448ecf9-e166-49bc-84d0-ef48fb3baabc,serp::https://jobs.lever.co/fieldnation/4448ecf9-e166-49bc-84d0-ef48fb3baabc,,"The Cloud Platforms team works across Field Nation to build and maintain the cloud infrastructure that engineers rely on to develop, ship, and scale software."
2026-04-24 12:56:53,serp:jobs.lever.co,revealtech,Security Clearance Required,,,https://jobs.lever.co/revealtech/b2a4cfb1-0470-4cf7-8706-e3a61c60ad36,serp::https://jobs.lever.co/revealtech/b2a4cfb1-0470-4cf7-8706-e3a61c60ad36,,"Active Secret Clearance (at minimum) · This position requires travel for around 25% of the work · Strong experience with cloud infrastructure (Azure, GCP, or AWS) ..."
2026-04-24 12:56:53,serp:jobs.lever.co,zencore,"Senior Cloud Engineer, Infrastructure",,,https://jobs.lever.co/zencore/2f59f6de-ac72-46aa-81e4-9c4d2fceded9,serp::https://jobs.lever.co/zencore/2f59f6de-ac72-46aa-81e4-9c4d2fceded9,,"Design, implement, and manage cloud infrastructure in Google Cloud; Migrate ... We are a fully remote company and offer competitive compensation and benefits."
2026-04-24 12:56:53,serp:jobs.lever.co,spotify,Site Reliability Engineer,,,https://jobs.lever.co/spotify/ad5ef898-b800-4213-a63e-e39a97df9cfb,serp::https://jobs.lever.co/spotify/ad5ef898-b800-4213-a63e-e39a97df9cfb,,"Site Reliability Engineer - Backstage. New York, NY. Engineering – Platform /. Permanent /. Remote. apply for this job. Are you excited by the idea of building ..."
2026-04-24 12:56:53,serp:jobs.lever.co,pointclickcare,Senior Database Reliability Engineer (SQL),,,https://jobs.lever.co/pointclickcare/1a88bdc7-ef46-4c3a-a7c2-db9541a8ed4e,serp::https://jobs.lever.co/pointclickcare/1a88bdc7-ef46-4c3a-a7c2-db9541a8ed4e,,Senior Database Reliability Engineer (SQL). Remote. PointClickCare – SaaS Ops /. Full-Time /. Hybrid. apply for this job. At PointClickCare our mission is ...
2026-04-24 12:56:53,serp:jobs.lever.co,talentwerx.io,E01-L03 Reliability Engineer IV,,,https://jobs.lever.co/talentwerx.io/c34df12d-8fd2-49bf-a3d4-867df8bfe551,serp::https://jobs.lever.co/talentwerx.io/c34df12d-8fd2-49bf-a3d4-867df8bfe551,,"E01-L03 Reliability Engineer IV. Remote. EXPANSIA – EXPANSIA /. Full Time /. Remote. apply for this job. Start Date: Immediate. JHNA, CTSi, and EXPANSIA have ..."
2026-04-24 12:56:53,serp:jobs.lever.co,filevine,Senior Database Reliability Engineer,,,https://jobs.lever.co/filevine/6c5e505e-8190-4813-8bf2-d08db49a4c74,serp::https://jobs.lever.co/filevine/6c5e505e-8190-4813-8bf2-d08db49a4c74,,Senior Database Reliability Engineer. United States. Engineering – Reliability /. Full-time /. Remote. apply for this job. Filevine is a Legal AI company ...
2026-04-24 12:56:53,serp:boards.greenhouse.io,tactacam,Job Application for DevOps Engineer at Tactacam,,,https://boards.greenhouse.io/tactacam/jobs/4231083009,serp::https://boards.greenhouse.io/tactacam/jobs/4231083009,,DevOps Engineer. Remote. Apply. Company Overview: Tactacam is a leading ... United States military operation for which an Armed Forces service medal was ...
2026-04-24 12:56:53,serp:boards.greenhouse.io,veeamsoftware,Job Application for Azure/AI DevOps Engineer III at Veeam Software,,,https://boards.greenhouse.io/veeamsoftware/jobs/4834475101,serp::https://boards.greenhouse.io/veeamsoftware/jobs/4834475101,,"Azure/AI DevOps Engineer III. Remote, United States. Apply. Veeam is the Data and AI Trust Company, specializing in helping organizations ensure their data and ..."
2026-04-24 12:56:53,serp:boards.greenhouse.io,veeamsoftware,AI Agents CI/CD DevOps Engineer III,,,https://boards.greenhouse.io/veeamsoftware/jobs/4834468101,serp::https://boards.greenhouse.io/veeamsoftware/jobs/4834468101,,"AI Agents CI/CD DevOps Engineer III. Remote, United States. Apply. Veeam is the Data and AI Trust Company, specializing in helping organizations ensure their ..."
2026-04-24 12:56:53,serp:boards.greenhouse.io,accenturefederalservices,Senior AWS DevSecOps Engineer,,,https://boards.greenhouse.io/accenturefederalservices/jobs/4674914006?gh_jid=4674914006,serp::https://boards.greenhouse.io/accenturefederalservices/jobs/4674914006?gh_jid=4674914006,,"Experience contributing to open-source projects. Any of the following certification(s): AWS Certified DevOps Engineer ... United States Postal Service, and USAID ..."
2026-04-24 12:56:53,serp:boards.greenhouse.io,corelight,Lead Cloud Infrastructure Engineer / Site Reliability Engineer (SRE),,,https://boards.greenhouse.io/corelight/jobs/7843517,serp::https://boards.greenhouse.io/corelight/jobs/7843517,,"Cloud certifications (AWS, Azure, or GCP – e.g., Solutions Architect, DevOps Engineer). ... Residence within the contiguous United States. Willingness to ..."
2026-04-24 12:56:53,serp:boards.greenhouse.io,andurilindustries,Job Application for Senior Site Reliability Engineer at Anduril ...,,,https://boards.greenhouse.io/andurilindustries/jobs/5055674007?gh_jid=5055674007,serp::https://boards.greenhouse.io/andurilindustries/jobs/5055674007?gh_jid=5055674007,,"Senior Site Reliability Engineer. Costa Mesa, California, United States. Apply. Anduril Industries is a defense technology ..."
2026-04-24 12:56:53,serp:boards.greenhouse.io,appspace,Job Application for Senior Site Reliability Engineer at Appspace,,,https://boards.greenhouse.io/appspace/jobs/5977665004,serp::https://boards.greenhouse.io/appspace/jobs/5977665004,,"Senior Site Reliability Engineer. Tampa, Florida, United States Remote. Apply ... In this Senior SRE role, you will be responsible for designing ..."
2026-04-24 12:56:53,serp:boards.greenhouse.io,andurilindustries,Senior Site Reliability Engineer,,,https://boards.greenhouse.io/andurilindustries/jobs/5050317007?gh_jid=5050317007,serp::https://boards.greenhouse.io/andurilindustries/jobs/5050317007?gh_jid=5050317007,,"Senior Site Reliability Engineer - Deployed, Connected Warfare. Costa Mesa, California, United States. Apply. Anduril Industries is a defense technology ..."
2026-04-24 12:56:53,serp:boards.greenhouse.io,cookunity,Senior Site Reliability Engineer,,,https://boards.greenhouse.io/cookunity/jobs/7589959003,serp::https://boards.greenhouse.io/cookunity/jobs/7589959003,,"Senior Site Reliability Engineer - B2B. Engineering. Argentina (Remote). About CookUnity: Food has lost its soul to modern convenience. And with it, it has ..."
2026-04-24 12:56:53,serp:boards.greenhouse.io,clarityinnovates,Job Application for Site Reliability Engineer at Clarity Innovations,,,https://boards.greenhouse.io/clarityinnovates/jobs/5114300007,serp::https://boards.greenhouse.io/clarityinnovates/jobs/5114300007,,"Site Reliability Engineer. Remote. Apply. Clarity Innovations is a trusted national security partner, dedicated to safeguarding our nation's interests and ..."
2026-04-24 12:56:53,serp:boards.greenhouse.io,bluerivertech,Blue River Technology,,,https://boards.greenhouse.io/bluerivertech/jobs/7739711,serp::https://boards.greenhouse.io/bluerivertech/jobs/7739711,,"Sr Platform Engineer, CVML. Department: PlatformLocation: Remote-US. Apply Now ... Work Location: Remote in the United States; Visa sponsorship will be ..."
2026-04-24 12:56:53,serp:boards.greenhouse.io,ridgeline,"Senior Platform Engineer, Data Persistence",,,https://boards.greenhouse.io/ridgeline/jobs/7615707003?gh_jid=7615707003?ref=employbl,serp::https://boards.greenhouse.io/ridgeline/jobs/7615707003?gh_jid=7615707003?ref=employbl,,"Senior Platform Engineer, Data Persistence. New York, NY ... You must be work authorized in the United States without the need for employer sponsorship."
2026-04-24 12:56:53,serp:boards.greenhouse.io,chime,"Mobile Software Engineer, Cross Platform",,,https://boards.greenhouse.io/chime/jobs/8433838002,serp::https://boards.greenhouse.io/chime/jobs/8433838002,,"As a mobile platform engineer ... Whether you're coming in regularly or are part of our fully remote program, you'll stay engaged with your work and teammates."
2026-04-24 12:56:53,serp:boards.greenhouse.io,pinterest,"Sr. Software Engineer, tvScientific",,,https://boards.greenhouse.io/pinterest/jobs/7782563,serp::https://boards.greenhouse.io/pinterest/jobs/7782563,,"Visit our PinFlex page to learn more about our working model. #LI-SM4. #LI-REMOTE ... ML Platform Engineer, tvScientific. Save Saved. San ..."
2026-04-24 12:56:53,serp:boards.greenhouse.io,dvtrading,Job Application for Senior Cloud Engineer (Remote) at DV Trading,,,https://boards.greenhouse.io/dvtrading/jobs/4687488005,serp::https://boards.greenhouse.io/dvtrading/jobs/4687488005,,Senior Cloud Engineer (Remote). Remote. Apply Now. About Us: Founded 20 years ... United States military operation for which an Armed Forces service medal ...
2026-04-24 12:56:53,serp:boards.greenhouse.io,andurilindustries,"Senior Cloud Engineer, Multinational Digital Infrastructure",,,https://boards.greenhouse.io/andurilindustries/jobs/5117576007,serp::https://boards.greenhouse.io/andurilindustries/jobs/5117576007,,"Senior Cloud Engineer, Multinational Digital Infrastructure. Boston ... If you are a United States citizen or national, please answer with ""N/A"". It ..."
2026-04-24 12:56:53,serp:boards.greenhouse.io,accenturefederalservices,"Job Application for Cloud Engineer (Winchester, VA) at Accenture ...",,,https://boards.greenhouse.io/accenturefederalservices/jobs/4674065006?gh_jid=4674065006,serp::https://boards.greenhouse.io/accenturefederalservices/jobs/4674065006?gh_jid=4674065006,,"Cloud Engineer (Winchester, VA). Arlington, VA. Apply. At Accenture ... United States Postal Service, and USAID (see list of exceptions below). NOTE ..."
2026-04-24 12:56:53,serp:boards.greenhouse.io,comptechcomputertechnologies,Job Application for Senior Systems Administrator at CompTech ...,,,https://boards.greenhouse.io/comptechcomputertechnologies/jobs/5197085008,serp::https://boards.greenhouse.io/comptechcomputertechnologies/jobs/5197085008,,Google Associate Cloud Engineer; Google Professional Cloud Architect. 3 ... United States military operation for which an Armed Forces service medal was ...
2026-04-24 12:56:53,serp:boards.greenhouse.io,sezzle,Job Application for Senior Security Infrastructure Engineer at Sezzle,,,https://boards.greenhouse.io/sezzle/jobs/7694885003,serp::https://boards.greenhouse.io/sezzle/jobs/7694885003,,"Senior Security Infrastructure Engineer. Colombia, Remote. Apply. The salary range for this role is $5,000 - $9,500 per month (Gross in USD). About Sezzle: With ..."
