collected_at_utc,source_type,company,title,location,team,url,external_id,posted_at,description_snippet
2026-04-25 12:37:04,serp:jobs.ashbyhq.com,craft.co,Sr. DevSecOps Engineer (US) @ Craft Machine Inc,,,https://jobs.ashbyhq.com/craft.co/9c0bcae2-0ee4-40a8-98ca-f92bc8b77e88/application,serp::https://jobs.ashbyhq.com/craft.co/9c0bcae2-0ee4-40a8-98ca-f92bc8b77e88/application,,DevSecOps Engineer (US). Location. US (Remote). Employment Type. Full time. Location Type. Remote. Department. Engineering. OverviewApplication. Autofill from ...
2026-04-25 12:37:04,serp:jobs.ashbyhq.com,tessera-labs,Cloud Infrastructure/DevOps Engineer @ Tessera Labs,,,https://jobs.ashbyhq.com/tessera-labs/3f8e8ada-2727-409a-991d-a31245b314c7,serp::https://jobs.ashbyhq.com/tessera-labs/3f8e8ada-2727-409a-991d-a31245b314c7,,Cloud Infrastructure/DevOps Engineer. Location. San Jose Office (HQ); Remote. Employment Type. Full time. Location Type. Hybrid. Department. Platform ...
2026-04-25 12:37:04,serp:jobs.ashbyhq.com,onebrief,"Cloud Infrastructure Engineer, Battle Road @ Onebrief",,,https://jobs.ashbyhq.com/onebrief/e2584bd8-7d9a-40fc-ba88-048af7c96aa0,serp::https://jobs.ashbyhq.com/onebrief/e2584bd8-7d9a-40fc-ba88-048af7c96aa0,,"Cloud Infrastructure Engineer, Battle Road. Location. United States | Remote. Employment Type. Full time. Location Type. Remote. Department. Battle Road Digital ..."
2026-04-25 12:37:04,serp:jobs.ashbyhq.com,hatch,Senior Cloud Infrastructure Engineer @ Hatch,,,https://jobs.ashbyhq.com/hatch/4c62ae75-eeb3-48c3-96c1-4c30c90b81b0,serp::https://jobs.ashbyhq.com/hatch/4c62ae75-eeb3-48c3-96c1-4c30c90b81b0,,Senior Cloud Infrastructure Engineer. Location. United States. Employment Type. Full time. Location Type. Remote. Department. Engineering. OverviewApplication.
2026-04-25 12:37:04,serp:jobs.ashbyhq.com,runlayer,Site Reliability @ Runlayer,,,https://jobs.ashbyhq.com/runlayer/48700d2d-dcbc-4c6d-8fa1-cca50e0fdf5d,serp::https://jobs.ashbyhq.com/runlayer/48700d2d-dcbc-4c6d-8fa1-cca50e0fdf5d,,"... remote MCP server with Anthropic. The co-creator of MCP is on our cap table ... Reliability Engineer, you'll own the reliability, performance, and ..."
2026-04-25 12:37:04,serp:apply.workable.com,therapynotes,TherapyNotes.com,,,https://apply.workable.com/therapynotes/j/15991C5E7D/,serp::https://apply.workable.com/therapynotes/j/15991C5E7D/,,DevOps Engineer. RemoteITFull time. United States. OverviewApplication. Share this job. SVGs not supported by this browser. Description. About Us. TherapyNotes ...
2026-04-25 12:37:04,serp:apply.workable.com,cocreativ,Senior DevOps Engineer,,,https://apply.workable.com/cocreativ/j/B1EE2D34C1,serp::https://apply.workable.com/cocreativ/j/B1EE2D34C1,,"Senior DevOps Engineer. HybridglobaleditFull time. New York, New York, United States ... We're looking for a Senior DevOps Engineer to take ownership of our ..."
2026-04-25 12:37:04,serp:apply.workable.com,tp-link-usa-corp,Senior Site Reliability Engineer,,,https://apply.workable.com/tp-link-usa-corp/j/797F8FB32B/,serp::https://apply.workable.com/tp-link-usa-corp/j/797F8FB32B/,,"Headquartered in the United States, TP-Link Systems Inc. is a ... Hands-on experience in SRE, DevOps, cloud operations, and cloud security best practices."
2026-04-25 12:37:04,serp:apply.workable.com,cathexis,Site Reliability Engineer,,,https://apply.workable.com/cathexis/j/BE6A4F1B2D/,serp::https://apply.workable.com/cathexis/j/BE6A4F1B2D/,,"Site Reliability Engineer - Top Secret (req-236). On-siteInformation TechnologyFull time. Tysons, Virginia, United States ... The Site Reliability Engineer (SRE) ..."
2026-04-25 12:37:04,serp:apply.workable.com,toucanberry,Azure Platform Engineer (Nearshore),,,https://apply.workable.com/toucanberry/j/5124344708,serp::https://apply.workable.com/toucanberry/j/5124344708,,Benefits. Fully Remote; Outside IR35; B2B Contract; Long Term; Mid Azure Platform Engineer - c£250/day; Senior Azure ...
2026-04-25 12:37:04,serp:apply.workable.com,cloudlinux-1,Senior IaaS / Kubernetes Platform Engineer (worldwide remote ...,,,https://apply.workable.com/cloudlinux-1/j/B2133E51A6/,serp::https://apply.workable.com/cloudlinux-1/j/B2133E51A6/,,"Senior IaaS / Kubernetes Platform Engineer (worldwide remote, work anywhere) ... We are driven by our principles: do the right thing, employees first, we are ..."
2026-04-25 12:37:04,serp:apply.workable.com,little-journey,Senior Infrastructure & Data Platform Engineer,,,https://apply.workable.com/little-journey/j/D2C9DDA950,serp::https://apply.workable.com/little-journey/j/D2C9DDA950,,Senior Infrastructure & Data Platform Engineer. RemoteFull time. Leeds ... We're looking for a Senior Infrastructure and Data Platform Engineer to own ...
2026-04-25 12:37:04,serp:apply.workable.com,tetrascience,Lead Software Engineer,,,https://apply.workable.com/tetrascience/j/00D96E7292/,serp::https://apply.workable.com/tetrascience/j/00D96E7292/,,"We're looking for a Lead/Principal Platform Engineer to lead that effort. ... Flexible working arrangements - Remote work; Company paid Life Insurance, LTD ..."
2026-04-25 12:37:04,serp:apply.workable.com,clickbank-19,Senior Cloud Engineer,,,https://apply.workable.com/clickbank-19/j/35F903F113/apply/,serp::https://apply.workable.com/clickbank-19/j/35F903F113/apply/,,"Senior Cloud Engineer. RemoteIT OperationsFull time. Boise, Idaho, United States."
2026-04-25 12:37:04,serp:apply.workable.com,systems-engineering-solutions-corporation,Systems Engineering Solutions Corporation,,,https://apply.workable.com/systems-engineering-solutions-corporation/j/3391A79D24/,serp::https://apply.workable.com/systems-engineering-solutions-corporation/j/3391A79D24/,,"FinOps Cloud Engineer. HybridFull time. Boston, Massachusetts, United States. Montgomery, Alabama, United States. OverviewApplication. Share this job. SVGs not ..."
2026-04-25 12:37:04,serp:apply.workable.com,fpmarkets,DevOps/Infrastructure Engineer (remote),,,https://apply.workable.com/fpmarkets/j/B87BA671B9/,serp::https://apply.workable.com/fpmarkets/j/B87BA671B9/,,We are growing and looking to recruit a Full-time DevOps/Infrastructure Engineer (remote). Responsibilities: Build and maintain CI/CD pipelines for automated ...
2026-04-25 12:37:04,serp:apply.workable.com,eqltech,Infrastructure Engineer,,,https://apply.workable.com/eqltech/j/A7180F0623/,serp::https://apply.workable.com/eqltech/j/A7180F0623/,,"Infrastructure Engineer. On-siteEngineering, Product & TechFull time. San Francisco, California, United States. Phoenix, Arizona, United States. Overview ..."
2026-04-25 12:37:04,serp:apply.workable.com,evolv-technology,Sr. Data Infrastructure Engineer,,,https://apply.workable.com/evolv-technology/j/B9262FDEB6,serp::https://apply.workable.com/evolv-technology/j/B9262FDEB6,,"Evolv Technologies Inc. Sr. Data Infrastructure Engineer. HybridEngineeringR0699. Waltham, Massachusetts, United States."
2026-04-25 12:37:04,serp:apply.workable.com,imetalx,DevSecOps Engineer,,,https://apply.workable.com/imetalx/j/603BE0E687/apply/,serp::https://apply.workable.com/imetalx/j/603BE0E687/apply/,,"DevSecOps Engineer. On-siteEngineeringFull time. Dayton, Ohio, United States ... *Do you have 4+ years of experience in a DevOps/DevSecOps/Platform Engineer or ..."
2026-04-25 12:37:04,serp:apply.workable.com,trinetix,Cloud Infrastructure Engineer,,,https://apply.workable.com/trinetix/j/607C4D90A6/apply/,serp::https://apply.workable.com/trinetix/j/607C4D90A6/apply/,,"Cloud Infrastructure Engineer. HybridSTA0022. Nashville, Tennessee, United States. Brentwood ..."
2026-04-25 12:37:04,serp:apply.workable.com,creativechaos,Lead Cloud Infrastructure Engineer (Azure+AWS),,,https://apply.workable.com/creativechaos/j/778E2FD691/,serp::https://apply.workable.com/creativechaos/j/778E2FD691/,,... cloud infrastructure across Azure (primary) and AWS. This role exists to ... Lead Cloud Infrastructure Engineer (Azure+AWS). Remote. Pakistan. Overview ...
2026-04-25 12:37:04,serp:apply.workable.com,palona,AI Reliability Engineer,,,https://apply.workable.com/palona/j/94F7EFDBDD/,serp::https://apply.workable.com/palona/j/94F7EFDBDD/,,"AI Reliability Engineer. HybridProduct EngineeringFull time. Seattle, Washington, United States ... As an AI Reliability Engineer, you will: Design and build ..."
2026-04-25 12:37:04,serp:apply.workable.com,twgai,Platform Reliability Engineer,,,https://apply.workable.com/twgai/j/E974265187/,serp::https://apply.workable.com/twgai/j/E974265187/,,"Platform Reliability Engineer. On-siteAI Product EngineeringFull time. Jacksonville, Florida, United States ... We are seeking a Platform Reliability Engineer ..."
2026-04-25 12:37:04,serp:jobs.smartrecruiters.com,mirantis,Mirantis Senior DevOps Engineer,,,https://jobs.smartrecruiters.com/Mirantis/744000109788455-senior-devops-engineer,serp::https://jobs.smartrecruiters.com/Mirantis/744000109788455-senior-devops-engineer,,"Senior DevOps Engineer. Riga, Latvia Employees can work ... Work in a global, collaborative, remote-first culture that rewards initiative and execution."
2026-04-25 12:37:04,serp:jobs.smartrecruiters.com,accoliteinc,Accolite Inc. DevOps (Remote Position),,,https://jobs.smartrecruiters.com/AccoliteInc/743999662588883-devops-remote-position-,serp::https://jobs.smartrecruiters.com/AccoliteInc/743999662588883-devops-remote-position-,,"DevOps (Remote Position). OR-99W, Portland, OR, USA; Contract. Job Description. Job Position ... IT DevOps Engineer (Hybrid position). Eurofins; Bogotá, Colombia."
2026-04-25 12:37:04,serp:jobs.smartrecruiters.com,nbcuniversal3,NBCUniversal Site Reliability Engineer,,,https://jobs.smartrecruiters.com/NBCUniversal3/744000122298602-site-reliability-engineer-nexthink,serp::https://jobs.smartrecruiters.com/NBCUniversal3/744000122298602-site-reliability-engineer-nexthink,,"Site Reliability Engineer - Nexthink ... Develop and implement automation strategies, including Nexthink remote actions and scripts, to proactively remediate ..."
2026-04-25 12:37:04,serp:jobs.smartrecruiters.com,abbvie,Senior Site Reliability Engineer (Remote),,,https://jobs.smartrecruiters.com/AbbVie/3743990012089126-senior-site-reliability-engineer-remote-?oga=true&trid=8dc3fc18-7d27-474f-af15-47b783076ace,serp::https://jobs.smartrecruiters.com/AbbVie/3743990012089126-senior-site-reliability-engineer-remote-?oga=true&trid=8dc3fc18-7d27-474f-af15-47b783076ace,,"Senior Site Reliability Engineer (Remote). Mettawa, IL, USA. Senior Site ... United States +1. Uruguay +598. US ..."
2026-04-25 12:37:04,serp:jobs.smartrecruiters.com,goldstonepartners,"Goldstone Partners, Inc. Senior Azure Engineer",,,https://jobs.smartrecruiters.com/goldstonepartners/744000121861587-senior-azure-engineer-us-remote,serp::https://jobs.smartrecruiters.com/goldstonepartners/744000121861587-senior-azure-engineer-us-remote,,"Applicants must be currently authorized to work in the United States without current or future visa sponsorship. ... DevOps Platform Engineer – US Remote. Golden, ..."
2026-04-25 12:37:04,serp:jobs.smartrecruiters.com,pddninc,PDDN INC. Senior Cloud Engineer W2 Hiring,,,https://jobs.smartrecruiters.com/PDDNINC/744000122765599--senior-cloud-engineer-w2-hiring,serp::https://jobs.smartrecruiters.com/PDDNINC/744000122765599--senior-cloud-engineer-w2-hiring,,"... Cloud Engineer with 10+ years of experience to design, build, and operate ... ASIC Verification Engineer - ARM Remote Job. Santa Clara, CA. Show all jobs ..."
2026-04-25 12:37:04,serp:jobs.smartrecruiters.com,artechinformationsystemllc,Artech Information System LLC Infrastructure Engineer,,,https://jobs.smartrecruiters.com/ArtechInformationSystemLLC/743999659207404-infrastructure-engineer,serp::https://jobs.smartrecruiters.com/ArtechInformationSystemLLC/743999659207404-infrastructure-engineer,,"Infrastructure Engineer. Ashburn, VA; Contract. Company ... • Ability to provide remote leadership and direction within conference bridge environments."
2026-04-25 12:37:04,serp:jobs.smartrecruiters.com,abbvie,AbbVie Application Security Engineer (Remote),,,https://jobs.smartrecruiters.com/AbbVie/3743990012688861-application-security-engineer-remote-,serp::https://jobs.smartrecruiters.com/AbbVie/3743990012688861-application-security-engineer-remote-,,"Application Security Engineer (Remote). Portland, ME, USA ... Experience implementing DevSecOps workflows in cloud environments such as AWS and Azure."
2026-04-25 12:37:04,serp:jobs.smartrecruiters.com,oteemoinc,Senior DevSecOps Engineer,,,https://jobs.smartrecruiters.com/OteemoInc/744000111137612-senior-devsecops-engineer?oga=true&trid=8dc3fc18-7d27-474f-af15-47b783076ace,serp::https://jobs.smartrecruiters.com/OteemoInc/744000111137612-senior-devsecops-engineer?oga=true&trid=8dc3fc18-7d27-474f-af15-47b783076ace,,"Senior DevSecOps Engineer. Manassas, VA, Manassas, VA, United States."
2026-04-25 12:37:04,serp:jobs.smartrecruiters.com,nextstepsystems,"Cloud Software Engineer with Java or C/C++, TS/SCI with a Full ...",,,https://jobs.smartrecruiters.com/NextStepSystems/744000117503257-cloud-software-engineer-with-java-or-c-c-ts-sci-with-a-full-scope-polygraph-security-clearance-required-onsite,serp::https://jobs.smartrecruiters.com/NextStepSystems/744000117503257-cloud-software-engineer-with-java-or-c-c-ts-sci-with-a-full-scope-polygraph-security-clearance-required-onsite,,... Cloud Infrastructure. Duties include design & development of new ... This is a 100% Onsite position and not open for Hybrid and/or Remote.
2026-04-25 12:37:04,serp:jobs.smartrecruiters.com,lancesoftinc2,Customer Reliability Engineer,,,https://jobs.smartrecruiters.com/LanceSoftInc2/86320131-customer-reliability-engineer-applications-engineer?oga=true&trid=8dc3fc18-7d27-474f-af15-47b783076ace,serp::https://jobs.smartrecruiters.com/LanceSoftInc2/86320131-customer-reliability-engineer-applications-engineer?oga=true&trid=8dc3fc18-7d27-474f-af15-47b783076ace,,"Customer Reliability Engineer/ Applications Engineer. Lisle, IL. Customer ... United States +1. Uruguay +598. US ..."
