collected_at_utc,source_type,company,title,location,team,url,external_id,posted_at,description_snippet
2026-05-05 13:08:20,serp:apply.workable.com,healthcare-management-administrators,Service Reliability Engineer II (Claims Operations),,,https://apply.workable.com/healthcare-management-administrators/j/52B307C47D/,serp::https://apply.workable.com/healthcare-management-administrators/j/52B307C47D/,,"Service Reliability Engineer II (Claims Operations). RemoteInformation TechnologyFull time. Bellevue, Washington, United States ... Reliability Engineer ..."
2026-05-05 13:08:20,serp:jobs.smartrecruiters.com,accoliteinc,Accolite Inc. DevOps (Remote Position),,,https://jobs.smartrecruiters.com/AccoliteInc/743999662588883-devops-remote-position-,serp::https://jobs.smartrecruiters.com/AccoliteInc/743999662588883-devops-remote-position-,,"DevOps (Remote Position). OR-99W, Portland, OR, USA; Contract. Job Description. Job Position ... IT DevOps Engineer (Hybrid position). Eurofins; Bogotá, Colombia."
2026-05-05 13:08:20,serp:jobs.smartrecruiters.com,parlaygames,Senior AWS DevOps Engineer (Web3- iGaming),,,https://jobs.smartrecruiters.com/ParlayGames/743999901606706-senior-aws-devops-engineer-web3-igaming-remote,serp::https://jobs.smartrecruiters.com/ParlayGames/743999901606706-senior-aws-devops-engineer-web3-igaming-remote,,Senior AWS DevOps Engineer (Web3- iGaming) - Remote. We are looking for a Senior AWS DevOps Engineer (PH -Based) to join our team to help with managing our ...
2026-05-05 13:08:20,serp:jobs.smartrecruiters.com,aristanetworks,FedRAMP Site Reliability Engineer (FedSRE),,,https://jobs.smartrecruiters.com/AristaNetworks/744000095464732-fedramp-site-reliability-engineer-fedsre-cloudvision,serp::https://jobs.smartrecruiters.com/AristaNetworks/744000095464732-fedramp-site-reliability-engineer-fedsre-cloudvision,,"... SRE team. SREs at Arista combine strong ... FedRAMP Site Reliability Engineer (FedSRE) - CloudVision. Remote, United States Employees can work remotely ..."
2026-05-05 13:08:20,serp:jobs.smartrecruiters.com,rackspacethe1managedcloudcompany,"Rackspace, the #1 managed cloud company Site Reliability Engineer",,,https://jobs.smartrecruiters.com/RackspaceThe1ManagedCloudCompany/743999675748333-site-reliability-engineer,serp::https://jobs.smartrecruiters.com/RackspaceThe1ManagedCloudCompany/743999675748333-site-reliability-engineer,,US REMOTE** **WORK FROM HOME**Rackspace Professional Services is helping ... Senior Site Reliability Engineer (SRE) – CloudVision as a Service (CVaaS).
2026-05-05 13:08:20,serp:jobs.smartrecruiters.com,goldstonepartners,"Goldstone Partners, Inc. DevOps Platform Engineer",,,https://jobs.smartrecruiters.com/goldstonepartners/744000115491827-devops-platform-engineer-us-remote,serp::https://jobs.smartrecruiters.com/goldstonepartners/744000115491827-devops-platform-engineer-us-remote,,"DevOps Platform Engineer – US Remote. Golden, CO, USA Employees can work remotely; Full-time. Compensation: USD 120,000 - USD 130,000 - yearly. Company ..."
2026-05-05 13:08:20,serp:jobs.smartrecruiters.com,nexthink,Nexthink Platform Engineer,,,https://jobs.smartrecruiters.com/Nexthink/744000111780468-platform-engineer,serp::https://jobs.smartrecruiters.com/Nexthink/744000111780468-platform-engineer,,"... Platform Engineer, you will own, evolve, and automate our enablement ... Hybrid work model balancing office and remote work, with a structured ..."
2026-05-05 13:08:20,serp:jobs.smartrecruiters.com,cloudnexacom,Senior Cloud Support Engineer,,,https://jobs.smartrecruiters.com/Cloudnexacom/743999802774594-level-3-senior-cloud-support-engineer,serp::https://jobs.smartrecruiters.com/Cloudnexacom/743999802774594-level-3-senior-cloud-support-engineer,,"As an AWS Cloud Engineer, you will be the 3rd Level Support responsible for ... Verify the right to work within the United States. Job Location. Google ..."
2026-05-05 13:08:20,serp:jobs.smartrecruiters.com,dev2,"Dev Regular/Senior Security Engineer, SecOps",,,https://jobs.smartrecruiters.com/Dev2/743999785102409-regular-senior-security-engineer-secops,serp::https://jobs.smartrecruiters.com/Dev2/743999785102409-regular-senior-security-engineer-secops,,"Manager, Cyber Threat Researcher, Cyber Intelligence (Remote-Eligible) ... Senior Professional DevSecOps Engineer (m/w/d) Java - Kompositversicherung (KFZ)."
2026-05-05 13:08:20,serp:jobs.smartrecruiters.com,abbvie,"AbbVie Engineer, Reliability II",,,https://jobs.smartrecruiters.com/AbbVie/3743990012932976-engineer-reliability-ii,serp::https://jobs.smartrecruiters.com/AbbVie/3743990012932976-engineer-reliability-ii,,"Other jobs at AbbVie. Principal Instrumentation & Controls Engineer. Worcester, MA. Senior Site Reliability Engineer (Remote). Mettawa, IL. Senior Principal ..."
