collected_at_utc,source_type,company,title,location,team,url,external_id,posted_at,description_snippet
2026-04-24 12:56:53,serp:apply.workable.com,systems-engineering-solutions-corporation,Systems Engineering Solutions Corporation,,,https://apply.workable.com/systems-engineering-solutions-corporation/j/5E8674A381/,serp::https://apply.workable.com/systems-engineering-solutions-corporation/j/5E8674A381/,,... DevOps Engineer. SES is seeking a DevOps Engineer supporting AWS ... DevOps Engineer. RemoteFull time. United States. OverviewApplication. Share this ...
2026-04-24 12:56:53,serp:apply.workable.com,riverside-insights,Senior DevOps Engineer,,,https://apply.workable.com/riverside-insights/j/85C5050596/,serp::https://apply.workable.com/riverside-insights/j/85C5050596/,,"Senior DevOps Engineer. RemoteClassroom, Classroom - EngineeringFull time. United States ... As a Senior DevOps Engineer, you will provide key technical ..."
2026-04-24 12:56:53,serp:apply.workable.com,platinum-list,Senior DevOps Engineer (remote),,,https://apply.workable.com/platinum-list/j/383C961E6D/apply/,serp::https://apply.workable.com/platinum-list/j/383C961E6D/apply/,,"Senior DevOps Engineer (remote) - AWS Cloud Hosting Platform ... Save time by importing your resume in one of the following formats: .pdf, .doc, .docx, .odt, or ."
2026-04-24 12:56:53,serp:apply.workable.com,workstate,Senior DevOps Engineer (Bazel),,,https://apply.workable.com/workstate/j/A94FD966D7/,serp::https://apply.workable.com/workstate/j/A94FD966D7/,,Workstate is seeking a DevOps Engineer with deep ... remote caching/execution ... Experience tuning Bazel remote cache and remote execution performance ...
2026-04-24 12:56:53,serp:apply.workable.com,aravo,Lead DevOps Engineer-SaaS Platform,,,https://apply.workable.com/aravo/j/7EC1A11DA3/,serp::https://apply.workable.com/aravo/j/7EC1A11DA3/,,"Aravo Solutions, Inc. Lead DevOps Engineer-SaaS Platform. HybridEngineeringFull time. Austin, Texas, United States."
2026-04-24 12:56:53,serp:apply.workable.com,libertexgroup,Site Reliability Engineer (Remote),,,https://apply.workable.com/libertexgroup/j/A262A42E8B/,serp::https://apply.workable.com/libertexgroup/j/A262A42E8B/,,"Site Reliability Engineer (Remote). RemoteInformation Technology. Overview ... We're looking for a hands-on SRE to ensure our platforms remain fast, reliable, and ..."
2026-04-24 12:56:53,serp:apply.workable.com,satsuma,Senior Site Reliability Engineer,,,https://apply.workable.com/satsuma/j/FFE6AEF596/apply/,serp::https://apply.workable.com/satsuma/j/FFE6AEF596/apply/,,"Senior Site Reliability Engineer. RemoteFull time. Austin, Texas, United States. OverviewApplication. Autofill application. Save time by importing your resume ..."
2026-04-24 12:56:53,serp:apply.workable.com,fable-1,Senior Site Reliability Engineer (SRE),,,https://apply.workable.com/fable-1/j/C49AEB4FED,serp::https://apply.workable.com/fable-1/j/C49AEB4FED,,"Senior Site Reliability Engineer (SRE). RemoteEngineeringFull time. Ontario ... As a Senior Site Reliability Engineer at Fable, you will play a critical ..."
2026-04-24 12:56:53,serp:apply.workable.com,qodeworld,Sr. Site Reliability Engineer,,,https://apply.workable.com/qodeworld/j/AD0DFA033E,serp::https://apply.workable.com/qodeworld/j/AD0DFA033E,,"Description. Role: Sr. Site Reliability Engineer (SRE) – Unified Observability & AIOps. Location: Austin, TX / Fort Mill, SC (Hybrid). Job Type: Full Time. Role ..."
2026-04-24 12:56:53,serp:apply.workable.com,satsuma,Senior Site Reliability Engineer,,,https://apply.workable.com/satsuma/j/2AE40C57BE/,serp::https://apply.workable.com/satsuma/j/2AE40C57BE/,,"Senior Site Reliability Engineer. RemoteFull time. Austin, Texas, United ... We're looking for a Senior SRE to own the reliability, scalability, and ..."
2026-04-24 12:56:53,serp:apply.workable.com,tyk-technologies,Site Reliability Engineer,,,https://apply.workable.com/tyk-technologies/j/8B2AC5C97A/,serp::https://apply.workable.com/tyk-technologies/j/8B2AC5C97A/,,"As a remote first company, you will have the opportunity to work with an ... Writing and maintaining documentation on SRE processes and policies ..."
2026-04-24 12:56:53,serp:apply.workable.com,alex-staff-agency-careers,Cloud / Platform Engineer (Remote),,,https://apply.workable.com/alex-staff-agency-careers/j/FC9253089D/,serp::https://apply.workable.com/alex-staff-agency-careers/j/FC9253089D/,,Cloud / Platform Engineer (Remote) ; Description · Support and develop AWS or GCP infrastructure (multi-region). Operate and troubleshoot Kubernetes platforms.
2026-04-24 12:56:53,serp:apply.workable.com,netx,Platform Engineer,,,https://apply.workable.com/netx/j/5AC4409BA0,serp::https://apply.workable.com/netx/j/5AC4409BA0,,"Platform Engineer. RemoteFull time. United States. OverviewApplication. Share ... The Platform Engineer is responsible for designing, building, and ..."
2026-04-24 12:56:53,serp:apply.workable.com,commercial-lending,"World Business Lenders, LLC",,,https://apply.workable.com/commercial-lending/j/687D6C0F9C,serp::https://apply.workable.com/commercial-lending/j/687D6C0F9C,,... United States that do not have access to traditional financing. The . ... Remote - Azure Platform Engineer. Remote. OverviewApplication. Share this job.
2026-04-24 12:56:53,serp:apply.workable.com,constructor-1,Platform Engineer: Platform Solutions (Remote),,,https://apply.workable.com/constructor-1/j/16EC82BD53/apply/,serp::https://apply.workable.com/constructor-1/j/16EC82BD53/apply/,,Platform Engineer: Platform Solutions (Remote). RemoteEngineering. OverviewApplication. Autofill application. Save time by importing your resume in one of the ...
2026-04-24 12:56:53,serp:apply.workable.com,visium,Platform Engineer (Azure/AWS),,,https://apply.workable.com/visium/j/3C217A0234/,serp::https://apply.workable.com/visium/j/3C217A0234/,,"Platform Engineer (Azure/AWS). RemoteEngineeringFull time. Barcelona ... As a Platform Engineer, you will own the design and evolution of cloud platforms ..."
2026-04-24 12:56:53,serp:apply.workable.com,worthai,Data Platform Engineer,,,https://apply.workable.com/worthai/j/D44E761CFF/,serp::https://apply.workable.com/worthai/j/D44E761CFF/,,"Data Platform Engineer. RemoteEngineeringFull time. Orlando, Florida, United States."
2026-04-24 12:56:53,serp:apply.workable.com,commercial-lending,"World Business Lenders, LLC",,,https://apply.workable.com/commercial-lending/j/900864697A/apply/,serp::https://apply.workable.com/commercial-lending/j/900864697A/apply/,,... United States that do not have access to traditional financing. The . ... Remote - Azure Platform Engineer. Remote. OverviewApplication. Autofill ...
2026-04-24 12:56:53,serp:apply.workable.com,aretum,Cloud / Platform Engineer,,,https://apply.workable.com/aretum/j/A58E597453/,serp::https://apply.workable.com/aretum/j/A58E597453/,,"Cloud / Platform Engineer. RemoteVeterans AffairsFull time. McLean, Virginia, United States ... As a Cloud / Platform Engineer, you will deploy, configure, and ..."
2026-04-24 12:56:53,serp:apply.workable.com,mindex,Senior AWS Cloud Engineer,,,https://apply.workable.com/mindex/j/5F72EE9A18/,serp::https://apply.workable.com/mindex/j/5F72EE9A18/,,"Senior AWS Cloud Engineer - Remote (Req. #757). RemoteCloudFull time. Rochester, New York, United States. OverviewApplication. Share this job. SVGs not ..."
2026-04-24 12:56:53,serp:apply.workable.com,the-ripple-way,NLM Cloud/System Engineer,,,https://apply.workable.com/the-ripple-way/j/43A4EB5641,serp::https://apply.workable.com/the-ripple-way/j/43A4EB5641,,"NLM Cloud/System Engineer. On-siteClient Delivery, Digital TransformationFull time2026-10. Rockville, Maryland, United States ... The Cloud Engineer will play a ..."
2026-04-24 12:56:53,serp:apply.workable.com,two95-international-inc-3,Cloud Infra Ops/Cloud Engineer,,,https://apply.workable.com/two95-international-inc-3/j/2DD152062F/,serp::https://apply.workable.com/two95-international-inc-3/j/2DD152062F/,,Description. ob Title: Cloud Infrastructure Operations / Cloud Engineer. Experience: 1–3 Years. Location: Open / Remote / Onsite. Employment Type: Full-Time.
2026-04-24 12:56:53,serp:apply.workable.com,protera,Jobs By Workable,,,https://apply.workable.com/protera/j/6352CA48B5/,serp::https://apply.workable.com/protera/j/6352CA48B5/,,"Cloud Engineer. RemoteCloudOpsFull time. United States. OverviewApplication ... The Cloud Engineer is responsible for Operations (design, installation and ..."
2026-04-24 12:56:53,serp:apply.workable.com,the-ripple-way,NLM Lead Cloud Engineer,,,https://apply.workable.com/the-ripple-way/j/32B36E3BE7/apply/,serp::https://apply.workable.com/the-ripple-way/j/32B36E3BE7/apply/,,"NLM Lead Cloud Engineer. On-siteClient Delivery, Digital TransformationFull time2026-14-1. Bethesda, Maryland, United States. OverviewApplication. Autofill ..."
2026-04-24 12:56:53,serp:apply.workable.com,mindex,Senior AWS Cloud Engineer,,,https://apply.workable.com/mindex/j/5F72EE9A18/apply/,serp::https://apply.workable.com/mindex/j/5F72EE9A18/apply/,,"Senior AWS Cloud Engineer - Remote (Req. #757). RemoteCloudFull time. Rochester, New York, United States. OverviewApplication. Autofill application. Save time ..."
2026-04-24 12:56:53,serp:apply.workable.com,mlabs,Senior Infrastructure Engineer,,,https://apply.workable.com/mlabs/j/94F4F1BD49/apply/,serp::https://apply.workable.com/mlabs/j/94F4F1BD49/apply/,,"Senior Infrastructure Engineer. RemoteAGF262519. New York, New York, United States. Washington, District of Columbia, United States. Boston, Massachusetts, ..."
2026-04-24 12:56:53,serp:apply.workable.com,maxana,Infrastructure Engineer,,,https://apply.workable.com/maxana/j/8FC5EEF581/,serp::https://apply.workable.com/maxana/j/8FC5EEF581/,,"Infrastructure Engineer. HybridFull time. New York, New York, United States. San Francisco, California, United States. Seattle, Washington, United States."
2026-04-24 12:56:53,serp:apply.workable.com,systems-engineering-solutions-corporation,Cloud Infrastructure Engineer,,,https://apply.workable.com/systems-engineering-solutions-corporation/j/25C6B3C979,serp::https://apply.workable.com/systems-engineering-solutions-corporation/j/25C6B3C979,,"Cloud Infrastructure Engineer. HybridFull time. Boston, Massachusetts, United States. Huntsville, Alabama, United States. OverviewApplication. Share this job."
2026-04-24 12:56:53,serp:apply.workable.com,mlabs,Senior Infrastructure Engineer,,,https://apply.workable.com/mlabs/j/94F4F1BD49/,serp::https://apply.workable.com/mlabs/j/94F4F1BD49/,,"Location: Remote - Remote - Based In ET+2 / -3, NY PreferredRemote | Full ... Senior Infrastructure Engineer. RemoteAGF262519. New York, New York, United States."
2026-04-24 12:56:53,serp:apply.workable.com,kraftkennedy,Microsoft Cloud Support Infrastructure Engineer,,,https://apply.workable.com/kraftkennedy/j/B0530C6B82/apply/,serp::https://apply.workable.com/kraftkennedy/j/B0530C6B82/apply/,,Microsoft Cloud Support Infrastructure Engineer. RemoteInfrastructure and Enterprise Systems (IES)Full time. United States. OverviewApplication. Autofill ...
2026-04-24 12:56:53,serp:apply.workable.com,fpmarkets,DevOps/Infrastructure Engineer (remote),,,https://apply.workable.com/fpmarkets/j/B87BA671B9/apply/,serp::https://apply.workable.com/fpmarkets/j/B87BA671B9/apply/,,DevOps/Infrastructure Engineer (remote). RemotePartners & Business DevelopmentFull time. Argentina. OverviewApplication. Autofill application. Save time by ...
2026-04-24 12:56:53,serp:apply.workable.com,surglobal,Windows Infrastructure Engineer,,,https://apply.workable.com/surglobal/j/E3CBBEABF3,serp::https://apply.workable.com/surglobal/j/E3CBBEABF3,,"Windows Infrastructure Engineer ... Understanding of application publishing, user access management, and optimizing performance for remote app users."
2026-04-24 12:56:53,serp:apply.workable.com,mlabs,Senior Infrastructure Engineer,,,https://apply.workable.com/mlabs/j/918C17F086/,serp::https://apply.workable.com/mlabs/j/918C17F086/,,Senior Infrastructure Engineer - Blockchain Wallet Backbone. Location: Remote - United States. Compensation: $180K - $300K.
2026-04-24 12:56:53,serp:apply.workable.com,kraftkennedy,Microsoft Cloud Support Infrastructure Engineer,,,https://apply.workable.com/kraftkennedy/j/B0530C6B82/,serp::https://apply.workable.com/kraftkennedy/j/B0530C6B82/,,Microsoft Cloud Support Infrastructure Engineer. RemoteInfrastructure and Enterprise Systems (IES)Full time. United States. OverviewApplication. Share this job.
2026-04-24 12:56:53,serp:apply.workable.com,opendatajobs,"Software Developer (Remote, Secret Clearance Preferred)",,,https://apply.workable.com/opendatajobs/j/57ADC6CFA9/,serp::https://apply.workable.com/opendatajobs/j/57ADC6CFA9/,,"Potomac, Maryland, United States ... You are comfortable working across SharePoint, Power Platform, and modern development frameworks, and you see DevSecOps ..."
2026-04-24 12:56:53,serp:apply.workable.com,geodelphi,DevSecOps Engineer,,,https://apply.workable.com/geodelphi/j/25B453E437/,serp::https://apply.workable.com/geodelphi/j/25B453E437/,,"DevSecOps Engineer. RemoteEngineeringFull time. United States. Alexandria, Virginia ..."
2026-04-24 12:56:53,serp:apply.workable.com,thaloz,Jobs By Workable,,,https://apply.workable.com/thaloz/j/1F1F00AF5A/,serp::https://apply.workable.com/thaloz/j/1F1F00AF5A/,,"Clearco is hiring a Senior DevSecOps ... Define and maintain end-user device security standards, including requirements for EDR and remote access tooling, and ..."
2026-04-24 12:56:53,serp:apply.workable.com,imetalx,DevSecOps Engineer (cleared),,,https://apply.workable.com/imetalx/j/1A17AFDD1A/,serp::https://apply.workable.com/imetalx/j/1A17AFDD1A/,,"DevSecOps Engineer (cleared). On-siteEngineeringFull time. Sausalito, California, United States ... 4+ years of experience in a DevOps/DevSecOps/Platform ..."
2026-04-24 12:56:53,serp:apply.workable.com,futurae,Security Engineer (DevSecOps),,,https://apply.workable.com/futurae/j/33039DCD9F/,serp::https://apply.workable.com/futurae/j/33039DCD9F/,,"Several years of experience with security engineering, DevSecOps, computer and network security, PKI and security protocols. ... Joint co-working days for remote ..."
2026-04-24 12:56:53,serp:apply.workable.com,imetalx,CyberSecurity & DevSecOps Engineer,,,https://apply.workable.com/imetalx/j/620D0C0ED9/,serp::https://apply.workable.com/imetalx/j/620D0C0ED9/,,"CyberSecurity & DevSecOps Engineer - Summer Internship 2026. On-siteEngineeringTemporary. Sausalito, California, United States ... DevSecOps Engineer - Summer ..."
2026-04-24 12:56:53,serp:apply.workable.com,alex-staff-agency-careers,Cloud / Platform Engineer (Remote),,,https://apply.workable.com/alex-staff-agency-careers/j/6C11C16FB5/,serp::https://apply.workable.com/alex-staff-agency-careers/j/6C11C16FB5/,,"This role is focused on production reliability, Kubernetes, and cloud infrastructure, not just CI/CD. ... Fully remote work. Mature, blame-free engineering ..."
2026-04-24 12:56:53,serp:apply.workable.com,remote-raven,AI & Cloud Engineering,,,https://apply.workable.com/remote-raven/j/B327D744A2,serp::https://apply.workable.com/remote-raven/j/B327D744A2,,Build and maintain AI systems and cloud infrastructure in accordance with ... Requirements. This is a 100% Remote Job. Full time. Rate is $10/hr. Apply for ...
2026-04-24 12:56:53,serp:apply.workable.com,leading-path-consulting,Cloud Solutions Engineer (TS/SCI w/ FS Poly required),,,https://apply.workable.com/leading-path-consulting/j/A772C2A783/,serp::https://apply.workable.com/leading-path-consulting/j/A772C2A783/,,"Demonstrated experience in cloud infrastructure-as-code networking and service administration, to include deploying, operating, and maintaining web services on ..."
2026-04-24 12:56:53,serp:apply.workable.com,two95-international-inc-3,Azure Cloud Infrastructure,,,https://apply.workable.com/two95-international-inc-3/j/E29507A844/,serp::https://apply.workable.com/two95-international-inc-3/j/E29507A844/,,Two95 International Inc. Title - Cloud DevOps - Azure Cloud Infrastructure. RemoteITContract. United States.
2026-04-24 12:56:53,serp:apply.workable.com,libertexgroup,Site Reliability Engineer (Remote),,,https://apply.workable.com/libertexgroup/j/A262A42E8B,serp::https://apply.workable.com/libertexgroup/j/A262A42E8B,,Site Reliability Engineer (Remote). RemoteInformation Technology. OverviewApplication. Share this job. SVGs not supported by this browser. Description.
2026-04-24 12:56:53,serp:apply.workable.com,soracom,Customer Reliability Engineer (Fully Remote),,,https://apply.workable.com/soracom/j/A0C4CB649D/apply/,serp::https://apply.workable.com/soracom/j/A0C4CB649D/apply/,,"Customer Reliability Engineer (Fully Remote) ... Save time by importing your resume in one of the following formats: .pdf, .doc, .docx, .odt, or .rtf."
2026-04-24 12:56:53,serp:apply.workable.com,systems-engineering-solutions-corporation,Systems Engineering Solutions ...,,,https://apply.workable.com/systems-engineering-solutions-corporation/j/3A513722EC/,serp::https://apply.workable.com/systems-engineering-solutions-corporation/j/3A513722EC/,,"Reliability Engineer. HybridFull time. Hanscom Air Force Base, Massachusetts, United States. Boston, Massachusetts, United States. OverviewApplication. Share ..."
2026-04-24 12:56:53,serp:apply.workable.com,j,Customer Reliability Engineer (Fully Remote),,,https://apply.workable.com/j/7031C8FA7C,serp::https://apply.workable.com/j/7031C8FA7C,,"About SoracomSoracom was founded in 2014 by AWS veterans with a clear vision to build a more connected world. Today, Soracom serves over 8000 customers and ..."
2026-04-24 12:56:53,serp:apply.workable.com,tecsys,Site Reliability Engineer,,,https://apply.workable.com/tecsys/j/C2935323AC/,serp::https://apply.workable.com/tecsys/j/C2935323AC/,,"Tecsys Inc. Site Reliability Engineer. RemoteProduct & TechnologyFull time. Montreal, Quebec, Canada."
2026-04-24 12:56:53,serp:jobs.smartrecruiters.com,360itprofessionals1,360 IT Professionals Remote Devops Engineer,,,https://jobs.smartrecruiters.com/360ITProfessionals1/743999651587409-remote-devops-engineer,serp::https://jobs.smartrecruiters.com/360ITProfessionals1/743999651587409-remote-devops-engineer,,"Remote Devops Engineer. Chicago, IL; Full-time. Company Description. We are focused on imparting effective business staffing services through high level cost ..."
2026-04-24 12:56:53,serp:jobs.smartrecruiters.com,renesaselectronics,Renesas Electronics DevOps Engineer,,,https://jobs.smartrecruiters.com/RenesasElectronics/744000122343590-devops-engineer,serp::https://jobs.smartrecruiters.com/RenesasElectronics/744000122343590-devops-engineer,,"DevOps Engineer. Los Angeles, CA, United States Employees work in a hybrid mode ... Our people-first culture and global support system, including the remote ..."
2026-04-24 12:56:53,serp:jobs.smartrecruiters.com,parlaygames,Senior AWS DevOps Engineer (Web3- iGaming),,,https://jobs.smartrecruiters.com/ParlayGames/743999901606706-senior-aws-devops-engineer-web3-igaming-remote,serp::https://jobs.smartrecruiters.com/ParlayGames/743999901606706-senior-aws-devops-engineer-web3-igaming-remote,,Senior AWS DevOps Engineer (Web3- iGaming) - Remote. We are looking for a Senior AWS DevOps Engineer (PH -Based) to join our team to help with managing our ...
2026-04-24 12:56:53,serp:jobs.smartrecruiters.com,abbvie,AbbVie Senior Site Reliability Engineer (Remote),,,https://jobs.smartrecruiters.com/AbbVie/3743990012089126-senior-site-reliability-engineer-remote-,serp::https://jobs.smartrecruiters.com/AbbVie/3743990012089126-senior-site-reliability-engineer-remote-,,"Senior Site Reliability Engineer (Remote). Mettawa, IL, USA Employees work in ... The SRE, coordinating with developers, will monitor the pulse of ..."
2026-04-24 12:56:53,serp:jobs.smartrecruiters.com,sectigo,Sectigo Site Reliability Engineer,,,https://jobs.smartrecruiters.com/Sectigo/3743990012649436-site-reliability-engineer,serp::https://jobs.smartrecruiters.com/Sectigo/3743990012649436-site-reliability-engineer,,... remote position based in the U.K. . ... Ensure the reliability of our critical products and services by meeting or exceeding SRE objectives.
2026-04-24 12:56:53,serp:jobs.smartrecruiters.com,now100,Now100 Site Reliability Engineer - SRE,,,https://jobs.smartrecruiters.com/Now100/743999884115973-site-reliability-engineer-sre,serp::https://jobs.smartrecruiters.com/Now100/743999884115973-site-reliability-engineer-sre,,"Site Reliability Engineer - SRE. Paces Ferry Rd, Atlanta, GA, United States Employees can work remotely; Contract. Company Description. Now100 is committed to ..."
2026-04-24 12:56:53,serp:jobs.smartrecruiters.com,servicenow,ServiceNow Technical Lead Site Reliability Engineer,,,https://jobs.smartrecruiters.com/ServiceNow/744000122552779--technical-lead-site-reliability-engineer-veza-,serp::https://jobs.smartrecruiters.com/ServiceNow/744000122552779--technical-lead-site-reliability-engineer-veza-,,"Experience and interest in SRE leadership; Strong experience with ... Work personas (flexible, remote, or required in office) are categories that ..."
2026-04-24 12:56:53,serp:jobs.smartrecruiters.com,bet3651,bet365 Site Reliability Engineer,,,https://jobs.smartrecruiters.com/Bet3651/744000116627647-site-reliability-engineer,serp::https://jobs.smartrecruiters.com/Bet3651/744000116627647-site-reliability-engineer,,"Regulatory Data Developer (Remote) ... Similar jobs. Senior Site Reliability Engineer FedRAMP. CyberArk; Boston, Massachusetts. Senior Site Reliability Engineer ( ..."
2026-04-24 12:56:53,serp:jobs.smartrecruiters.com,experian,"Experian Senior Data Platform Engineer, Remote",,,https://jobs.smartrecruiters.com/Experian/744000122554299-senior-data-platform-engineer-remote,serp::https://jobs.smartrecruiters.com/Experian/744000122554299-senior-data-platform-engineer-remote,,"Senior Data Platform Engineer, Remote. United States, United States, United States, United States Employees can work remotely; Full-time. Employee Status ..."
2026-04-24 12:56:53,serp:jobs.smartrecruiters.com,wellmarkinc,"Wellmark, Inc. Platform Engineer - Tech Incubation",,,https://jobs.smartrecruiters.com/WellmarkInc/744000121197283-platform-engineer-tech-incubation,serp::https://jobs.smartrecruiters.com/WellmarkInc/744000121197283-platform-engineer-tech-incubation,,"Platform Engineer - Tech Incubation. Des Moines, IA, USA ... United States. This includes, but IS NOT LIMITED TO: F1-OPT, F1-CPT ..."
2026-04-24 12:56:53,serp:jobs.smartrecruiters.com,blueally,BlueAlly Platform Engineer,,,https://jobs.smartrecruiters.com/BlueAlly/744000114703579-platform-engineer,serp::https://jobs.smartrecruiters.com/BlueAlly/744000114703579-platform-engineer,,"Platform Engineer. Manila, Metro Manila, Philippines Employees can work ... ***This role is 100% remote. I'm interested · I'm interested. Cookies Settings."
2026-04-24 12:56:53,serp:jobs.smartrecruiters.com,goldstonepartners,DevOps Platform Engineer – US Remote,,,https://jobs.smartrecruiters.com/goldstonepartners/744000115491827-devops-platform-engineer-us-remote?oga=true,serp::https://jobs.smartrecruiters.com/goldstonepartners/744000115491827-devops-platform-engineer-us-remote?oga=true,,"DevOps Platform Engineer – US Remote. Golden, CO, USA. DevOps Platform ... United States +1. Uruguay +598. US ..."
2026-04-24 12:56:53,serp:jobs.smartrecruiters.com,cyberark1,Back End Platform Engineer (Machine Identity Security) hybrid,,,https://jobs.smartrecruiters.com/Cyberark1/744000119519107-senior-software-engineer-back-end-platform-engineer-machine-identity-security-hybrid,serp::https://jobs.smartrecruiters.com/Cyberark1/744000119519107-senior-software-engineer-back-end-platform-engineer-machine-identity-security-hybrid,,"Senior Software Engineer - Back End Platform Engineer (Machine Identity Security) hybrid. Santa Clara, California, United States Employees work in a hybrid ..."
2026-04-24 12:56:53,serp:jobs.smartrecruiters.com,nexthink,Nexthink Platform Engineer,,,https://jobs.smartrecruiters.com/Nexthink/744000111780468-platform-engineer,serp::https://jobs.smartrecruiters.com/Nexthink/744000111780468-platform-engineer,,"... Platform Engineer, you will own, evolve, and automate our enablement ... Hybrid work model balancing office and remote work, with a structured ..."
2026-04-24 12:56:53,serp:jobs.smartrecruiters.com,goldstonepartners,Senior Azure Cloud Engineer,,,https://jobs.smartrecruiters.com/goldstonepartners/744000117931877-senior-azure-cloud-engineer-us-remote?oga=true,serp::https://jobs.smartrecruiters.com/goldstonepartners/744000117931877-senior-azure-cloud-engineer-us-remote?oga=true,,"Senior Azure Cloud Engineer - US Remote. Oak Brook, IL, USA. Senior Azure ... United States +1. Uruguay +598. US ..."
2026-04-24 12:56:53,serp:jobs.smartrecruiters.com,ignatiuzcom,Google Cloud Engineer,,,https://jobs.smartrecruiters.com/Ignatiuzcom/87284586-google-cloud-engineer?oga=true&trid=8dc3fc18-7d27-474f-af15-47b783076ace,serp::https://jobs.smartrecruiters.com/Ignatiuzcom/87284586-google-cloud-engineer?oga=true&trid=8dc3fc18-7d27-474f-af15-47b783076ace,,"Google Cloud Engineer. Atlanta, GA. Google Cloud Engineer. Easy Apply. Choose ... United States +1. Uruguay +598. US ..."
2026-04-24 12:56:53,serp:jobs.smartrecruiters.com,westerndigital,Western Digital AWS Cloud Engineer / Administrator,,,https://jobs.smartrecruiters.com/WesternDigital/744000117053907-aws-cloud-engineer-administrator,serp::https://jobs.smartrecruiters.com/WesternDigital/744000117053907-aws-cloud-engineer-administrator,,"AWS Cloud Engineer / Administrator. 5601 Great Oaks Parkway, San Jose ... remote jobs that can be performed in California, Colorado and New York. This ..."
