collected_at_utc,source_type,company,title,location,team,url,external_id,posted_at,description_snippet
2026-04-24 12:56:53,serp:job-boards.greenhouse.io,beaconbiosignals,Job Application for Site Reliability Engineer at Beacon Biosignals,,,http://job-boards.greenhouse.io/beaconbiosignals/jobs/4105184009,serp::http://job-boards.greenhouse.io/beaconbiosignals/jobs/4105184009,,"Site Reliability Engineer. Boston, MA - Remote. Apply. Beacon Biosignals is on a mission to ..."
2026-04-24 12:56:53,serp:job-boards.greenhouse.io,customerio,Job Application for Senior Site Reliability Engineer at Customer.io,,,http://job-boards.greenhouse.io/customerio/jobs/7688375,serp::http://job-boards.greenhouse.io/customerio/jobs/7688375,,"Senior Site Reliability Engineer. Americas Remote. Apply. About Customer.io. Over 8,000 companies - from ..."
2026-04-24 12:56:53,serp:jobs.ashbyhq.com,highlightta,DevOps Engineer @ HighlightTA,,,https://jobs.ashbyhq.com/highlightta/03ec9df0-ef3e-4121-a6a7-960d531c6be1,serp::https://jobs.ashbyhq.com/highlightta/03ec9df0-ef3e-4121-a6a7-960d531c6be1,,"DevOps Engineer ... If you're passionate about using your skills to drive real impact and want to thrive in a collaborative, fully remote environment, Neon One is ..."
2026-04-24 12:56:53,serp:jobs.ashbyhq.com,10xteam,8-20hrs/week,,,https://jobs.ashbyhq.com/10xteam/1318bb44-d731-4b83-bf7a-90914097db8d,serp::https://jobs.ashbyhq.com/10xteam/1318bb44-d731-4b83-bf7a-90914097db8d,,DevOps Lead - AI Trainer - Freelance - 8-20hrs/week - Remote ... Are you an experienced DevOps engineer who instinctively spots gaps ...
2026-04-24 12:56:53,serp:jobs.ashbyhq.com,bespokelabs,DevOps Engineer (Contract) — Auto Test @ Bespoke Labs,,,https://jobs.ashbyhq.com/bespokelabs/1a9fdb50-5e30-4655-8f00-1210fcb906e3,serp::https://jobs.ashbyhq.com/bespokelabs/1a9fdb50-5e30-4655-8f00-1210fcb906e3,,DevOps Engineer (Contract) — Auto Test. Location. Remote. Employment Type ... This role is open to candidates based in the United States. Responsibilities ...
2026-04-24 12:56:53,serp:jobs.ashbyhq.com,flipper,Senior @ Flipper - Jobs,,,https://jobs.ashbyhq.com/flipper/6853d62b-a6f9-4cb2-91be-aa96b6f1af36?utm_source=5q3OE442Za,serp::https://jobs.ashbyhq.com/flipper/6853d62b-a6f9-4cb2-91be-aa96b6f1af36?utm_source=5q3OE442Za,,"Remote, Remote. Employment Type. Full time. Location Type. Remote. Department ... That's why we are looking for a DevOps Engineer experienced with cloud-native ..."
2026-04-24 12:56:53,serp:jobs.ashbyhq.com,havocai,DevOps Engineer @ HavocAI,,,https://jobs.ashbyhq.com/havocai/0ec8458c-bd5b-480e-9028-d7a2243df0cc,serp::https://jobs.ashbyhq.com/havocai/0ec8458c-bd5b-480e-9028-d7a2243df0cc,,DevOps Engineer. Location. Remote. Employment Type. Full time. Location Type. Remote. Department. Cloud. Compensation. $150K – $175K • Offers Equity • Offers ...
2026-04-24 12:56:53,serp:jobs.ashbyhq.com,kraken.com,SRE / DevOps Engineer @ Kraken,,,https://jobs.ashbyhq.com/kraken.com/0e512814-a14c-4ea7-8391-7d1c3e540bb9,serp::https://jobs.ashbyhq.com/kraken.com/0e512814-a14c-4ea7-8391-7d1c3e540bb9,,SRE / DevOps Engineer ; Location. United States ; Employment Type. Full time ; Location Type. Remote ; Department. EngineeringSRE / Devops ; Compensation. $96K – ...
2026-04-24 12:56:53,serp:jobs.ashbyhq.com,knox-systems,Level 3 (L3) DevOps Engineer (Mid-level) @ Knox Systems,,,https://jobs.ashbyhq.com/knox-systems/39e19189-1c03-4a6e-b023-578359224fb9,serp::https://jobs.ashbyhq.com/knox-systems/39e19189-1c03-4a6e-b023-578359224fb9,,Level 3 (L3) DevOps Engineer (Mid-level). Location. Remote. Employment Type. Full time. Location Type. Remote. Department. OperationsDevOps. Compensation. $120K ...
2026-04-24 12:56:53,serp:jobs.ashbyhq.com,swap,DevOps Engineer @ Swap,,,https://jobs.ashbyhq.com/swap/ba796ff1-4b2c-4630-9371-ec73d637b786,serp::https://jobs.ashbyhq.com/swap/ba796ff1-4b2c-4630-9371-ec73d637b786,,"Location: Austin, Texas (Remote) ABOUT SWAP Swap is the infrastructure ... DevOps Engineer to join our growing team and help us build and maintain ..."
2026-04-24 12:56:53,serp:jobs.ashbyhq.com,homevision,Associate Site Reliability Engineer,,,https://jobs.ashbyhq.com/homevision/fb31c9cd-89c8-4001-8f51-303e504123e3,serp::https://jobs.ashbyhq.com/homevision/fb31c9cd-89c8-4001-8f51-303e504123e3,,Associate Site Reliability Engineer - US - Remote. Location. United States ... (Note: There is also an opening for a more senior SRE role - see the job board.).
2026-04-24 12:56:53,serp:jobs.ashbyhq.com,perchwell,Senior Site Reliability Engineer (Remote or NYC,,,https://jobs.ashbyhq.com/Perchwell/f1f6fa02-f905-4f43-b7c6-71a8e01cdc93,serp::https://jobs.ashbyhq.com/Perchwell/f1f6fa02-f905-4f43-b7c6-71a8e01cdc93,,"... SRE, you will help own and improve the ... Senior Site Reliability Engineer (Remote or NYC - Hybrid). Location. New York Office; United States - Remote ..."
2026-04-24 12:56:53,serp:jobs.ashbyhq.com,close,Site Reliability Engineer (USA Only,,,https://jobs.ashbyhq.com/close/6610824b-2d94-4071-90e0-bafc3b078870,serp::https://jobs.ashbyhq.com/close/6610824b-2d94-4071-90e0-bafc3b078870,,Site Reliability Engineer (USA Only - 100% Remote). Location. USA - Remote. Employment Type. Full time. Location Type. Remote. Department. Engineering ...
2026-04-24 12:56:53,serp:jobs.ashbyhq.com,hopper,"Senior Site Reliability Engineer, Platform & Cloud FinOps ...",,,https://jobs.ashbyhq.com/hopper/a9cb4379-e2a6-4064-b4db-884921a03c44,serp::https://jobs.ashbyhq.com/hopper/a9cb4379-e2a6-4064-b4db-884921a03c44,,"Senior Site Reliability Engineer, Platform & Cloud FinOps (100% Remote - USA Central & EST). Location. Boston - Remote; Austin - Remote ... Strong background in ..."
2026-04-24 12:56:53,serp:jobs.ashbyhq.com,andromeda,Senior Site Reliability Engineer,,,https://jobs.ashbyhq.com/andromeda/c0129afa-ddfb-47e1-9968-b3dbf27b5d55,serp::https://jobs.ashbyhq.com/andromeda/c0129afa-ddfb-47e1-9968-b3dbf27b5d55,,"Senior Site Reliability Engineer - AI Infrastructure Location: Global Remote / ... SRE role. You will design, operate, and debug large ..."
2026-04-24 12:56:53,serp:jobs.ashbyhq.com,close,Site Reliability Engineer (USA Only,,,https://jobs.ashbyhq.com/close/6610824b-2d94-4071-90e0-bafc3b078870/application,serp::https://jobs.ashbyhq.com/close/6610824b-2d94-4071-90e0-bafc3b078870/application,,Site Reliability Engineer (USA Only - 100% Remote) · Location · Employment Type · Location Type · Department · Compensation · General Application Questions · SRE.
2026-04-24 12:56:53,serp:jobs.ashbyhq.com,onebrief,"Senior Site Reliability Engineer, Colorado Springs @ Onebrief",,,https://jobs.ashbyhq.com/onebrief/7ffd6f91-00be-4b19-ad6f-0de369958acc,serp::https://jobs.ashbyhq.com/onebrief/7ffd6f91-00be-4b19-ad6f-0de369958acc,,"... remote company, though many of our employees work alongside our customers at ... Site Reliability Engineer to join our Infrastructure & Security team ..."
2026-04-24 12:56:53,serp:jobs.ashbyhq.com,flock%20safety,"Site Reliability Engineer III, Aviation @ Flock",,,https://jobs.ashbyhq.com/flock%20safety/8f4dd66b-9051-44c0-b192-54041d715e7c,serp::https://jobs.ashbyhq.com/flock%20safety/8f4dd66b-9051-44c0-b192-54041d715e7c,,"... SRE who will be responsible for designing and building systems, tooling, and ... Site Reliability Engineer III, Aviation. Location. Remote - USA ..."
2026-04-24 12:56:53,serp:jobs.ashbyhq.com,freeplay,Site Reliability Engineer (SRE) @ Freeplay,,,https://jobs.ashbyhq.com/Freeplay/e8b1745e-1ef8-45e7-9fd2-bfe183852296,serp::https://jobs.ashbyhq.com/Freeplay/e8b1745e-1ef8-45e7-9fd2-bfe183852296,,"Site Reliability Engineer (SRE). Location. Boulder, CO. Employment Type. Full time. Department. Engineering. Compensation. $135K – $180K • Offers Equity ..."
2026-04-24 12:56:53,serp:jobs.ashbyhq.com,propel,Senior Platform Engineer @ Propel,,,https://jobs.ashbyhq.com/propel/11265618-fbca-405c-b52f-a9b85ffe6aed/application,serp::https://jobs.ashbyhq.com/propel/11265618-fbca-405c-b52f-a9b85ffe6aed/application,,"... Platform Engineer looking to make a big ... remote-first working environment. Our ... Unfortunately, we can only hire in the United States at this time."
2026-04-24 12:56:53,serp:jobs.ashbyhq.com,homebase,Data & ML Platform Engineer (Hybrid) @ Homebase,,,https://jobs.ashbyhq.com/homebase/9e4ddfec-a157-4a33-a1f7-8132ee151e55/application,serp::https://jobs.ashbyhq.com/homebase/9e4ddfec-a157-4a33-a1f7-8132ee151e55/application,,... Platform Engineer will be part of the team responsible for designing and ... Other - I'm looking for a remote role and not able to work from a hub city.
2026-04-24 12:56:53,serp:jobs.ashbyhq.com,aerovy,Platform Engineer @ Aerovy,,,https://jobs.ashbyhq.com/aerovy/23e2cb86-64e0-46ac-bf6f-4acbc0ba6171/application,serp::https://jobs.ashbyhq.com/aerovy/23e2cb86-64e0-46ac-bf6f-4acbc0ba6171/application,,Platform Engineer. Location. Seattle ... Are you legally authorized to work in the United States without requiring visa sponsorship now or in the future?
2026-04-24 12:56:53,serp:jobs.ashbyhq.com,verisoul,Site Reliability & Infrastructure,,,https://jobs.ashbyhq.com/verisoul/9059c9fa-68f9-4ba7-b4f6-1c7d1ff4ae49,serp::https://jobs.ashbyhq.com/verisoul/9059c9fa-68f9-4ba7-b4f6-1c7d1ff4ae49,,... Remote Annually - Beautiful Office OUR VALUES 1. All-in Optimism: Building a ... Platform Engineer - Site Reliability & Infrastructure. Location. Austin ...
2026-04-24 12:56:53,serp:jobs.ashbyhq.com,10xteam,Platform Engineer,,,https://jobs.ashbyhq.com/10xteam/f9d62144-4bdc-40b5-9192-bcf78233375e/application,serp::https://jobs.ashbyhq.com/10xteam/f9d62144-4bdc-40b5-9192-bcf78233375e/application,,Platform Engineer - AI Trainer.
2026-04-24 12:56:53,serp:jobs.ashbyhq.com,virtuous,Lead Data Platform Engineer @ Virtuous,,,https://jobs.ashbyhq.com/virtuous/95b59805-65c6-466b-aa13-7eb8e350ee79/application?embed=js,serp::https://jobs.ashbyhq.com/virtuous/95b59805-65c6-466b-aa13-7eb8e350ee79/application?embed=js,,"Lead Data Platform Engineer. Location. Phoenix, AZ; Remote, USA. Employment Type. Full time. Department. Operations. OverviewApplication. Autofill from resume."
2026-04-24 12:56:53,serp:jobs.ashbyhq.com,spoton,Senior Platform Engineer @ SpotOn,,,https://jobs.ashbyhq.com/spoton/47a5833e-d6dc-4443-a77a-d46f2c4b5688/application,serp::https://jobs.ashbyhq.com/spoton/47a5833e-d6dc-4443-a77a-d46f2c4b5688/application,,... (Remote Friendly) The Infrastructure Delivery team is seeking a skilled Senior Platform Engineer to help us build the foundational infrastructure platform ...
2026-04-24 12:56:53,serp:jobs.ashbyhq.com,treeswift,Data Platform Engineer @ Treeswift Inc,,,https://jobs.ashbyhq.com/treeswift/12f0df75-2829-462e-a458-d6a156524f85/application,serp::https://jobs.ashbyhq.com/treeswift/12f0df75-2829-462e-a458-d6a156524f85/application,,... United States and are rapidly expanding across new customers and use cases ... Remote. Diversity Survey. This optional survey helps us evaluate our ...
2026-04-24 12:56:53,serp:jobs.ashbyhq.com,joor,Platform Engineer,,,https://jobs.ashbyhq.com/joor/c825e5c0-d79d-4d37-a9cc-18b30412debc/application,serp::https://jobs.ashbyhq.com/joor/c825e5c0-d79d-4d37-a9cc-18b30412debc/application,,Platform Engineer. Location. Central and South America. Employment Type. Contract. Location Type. Remote. Department. Engineering. OverviewApplication. Autofill ...
2026-04-24 12:56:53,serp:jobs.ashbyhq.com,thirstysprout,Full Stack Platform Engineer @ ThirstySprout,,,https://jobs.ashbyhq.com/thirstysprout/257a82a2-4f72-4142-993c-c33211dd2512,serp::https://jobs.ashbyhq.com/thirstysprout/257a82a2-4f72-4142-993c-c33211dd2512,,"... Platform Engineer at our client. In this role, you'll be responsible for designing and developing robust, scalable, and efficient ... Remote."
2026-04-24 12:56:53,serp:jobs.ashbyhq.com,ncontracts,Senior Cloud Engineer @ Ncontracts,,,https://jobs.ashbyhq.com/ncontracts/a517f2f0-08ec-40e4-8447-cedee86dde71?embed=js,serp::https://jobs.ashbyhq.com/ncontracts/a517f2f0-08ec-40e4-8447-cedee86dde71?embed=js,,Senior Cloud Engineer. Location. Remote. Employment Type. Full time. Location Type. Remote. Department. EngineeringPlatform Engineering. Compensation. $135K – ...
2026-04-24 12:56:53,serp:jobs.ashbyhq.com,handshake,Senior Cloud Engineer @ Handshake,,,https://jobs.ashbyhq.com/handshake/117385d2-2578-45ba-a7b6-417ec7b48166,serp::https://jobs.ashbyhq.com/handshake/117385d2-2578-45ba-a7b6-417ec7b48166,,"... Cloud Engineer, you'll be at the center of how we design, deploy, and ... Remote & Office: Internet, commuting, and free lunch/gym in our SF office ..."
2026-04-24 12:56:53,serp:jobs.ashbyhq.com,megazone,Megazone Cloud US,,,https://jobs.ashbyhq.com/megazone,serp::https://jobs.ashbyhq.com/megazone,,"Cloud Engineer Co-op. Tech • Rochester, NY • Full time • On-site. $20 – $30 ... Tech • United States- Remote • Full time • Remote. $110K – $140K • Offers ..."
2026-04-24 12:56:53,serp:jobs.ashbyhq.com,pragmatike,Senior Cloud Engineer @ Pragmatike,,,https://jobs.ashbyhq.com/pragmatike/28e6df59-0f6d-4e0a-b7cd-6155cb41bdbe,serp::https://jobs.ashbyhq.com/pragmatike/28e6df59-0f6d-4e0a-b7cd-6155cb41bdbe,,Senior Cloud Engineer. Location. Cambridge ; Boston ; California; New Jersey ... Remote option for Out-Of-State applicants. Start date: ASAP Languages ...
2026-04-24 12:56:53,serp:jobs.ashbyhq.com,fundingcircle,Senior Cloud Engineer (Cloud Platform) @ Funding Circle,,,https://jobs.ashbyhq.com/fundingcircle/479409be-a061-4cf8-9d62-928e1d1c70e2,serp::https://jobs.ashbyhq.com/fundingcircle/479409be-a061-4cf8-9d62-928e1d1c70e2,,"Senior Cloud Engineer (Cloud Platform) ... Experience working with AI infrastructure concepts such as MCP, remote agents, as well as tooling like AWS Bedrock."
2026-04-24 12:56:53,serp:jobs.ashbyhq.com,grindr%20llc,Senior Cloud Engineer @ Grindr,,,https://jobs.ashbyhq.com/Grindr%20LLC/30116d94-38bf-4f90-9065-24f2b66e82bb/application,serp::https://jobs.ashbyhq.com/Grindr%20LLC/30116d94-38bf-4f90-9065-24f2b66e82bb/application,,... Cloud Engineer who is passionate about development operations and ... Are you authorized to work in the United States for any employer? Yes No.
2026-04-24 12:56:53,serp:jobs.ashbyhq.com,megazone,Sr. Cloud Engineer- Infrastructure @ Megazone Cloud US,,,https://jobs.ashbyhq.com/megazone/c654a817-afc9-42b8-9b2f-90b658f060a6/application,serp::https://jobs.ashbyhq.com/megazone/c654a817-afc9-42b8-9b2f-90b658f060a6/application,,"Cloud Engineer- Infrastructure. Location. Rochester, NY; Frisco, TX; Irvine ... Open to remote work. Will you now or in the future require sponsorship for ..."
2026-04-24 12:56:53,serp:jobs.ashbyhq.com,crusoe,Atlassian Cloud Engineer @ Crusoe,,,https://jobs.ashbyhq.com/Crusoe/06d1fdc2-215b-47ea-acac-37ec9fa9a86d/application?utm_source=Climatebase,serp::https://jobs.ashbyhq.com/Crusoe/06d1fdc2-215b-47ea-acac-37ec9fa9a86d/application?utm_source=Climatebase,,... Cloud Engineer to serve as the primary administrator and strategic ... United States military operation for which an Armed Forces service medal was ...
2026-04-24 12:56:53,serp:jobs.ashbyhq.com,handshake,Senior Cloud Engineer @ Handshake,,,https://jobs.ashbyhq.com/handshake/117385d2-2578-45ba-a7b6-417ec7b48166/application,serp::https://jobs.ashbyhq.com/handshake/117385d2-2578-45ba-a7b6-417ec7b48166/application,,"... Remote & Office: Internet, commuting, and free lunch/gym in our SF office ... United States military operation for which an Armed Forces service medal ..."
2026-04-24 12:56:53,serp:jobs.ashbyhq.com,tempo-xyz,"Infrastructure Engineer, Blockchain (Remote",,,https://jobs.ashbyhq.com/tempo-xyz/2572ff39-1777-4d0a-a2e1-c03ad4317bf2,serp::https://jobs.ashbyhq.com/tempo-xyz/2572ff39-1777-4d0a-a2e1-c03ad4317bf2,,Infrastructure Engineer.
2026-04-24 12:56:53,serp:jobs.ashbyhq.com,fieldguide,Infrastructure Engineer @ Fieldguide,,,https://jobs.ashbyhq.com/fieldguide/92cef08a-e3a4-4542-9973-e9005d70577d,serp::https://jobs.ashbyhq.com/fieldguide/92cef08a-e3a4-4542-9973-e9005d70577d,,"Infrastructure Engineer. Location. San Francisco, CA or Remote (USA). Employment Type. Full time. Location Type. Remote. Department. Engineering, Product, and ..."
2026-04-24 12:56:53,serp:jobs.ashbyhq.com,scrunch,Senior Infrastructure Engineer @ Scrunch,,,https://jobs.ashbyhq.com/scrunch/8182e8cf-12fe-4d3a-a143-ace3c8f7eddd,serp::https://jobs.ashbyhq.com/scrunch/8182e8cf-12fe-4d3a-a143-ace3c8f7eddd,,Senior Infrastructure Engineer. Location. Remote USA. Employment Type. Full ... 🖥️ Remote support: Phone and internet reimbursement Growth: L&D budget ...
2026-04-24 12:56:53,serp:jobs.ashbyhq.com,sentilink,Infrastructure Engineer (Experienced/Senior+ Levels) @ SentiLink,,,https://jobs.ashbyhq.com/sentilink/95231d9a-0567-44a8-ac1f-8f9dd12bac79,serp::https://jobs.ashbyhq.com/sentilink/95231d9a-0567-44a8-ac1f-8f9dd12bac79,,Infrastructure Engineer (Experienced/Senior+ Levels). Location. United States. Employment Type. Full time. Location Type. Remote ...
2026-04-24 12:56:53,serp:jobs.ashbyhq.com,workos,Infrastructure Engineer @ WorkOS,,,https://jobs.ashbyhq.com/workos/26a54ffa-9465-4d13-bc5f-db41a2bbe505,serp::https://jobs.ashbyhq.com/workos/26a54ffa-9465-4d13-bc5f-db41a2bbe505,,Infrastructure Engineer. Location. United States. Employment Type. Full time. Location Type. Remote ...
2026-04-24 12:56:53,serp:jobs.ashbyhq.com,atticus,Lead Infrastructure Engineer @ Atticus,,,https://jobs.ashbyhq.com/atticus/e27531ca-47c0-4282-87c3-65e6db4718d0,serp::https://jobs.ashbyhq.com/atticus/e27531ca-47c0-4282-87c3-65e6db4718d0,,Lead Infrastructure Engineer. Location. Remote. Employment Type. Full time. Location Type. Remote. Department. Engineering. OverviewApplication. About Atticus.
2026-04-24 12:56:53,serp:jobs.ashbyhq.com,vcluster,AI Infrastructure Engineer @ vCluster Labs,,,https://jobs.ashbyhq.com/vCluster/19a7f22e-ee7d-419b-bc9e-e2fa61dff2d1,serp::https://jobs.ashbyhq.com/vCluster/19a7f22e-ee7d-419b-bc9e-e2fa61dff2d1,,"AI Infrastructure Engineer. Location. Remote- US; USA - Boston; USA - New York ... As an AI Infrastructure Engineer, your role will include: Lead ..."
2026-04-24 12:56:53,serp:jobs.ashbyhq.com,unit410,"Cryptocurrency Infrastructure Engineer @ Unit 410, LLC",,,https://jobs.ashbyhq.com/unit410/e45281d5-2ca7-4db1-9b15-64c27f391604,serp::https://jobs.ashbyhq.com/unit410/e45281d5-2ca7-4db1-9b15-64c27f391604,,Cryptocurrency Infrastructure Engineer. Location. United States - Remote. Employment Type. Full time. Department. EngineeringInfrastructure. Compensation. $175K ...
2026-04-24 12:56:53,serp:jobs.ashbyhq.com,edgesource%20corporation,DevSecOps Engineer SME I,,,https://jobs.ashbyhq.com/edgesource%20corporation/79955ca6-e853-4c8e-83ea-b6af119b4005,serp::https://jobs.ashbyhq.com/edgesource%20corporation/79955ca6-e853-4c8e-83ea-b6af119b4005,,The DevSecOps Engineer SME I supports the implementation and maintenance of ... Flexible Work Schedules (Remote / Hybrid). Medical / Dental / Vision ...
2026-04-24 12:56:53,serp:jobs.ashbyhq.com,clearco,Senior DevSecOps Engineer @ Clearco,,,https://jobs.ashbyhq.com/clearco/2daf0010-f167-4bf2-80b5-f38c61fa311f,serp::https://jobs.ashbyhq.com/clearco/2daf0010-f167-4bf2-80b5-f38c61fa311f,,"... DevSecOps Engineer to operate at the intersection of Infrastructure, Security ... remote access tooling, and partner with stakeholders for operational ..."
2026-04-24 12:56:53,serp:jobs.ashbyhq.com,edgesource%20corporation,DevSecOps SME II @ Edgesource Corporation,,,https://jobs.ashbyhq.com/edgesource%20corporation/e6eefea3-2d35-4f76-a51b-c11d0351ef67,serp::https://jobs.ashbyhq.com/edgesource%20corporation/e6eefea3-2d35-4f76-a51b-c11d0351ef67,,"This role works closely with the Lead DevSecOps Engineer, internal engineering teams, and customer DevSecOps ... Flexible Work Schedules (Remote / Hybrid)."
2026-04-24 12:56:53,serp:jobs.ashbyhq.com,knox-systems,Devops Security Engineer @ Knox Systems,,,https://jobs.ashbyhq.com/knox-systems/747e6c89-9492-491a-8ccb-adbc148857e4,serp::https://jobs.ashbyhq.com/knox-systems/747e6c89-9492-491a-8ccb-adbc148857e4,,"Department: Operations Location: Remote (U.S.), West Coast hours preferred ... DevSecOps role responsible for securing cloud-native, multi-tenant ..."
2026-04-24 12:56:53,serp:jobs.ashbyhq.com,spear-ai,DevSecOps Engineer @ Spear AI,,,https://jobs.ashbyhq.com/spear-ai/dc756f51-3761-493b-b76e-781ab27b302c,serp::https://jobs.ashbyhq.com/spear-ai/dc756f51-3761-493b-b76e-781ab27b302c,,"We are seeking a DevSecOps Engineer to design, implement, and manage secure DevSecOps pipelines and cloud infrastructure ... Remote / Flexible."
2026-04-24 12:56:53,serp:jobs.ashbyhq.com,breaker,DevSecOps @ Breaker,,,https://jobs.ashbyhq.com/breaker/70f60bc5-929e-46d1-901a-ac1dc7b9247f,serp::https://jobs.ashbyhq.com/breaker/70f60bc5-929e-46d1-901a-ac1dc7b9247f,,"Platform Engineer (DevSecOps). TL;DR. Own and build Breaker's CI/CD platform from the ground up. GitLab, AWS, Docker, Infrastructure as Code."
2026-04-24 12:56:53,serp:jobs.ashbyhq.com,mercor,"Security Engineer, Cloud Infrastructure @ Mercor",,,https://jobs.ashbyhq.com/mercor/2734b1c6-4c50-4317-b3bc-3c7cad32bf4b,serp::https://jobs.ashbyhq.com/mercor/2734b1c6-4c50-4317-b3bc-3c7cad32bf4b,,"... remote. WHAT YOU'LL BUILD: - Multi-account AWS tenant isolation architecture ... Security Engineer, Cloud Infrastructure. Location. San Francisco; NYC ..."
2026-04-24 12:56:53,serp:jobs.ashbyhq.com,farsight,Cloud Infrastructure Engineer @ Farsight AI,,,https://jobs.ashbyhq.com/farsight/b4eca1e7-2c95-4c79-af7e-8b6bd0b0d431,serp::https://jobs.ashbyhq.com/farsight/b4eca1e7-2c95-4c79-af7e-8b6bd0b0d431,,"... remote). Job Description As a Cloud Infrastructure Engineer at Farsight AI, you'll lead the design, implementation, and management of infrastructure ..."
2026-04-24 12:56:53,serp:jobs.ashbyhq.com,rula,Sr. Infrastructure Security Engineer (Remote) @ Rula,,,https://jobs.ashbyhq.com/rula/88508717-63a0-4c94-acda-ca54fc266ab2,serp::https://jobs.ashbyhq.com/rula/88508717-63a0-4c94-acda-ca54fc266ab2,,"... cloud infrastructure. Overall, you'll encounter endless learning ... Infrastructure Security Engineer (Remote). Location. Remote - United States ..."
2026-04-24 12:56:53,serp:jobs.ashbyhq.com,valon,Senior Cloud Infrastructure Engineer @ Valon Tech,,,https://jobs.ashbyhq.com/valon/71dcb68c-302d-4f8c-80cf-c1bd5ac106d5,serp::https://jobs.ashbyhq.com/valon/71dcb68c-302d-4f8c-80cf-c1bd5ac106d5,,We also fully support remote work. About the Role. We're looking for a Senior Software Engineer to join our Cloud Infrastructure team within Platform ...
2026-04-24 12:56:53,serp:jobs.ashbyhq.com,vultr,Technical Support Specialist @ Vultr,,,https://jobs.ashbyhq.com/vultr/130eac96-6ec0-47fb-b57b-357f9ed799a9,serp::https://jobs.ashbyhq.com/vultr/130eac96-6ec0-47fb-b57b-357f9ed799a9,,... cloud infrastructure company. Vultr Cares - 100% company ... Technical Support Specialist. Location. Remote - United States. Employment Type.
2026-04-24 12:56:53,serp:jobs.ashbyhq.com,level,Cloud Infrastructure Engineer (senior or above) @ Level,,,https://jobs.ashbyhq.com/level/4d67ded7-116c-4528-b43f-f3f5ae52671f/application?utm_source=bandana,serp::https://jobs.ashbyhq.com/level/4d67ded7-116c-4528-b43f-f3f5ae52671f/application?utm_source=bandana,,"As a Cloud Infrastructure Engineer (senior or above) at Level, you will be a key technical leader within the team responsible for architecting, building, ..."
2026-04-24 12:56:53,serp:jobs.ashbyhq.com,arkenstonedefense,Systems Reliability Engineer @ Arkenstone Defense,,,https://jobs.ashbyhq.com/ArkenstoneDefense/6b71f94b-7461-4910-8e3f-b0a00d499d12,serp::https://jobs.ashbyhq.com/ArkenstoneDefense/6b71f94b-7461-4910-8e3f-b0a00d499d12,,Systems Reliability Engineer. Location. United States; Menlo Park or D.C.. Employment Type. Full time. Location Type. Remote. Department. MAC. Compensation.
2026-04-24 12:56:53,serp:jobs.ashbyhq.com,workos,Database Reliability Engineer @ WorkOS,,,https://jobs.ashbyhq.com/workos/599978f1-c834-4e42-aa44-23bc47518fad,serp::https://jobs.ashbyhq.com/workos/599978f1-c834-4e42-aa44-23bc47518fad,,"Database Reliability Engineer. Location. United States. Employment Type. Full ... We offer parental leave, paid-time off and fully remote working arrangements."
2026-04-24 12:56:53,serp:jobs.ashbyhq.com,perchwell,Senior Site Reliability Engineer (Remote or NYC,,,https://jobs.ashbyhq.com/Perchwell/f1f6fa02-f905-4f43-b7c6-71a8e01cdc93/application,serp::https://jobs.ashbyhq.com/Perchwell/f1f6fa02-f905-4f43-b7c6-71a8e01cdc93/application,,Senior Site Reliability Engineer (Remote or NYC - Hybrid). Location. New York Office; United States - Remote. Employment Type. Full time. Department.
2026-04-24 12:56:53,serp:jobs.ashbyhq.com,supabase,Customer Reliability Engineer @ Supabase,,,https://jobs.ashbyhq.com/supabase/26ad8432-a03e-40f9-a4cc-05344ceedfa3,serp::https://jobs.ashbyhq.com/supabase/26ad8432-a03e-40f9-a4cc-05344ceedfa3,,Customer Reliability Engineer. Location. AMER. Employment Type. Full time. Location Type. Remote ...
2026-04-24 12:56:53,serp:apply.workable.com,telestream,Jobs By Workable,,,https://apply.workable.com/telestream/j/ED54675F67/,serp::https://apply.workable.com/telestream/j/ED54675F67/,,DevOps Engineer. RemoteDevOpsFull timeDevOps Engineer. United States. Overview ... Candidates must be legally authorized to work in the United States.
2026-04-24 12:56:53,serp:apply.workable.com,resonance,DevOps Engineer (Mid-to-Senior Level),,,https://apply.workable.com/resonance/j/7938DFC75D/,serp::https://apply.workable.com/resonance/j/7938DFC75D/,,"DevOps Engineer (Mid-to-Senior Level). RemoteAI System DevelopmentFull time. New York, New York, United States ... Remote Work: This is a fully remote position."
