collected_at_utc,source_type,company,title,location,team,url,external_id,posted_at,description_snippet
2026-04-25 12:37:04,serp:jobs.lever.co,mcgovern,Patrick J McGovern Foundation,,,https://jobs.lever.co/mcgovern/885d7a1a-16f6-4326-9d7c-da7404dfd1f5,serp::https://jobs.lever.co/mcgovern/885d7a1a-16f6-4326-9d7c-da7404dfd1f5,,Jr DevOps Engineer. Remote. Strategy and Innovation – Products & Services /. Full-time /. Remote. apply for this job. About Us: The Patrick J. McGovern ...
2026-04-25 12:37:04,serp:jobs.lever.co,truv,Senior DevOps Engineer,,,https://jobs.lever.co/truv/4049ad13-7b17-4638-bf5d-2c4079474010,serp::https://jobs.lever.co/truv/4049ad13-7b17-4638-bf5d-2c4079474010,,Senior DevOps Engineer. Miami / New York / San Francisco. Engineering /. Remote /. Remote. apply for this job. About Truv. Truv is transforming the financial ...
2026-04-25 12:37:04,serp:jobs.lever.co,jobgether,Sr. Site Reliability Engineer,,,https://jobs.lever.co/jobgether/52ffd93b-10e9-437c-a009-568b42de1ceb,serp::https://jobs.lever.co/jobgether/52ffd93b-10e9-437c-a009-568b42de1ceb,,"We are currently looking for a Sr. Site Reliability Engineer in United States. This role sits at the core of building and maintaining highly reliable, scalable, ..."
2026-04-25 12:37:04,serp:jobs.lever.co,palantir,Site Reliability Engineer,,,https://jobs.lever.co/palantir/211f99dc-269e-4f25-84d3-d73dea782080,serp::https://jobs.lever.co/palantir/211f99dc-269e-4f25-84d3-d73dea782080,,"Site Reliability Engineer - US Government ... Based on business need, there are a few roles that allow for “Remote” work on an exceptional basis."
2026-04-25 12:37:04,serp:jobs.lever.co,jobgether,Platform Engineer – Senior Tech (Platform),,,https://jobs.lever.co/jobgether/666363a1-eaeb-44ac-90d0-8e09f4da1d79,serp::https://jobs.lever.co/jobgether/666363a1-eaeb-44ac-90d0-8e09f4da1d79,,We are currently looking for a Platform Engineer – Senior Tech (Platform) in United States. ... Fully remote role with the flexibility to work from anywhere.
2026-04-25 12:37:04,serp:jobs.lever.co,smiledigitalhealth,Senior Cloud Engineer,,,https://jobs.lever.co/smiledigitalhealth/3aa77182-9caa-4c9c-be1a-cbefa62e9b35,serp::https://jobs.lever.co/smiledigitalhealth/3aa77182-9caa-4c9c-be1a-cbefa62e9b35,,Senior Cloud Engineer - Remote US. Remote US. Technology & Delivery Ops – Cloud & Support Services /. Full Time /. Remote. apply for this job. Working for a ...
2026-04-25 12:37:04,serp:jobs.lever.co,smiledigitalhealth,Senior Cloud Engineer,,,https://jobs.lever.co/smiledigitalhealth/3aa77182-9caa-4c9c-be1a-cbefa62e9b35/apply,serp::https://jobs.lever.co/smiledigitalhealth/3aa77182-9caa-4c9c-be1a-cbefa62e9b35/apply,,"Senior Cloud Engineer - Remote US. Remote US. Technology & Delivery Ops ... Are you legally authorized to work in the United States?✱. Select... Yes, No."
2026-04-25 12:37:04,serp:jobs.lever.co,h1,Sr. DevOps AWS Cloud Engineer,,,https://jobs.lever.co/h1/73868723-fcc6-4338-896c-3a59b53eb934/apply?source=LinkedIn,serp::https://jobs.lever.co/h1/73868723-fcc6-4338-896c-3a59b53eb934/apply?source=LinkedIn,,DevOps AWS Cloud Engineer. New York. Technical Excellence – Technical Excellence /. Full time /. Remote. Submit your application. Resume/CV ✱. ATTACH RESUME/CV.
2026-04-25 12:37:04,serp:jobs.lever.co,innovativesol-2,Innovative Solutions,,,https://jobs.lever.co/innovativesol-2/398b2b92-a60f-43b7-acb4-30717addf359/apply,serp::https://jobs.lever.co/innovativesol-2/398b2b92-a60f-43b7-acb4-30717addf359/apply,,"Cloud Engineer - Full Stack Developer. Reports into Rochester, NY ... Are you legally authorized to work in the United States?✱. Yes; No. Will you ..."
2026-04-25 12:37:04,serp:jobs.lever.co,zencore,Senior Cloud Engineer (Short Term Contract),,,https://jobs.lever.co/zencore/f15d7703-cffa-43a8-94f4-d1fb3f291900,serp::https://jobs.lever.co/zencore/f15d7703-cffa-43a8-94f4-d1fb3f291900,,Senior Cloud Engineer (Short Term Contract). Remote. Engineering – Infrastructure /. Full-Time /. Remote. apply for this job. Zencore is a fast-growing company ...
2026-04-25 12:37:04,serp:jobs.lever.co,weloglobal,Cloud Infrastructure Engineer,,,https://jobs.lever.co/weloglobal/e5371726-7b59-448e-8c01-bdcacd1551f9,serp::https://jobs.lever.co/weloglobal/e5371726-7b59-448e-8c01-bdcacd1551f9,,"Cloud Infrastructure Engineer. Mexico City, Mexico. Welo Global – Technology /. Full Time /. Remote. apply for this job. About Welocalize. Welocalize, a Welo ..."
2026-04-25 12:37:04,serp:jobs.lever.co,sysdig,Senior Infrastructure Engineer,,,https://jobs.lever.co/sysdig/9c63b209-7dfa-489a-b75b-a033fde72850/apply,serp::https://jobs.lever.co/sysdig/9c63b209-7dfa-489a-b75b-a033fde72850/apply,,Senior Infrastructure Engineer. Flexible - USA. Engineering – INFRASTRUCTURE /. Regular - Full Time /. Remote. Submit your application. Resume/CV ✱. ATTACH ...
2026-04-25 12:37:04,serp:jobs.lever.co,pingwind,DevSecOps Senior Specialist,,,https://jobs.lever.co/pingwind/f457facc-4be7-418e-ab55-e5f01498e506,serp::https://jobs.lever.co/pingwind/f457facc-4be7-418e-ab55-e5f01498e506,,DevSecOps Senior Specialist. Multiple Locations. Upcoming Work – FT. Meade /. Remote. apply for this job. Location: Multiples Locations. Required Clearance: Top ...
2026-04-25 12:37:04,serp:jobs.lever.co,workwave,Cloud Security Engineer,,,https://jobs.lever.co/workwave/f67b1d54-83a6-4783-a280-be63c09a995b,serp::https://jobs.lever.co/workwave/f67b1d54-83a6-4783-a280-be63c09a995b,,... cloud infrastructure ... Join our Remote-First Global Work Community: WorkWave provides an innovative and dynamic remote-first Global Work Community that ...
2026-04-25 12:37:04,serp:jobs.lever.co,noodle,CloudOps Engineer III,,,https://jobs.lever.co/noodle/49f756dc-5a43-4edf-920f-2f4fbb6c2ca1?lever-source%5B%5D=careers.owlvc.com,serp::https://jobs.lever.co/noodle/49f756dc-5a43-4edf-920f-2f4fbb6c2ca1?lever-source%5B%5D=careers.owlvc.com,,"CloudOps Engineer III. Remote, South Africa ... As a CloudOps Engineer III, you will be responsible for the maintenance and enhancement of cloud infrastructure ..."
2026-04-25 12:37:04,serp:jobs.lever.co,investorflow,Site Reliability Engineer II Remote,,,https://jobs.lever.co/investorflow/ef78570b-622d-4b13-a3ad-c5c7b3b4c850/apply?lever-origin=applied&lever-source%5B%5D=Jobgether&utm_campaign=search&utm_medium=website,serp::https://jobs.lever.co/investorflow/ef78570b-622d-4b13-a3ad-c5c7b3b4c850/apply?lever-origin=applied&lever-source%5B%5D=Jobgether&utm_campaign=search&utm_medium=website,,Site Reliability Engineer II Remote. Remote - Santo Domingo. Research & Development /. Full Time /. Remote. Submit your application. Resume/CV ✱. ATTACH RESUME ...
2026-04-25 12:37:04,serp:boards.greenhouse.io,ecoatmgazelle,Job Application for Sr. DevOps Engineer at ecoATM,,,https://boards.greenhouse.io/ecoatmgazelle/jobs/5197447008,serp::https://boards.greenhouse.io/ecoatmgazelle/jobs/5197447008,,DevOps Engineer. Remote. Apply. Company Overview (Who are we? Why should you ... Location (Where will you be working?) Remote within the United States. Pay ...
2026-04-25 12:37:04,serp:boards.greenhouse.io,nice,"Job Application for Senior DevOps Engineer, CX at NICE",,,https://boards.greenhouse.io/nice/jobs/4846239101,serp::https://boards.greenhouse.io/nice/jobs/4846239101,,"At NICE, we work according to the NICE-FLEX hybrid model, which enables maximum flexibility: 2 days working from the office and 3 days of remote work, each week ..."
2026-04-25 12:37:04,serp:boards.greenhouse.io,bitwarden,Solutions Engineer,,,https://boards.greenhouse.io/bitwarden/jobs/7651358003,serp::https://boards.greenhouse.io/bitwarden/jobs/7651358003,,"... DevOps Engineer, IT Infrastructure Engineer, etc). Equivalent education or ... In the United States, the starting base compensation range for this role ..."
2026-04-25 12:37:04,serp:boards.greenhouse.io,veracyte,Veracyte - Greenhouse,,,https://boards.greenhouse.io/veracyte/jobs/5089369007,serp::https://boards.greenhouse.io/veracyte/jobs/5089369007,,"Software Development Manager. Remote | San Diego, California, United States ... AWS certifications (Solutions Architect, DevOps Engineer, etc.). Exposure to ..."
2026-04-25 12:37:04,serp:boards.greenhouse.io,nice,Job Application for Site Reliability Engineer at NICE,,,https://boards.greenhouse.io/nice/jobs/4837196101,serp::https://boards.greenhouse.io/nice/jobs/4837196101,,The SRE – NOC role sits at the intersection of traditional Network ... Role Type: Individual Contributor. #LI-Remote. About NiCE. NICE Ltd. (NASDAQ: NICE) ...
2026-04-25 12:37:04,serp:boards.greenhouse.io,dataiku,Job Application for Sr Site Reliability Engineer,,,https://boards.greenhouse.io/dataiku/jobs/5775043004,serp::https://boards.greenhouse.io/dataiku/jobs/5775043004,,Sr Site Reliability Engineer ... Debrief of your technical Assessment with two SRE team members; Final Interview with the SRE Director ... United States military ...
2026-04-25 12:37:04,serp:boards.greenhouse.io,tvscientificpoweredbypinterest,Job Application for ML Platform Engineer at tvScientific,,,https://boards.greenhouse.io/tvscientificpoweredbypinterest/jobs/7803455,serp::https://boards.greenhouse.io/tvscientificpoweredbypinterest/jobs/7803455,,"ML Platform Engineer. San Francisco, CA, US; Remote, US. Apply. About ... We are looking for an ambitious Systems / Platform Engineer to join a team at ..."
2026-04-25 12:37:04,serp:boards.greenhouse.io,apptronik,Job Application for Data Platform Engineer at Apptronik,,,https://boards.greenhouse.io/apptronik/jobs/5978948004?gh_jid=5978948004,serp::https://boards.greenhouse.io/apptronik/jobs/5978948004?gh_jid=5978948004,,"Data Platform Engineer. Austin, TX. Apply. Apptronik is a human-centered ... United States military operation for which an Armed Forces service medal was ..."
2026-04-25 12:37:04,serp:boards.greenhouse.io,generalassembly,MLOps / AI Platform Engineer Subject Matter Expert,,,https://boards.greenhouse.io/generalassembly/jobs/7842854,serp::https://boards.greenhouse.io/generalassembly/jobs/7842854,,"Unless otherwise noted, remote positions can be performed from the following approved General Assembly operating countries. United States of America (states ..."
2026-04-25 12:37:04,serp:boards.greenhouse.io,veeamsoftware,Cloud Platform Engineer (Azure/AWS),,,https://boards.greenhouse.io/veeamsoftware/jobs/4775446101,serp::https://boards.greenhouse.io/veeamsoftware/jobs/4775446101,,"Cloud Platform Engineer (Azure/AWS). Remote, Czechia. Apply. Veeam is the Data and AI Trust Company, specializing in helping organizations ensure their data ..."
2026-04-25 12:37:04,serp:boards.greenhouse.io,further,Job Application for Cloud Engineer at Further,,,https://boards.greenhouse.io/further/jobs/8459599002,serp::https://boards.greenhouse.io/further/jobs/8459599002,,"Cloud Engineer. Atlanta, Georgia; Cleveland, Ohio; Dallas, Texas. Apply ... United States military operation for which an Armed Forces service medal was ..."
2026-04-25 12:37:04,serp:boards.greenhouse.io,smxtech,Careers,,,https://boards.greenhouse.io/smxtech/jobs/6314232003,serp::https://boards.greenhouse.io/smxtech/jobs/6314232003,,United States. Department: Accounting. View Details · All-Source Intelligence ... Azure Cloud Engineer (4857). We are seeking a Cloud Engineer with strong ...
2026-04-25 12:37:04,serp:boards.greenhouse.io,relativity,Job Application for Infrastructure Engineer I at Relativity Space,,,https://boards.greenhouse.io/relativity/jobs/8517617002?gh_jid=8517617002,serp::https://boards.greenhouse.io/relativity/jobs/8517617002?gh_jid=8517617002,,Experience with direct responsibility driving projects forward while managing and reporting progress to remote management. ... United States military ...
2026-04-25 12:37:04,serp:boards.greenhouse.io,gitlab,Job Application for Software Security Engineer at GitLab,,,https://boards.greenhouse.io/gitlab/jobs/8516916002,serp::https://boards.greenhouse.io/gitlab/jobs/8516916002,,"Software Security Engineer. Remote, Canada; Remote, US. Apply. GitLab is the intelligent orchestration platform for DevSecOps. GitLab enables organizations to ..."
2026-04-25 12:37:04,serp:boards.greenhouse.io,andurilindustries,Senior Cloud Software Engineer,,,https://boards.greenhouse.io/andurilindustries/jobs/5119409007?gh_jid=5119409007,serp::https://boards.greenhouse.io/andurilindustries/jobs/5119409007?gh_jid=5119409007,,Deep experience with architecting and securing cloud infrastructure in deployed/production environment ... United States military operation for which an Armed ...
2026-04-25 12:37:04,serp:job-boards.greenhouse.io,formativgroup,Job Application for DevOps Engineer,,,http://job-boards.greenhouse.io/formativgroup/jobs/4204399009,serp::http://job-boards.greenhouse.io/formativgroup/jobs/4204399009,,"DevOps Engineer - Remote. Remote/ United States - Full-Time. Apply. Summary. The role of the DevOps Engineer is to design, implement, and maintain secure ..."
2026-04-25 12:37:04,serp:job-boards.greenhouse.io,tactacam,Job Application for DevOps Engineer at Tactacam,,,http://job-boards.greenhouse.io/tactacam/jobs/4231083009,serp::http://job-boards.greenhouse.io/tactacam/jobs/4231083009,,DevOps Engineer. Remote. Apply. Company Overview: Tactacam is a leading ... United States military operation for which an Armed Forces service medal was ...
2026-04-25 12:37:04,serp:job-boards.greenhouse.io,55564patriot334567software868575745,Job Application for Senior DevOps Engineer at Patriot Software,,,http://job-boards.greenhouse.io/55564patriot334567software868575745/jobs/4091852009,serp::http://job-boards.greenhouse.io/55564patriot334567software868575745/jobs/4091852009,,"Full-time, direct-hire, 100% remote role · Open to candidates residing in and legally eligible to work in the United States · Not open to applicants residing in: ..."
2026-04-25 12:37:04,serp:job-boards.greenhouse.io,defenseunicorns,Job Application for Platform Engineer at Defense Unicorns,,,http://job-boards.greenhouse.io/defenseunicorns/jobs/5107193007,serp::http://job-boards.greenhouse.io/defenseunicorns/jobs/5107193007,,"Platform Engineer. Remote, United States. Apply. EMPLOYER IS A CONTRACTOR FOR THE U.S. GOVERNMENT. THIS POSITION REQUIRES AN ACTIVE SECRET CLEARANCE. Role ..."
2026-04-25 12:37:04,serp:job-boards.greenhouse.io,pinterest,"Sr. ML Platform Engineer, tvScientific",,,https://job-boards.greenhouse.io/pinterest/jobs/7642249,serp::https://job-boards.greenhouse.io/pinterest/jobs/7642249,,"ML Platform Engineer, tvScientific. San Francisco / Remote · tvScientific ... We are looking for an experienced ML Platform Engineer to join a team at the ..."
2026-04-25 12:37:04,serp:job-boards.greenhouse.io,drweng,Job Application for Platform Engineer at DRW,,,http://job-boards.greenhouse.io/drweng/jobs/7802168,serp::http://job-boards.greenhouse.io/drweng/jobs/7802168,,"Platform Engineer. Chicago, Austin, New York, Greenwich, Houston. Apply. DRW is ... We are open to remote workers for this role with the correct set of skils."
2026-04-25 12:37:04,serp:job-boards.greenhouse.io,further,Job Application for Cloud Engineer at Further,,,http://job-boards.greenhouse.io/further/jobs/8459599002,serp::http://job-boards.greenhouse.io/further/jobs/8459599002,,"Cloud Engineer. Atlanta, Georgia; Cleveland, Ohio; Dallas, Texas. Apply ... United States military operation for which an Armed Forces service medal was ..."
2026-04-25 12:37:04,serp:job-boards.greenhouse.io,strivehealth,Job Application for Sr. Cloud Engineer at Strive Health,,,http://job-boards.greenhouse.io/strivehealth/jobs/4667911006,serp::http://job-boards.greenhouse.io/strivehealth/jobs/4667911006,,"Sr. Cloud Engineer · Hybrid-Remote Flexibility – · Comprehensive Benefits – Medical, dental, and vision insurance, employee assistance programs, employer-paid and ..."
2026-04-25 12:37:04,serp:job-boards.greenhouse.io,leaflink,Job Application for Senior Cloud Engineer at LeafLink,,,http://job-boards.greenhouse.io/leaflink/jobs/8478947002,serp::http://job-boards.greenhouse.io/leaflink/jobs/8478947002,,"Senior Cloud Engineer. New York, New York, United States. Apply. About LeafLink ... LeafLink is seeking a Staff Cloud Engineer to lead the evolution of our cloud ..."
2026-04-25 12:37:04,serp:job-boards.greenhouse.io,twilio,Job Application for Senior Infrastructure Engineer at Twilio,,,http://job-boards.greenhouse.io/twilio/jobs/7474040,serp::http://job-boards.greenhouse.io/twilio/jobs/7474040,,"Senior Infrastructure Engineer. Remote - US. Apply. Who we are. At Twilio, we're ..."
2026-04-25 12:37:04,serp:job-boards.greenhouse.io,tribalscale,Job Application for Oracle Cloud Infrastructure Engineer at TribalScale,,,http://job-boards.greenhouse.io/tribalscale/jobs/4653626006,serp::http://job-boards.greenhouse.io/tribalscale/jobs/4653626006,,"Oracle Cloud Infrastructure Engineer. Remote Office. Apply. Shape the Future with TribalScale. At TribalScale, we're not just participating in digital ..."
2026-04-25 12:37:04,serp:job-boards.greenhouse.io,defcon,Senior DevSecOps / Platform Security Engineer (AWS + Kubernetes),,,http://job-boards.greenhouse.io/defcon/jobs/5049058007,serp::http://job-boards.greenhouse.io/defcon/jobs/5049058007,,"Senior DevSecOps / Platform Security Engineer (AWS + Kubernetes). Remote, USA. Apply. ABOUT DEFCON AI. RESILIENCE IN THE FACE OF DISRUPTION ..."
2026-04-25 12:37:04,serp:job-boards.greenhouse.io,redcellpartners,Job Application for Cloud Infrastructure Engineer at Red Cell Partners,,,http://job-boards.greenhouse.io/redcellpartners/jobs/5091754007,serp::http://job-boards.greenhouse.io/redcellpartners/jobs/5091754007,,"Cloud Infrastructure Engineer. Remote, USA. Apply. About Us. Red Cell Partners is an incubation ..."
2026-04-25 12:37:04,serp:job-boards.greenhouse.io,rapidsos,Job Application for Senior Site Reliability Engineer at RapidSOS,,,http://job-boards.greenhouse.io/rapidsos/jobs/5115767007,serp::http://job-boards.greenhouse.io/rapidsos/jobs/5115767007,,Senior Site Reliability Engineer. New York (Remote) or Boston (Remote). Apply ... United States military operation for which an Armed Forces service ...
2026-04-25 12:37:04,serp:job-boards.greenhouse.io,runpod,"Job Application for Site Reliability Engineer at Runpod, Inc.",,,https://job-boards.greenhouse.io/runpod/jobs/4108951008,serp::https://job-boards.greenhouse.io/runpod/jobs/4108951008,,"Site Reliability Engineer. Remote, USA. Apply. Runpod is the foundational platform for developers to build and ..."
2026-04-25 12:37:04,serp:job-boards.greenhouse.io,calendly,Job Application for Senior Site Reliability Engineer at Calendly,,,http://job-boards.greenhouse.io/calendly/jobs/8504765002,serp::http://job-boards.greenhouse.io/calendly/jobs/8504765002,,Senior Site Reliability Engineer. Remote - US. Apply. What's in it for you? Ready to ...
2026-04-25 12:37:04,serp:jobs.ashbyhq.com,risklabs,Senior DevOps Engineer @ Risk Labs,,,https://jobs.ashbyhq.com/risklabs/1e85d1db-d48a-4f05-ba5b-32c5eeae12f4,serp::https://jobs.ashbyhq.com/risklabs/1e85d1db-d48a-4f05-ba5b-32c5eeae12f4,,Senior DevOps Engineer. Location. Remote. Employment Type. Full time. Department. Risk Labs.
2026-04-25 12:37:04,serp:jobs.ashbyhq.com,jump-app,U.S. Senior DevOps Engineer @ Jump,,,https://jobs.ashbyhq.com/jump-app/b53f05ce-9647-4474-b9ae-b3cc3ba6e9b8,serp::https://jobs.ashbyhq.com/jump-app/b53f05ce-9647-4474-b9ae-b3cc3ba6e9b8,,"U.S. Senior DevOps Engineer. Location. Remote. Employment Type. Full time. Location Type. Remote. Department. Engineering, Product & Design. Compensation. $150K ..."
2026-04-25 12:37:04,serp:jobs.ashbyhq.com,megazone,Sr. Devops Engineer AWS @ Megazone Cloud US,,,https://jobs.ashbyhq.com/megazone/17647053-08cd-4490-a1e1-4fe356bc6660/application?utm_source=bandana,serp::https://jobs.ashbyhq.com/megazone/17647053-08cd-4490-a1e1-4fe356bc6660/application?utm_source=bandana,,Sr. Devops Engineer AWS ; Location. United States- Remote ; Employment Type. Full time ; Location Type. Remote ; Department. Tech ; Compensation. $145K – $165K • ...
2026-04-25 12:37:04,serp:jobs.ashbyhq.com,kraken.com,Senior Site Reliability Engineer,,,https://jobs.ashbyhq.com/kraken.com/cd033236-4e99-41da-984b-2de1de7c0f61/application,serp::https://jobs.ashbyhq.com/kraken.com/cd033236-4e99-41da-984b-2de1de7c0f61/application,,Senior Site Reliability Engineer - Payward Services ; Location. United States ; Employment Type. Full time ; Location Type. Remote ; Department. EngineeringSRE / ...
2026-04-25 12:37:04,serp:jobs.ashbyhq.com,workos,Site Reliability Engineer @ WorkOS,,,https://jobs.ashbyhq.com/workos/cff5a16f-fd1c-4b64-9b66-8a8321122375,serp::https://jobs.ashbyhq.com/workos/cff5a16f-fd1c-4b64-9b66-8a8321122375,,Site Reliability Engineer. Location. United States. Employment Type. Full time. Location Type. Remote ...
2026-04-25 12:37:04,serp:jobs.ashbyhq.com,cubist,"Site Reliability Engineer (SRE), Platform Engineering Team @ Cubist",,,https://jobs.ashbyhq.com/cubist/7cb42f0e-9e41-4620-990d-133046a9bb83,serp::https://jobs.ashbyhq.com/cubist/7cb42f0e-9e41-4620-990d-133046a9bb83,,"Site Reliability Engineer (SRE), Platform Engineering Team. Location. Remote. Employment Type. Full time. Location Type. Remote. Department. Engineering."
2026-04-25 12:37:04,serp:jobs.ashbyhq.com,vantageanalytics,Senior Site Reliability Engineer @ Vantage,,,https://jobs.ashbyhq.com/vantageanalytics/74cb0070-b786-4fd9-908c-45a019267afb,serp::https://jobs.ashbyhq.com/vantageanalytics/74cb0070-b786-4fd9-908c-45a019267afb,,"As a Senior Site Reliability Engineer (SRE) / DevOps Engineer at Vantage ... Remote-First, Based in Toronto Vantage is proudly headquartered in Toronto ..."
2026-04-25 12:37:04,serp:jobs.ashbyhq.com,10xteam,Lead Platform Engineer,,,https://jobs.ashbyhq.com/10xteam/d0e0d5c2-09ba-460b-915f-b34eab92569e,serp::https://jobs.ashbyhq.com/10xteam/d0e0d5c2-09ba-460b-915f-b34eab92569e,,"Lead Platform Engineer - AI Trainer - Freelance - 8-20hrs/week - Remote ... Why Join? Flexible, fully remote freelance work that fits your current ..."
2026-04-25 12:37:04,serp:jobs.ashbyhq.com,wundergraph,"Remote (EMEA) @ WunderGraph, Inc.",,,https://jobs.ashbyhq.com/wundergraph/05bf1896-580e-4376-b8f8-a13d4897ca5c,serp::https://jobs.ashbyhq.com/wundergraph/05bf1896-580e-4376-b8f8-a13d4897ca5c,,Staff Platform Engineer - Remote (EMEA). Location. EMEA. Employment Type. Full time. Location Type. Remote. Department. Engineering. Compensation. €100K – €130K.
2026-04-25 12:37:04,serp:jobs.ashbyhq.com,loancrate,Senior Platform Engineer @ Loancrate,,,https://jobs.ashbyhq.com/loancrate/efe03f3a-2c3d-4bd7-b237-978deed13cbd,serp::https://jobs.ashbyhq.com/loancrate/efe03f3a-2c3d-4bd7-b237-978deed13cbd,,Senior Platform Engineer. Location. United States. Employment Type. Full time. Location Type. Remote ...
2026-04-25 12:37:04,serp:jobs.ashbyhq.com,whatnot,Feature Platform Engineer @ Whatnot,,,https://jobs.ashbyhq.com/whatnot/cb4e987c-b3ea-4117-b91c-75c61b83a7dc,serp::https://jobs.ashbyhq.com/whatnot/cb4e987c-b3ea-4117-b91c-75c61b83a7dc,,"... remote co-located team, we're inspired by our values https ... Feature Platform Engineer. Location. San Francisco, CA. Employment Type."
2026-04-25 12:37:04,serp:jobs.ashbyhq.com,p-1%20ai,Platform Engineer @ P-1 AI,,,https://jobs.ashbyhq.com/p-1%20ai/43decc77-6579-4f95-ac1e-77d1db748b71,serp::https://jobs.ashbyhq.com/p-1%20ai/43decc77-6579-4f95-ac1e-77d1db748b71,,Platform Engineer. Location. United States. Employment Type. Full time. Location Type. Remote. Department. Core Engineering. Compensation. $200K – $250K • ...
2026-04-25 12:37:04,serp:jobs.ashbyhq.com,rallyuxr,Senior Platform Engineer @ Rally,,,https://jobs.ashbyhq.com/rallyuxr/a4340769-40cd-4dff-8075-5c25eff393ae,serp::https://jobs.ashbyhq.com/rallyuxr/a4340769-40cd-4dff-8075-5c25eff393ae,,Senior Platform Engineer. Location. United States. Employment Type. Full time. Location Type. Remote ...
2026-04-25 12:37:04,serp:jobs.ashbyhq.com,virtuous,Lead Data Platform Engineer @ Virtuous,,,https://jobs.ashbyhq.com/virtuous/95b59805-65c6-466b-aa13-7eb8e350ee79,serp::https://jobs.ashbyhq.com/virtuous/95b59805-65c6-466b-aa13-7eb8e350ee79,,"Lead Data Platform Engineer. Location. Phoenix, AZ; Remote, USA. Employment Type. Full time. Department. Operations. OverviewApplication. About Us. Virtuous is ..."
2026-04-25 12:37:04,serp:jobs.ashbyhq.com,comulate,Platform Engineer @ Comulate,,,https://jobs.ashbyhq.com/comulate/b553bfae-6722-4d3f-8585-372c98708996,serp::https://jobs.ashbyhq.com/comulate/b553bfae-6722-4d3f-8585-372c98708996,,Platform Engineer. Location. San Francisco / Remote. Employment Type. Full time. Location Type. Remote. Department. Engineering. Compensation. $160K – $240K • ...
2026-04-25 12:37:04,serp:jobs.ashbyhq.com,jane,Cloud Engineer @ Jane,,,https://jobs.ashbyhq.com/jane/c8539d70-9874-44b8-b8ca-78b76a97b435,serp::https://jobs.ashbyhq.com/jane/c8539d70-9874-44b8-b8ca-78b76a97b435,,"Cloud Engineer. Location. Canada. Employment Type. Full time. Location Type. Remote. Department. Development. OverviewApplication. About The Role. Hi, I'm Scott ..."
2026-04-25 12:37:04,serp:jobs.ashbyhq.com,hireveterans,AWS Cloud Engineer @ Hire Veterans,,,https://jobs.ashbyhq.com/hireveterans/50f0112c-b56f-4ac5-a7c2-217c5e9f5b4c,serp::https://jobs.ashbyhq.com/hireveterans/50f0112c-b56f-4ac5-a7c2-217c5e9f5b4c,,AWS Cloud Engineer. Location ... Technology. OverviewApplication. AWS Cloud Systems Engineer (Mid-Level). Location: Remote (U.S.-based – Boston preferred).
2026-04-25 12:37:04,serp:jobs.ashbyhq.com,togal-ai,Infrastructure Engineer @ Togal AI,,,https://jobs.ashbyhq.com/togal-ai/b46513d8-5b9a-415d-947c-94d3c3663eca,serp::https://jobs.ashbyhq.com/togal-ai/b46513d8-5b9a-415d-947c-94d3c3663eca,,Infrastructure Engineer. Location. Remote; EMEA; United States. Employment Type. Full time. Location Type. Remote. Department. Technology. Compensation. €85K – ...
